Sheet: Table108
A1: E | B1: I | C1: P | D1: C
A2: Equinor ASA | F2: OPM Flow Reference Manual

Sheet: Table5
A1: O | B1: P | C1: M | D1: OPEN POROUS MEDIA
A2: OPM Flow Reference Manual(2023-04) | E2: Revision: Rev-0

Sheet: Table109
A1: A | B1: B | C1: C | D1: D | E1: E | F1: F | G1: G | H1: H | I1: I | J1: J | K1: K | L1: L | M1: M | N1: N | O1: O | P1: P | Q1: Q | R1: R | S1: S | T1: T | U1: U | V1: V | W1: W | X1: X | Y1: Y | Z1: Z

Sheet: Table1
A1: O | B1: P | C1: M | D1: OPEN POROUS MEDIA
A2: OPM Flow Reference Manual(2023-04) | E2: Revision: Rev-0

Sheet: Table1884
A1: O | B1: P | C1: M | D1: OPEN POROUS MEDIA
A2: OPM Flow Reference Manual(2023-04) | E2: Revision: Rev-0

Sheet: Table1885
A1: O | B1: P | C1: M | D1: OPEN POROUS MEDIA
A2: OPM Flow Reference Manual(2023-04) - APPENDIX A: | E2: Revision: Rev-0

Sheet: Table1886
A1: O | B1: P | C1: M | D1: OPEN POROUS MEDIA
A2: OPM Flow Reference Manual(2023-04) | E2: Revision: Rev-0

Sheet: Table3
A1: OPM Flow 2024-04 Command Line Options
A2: No. | B2: Variable Name | C2: Description | D2: Default
A3: 1 | B3: -h or --help | C3: A character string that causes OPM Flow to print a help message that gives a brief description of the available command line parameters. This now only prints the active user facing command line options. | D3: N/A
A4: ooow:<A3>+1 -> 2 | B4: --help-all | C4: Prints all the command line options included in the release, including obsolete, hidden and deprecated options. | D4: N/A
A5: ooow:<A4>+1 -> 3 | B5: --accelerator-mode | C5: A defined character string that selects the linear solver, usage: '--accelerator-mode=[none|cusparse|opencl|amgcl|rocalution|rocsparse]'. | D5: “none”
A6: ooow:<A5>+1 -> 4 | B6: --allow-distributed-wells | C6: Allow the perforations of a well to be distributed to interior of multiple processes. | D6: false
A7: ooow:<A6>+1 -> 5 | B7: --alternative-well-rate-init | C7: Use alternative well rate initialization procedure. | D7: true
A8: ooow:<A7>+1 -> 6 | B8: --bda-device-id | C8: Choose device ID for cusparseSolver or openclSolver, use 'nvidia-smi' or 'clinfo' commands to determine valid IDs. | D8: 0
A9: ooow:<A8>+1 -> 7 | B9: --continue-on-convergence-error | C9: Continue with a non-converged solution instead of giving up if we encounter a time step size smaller than the minimum time step size. | D9: false
A10: ooow:<A9>+1 -> 8 | B10: --cpr-reuse-interval | C10: A positive integer that sets the reuse preconditioner interval. Used when --cpr-reuse-setup is set to 4, then the preconditioner will be fully recreated instead of reused every N linear solve, where N is this parameter. | D10: 30
A11: ooow:<A10>+1 -> 9 | B11: --cpr-reuse-setup | C11: A positive integer that defines if the CPR solver should re-use the AMG setup. Valid options are: Changed the default value from three to four. | D11: 4
A12: ooow:<A11>+1 -> 10 | B12: --dbph-max-rel | C12: A real positive value that sets maximum relative change of the bottom-hole pressure in a single iteration | D12: 1.0
A13: ooow:<A12>+1 -> 11 | B13: --dp-max-rel | C13: A real positive double precision value that sets the maximum allowed relative change of pressure per iteration. | D13: 0.3
A14: ooow:<A13>+1 -> 12 | B14: --ds-max | C14: A real positive double precision value that sets the maximum allowed change in saturation per iteration. | D14: 0.2
A15: ooow:<A14>+1 -> 13 | B15: --dwell-fraction-max | C15: A real positive value that sets the maximum allowed change in well’s volume fraction per iteration. | D15: 0.2
A16: ooow:<A15>+1 -> 14 | B16: --debug-emit-cell-partition | C16: A boolean value that determines whether (true) or not (false) to emit cell partitions as a debugging aid. | D16: false
A17: ooow:<A16>+1 -> 15 | B17: --ecl-deck-file-name | C17: A character string that defines the name of the OPM Flow input file which contains the simulator’s ECLIPSE formatted input deck to be simulated. Note that there must be no spaces in the filename. If there are spaces, which can typically occur on Windows based systems, then the filename should be enclosed in quotes; thus instead of FILE NAME use “FILE NAME” | D17: “”
A18: ooow:<A17>+1 -> 16 | B18: --enable-drift-compensation | C18: A Boolean value set to true or false that enables (true) or disables (false) partial compensation of systematic mass losses via the source term of the next time step. | D18: true
A19: ooow:<A18>+1 -> 17 | B19: --ecl-enable-tuning | C19: Honor some aspects of the TUNING keyword from the ECL deck. | D19: false
A20: ooow:<A19>+1 -> 18 | B20: --ecl-newton-relaxed-tolerance | C20: The maximum error which the volumetric residual may exhibit if it is in a 'relaxed' region during a strict iteration. | D20: 1e+09
A21: ooow:<A20>+1 -> 19 | B21: --ecl-newton-relaxed-volume-fraction | C21: The fraction of the pore volume of the reservoir where the volumetric error may be voilated during strict Newton iterations. | D21: 0.03
A22: ooow:<A21>+1 -> 20 | B22: --ecl-newton-strict-iterations | C22: The number of Newton iterations where the volumetric error is considered. | D22: 8
A23: ooow:<A22>+1 -> 21 | B23: --ecl-newton-sum-tolerance | C23: The maximum error tolerated by the Newton method for considering a solution to be converged. | D23: 0.0001
A24: ooow:<A23>+1 -> 22 | B24: --ecl-newton-sum-tolerance-exponent | C24: The exponent used to scale the sum tolerance by the total pore volume of the reservoir. | D24: 0.333333
A25: ooow:<A24>+1 -> 23 | B25: --ecl-output-double-precision | C25: A Boolean value set to true or false that switches on (true) or off (false) double precision in restart files. Useful for 'perfect' restarts. | D25: false
A26: ooow:<A25>+1 -> 24 | B26: --ecl-output-interval | C26: An integer value defining the number of report steps that ought to be skipped between two writes of restart files results. | D26: -1
A27: ooow:<A26>+1 -> 25 | B27: --edge-weights-method | C27: A defined positive integer value that defines the edge-weighing strategy: | D27: 1
A28: ooow:<A27>+1 -> 26 | B28: --enable-adaptive-time-stepping | C28: A Boolean value set to true or false that turns on (true) or off (false) adaptive time stepping. If set to false the report time steps provided by the input deck are used. | D28: true
A29: ooow:<A28>+1 -> 27 | B29: --enable-async-ecl-output | C29: A Boolean value set to true or false that sets the output mode to be asynchronous (true), letting the simulator continue computing the next time step while writing results to restart and summary files in the commercial simulator’s format on a separate thread. | D29: true
A30: ooow:<A29>+1 -> 28 | B30: --enable-async-vtk-output | C30: A Boolean value set to true or false that sets the output mode to be asynchronous (true), letting the simulator continue computing the next time step while writing results to the VTK output files on a separate thread. | D30: true
A31: ooow:<A30>+1 -> 29 | B31: --enable-dry-run | C31: A Boolean value set to true or false that specifies if the simulation should actually run (true), or just check the input deck (false). This option is equivalent to activating the NOSIM keyword in the RUNSPEC section of the input deck (see section Error: Reference source not foundError: Reference source not found). The default value of “auto’ will use whatever is stipulated in the input deck via the NOSIM keyword. | D31: “auto”
A32: ooow:<A31>+1 -> 30 | B32: --enable-ecl-output | C32: A Boolean value set to true or false that specifies if the binary output files (restart, summary files, etc.) should be written in the commercial simulator’s format (true), or OPM Flow’s format (false). | D32: true
A33: ooow:<A32>+1 -> 31 | B33: --enable-esmry | C33: A Boolean value that switches on (true) or off (false) the output of SUMMARY vectors to the ESMRY file for fast loading of summary data. | D33: false
A34: ooow:<A33>+1 -> 32 | B34: --enable-gravity | C34: A Boolean value that switches on (true) or off (false) the use of the gravity correction for the pressure gradients. | D34: true
A35: ooow:<A34>+1 -> 33 | B35: --enable-grid-adaptation | C35: A Boolean value that enables (true) or disables (false) adaptive grid refinement/coarsening. Note that Eclipse grid output will be disabled if adaptive grid refinement/coarsening is enabled. | D35: false
A36: ooow:<A35>+1 -> 34 | B36: --enable-intensive-quantity-cache | C36: A Boolean value that switches on (true) or off (false) the caching of intensive quantities. | D36: true
A37: ooow:<A36>+1 -> 35 | B37: --enable-logging-fallout-warning | C37: A Boolean value set to true or false that sets the developer option to see whether logging was on non-root processors (true). If set to true output will be appended to the *.DBG or *.PRT files. | D37: false
A38: ooow:<A37>+1 -> 36 | B38: --enable-opm-rst-file | C38: A Boolean value set to true or false to write OPM specific data sets to the commercial simulators restart file to enable restart of OPM Flow runs by OPM Flow (true), or not to write the data (false). | D38: false
A39: ooow:<A38>+1 -> 37 | B39: --enable-storage-cache | C39: A Boolean value set to true or false that turns on (true) or off (false) storing previous storage terms and avoid re-calculating them. | D39: true
A40: ooow:<A39>+1 -> 38 | B40: --enable-terminal-output | C40: A Boolean value set to true or false that turns on (true) or off (false) high-level information about the simulation's progress to the terminal | D40: true
A41: ooow:<A40>+1 -> 39 | B41: --enable-thermodynamic-hints | C41: A Boolean value that enables (true) or disables (false) thermodynamic hints. | D41: false
A42: ooow:<A41>+1 -> 40 | B42: --enable-tuning | C42: A Boolean value set to true or false that instructs OPM Flow to read the time stepping parameters from the Error: Reference source not foundkeyword in the input deck, if set to true. Note that only the first record of the TUNING keyword is processed. | D42: false
A43: ooow:<A42>+1 -> 41 | B43: --enable-vtk-output | C43: A Boolean value set to true or false that turns on (true) or off (false) a global switch for writing VTK files. | D43: false
A44: ooow:<A43>+1 -> 42 | B44: --enable-well-operability-check | C44: A Boolean value set to true or false that enables (true) checking of a well’s operating status, or disables (false) the checking. | D44: true
A45: ooow:<A44>+1 -> 43 | B45: --enable-well-operability-check-iter | C45: A Boolean value set to true or false that enables (true) checking of a well’s operating status during iterations, or disables (false) the checking during iterations. | D45: false
A46: ooow:<A45>+1 -> 44 | B46: --enable-write-all-solutions | C46: A Boolean value set to true or false that turns on (true) or off (false) the writing of all solutions to disk instead of only the ones for the report steps. | D46: false
A47: ooow:<A46>+1 -> 45 | B47: --end-time | C47: The simulation time at which the simulation is finished [s]. | D47: 1e+100
A48: ooow:<A47>+1 -> 46 | B48: --explicit-rock-compaction | C48: A boolean value. Use pressure from end of the last time step when evaluating rock compaction (true) or not (false). | D48: false
A49: ooow:<A48>+1 -> 47 | B49: --external-partition | C49: A quoted character string. Name of file from which to load an externally generated partitioning of the model's active cells for MPI distribution purposes. If empty, the built-in partitioning method will be employed. | D49: “”
A50: ooow:<A49>+1 -> 48 | B50: --force-disable-fluid-in-place-output | C50: A Boolean value set to true or false that instructs OPM Flow not to print the Fluid In-Place report after each report time step (true) or not (false). Note this parameter will override the print request in the input deck. | D50: false
A51: ooow:<A50>+1 -> 49 | B51: --force-disable-resv-fluid-in-place-output | C51: A Boolean value set to true or false that instructs OPM Flow to not to print the Reservoir Volume Fluid In-Place report after each report time step (true) or not (false). Note this parameter will override the print request in the input deck. | D51: false
A52: ooow:<A51>+1 -> 50 | B52: --full-time-step-initially | C52: A Boolean value set to true or false that instructs OPM Flow to always attempt to finish a report step using a single time step (true) or not (false). | D52: false
A53: ooow:<A52>+1 -> 51 | B53: --ignore-keywords | C53: A character string that defines a list of keywords which should be ignored by OPM Flow. The keyword string should be enclosed in quotes and each keyword separated by a colon, that is ':'. | D53: “”
A54: ooow:<A53>+1 -> 52 | B54: --ilu-fillin-level | C54: A positive integer value that sets the fill in level for the ILU preconditioner. | D54: 0
A55: ooow:<A54>+1 -> 53 | B55: --ilu-redblack | C55: A Boolean value set to true or false that instructs OPM Flow to use red-black partitioning for the ILU preconditioner. (true) or not (false). | D55: false
A56: ooow:<A55>+1 -> 54 | B56: --ilu-relaxation | C56: A real positive double precision value that sets the relaxation factor of the linear solver's ILU preconditioner | D56: 0.9
A57: ooow:<A56>+1 -> 55 | B57: --ilu-reorder-spheres | C57: A Boolean value set to true or false that specifies OPM Flow to reorder the entries of the matrix in the red-black ILU preconditioner in spheres starting at an edge (true) or not (false) If false the original ordering is preserved in each color. Otherwise try to ensure D4 ordering (in a 2D structured grid, the diagonal elements are consecutive). | D57: false
A58: ooow:<A57>+1 -> 56 | B58: --initial-time-step-in-days | C58: A real double precision value that sets the size of initial time step in days. | D58: 1.0
A59: ooow:<A58>+1 -> 57 | B59: --initial-time-step-size | C59: A real double precision value that sets the size of initial time step in seconds. | D59: 86400
A60: ooow:<A59>+1 -> 58 | B60: --linear-solver | C60: A defined quoted character string that sets the configuration of the linear solver, valid values are: Option (3) extends the existing Constrained Pressure Residual (“CPR”) preconditioner to include wells. This option can also be invoked via the CPR keyword in the RUNSPEC section; however, the command line parameter takes precedence. For option (9) one enters a character string enclosed in quotes that defines the filename of a JSON configuration file for the flexible linear solver system. In this case the file extension should be ‘.json’. Note that the *.PRT file contains the “Property tree for the linear solver” listing, which is the JSON specification of the current case, and can be used to configure a user specific linear solver JSON file. The option "cpr" now is an alias for "cprw" instead of "cpr_trueimpes". | D60: “ilu0”
A61: ooow:<A60>+1 -> 59 | B61: --linear-solver-ignore-convergence-failure | C61: A Boolean value set to true or false that if set to true convergences failures in the linear solver are ignored. This option should be used with care, as the results might be unreliable. | D61: false
A62: ooow:<A61>+1 -> 60 | B62: --linear-solver-max-iter | C62: A positive integer value that defines the maximum number of linear iterations. | D62: 200
A63: ooow:<A62>+1 -> 61 | B63: --linear-solver-print-json-definition | C63: Write the JSON definition of the linear solver setup to the DBG file. | D63: true
A64: ooow:<A63>+1 -> 62 | B64: --linear-solver-reduction | C64: A real positive double precision value that sets the minimum reduction of the residual for the linear solver. The linear solver convergences when the residual is reduced sufficiently. The simulator now overrides the default reduction to be 0.005 instead of 0.01, if the linear solver has been set to one of the cpr options, in a similar manner as how the default maximum number of linear iterations for the cpr and cprw options are changed to 20 instead of 100, unless specified by the command line option by the user. | D64: 0.01
A65: ooow:<A64>+1 -> 63 | B65: --linear-solver-restart | C65: A positive integer value that sets the number of iterations after which GMRES is restarted. | D65: 40
A66: ooow:<A65>+1 -> 64 | B66: --linear-solver-verbosity | C66: A positive integer value that defines the output from linear solver: | D66: 0
A67: ooow:<A66>+1 -> 65 | B67: --load-file | C67: A character string enclosed in quotes that defines the FileName for the .OPMRST file used to load the serialized state. If empty, CASENAME.OPMRST is used. | D67: ""
A68: ooow:<A67>+1 -> 66 | B68: --load-step | C68: An integer value that determines if the simulator should load the serialized state from OPM Flow's version of the restart file. and should be set to either a specific report step, or 0 to load the last stored report step. The default value of -1 does not load the data from the OPM Flow specific restart file. OPM Flow's version of the restart file, is written using the --save-step=N option. | D68: -1
A69: ooow:<A68>+1 -> 67 | B69: --local-domains-ordering-measure | C69: A character string enclosed in quotes that defines the subdomain ordering measure. Allowed values are 'maxpressure', ‘averagepressure’ and 'residual'. | D69: "maxpressure"
A70: ooow:<A69>+1 -> 68 | B70: --local-domains-partitioning-imbalance | C70: A real positive double precision value that sets the subdomain partitioning imbalance tolerance. 1.03 is 3 percent imbalance. | D70: 1.03
A71: ooow:<A70>+1 -> 69 | B71: --local-domains-partitioning-method | C71: A character string enclosed in quotes that defines the subdomain partitioning method. Allowed values are 'zoltan', 'simple', and the name of a partition file ending with '.partition'. | D71: "zoltan"
A72: ooow:<A71>+1 -> 70 | B72: --local-solve-approach | C72: A character string enclosed in quotes that defines the local solve approach. Valid choices are ‘jacobi’ and ‘gauss-seidel’. | D72: "gauss-seidel"
A73: ooow:<A72>+1 -> 71 | B73: --local-tolerance-scaling-cnv | C73: A real positive double precision value that sets the convergence tolerance for local solves. Set to lower than 1.0 to use stricter convergence tolerance for local solves. | D73: 0.1
A74: ooow:<A73>+1 -> 72 | B74: --local-tolerance-scaling-mb | C74: A real positive double precision value that sets the convergence tolerance for local solves. Set to lower than 1.0 to use stricter convergence tolerance for local solves. | D74: 1
A75: ooow:<A74>+1 -> 73 | B75: --local-well-solve-control-switching | C75: A boolean value that allows (true) or disallows (false) control switching during local well solutions. | D75: false
A76: ooow:<A75>+1 -> 74 | B76: --matrix-add-well-contributions | C76: A Boolean value set to true or false that if set to true explicitly specifies the influences of wells between cells in the Jacobian and preconditioner matrices. | D76: false
A77: ooow:<A76>+1 -> 75 | B77: --max-inner-iter-ms-wells | C77: A positive integer value that defines the maximum number of inner iterations for multi-segment wells. | D77: 100
A78: ooow:<A77>+1 -> 76 | B78: --max-inner-iter-wells | C78: A positive integer value that defines the maximum number of inner iterations for standard wells. | D78: 50
A79: ooow:<A78>+1 -> 77 | B79: --max-local-solve-iterations | C79: A positive integer value that defines the maximum number of iterations for local solves with NLDD nonlinear solver. | D79: 20
A80: ooow:<A79>+1 -> 78 | B80: --max-newton-iterations-with-inner-well-iterations | C80: A positive integer that specifies the maximum newton iterations with inner well iterations. | D80: 8
A81: ooow:<A80>+1 -> 79 | B81: --max-pressure-change-ms-wells | C81: A real positive value that defines the maximum relative pressure change for a single iteration of the multi-segment well model. | D81: 1.0 x 106
A82: ooow:<A81>+1 -> 80 | B82: --max-residual-allowed | C82: A real positive value that sets the absolute maximum tolerance for residuals without cutting the time step size. | D82: 1.0 x 107
A83: ooow:<A82>+1 -> 81 | B83: --max-single-precision-days | C83: A real positive value that sets the maximum time step size where single precision floating point arithmetic can be used for solving the linear systems of equations. | D83: 20.0
A84: ooow:<A83>+1 -> 82 | B84: --max-temperature-change | C84: A real positive value that stipulates the maximum absolute change of temperature in a single iteration. | D84: 5
A85: ooow:<A84>+1 -> 83 | B85: --max-time-step-divisions | C85: A positive integer that specifies the maximum number of divisions by two of the timestep size before the simulation bails out. | D85: 10
A86: ooow:<A85>+1 -> 84 | B86: --max-time-step-size | C86: A real positive value that defines the maximum size to which all time steps are limited to in seconds. | D86: inf
A87: ooow:<A86>+1 -> 85 | B87: --max-welleq-iter | C87: A positive integer that defines the maximum number of iterations to determine the solution to the well equations. | D87: 30
A88: ooow:<A87>+1 -> 86 | B88: --maximum-number-of-well-switches | C88: A positive integer values that stipulates the maximum number of times a well can switch to the same control. | D88: 3
A89: ooow:<A88>+1 -> 87 | B89: --maximum-water-saturation | C89: A real positive value that defines the maximum water saturation. | D89: 1.0
A90: ooow:<A89>+1 -> 88 | B90: --milu-variant | C90: A defined character string that specifies which variant of the modified ILU preconditioner ought to be used. Possible variants are: | D90: “ILU”
A91: ooow:<A90>+1 -> 89 | B91: --min-strict-cnv-ite | C91: A positive integer that sets the minimum number of Newton iterations before relaxed tolerances are used for the CNV convergence criterion. | D91: 0
A92: ooow:<A91>+1 -> 90 | B92: --min-strict-mb-iter | C92: An integer value defining the number of Newton iterations before relaxed tolerances can be used for the MB convergence criterion. Default -1 means that the relaxed tolerance is used when maximum number of Newton iterations are reached. | D92: -1
A93: ooow:<A92>+1 -> 91 | B93: --min-time-step-based-on-newton-iterations | C93: A real positive value that sets the minimum time step size (in days for field and metric unit and hours for lab unit) can be reduced to based on Newton iteration counts. | D93: 0.0
A94: ooow:<A93>+1 -> 92 | B94: --min-time-step-before-shutting-problematic-wells-in-days | C94: A real positive value that sets the minimum time step size in days for which problematic wells are not shut. Time steps below this value will result in problematic wells being shut-in by the simulator. | D94: 0.01
A95: ooow:<A94>+1 -> 93 | B95: --min-time-step-size | C95: A real positive value that sets the minimum size to which all time steps are limited to in seconds. | D95: 0.0
A96: ooow:<A95>+1 -> 94 | B96: --network-max-iterations | C96: A positive integer that sets the maximum number of iterations in the network solver before giving up. | D96: 200
A97: ooow:<A96>+1 -> 95 | B97: --network-max-strict-iterations | C97: A positive integer that sets the maximum iterations in network solver before relaxing tolerance. | D97: 100
A98: ooow:<A97>+1 -> 96 | B98: --newton-max-error | C98: A real positive value that sets the maximum error tolerated by the Newton method to which does not cause an abort. | D98: 1e+100
A99: ooow:<A98>+1 -> 97 | B99: --newton-max-iterations | C99: A positive integer that defines the maximum number of Newton iterations per time step used by the simulator. | D99: 20
A100: ooow:<A99>+1 -> 98 | B100: --newton-max-relax | C100: A real positive value that sets the maximum relaxation factor of a Newton iteration used by the simulator. | D100: 0.5
A101: ooow:<A100>+1 -> 99 | B101: --newton-min-iterations | C101: A positive integer that sets the minimum number of Newton iterations per time step used by the simulator. | D101: 2
A102: ooow:<A101>+1 -> 100 | B102: --newton-relaxation-type | C102: A character string that defines the type of relaxation used in Newton’s method, the default is dampen. | D102: “dampen”
A103: ooow:<A102>+1 -> 101 | B103: --newton-target-iterations | C103: A positive integer that sets the 'optimum' number of Newton iterations per time step. | D103: 10
A104: ooow:<A103>+1 -> 102 | B104: --newton-tolerance | C104: A real positive value that sets the maximum raw error tolerated by the Newtonmethod for considering a solution to be converged. | D104: 0.01
A105: ooow:<A104>+1 -> 103 | B105: --newton-verbose | C105: A boolean value that specifies whether the Newton method should inform the user about its progress (true) or not (false). | D105: true
A106: ooow:<A105>+1 -> 104 | B106: --newton-write-convergence | C106: A boolean value that specifies whether to write the convergence behaviour of the Newton method to a VTK file (true) or not (false). | D106: false
A107: ooow:<A106>+1 -> 105 | B107: --nldd-num-initial-newton-iter | C107: A positive integer that sets the number of initial global Newton iterations when running the NLDD nonlinear solver. | D107: 1
A108: ooow:<A107>+1 -> 106 | B108: --nonlinear-solver | C108: A character string that specifies the nonlinear solver. Valid choices are newton or nldd. | D108: "newton"
A109: ooow:<A108>+1 -> 107 | B109: --num-local-domains | C109: A positive integer that sets the number of local domains for NLDD nonlinear solver. Note this is an experimental feature in the current release 2023.10 that is expected to be more complete and tested by the 2024.10 release. | D109: 0
A110: ooow:<A109>+1 -> 108 | B110: --num-pressure-points-equil | C110: A positive integer that sets the number of pressure points (in each direction) in tables used for equilibration. | D110: 2000
A111: ooow:<A110>+1 -> 109 | B111: --opencl-ilu-parallel | C111: A Boolean value set to true or false that if set to true then parallelize the ILU decomposition and application on GPU, or not (false). | D111: true
A112: ooow:<A111>+1 -> 110 | B112: --opencl-platform-id | C112: A positive integer that specifies the platform identification (“ID”) for the openSolver. Use the “clinfo” command to determine valid IDs. | D112: 0
A113: ooow:<A112>+1 -> 111 | B113: --output-dir | C113: A character string that defines the directory to which OPM Flow is to write the commercial simulator compatible output files (restart, summary files etc.). The default value results in the files be written to the same directory as the input file. | D113: “”
A114: ooow:<A113>+1 -> 112 | B114: --output-extra-convergence-info | C114: A defined character string that specifies whether to provide additional convergence output to separate files for diagnostic purposes. The available options are: Options can be combined with commas, e.g."steps,iterations" for multiple outputs. The default value of "none" prevents the two files from being written out, for better compatibility with the commercial simulator. | D114: “none”
A115: ooow:<A114>+1 -> 113 | B115: --output-interval | C115: A positive integer that specifies the number of report steps between two consecutive writes of restart data. | D115: 1
A116: ooow:<A115>+1 -> 114 | B116: --output-mode | C116: A defined character string that defines the output to the *.PRT and *.DBG files: For example to just output logging information use: --output-mode=”log” or --output-mode=false | D116: “all”
A117: ooow:<A116>+1 -> 115 | B117: --owner-cells-first | C117: A Boolean value set to true or false that determines if the cells owned by a rank should be ordered before ghost/overlapping the cells (true), or not (false). | D117: true
A118: ooow:<A117>+1 -> 116 | B118: --parameter-file | C118: A character string that defines the name of a parameter file which contains the simulator’s set of run-time parameters, as listed in this table. | D118: “”
A119: ooow:<A118>+1 -> 117 | B119: --parsing-strictness | C119: Set strictness of parsing process. Available options are: Default: "normal" | D119: "normal"
A120: ooow:<A119>+1 -> 118 | B120: --predetermined-time-steps-file | C120: A file with a list of predetermined time step sizes (one time step per line). | D120: ""
A121: ooow:<A120>+1 -> 119 | B121: --pressure-max | C121: A positive real value. Maximum absolute pressure. | D121: 1e+99
A122: ooow:<A121>+1 -> 120 | B122: --pressure-min | C122: A real value. Minimum absolute pressure. | D122: -1e+99
A123: ooow:<A122>+1 -> 121 | B123: --pressure-scale | C123: A positive real value. Scaling of pressure primary variable. | D123: 1
A124: ooow:<A123>+1 -> 122 | B124: --pri-var-oscilation-threshold | C124: A real positive value that defines the threshold value for the primary variable switching conditions after its meaning has switched to hinder oscillations. | D124: 1.0 x 10-5
A125: ooow:<A124>+1 -> 123 | B125: --print-parameters | C125: A positive integer value that request that the run time parameters be printed at the start of the run: | D125: 2
A126: ooow:<A125>+1 -> 124 | B126: --print-properties | C126: A positive integer value that request that the compile time parameters be printed at the start of the run: | D126: 2
A127: ooow:<A126>+1 -> 125 | B127: --project-saturations | C127: A Boolean value set to true or false that determines if all the fluid saturations should be scaled to ensure the values are in the interval (0, 1), including runs that use solvents (true), or not (false). | D127: false
A128: ooow:<A127>+1 -> 126 | B128: --regularization-factor-wells | C128: A real positive value that defines the “regularization factor” for wells. | D128: 100
A129: ooow:<A128>+1 -> 127 | B129: --relaxed-linear-solver-reduction | C129: A real positive value that defines the minimum reduction of the residual which the linear solver need to achieve for the solution to be accepted. | D129: 0.01
A130: ooow:<A129>+1 -> 128 | B130: --relaxed-max-pv-fraction | C130: A real positive value that defines The fraction of the pore volume of the reservoir where the volumetric error (CNV) might be violated during strict Newton iterations. | D130: 0.03
A131: ooow:<A130>+1 -> 129 | B131: --relaxed-pressure-tol-msw | C131: A real positive value that sets the relaxation tolerance for the multi-segment well pressure solution in Pascals. | D131: 10000
A132: ooow:<A131>+1 -> 130 | B132: --relaxed-well-flow-tol | C132: A real positive value that sets the relaxation tolerance for the well flow residual in reservoir cubic metres (rm3). | D132: 0.001
A133: ooow:<A132>+1 -> 131 | B133: --restart-time | C133: A real positive value that sets the simulation time at which a restart should be attempted [s]. | D133: -1e+35
A134: ooow:<A133>+1 -> 132 | B134: --restart-writing-interval | C134: A positive integer value that sets the frequency at which time steps are serialized to disk. | D134: 16777215
A135: ooow:<A134>+1 -> 133 | B135: --save-file | C135: A character string that specifies the FileName for .OPMRST file used for saving serialized state. If empty, CASENAME.OPMRST is used. | D135: ""
A136: ooow:<A135>+1 -> 134 | B136: --save-step | C136: A character string that determines if the simulator should save the serialized state of the OPM Flow simulator at one or more report steps to a special *.OPMRST file. This is in addition to the normal restart files written, and consumes significantly more space than the normal restart files, but restarting OPM Flow from this file using the --load-step option deviates less from the original run, compared to restarting using the normal restart features. The files produced are not compatible with other simulators, and also will not be compatible between different releases of OPM Flow The parameter should be set to one of the following: The default value of "" does not write anything to the OPM Flow specific restart file. | D136: ""
A137: ooow:<A136>+1 -> 135 | B137: --scale-linear-system | C137: A Boolean value set to true or false that switches on (true) or off (false) the scaling of linear system of equations according to the equation scale and primary variable types. | D137: false
A138: ooow:<A137>+1 -> 136 | B138: --sched-restart | C138: A Boolean value that determines for a restart run if the case should initialize wells and groups from the historical SCHEDULE section (true), or from the well and group data on the restart file (false). Note that the commercial simulator always uses data from the restart file (false). | D138: false
A139: ooow:<A138>+1 -> 137 | B139: --serial-partitioning | C139: A Boolean value that determines if partitioning for parallel runs on a single process (true), or not (false). | D139: false
A140: ooow:<A139>+1 -> 138 | B140: --shut-unsolvable-wells | C140: A Boolean value that determines if the simulator should shut unsolvable wells (true), or not (false). | D140: true
A141: ooow:<A140>+1 -> 139 | B141: --solve-welleq-initially | C141: A Boolean value set to true or false that determines if the simulator should fully solve the well equations before each iteration of the reservoir model (true), or not (false). Note that the well equations are always added to the full system and solved until converged. | D141: true
A142: ooow:<A141>+1 -> 140 | B142: --solver-continue-on-convergence-failure | C142: A Boolean value that stipulates if the simulator should continue (true) instead of stopping (false) when the minimum solver time step is reached. | D142: false
A143: ooow:<A142>+1 -> 141 | B143: --solver-growth-factor | C143: A real positive value that specifies the growth factor a time step can be increased by when recovering from one or more time step chops, subject to the maximum allowable time step size set by the --solver-max-time-step-in-days parameter. For example, if the current time step has converged at 5 days after a time step chop, and --solver-growth-factor is set to the default value of 2.0, then the next time step will be 2.0 * 5 days, that is at 10 days. | D143: 2.0
A144: ooow:<A143>+1 -> 142 | B144: --solver-max-growth | C144: A real positive value that specifies the maximum growth factor a time step can be increased by after a report time step. subject to the maximum allowable time step size set by the --solver-max-time-step-in-days parameter. Thus, if the current time step has converged at 5 days after at a report step, and --solver-max-growth is set to the default value of 3.0, then the next time step will be 3.0 * 5 days, that is at 15 days. | D144: 3.0
A145: ooow:<A144>+1 -> 143 | B145: --solver-max-restarts | C145: A positive integer that defines the number of allowed consecutive restarts (or time step chops) before the simulation is terminated. | D145: 10
A146: ooow:<A145>+1 -> 144 | B146: --solver-max-time-step-in-days | C146: A real positive double precision value that specifies the maximum allowed time step size in days. | D146: 365
A147: ooow:<A146>+1 -> 145 | B147: --solver-min-time-step | C147: A real positive double precision value that specifies the minimum size of a time step in days for field and metric units, and hours for laboratory units If a time step cannot converge without getting cut below this time step size the simulator will stop. | D147: 1.0 x 10-12
A148: ooow:<A147>+1 -> 146 | B148: --solver-restart-factor | C148: A real positive double precision value that sets the time step chop factor of the time step after a convergence failure. For example, if the current non-convergent time step is 30 days and --solver-restart-factor is set to the default value, then the time step will be repeated using 0.33 * 30 days as the time step, that is 9.9 days. | D148: 0.33
A149: ooow:<A148>+1 -> 147 | B149: --solver-verbosity | C149: A positive integer that specifies the "chattiness" of the non-linear solver. | D149: 1
A150: ooow:<A149>+1 -> 148 | B150: --strict-inner-iter-wells | C150: A positive integer that specifies the number of inner well iterations with strict tolerance. | D150: 40
A151: ooow:<A150>+1 -> 149 | B151: --strict-outer-iter-wells | C151: A positive integer that specifies the number of newton iterations for which wells are checked with strict tolerance. | D151: 6
A152: ooow:<A151>+1 -> 150 | B152: --temperature-max | C152: A real positive value that sets the maximum absolute temperature. | D152: 1.0 x 109
A153: ooow:<A152>+1 -> 151 | B153: --temperature-min | C153: A real positive value that sets the minimum absolute temperature. | D153: 0
A154: ooow:<A153>+1 -> 152 | B154: --threads-per-process | C154: A positive integer value that stipulates the maximum number of threads to be instantiated per process ('-1' means 'automatic'). | D154: -1
A155: ooow:<A154>+1 -> 153 | B155: --tolerance-mb-relaxed | C155: A positive real value. Relaxed tolerated mass balance error that applies for iterations after the iterations with the strict tolerance. | D155: 1e-06
A156: ooow:<A155>+1 -> 154 | B156: --time-step-after-event-in-days | C156: A real double precision value that sets maximum allowed time step after an event; for example, when a well is open or closed etc. The default value of -1 means that events to do effect the time stepping. | D156: -1
A157: ooow:<A156>+1 -> 155 | B157: --time-step-control | C157: A defined character string that defines the time stepping control algorithm and is set to one of the following: | D157: “pid+newtoniteration”
A158: ooow:<A157>+1 -> 156 | B158: --time-step-control-decay-damping-factor | C158: A real positive value that specifies the decay rate a time step can be decreased by after the number target iterations has been exceeded | D158: 1.0
A159: ooow:<A158>+1 -> 157 | B159: --time-step-control-decay-rate | C159: A real positive value that specifies the decay rate a time step size can be decreased by after the number of target iterations has been exceeded | D159: 0.75
A160: ooow:<A159>+1 -> 158 | B160: --time-step-control-file-name | C160: A character string enclosed in quotes that specifies a filename where time steps are specified. The default is the character string timesteps For instance time steps can be generated by the ecl_summary application in libecl as per the following UNIX command line: path_to_libecl_applications/ecl_summary DECK TIME > filename Where: DECK is the name of the data deck you want to get the time steps from, TIME tells the application to return the timing for the run, and "filename" is the name of the file the times are piped to. | D160: “timesteps”
A161: ooow:<A160>+1 -> 159 | B161: --time-step-control-growth-damping-factor | C161: A real positive value that specifies the growth rate of the time step increase when the number of target iterations are undercut. | D161: 3.2
A162: ooow:<A161>+1 -> 160 | B162: --time-step-control-growth-rate | C162: A real positive value that specifies the growth rate of the time step size when the number of target iterations are undercut. | D162: 1.25
A163: ooow:<A162>+1 -> 161 | B163: --time-step-control-target-iterations | C163: A positive integer that defines the number of linear iterations which the time step control scheme should aim for (if applicable). | D163: 30
A164: ooow:<A163>+1 -> 162 | B164: --time-step-control-target-newton-iterations | C164: A positive integer that specifies the number of Newton iterations which the time step control scheme should aim for (if applicable). | D164: 8
A165: ooow:<A164>+1 -> 163 | B165: --time-step-control-tolerance | C165: A real double precision value that sets the tolerance for PID (only used with the pid and pid+ options defined by the --time-step-control option). | D165: 0.1
A166: ooow:<A165>+1 -> 164 | B166: --time-step-verbosity | C166: A positive integer that specifies the "chattiness" during the time integration. | D166: 1
A167: ooow:<A166>+1 -> 165 | B167: --tolerance-cnv | C167: A real positive double precision value that specifies the maximum non-linear tolerance error. This is the local convergence tolerance (maximum of local saturation errors). | D167: 0.01
A168: ooow:<A167>+1 -> 166 | B168: --tolerance-cnv-relaxed | C168: A real positive value that defines the relaxed local convergence tolerance that applies for iterations after the iterations with the strict tolerance. | D168: 1.0
A169: ooow:<A168>+1 -> 167 | B169: --tolerance-mb | C169: A real positive double precision value that sets the maximum mass balance error, that is the tolerated mass balance error relative to total mass present. | D169: 1.0 x 10-6
A170: ooow:<A169>+1 -> 168 | B170: --tolerance-pressure-ms-wells | C170: A real positive double precision value that specifies the tolerance for the pressure equations for multi-segment wells. | D170: 1000
A171: ooow:<A170>+1 -> 169 | B171: --tolerance-well-control | C171: A real positive double precision value that sets the maximum tolerance for the well control equations. | D171: 1.0 x 10-7
A172: ooow:<A171>+1 -> 170 | B172: --tolerance-wells | C172: A real positive double precision value that defines the maximum non-linear error for the well equations. | D172: 1.0 x 10-4
A173: ooow:<A172>+1 -> 171 | B173: -update-equations-scaling | C173: A Boolean value that switches on (true) or off (false) the updating of the scaling factors for mass balance equations during the simulation. | D173: false
A174: ooow:<A173>+1 -> 172 | B174: --use-average-density-ms-wells | C174: A Boolean value that specifies whether to approximate segment densitities by averaging over the segment and its outlet (true) or not (false). | D174: false
A175: ooow:<A174>+1 -> 173 | B175: --use-gmres | C175: A Boolean value that when set to true OPM Flow will use Generalized Minimal Residual (“GMRES”)6 Y. Saad, A flexible inner-outer preconditioned GMRES algorithm, SIAM J. Sci. Statist. Comput.,14, (1993). and 7 Y. Saad and M.H. Schultz, GMRES: A generalized minimum residual algorithm for solving nonsymmetric linear systems, SIAM J. Sci. Statist. Comput., 7 (1986), pp. 856{869.solver instead of Biconjugate Gradient Stabilized (“BiCGSTAB”)8 Van der Vorst, H. A. (1992). "Bi-CGSTAB: A Fast and Smoothly Converging Variant of Bi-CG for the Solution of Nonsymmetric Linear Systems". SIAM J. Sci. Stat. Comput. 13 (2): 631–644. doi:10.1137/0913035. hdl:10338.dmlcz/104566 and 9 Sleijpen, G. L. G.; Fokkema, D. R. (November 1993). "BiCGstab(l) for linear equations involving unsymmetric matrices with complex spectrum" (PDF). Electronic Transactions on Numerical Analysis. Kent, OH: Kent State University. 1: 11–32. ISSN 1068-9613.as the linear solver within the Newton iterations. | D175: false
A176: ooow:<A175>+1 -> 174 | B176: --use-implicit-ipr | C176: A boolean value. Compute implicit IPR for stability checks and stable solution search. | D176: false
A177: ooow:<A176>+1 -> 175 | B177: --use-multisegment-well | C177: A Boolean value that when set to true the simulator will use the well model for multi-segment wells instead of the one for single-segment wells. | D177: true
A178: ooow:<A177>+1 -> 176 | B178: --use-update-stabilization | C178: A Boolean value set to true or false that switches on (true) or off (false) the stabilized Newton option, that attempts to detect and correct oscillations or stagnation during the Newton iterations. This option may improve convergence for some cases. | D178: true
A179: ooow:<A178>+1 -> 177 | B179: --water-only-threshold | C179: A real positive value that defines the saturation threshold, for which cells with water saturations above or equal to this threshold are considered one-phase water only. | D179: 1.0
A180: ooow:<A179>+1 -> 178 | B180: --zoltan-imbalance-tol | C180: A real positive value that defines the tolerable imbalance of the load balancing provided by Zoltan package. | D180: 1.1
A181: ooow:<A180>+1 -> 179 | B181: --zoltan-params | C181: A character string that specifies the configuration of the Zoltan partitioner. Valid options are: graph, hypergraph or scotch. Alternatively, you can request a configuration to be read from a JSON file by giving the filename here, ending with '.json.' See https://sandialabs.github.io/Zoltan/ug_html/ug.html for available Zoltan options. | D181: "graph"
A182: Notes: flow --help instead use: flow --help-all to get a list of supported command line Parameters.

Sheet: Table2
A1: OPM Flow 2023-10 Command Line Options
A2: No. | B2: Variable Name | C2: Description | D2: Default
A3: 1 | B3: -h or --help | C3: A character string that causes OPM Flow to print a help message that gives a brief description of the available command line parameters. This now only prints the active user facing command line options. | D3: N/A
A4: ooow:<A3>+1 -> 2 | B4: --help-all | C4: Prints all the command line options included in the release, including obsolete, hidden and deprecated options. | D4: N/A
A5: ooow:<A4>+1 -> 3 | B5: --accelerator-mode | C5: Choose a linear solver, usage: '--accelerator-mode=[ none | cusparse | opencl | amgcl | rocalution ]'. | D5: “none”
A6: ooow:<A5>+1 -> 4 | B6: --allow-distributed-wells | C6: Allow the perforations of a well to be distributed to interior of multiple processes. | D6: false
A7: ooow:<A6>+1 -> 5 | B7: --alternative-well-rate-init | C7: Use alternative well rate initialization procedure. | D7: true
A8: ooow:<A7>+1 -> 6 | B8: --bda-device-id | C8: Choose device ID for cusparseSolver or openclSolver, use 'nvidia-smi' or 'clinfo' commands to determine valid IDs. | D8: 0
A9: ooow:<A8>+1 -> 7 | B9: --continue-on-convergence-error | C9: Continue with a non-converged solution instead of giving up if we encounter a time step size smaller than the minimum time step size. | D9: false
A10: ooow:<A9>+1 -> 8 | B10: --cpr-reuse-interval | C10: A positive integer that sets the reuse preconditioner interval. Used when --cpr-reuse-setup is set to 4, then the preconditioner will be fully recreated instead of reused every N linear solve, where N is this parameter. | D10: 30
A11: ooow:<A10>+1 -> 9 | B11: --cpr-reuse-setup | C11: A positive integer that defines if the CPR solver should re-use the AMG setup. Valid options are: Changed the default value from three to four. | D11: 4
A12: ooow:<A11>+1 -> 10 | B12: --dbph-max-rel | C12: A real positive value that sets maximum relative change of the bottom-hole pressure in a single iteration | D12: 1.0
A13: ooow:<A12>+1 -> 11 | B13: --dp-max-rel | C13: A real positive double precision value that sets the maximum allowed relative change of pressure per iteration. | D13: 0.3
A14: ooow:<A13>+1 -> 12 | B14: --ds-max | C14: A real positive double precision value that sets the maximum allowed change in saturation per iteration. | D14: 0.2
A15: ooow:<A14>+1 -> 13 | B15: --dwell-fraction-max | C15: A real positive value that sets the maximum allowed change in well’s volume fraction per iteration. | D15: 0.2
A16: ooow:<A15>+1 -> 14 | B16: --ecl-deck-file-name | C16: A character string that defines the name of the OPM Flow input file which contains the simulator’s ECLIPSE formatted input deck to be simulated. Note that there must be no spaces in the filename. If there are spaces, which can typically occur on Windows based systems, then the filename should be enclosed in quotes; thus instead of FILE NAME use "FILE NAME". | D16: “”
A17: ooow:<A16>+1 -> 15 | B17: --ecl-enable-drift-compensation | C17: A Boolean value set to true or false that enables (true) or disables (false) partial compensation of systematic mass losses via the source term of the next time step. | D17: true
A18: ooow:<A17>+1 -> 16 | B18: --ecl-enable-tuning | C18: Honor some aspects of the TUNING keyword from the ECL deck. | D18: false
A19: ooow:<A18>+1 -> 17 | B19: --ecl-newton-relaxed-tolerance | C19: The maximum error which the volumetric residual may exhibit if it is in a 'relaxed' region during a strict iteration. | D19: 1e+09
A20: ooow:<A19>+1 -> 18 | B20: --ecl-newton-relaxed-volume-fraction | C20: The fraction of the pore volume of the reservoir where the volumetric error may be voilated during strict Newton iterations. | D20: 0.03
A21: ooow:<A20>+1 -> 19 | B21: --ecl-newton-strict-iterations | C21: The number of Newton iterations where the volumetric error is considered. | D21: 8
A22: ooow:<A21>+1 -> 20 | B22: --ecl-newton-sum-tolerance | C22: The maximum error tolerated by the Newton method for considering a solution to be converged. | D22: 0.0001
A23: ooow:<A22>+1 -> 21 | B23: --ecl-newton-sum-tolerance-exponent | C23: The exponent used to scale the sum tolerance by the total pore volume of the reservoir. | D23: 0.333333
A24: ooow:<A23>+1 -> 22 | B24: --ecl-output-double-precision | C24: A Boolean value set to true or false that switches on (true) or off (false) double precision in restart files. Useful for 'perfect' restarts. | D24: false
A25: ooow:<A24>+1 -> 23 | B25: --ecl-output-interval | C25: An integer value defining the number of report steps that ought to be skipped between two writes of restart files results. | D25: -1
A26: ooow:<A25>+1 -> 24 | B26: --edge-weights-method | C26: A defined positive integer value that defines the edge-weighing strategy: | D26: 1
A27: ooow:<A26>+1 -> 25 | B27: --enable-adaptive-time-stepping | C27: A Boolean value set to true or false that turns on (true) or off (false) adaptive time stepping. If set to false the report time steps provided by the input deck are used. | D27: true
A28: ooow:<A27>+1 -> 26 | B28: --enable-async-ecl-output | C28: A Boolean value set to true or false that sets the output mode to be asynchronously (true), letting the simulator continue computing the next time step while writing results to restart and summary files in the commercial simulators format. | D28: true
A29: ooow:<A28>+1 -> 27 | B29: --enable-async-vtk-output | C29: A Boolean value set to true or false that sets the output mode to be asynchronously (true), letting the simulator continue computing the next time step while writing results to the VTK output files. | D29: true
A30: ooow:<A29>+1 -> 28 | B30: --enable-dry-run | C30: A Boolean value set to true or false that specifies if the simulation should actually run, (true) or just check the input deck (false). This option is equivalent to activating the NOSIM keyword in the RUNSPEC section of the input deck (see section Error: Reference source not foundError: Reference source not found). The default value of “auto’ will use whatever is stipulated in the input deck via the NOSIM keyword. | D30: “auto”
A31: ooow:<A30>+1 -> 29 | B31: --enable-ecl-output | C31: A Boolean value set to true or false that specifies if the binary output files (restart, summary files, etc.) should be written in the commercial simulator’s format (true), or OPM Flow’s format (false). | D31: true
A32: ooow:<A31>+1 -> 30 | B32: --enable-esmry | C32: A Boolean value that switches on (true) or off (false) the output SUMMARY vectors to the ESMRY file for fast loading of summary data. | D32: false
A33: ooow:<A32>+1 -> 31 | B33: --enable-gravity | C33: A Boolean value that switches on (true) or off (false) the use of the gravity correction for the pressure gradients. | D33: true
A34: ooow:<A33>+1 -> 32 | B34: --enable-grid-adaptation | C34: A Boolean value that enables (true) or disables (false) adaptive grid refinement/coarsening. Note that Eclipse grid output will be disabled if adaptive grid refinement/coarsening is enabled. | D34: false
A35: ooow:<A34>+1 -> 33 | B35: --enable-intensive-quantity-cache | C35: A Boolean value that switches on (true) or off (false) the caching of intensive quantities. | D35: true
A36: ooow:<A35>+1 -> 34 | B36: --enable-logging-fallout-warning | C36: A Boolean value set to true or false that sets the developer option to see whether logging was on non-root processors (true). If set to true output will be appended to the *.DBG or *.PRT files. | D36: false
A37: ooow:<A36>+1 -> 35 | B37: --enable-opm-rst-file | C37: A Boolean value set to true or false to write OPM specific data sets to the commercial simulators restart file to enable restart of an OPM Flow runs (true) by OPM Flow, or not to write the data (false). | D37: false
A38: ooow:<A37>+1 -> 36 | B38: --enable-storage-cache | C38: A Boolean value set to true or false that turns on (true) or off (false) storing previous storage terms and avoid re-calculating them. | D38: true
A39: ooow:<A38>+1 -> 37 | B39: --enable-terminal-output | C39: A Boolean value set to true or false that turns on (true) or off (false) high-level information about the simulation's progress to the terminal | D39: true
A40: ooow:<A39>+1 -> 38 | B40: --enable-thermodynamic-hints | C40: A Boolean value that enables (true) or disables (false) thermodynamic hints. | D40: false
A41: ooow:<A40>+1 -> 39 | B41: --enable-tuning | C41: A Boolean value set to true or false that instructs OPM Flow to read the time stepping parameters from the Error: Reference source not foundkeyword in the input deck, if set to true. Note that only the first record of the TUNING keyword is processed. | D41: false
A42: ooow:<A41>+1 -> 40 | B42: --enable-vtk-output | C42: A Boolean value set to true or false that turns on (true) or off (false) a global switch for writing VTK files. | D42: false
A43: ooow:<A42>+1 -> 41 | B43: --enable-well-operability-check | C43: A Boolean value set to true or false that enables (true) checking of a well’s operating status, or disables (false) the checking. | D43: true
A44: ooow:<A43>+1 -> 42 | B44: --enable-well-operability-check-iter | C44: A Boolean value set to true or false that enables (true) checking of a well’s operating status during iterations, or disables (false) the checking during iterations. | D44: false
A45: ooow:<A44>+1 -> 43 | B45: --enable-write-all-solutions | C45: A Boolean value set to true or false that turns on (true) or off (false) the writing of all solutions to disk instead of only the ones for the report steps. | D45: false
A46: ooow:<A45>+1 -> 44 | B46: --end-time | C46: The simulation time at which the simulation is finished [s]. | D46: 1e+100
A47: ooow:<A46>+1 -> 45 | B47: --force-disable-fluid-in-place-output | C47: A Boolean value set to true or false that instructs OPM Flow not to print the Fluid In-Place report after each report time step (true) or not (false). Note this parameter will override the print request in the input deck. | D47: false
A48: ooow:<A47>+1 -> 46 | B48: --force-disable-resv-fluid-in-place-output | C48: A Boolean value set to true or false that instructs OPM Flow to not to print the Reservoir Volume Fluid In-Place report after each report time step (true) or not (false). Note this parameter will override the print request in the input deck. | D48: false
A49: ooow:<A48>+1 -> 47 | B49: --full-time-step-initially | C49: A Boolean value set to true or false that instructs OPM Flow to always attempt to finish a report step using a single time step (true) or not (false). | D49: false
A50: ooow:<A49>+1 -> 48 | B50: --ignore-keywords | C50: A character string that defines a list of keywords which should be ignored by OPM Flow. The keyword string should be enclosed in quotes and each keyword separated by a colon, that is ':'. | D50: “”
A51: ooow:<A50>+1 -> 49 | B51: --ilu-fillin-level | C51: A positive integer value that sets the fill in level for the ILU preconditioner. | D51: 0
A52: ooow:<A51>+1 -> 50 | B52: --ilu-redblack | C52: A Boolean value set to true or false that instructs OPM Flow to use red-black partitioning for the ILU preconditioner. (true) or not (false). | D52: false
A53: ooow:<A52>+1 -> 51 | B53: --ilu-relaxation | C53: A real positive double precision value that sets the relaxation factor of the linear solver's ILU preconditioner | D53: 0.9
A54: ooow:<A53>+1 -> 52 | B54: --ilu-reorder-spheres | C54: A Boolean value set to true or false that specifies OPM Flow to reorder the entries of the matrix in the red-black ILU preconditioner in spheres starting at an edge (true) or not (false) If false the original ordering is preserved in each color. Otherwise try to ensure D4 ordering (in a 2D structured grid, the diagonal elements are consecutive). | D54: false
A55: ooow:<A54>+1 -> 53 | B55: --initial-time-step-in-days | C55: A real double precision value that sets the size of initial time step in days. | D55: 1.0
A56: ooow:<A55>+1 -> 54 | B56: --initial-time-step-size | C56: A real double precision value that sets the size of initial time step in seconds. | D56: 86400
A57: ooow:<A56>+1 -> 55 | B57: --linear-solver | C57: A defined quoted character string that sets the configuration of the linear solver, valid values are: Option (2) extends the existing Constrained Pressure Residual (“CPR”) preconditioner to include wells. This option can also be invoked via the CPR keyword in the RUNSPEC section; however, the command line parameter takes precedence. For option (7) one enters a character string enclosed in quotes that defines the filename of a JSON configuration file for the flexible linear solver system. In this case the file extension should be ‘.json’. Note that the *.PRT file contains the “Property tree for the linear solver” listing, which is the JSON specification of the current case, and can be used to configure a user specific linear solver JSON file. The option "cpr" now is an alias for "cprw" instead of "cpr_trueimpes". | D57: “ilu0”
A58: ooow:<A57>+1 -> 56 | B58: --linear-solver-ignore-convergence-failure | C58: A Boolean value set to true or false that if set to true convergences failures in the linear solver are ignored. This option should be used with care, as the results might be unreliable. | D58: false
A59: ooow:<A58>+1 -> 57 | B59: --linear-solver-max-iter | C59: A positive integer value that defines the maximum number of linear iterations. | D59: 200
A60: ooow:<A59>+1 -> 58 | B60: --linear-solver-print-json-definition | C60: Write the JSON definition of the linear solver setup to the DBG file. | D60: true
A61: ooow:<A60>+1 -> 59 | B61: --linear-solver-reduction | C61: A real positive double precision value that sets the minimum reduction of the residual for the linear solver. The linear solver convergences when the residual is reduced sufficiently. The simulator now overrides the default reduction to be 0.005 instead of 0.01, if the linear solver has been set to one of the cpr options, in a similar manner as how the default maximum number of linear iterations for the cpr and cprw options are changed to 20 instead of 100, unless specified by the command line option by the user. | D61: 0.01
A62: ooow:<A61>+1 -> 60 | B62: --linear-solver-restart | C62: A positive integer value that sets the number of iterations after which GMRES is restarted. | D62: 40
A63: ooow:<A62>+1 -> 61 | B63: --linear-solver-verbosity | C63: A positive integer value that defines the output from linear solver: | D63: 0
A64: ooow:<A63>+1 -> 62 | B64: --load-file | C64: A character string enclosed in quotes that defines the FileName for the .OPMRST file used to load the serialized state. If empty, CASENAME.OPMRST is used. | D64: ""
A65: ooow:<A64>+1 -> 63 | B65: --load-step | C65: An integer value that determines if the simulator should load the serialized state from OPM Flow's version of the restart file. and should be set to either a specific report step, or 0 to load the last stored report step. The default value of -1 does not load the data from the OPM Flow specific restart file. OPM Flow's version of the restart file, is written using the --save-step=N option. | D65: -1
A66: ooow:<A65>+1 -> 64 | B66: --local-domains-ordering-measure | C66: A character string enclosed in quotes that defines the subdomain ordering measure. Allowed values are 'pressure' and 'residual'. | D66: "pressure"
A67: ooow:<A66>+1 -> 65 | B67: --local-domains-partitioning-imbalance | C67: A real positive double precision value that sets the subdomain partitioning imbalance tolerance. 1.03 is 3 percent imbalance. | D67: 1.03
A68: ooow:<A67>+1 -> 66 | B68: --local-domains-partitioning-method | C68: A character string enclosed in quotes that defines the subdomain partitioning method. Allowed values are 'zoltan', 'simple', and the name of a partition file ending with '.partition'. | D68: "zoltan"
A69: ooow:<A68>+1 -> 67 | B69: --local-solve-approach | C69: A character string enclosed in quotes that defines the local solve approach. Valid choices are ‘jacobi’ and ‘gauss-seidel’. | D69: "jacobi"
A70: ooow:<A69>+1 -> 68 | B70: --local-tolerance-scaling-cnv | C70: A real positive double precision value that sets the convergence tolerance for local solves. Set to lower than 1.0 to use stricter convergence tolerance for local solves. | D70: 0.01
A71: ooow:<A70>+1 -> 69 | B71: --local-tolerance-scaling-mb | C71: A real positive double precision value that sets the convergence tolerance for local solves. Set to lower than 1.0 to use stricter convergence tolerance for local solves. | D71: 1
A72: ooow:<A71>+1 -> 70 | B72: --local-well-solve-control-switching | C72: A boolean value that allows (true) or disallows (false) control switching during local well solutions. | D72: false
A73: ooow:<A72>+1 -> 71 | B73: --matrix-add-well-contributions | C73: A Boolean value set to true or false that if set to true explicitly specifies the influences of wells between cells in the Jacobian and preconditioner matrices. | D73: false
A74: ooow:<A73>+1 -> 72 | B74: --max-inner-iter-ms-wells | C74: A positive integer value that defines the maximum number of inner iterations for multi-segment wells. | D74: 100
A75: ooow:<A74>+1 -> 73 | B75: --max-inner-iter-wells | C75: A positive integer value that defines the maximum number of inner iterations for standard wells. | D75: 50
A76: ooow:<A75>+1 -> 74 | B76: --max-local-solve-iterations | C76: A positive integer value that defines the maximum number of iterations for local solves with NLDD nonlinear solver. | D76: 20
A77: ooow:<A76>+1 -> 75 | B77: --max-newton-iterations-with-inner-well-iterations | C77: A positive integer that specifies the maximum newton iterations with inner well iterations. | D77: 8
A78: ooow:<A77>+1 -> 76 | B78: --max-pressure-change-ms-wells | C78: A real positive value that defines the maximum relative pressure change for a single iteration of the multi-segment well model. | D78: 1.0 x 106
A79: ooow:<A78>+1 -> 77 | B79: --max-residual-allowed | C79: A real positive value that sets the absolute maximum tolerance for residuals without cutting the time step size. | D79: 1.0 x 107
A80: ooow:<A79>+1 -> 78 | B80: --max-single-precision-days | C80: A real positive value that sets the maximum time step size where single precision floating point arithmetic can be used for solving the linear systems of equations. | D80: 20.0
A81: ooow:<A80>+1 -> 79 | B81: --max-temperature-change | C81: A real positive value that stipulates the maximum absolute change of temperature in a single iteration. | D81: 5
A82: ooow:<A81>+1 -> 80 | B82: --max-time-step-divisions | C82: A positive integer that specifies the maximum number of divisions by two of the timestep size before the simulation bails out. | D82: 10
A83: ooow:<A82>+1 -> 81 | B83: --max-time-step-size | C83: A real positive value that defines the maximum size to which all time steps are limited to in seconds. | D83: inf
A84: ooow:<A83>+1 -> 82 | B84: --max-welleq-iter | C84: A positive integer that defines the maximum number of iterations to determine the solution to the well equations. | D84: 30
A85: ooow:<A84>+1 -> 83 | B85: --maximum-number-of-well-switches | C85: A positive integer values that stipulates the maximum number of times a well can switch to the same control. | D85: 3
A86: ooow:<A85>+1 -> 84 | B86: --maximum-water-saturation | C86: A real positive value that defines the maximum water saturation. | D86: 1.0
A87: ooow:<A86>+1 -> 85 | B87: --milu-variant | C87: A defined character string that specifies which variant of the modified ILU preconditioner ought to be used. Possible variants are: The default is “ILU” | D87: “ILU”
A88: ooow:<A87>+1 -> 86 | B88: --min-strict-cnv-ite | C88: A positive integer that sets the minimum number of Newton iterations before relaxed tolerances are used for the CNV convergence criterion. | D88: 0
A89: ooow:<A88>+1 -> 87 | B89: --min-time-step-based-on-newton-iterations | C89: A real positive value that sets the minimum time step size (in days for field and metric unit and hours for lab unit) can be reduced to based on Newton iteration counts. | D89: 0.0
A90: ooow:<A89>+1 -> 88 | B90: --min-time-step-before-shutting-problematic-wells-in-days | C90: A real positive value that sets the minimum time step size in days for which problematic wells are not shut. Time steps below this value will result in problematic wells being shut-in by the simulator. | D90: 0.01
A91: ooow:<A90>+1 -> 89 | B91: --min-time-step-size | C91: A real positive value that sets the minimum size to which all time steps are limited to in seconds. | D91: 0.0
A92: ooow:<A91>+1 -> 90 | B92: --network-max-iterations | C92: A positive integer that sets the maximum number of iterations in the network solver before giving up. | D92: 200
A93: ooow:<A92>+1 -> 91 | B93: --network-max-strict-iterations | C93: A positive integer that sets the maximum iterations in network solver before relaxing tolerance. | D93: 100
A94: ooow:<A93>+1 -> 92 | B94: --newton-max-error | C94: A real positive value that sets the maximum error tolerated by the Newton method to which does not cause an abort. | D94: 1e+10
A95: ooow:<A94>+1 -> 93 | B95: --newton-max-iterations | C95: A positive integer that defines the maximum number of Newton iterations per time step used by the simulator. | D95: 20
A96: ooow:<A95>+1 -> 94 | B96: --newton-max-relax | C96: A real positive value that sets the maximum relaxation factor of a Newton iteration used by the simulator. | D96: 0.5
A97: ooow:<A96>+1 -> 95 | B97: --newton-min-iterations | C97: A positive integer that sets the minimum number of Newton iterations per time step used by the simulator. The default value of one ensures that at least one Newton iteration is performed after the previous time step. | D97: 1
A98: ooow:<A97>+1 -> 96 | B98: --newton-relaxation-type | C98: A character string that defines the type of relaxation used in Newton’s method, the default is dampen. | D98: “dampen”
A99: ooow:<A98>+1 -> 97 | B99: --newton-target-iterations | C99: A positive integer that sets the 'optimum' number of Newton iterations per time step. | D99: 6
A100: ooow:<A99>+1 -> 98 | B100: --newton-tolerance | C100: A real positive value that sets the maximum raw error tolerated by the Newtonmethod for considering a solution to be converged. | D100: 0.01
A101: ooow:<A100>+1 -> 99 | B101: --newton-verbose | C101: A boolean value that specifies whether the Newton method should inform the user about its progress (true) or not (false). | D101: true
A102: ooow:<A101>+1 -> 100 | B102: --newton-write-convergence | C102: A boolean value that specifies whether to write the convergence behaviour of the Newton method to a VTK file (true) or not (false). | D102: false
A103: ooow:<A102>+1 -> 101 | B103: --nldd-num-initial-newton-iter | C103: A positive integer that sets the number of initial global Newton iterations when running the NLDD nonlinear solver. | D103: 1
A104: ooow:<A103>+1 -> 102 | B104: --nonlinear-solver | C104: A character string that specifies the nonlinear solver. Valid choices are newton or nldd. | D104: "newton"
A105: ooow:<A104>+1 -> 103 | B105: --num-local-domains | C105: A positive integer that sets the number of local domains for NLDD nonlinear solver. Note this is an experimental feature in the current release 2023.10 that is expected to be more complete and tested by the 2024.10 release. | D105: 0
A106: ooow:<A105>+1 -> 104 | B106: --num-pressure-points-equil | C106: A positive integer that sets the number of pressure points (in each direction) in tables used for equilibration. | D106: 2000
A107: ooow:<A106>+1 -> 105 | B107: --opencl-ilu-parallel | C107: A Boolean value set to true or false that if set to true then parallelize the ILU decomposition and application on GPU, or not (false). | D107: true
A108: ooow:<A107>+1 -> 106 | B108: --opencl-platform-id | C108: A positive integer that specifies the platform identification (“ID”) for the openSolver. Use the “clinfo” command to determine valid IDs. | D108: 0
A109: ooow:<A108>+1 -> 107 | B109: --output-dir | C109: A character string that defines the directory to which OPM Flow is to write the commercial simulator compatible output files (restart, summary files etc.). The default value results in the files be written to the same directory as the input file. | D109: “”
A110: ooow:<A109>+1 -> 108 | B110: --output-extra-convergence-info | C110: A defined character string that specifies whether to provide additional convergence output to separate files for diagnostic purposes. The available options are: Options can be combined with commas, e.g."steps,iterations" for multiple outputs. The default value of "none" prevents the two files from being written out, for better compatibility with the commercial simulator. | D110: “none”
A111: ooow:<A110>+1 -> 109 | B111: --output-interval | C111: A positive integer that specifies the number of report steps between two consecutive writes of restart data. | D111: 1
A112: ooow:<A111>+1 -> 110 | B112: --output-mode | C112: A defined character string that defines the output to the *.PRT and *.DBG files: For example to just output logging information use: --output-mode=”log” or --output-mode=false | D112: “all”
A113: ooow:<A112>+1 -> 111 | B113: --owner-cells-first | C113: A Boolean value set to true or false that determines if the cells owned by a rank should be ordered before ghost/overlapping the cells (true), or not (false). | D113: true
A114: ooow:<A113>+1 -> 112 | B114: --parameter-file | C114: A character string that defines the name of a parameter file which contains the simulator’s set of run-time parameters, as listed in this table. | D114: “”
A115: ooow:<A114>+1 -> 113 | B115: --parsing-strictness | C115: Set strictness of parsing process. Available options are: Default: "normal" | D115: "normal"
A116: ooow:<A115>+1 -> 114 | B116: --predetermined-time-steps-file | C116: A file with a list of predetermined time step sizes (one time step per line). | D116: ""
A117: ooow:<A116>+1 -> 115 | B117: --pri-var-oscilation-threshold | C117: A real positive value that defines the threshold value for the primary variable switching conditions after its meaning has switched to hinder oscillations. | D117: 1.0 x 10-5
A118: ooow:<A117>+1 -> 116 | B118: --print-parameters | C118: A positive integer value that request that the run time parameters be printed at the start of the run: | D118: 2
A119: ooow:<A118>+1 -> 117 | B119: --print-properties | C119: A positive integer value that request that the compile time parameters be printed at the start of the run: | D119: 2
A120: ooow:<A119>+1 -> 118 | B120: --project-saturations | C120: A Boolean value set to true or false that determines if all the fluid saturations should be scaled to ensure the values are in the interval (0, 1), including runs that use solvents (true), or not (false). | D120: false
A121: ooow:<A120>+1 -> 119 | B121: --regularization-factor-wells | C121: A real positive value that defines the “regularization factor” for wells. | D121: 100
A122: ooow:<A121>+1 -> 120 | B122: --relaxed-linear-solver-reduction | C122: A real positive value that defines the minimum reduction of the residual which the linear solver need to achieve for the solution to be accepted. | D122: 0.01
A123: ooow:<A122>+1 -> 121 | B123: --relaxed-max-pv-fraction | C123: A real positive value that defines The fraction of the pore volume of the reservoir where the volumetric error (CNV) might be violated during strict Newton iterations. | D123: 0.03
A124: ooow:<A123>+1 -> 122 | B124: --relaxed-pressure-tol-msw | C124: A real positive value that sets the relaxation tolerance for the multi-segment well pressure solution in Pascals. | D124: 10000
A125: ooow:<A124>+1 -> 123 | B125: --relaxed-well-flow-tol | C125: A real positive value that sets the relaxation tolerance for the well flow residual in reservoir cubic metres (rm3). | D125: 0.001
A126: ooow:<A125>+1 -> 124 | B126: --restart-time | C126: A real positive value that sets the simulation time at which a restart should be attempted [s]. | D126: -1e+35
A127: ooow:<A126>+1 -> 125 | B127: --restart-writing-interval | C127: A positive integer value that sets the frequency at which time steps are serialized to disk. | D127: 16777215
A128: ooow:<A127>+1 -> 126 | B128: --save-file | C128: A character string that specifies the FileName for .OPMRST file used for saving serialized state. If empty, CASENAME.OPMRST is used. | D128: ""
A129: ooow:<A128>+1 -> 127 | B129: --save-step | C129: A character string that determines if the simulator should save the serialized state of the OPM Flow simulator at one or more report steps to a special *.OPMRST file. This is in addition to the normal restart files written, and consumes significantly more space than the normal restart files, but restarting OPM Flow from this file using the --load-step option deviates less from the original run, compared to restarting using the normal restart features. The files produced are not compatible with other simulators, and also will not be compatible between different releases of OPM Flow The parameter should be set to one of the following: The default value of "" does not write anything to the OPM Flow specific restart file. | D129: ""
A130: ooow:<A129>+1 -> 128 | B130: --scale-linear-system | C130: A Boolean value set to true or false that switches on (true) or off (false) the scaling of linear system of equations according to the equation scale and primary variable types. | D130: false
A131: ooow:<A130>+1 -> 129 | B131: --sched-restart | C131: A Boolean value that determines for a restart run if the case should initialize wells and groups from the historical SCHEDULE section (true), or from the well and group data on the restart file (false). Note that the commercial simulator always uses data from the restart file (false). | D131: FALSe
A132: ooow:<A131>+1 -> 130 | B132: --serial-partitioning | C132: A Boolean value that determines if partitioning for parallel runs on a single process (true), or not (false). | D132: false
A133: ooow:<A132>+1 -> 131 | B133: --shut-unsolvable-wells | C133: A Boolean value that determines if the simulator should shut unsolvable wells (true), or not (false). | D133: true
A134: ooow:<A133>+1 -> 132 | B134: --solve-welleq-initially | C134: A Boolean value set to true or false that determines if the simulator should fully solve the well equations before each iteration of the reservoir model (true), or not (false). Note that the well equations are always added to the full system and solved until converged. | D134: true
A135: ooow:<A134>+1 -> 133 | B135: --solver-continue-on-convergence-failure | C135: A Boolean value that stipulates if the simulator should continue (true) instead of stopping (false) when the minimum solver time step is reached. | D135: false
A136: ooow:<A135>+1 -> 134 | B136: --solver-growth-factor | C136: A real positive value that specifies the growth factor a time step can be increased by when recovering from one or more time step chops, subject to the maximum allowable time step size set by the --solver-max-time-step-in-days parameter. For example, if the current time step has converged at 5 days after a time step chop, and --solver-growth-factor is set to the default value of 2.0, then the next time step will be 2.0 * 5 days, that is at 10 days. | D136: 2.0
A137: ooow:<A136>+1 -> 135 | B137: --solver-max-growth | C137: A real positive value that specifies the maximum growth factor a time step can be increased by after a report time step. subject to the maximum allowable time step size set by the --solver-max-time-step-in-days parameter. Thus, if the current time step has converged at 5 days after at a report step, and --solver-max-growth is set to the default value of 3.0, then the next time step will be 3.0 * 5 days, that is at 15 days. | D137: 3.0
A138: ooow:<A137>+1 -> 136 | B138: --solver-max-restarts | C138: A positive integer that defines the number of allowed consecutive restarts (or time step chops) before the simulation is terminated. | D138: 10
A139: ooow:<A138>+1 -> 137 | B139: --solver-max-time-step-in-days | C139: A real positive double precision value that specifies the maximum allowed time step size in days. | D139: 365
A140: ooow:<A139>+1 -> 138 | B140: --solver-min-time-step | C140: A real positive double precision value that specifies the minimum size of a time step in days for field and metric units, and hours for laboratory units If a time step cannot converge without getting cut below this time step size the simulator will stop. | D140: 1.0 x 10-12
A141: ooow:<A140>+1 -> 139 | B141: --solver-restart-factor | C141: A real positive double precision value that sets the time step chop factor of the time step after a convergence failure. For example, if the current non-convergent time step is 30 days and --solver-restart-factor is set to the default value, then the time step will be repeated using 0.33 * 30 days as the time step, that is 9.9 days. | D141: 0.33
A142: ooow:<A141>+1 -> 140 | B142: --solver-verbosity | C142: A positive integer that specifies the "chattiness" of the non-linear solver. | D142: 1
A143: ooow:<A142>+1 -> 141 | B143: --strict-inner-iter-wells | C143: A positive integer that specifies the number of inner well iterations with strict tolerance. | D143: 40
A144: ooow:<A143>+1 -> 142 | B144: --strict-outer-iter-wells | C144: A positive integer that specifies the number of newton iterations for which wells are checked with strict tolerance. | D144: 6
A145: ooow:<A144>+1 -> 143 | B145: --temperature-max | C145: A real positive value that sets the maximum absolute temperature. | D145: 1.0 x 109
A146: ooow:<A145>+1 -> 144 | B146: --temperature-min | C146: A real positive value that sets the minimum absolute temperature. | D146: 0
A147: ooow:<A146>+1 -> 145 | B147: --threads-per-process | C147: A positive integer value that stipulates the maximum number of threads to be instantiated per process ('-1' means 'automatic'). | D147: -1
A148: ooow:<A147>+1 -> 146 | B148: --time-step-after-event-in-days | C148: A real double precision value that sets maximum allowed time step after an event; for example, when a well is open or closed etc. The default value of -1 means that events to do effect the time stepping. | D148: -1
A149: ooow:<A148>+1 -> 147 | B149: --time-step-control | C149: A defined character string that defines the time stepping control algorithm and is set to one of the following: | D149: “pid+newtoniteration”
A150: ooow:<A149>+1 -> 148 | B150: --time-step-control-decay-damping-factor | C150: A real positive value that specifies the decay rate a time step can be decreased by after the number target iterations has been exceeded | D150: 1.0
A151: ooow:<A150>+1 -> 149 | B151: --time-step-control-decay-rate | C151: A real positive value that specifies the decay rate a time step size can be decreased by after the number of target iterations has been exceeded | D151: 0.75
A152: ooow:<A151>+1 -> 150 | B152: --time-step-control-file-name | C152: A character string enclosed in quotes that specifies a filename where time steps are specified. The default is the character string timesteps For instance time steps can be generated by the ecl_summary application in libecl as per the following UNIX command line: path_to_libecl_applications/ecl_summary DECK TIME > filename Where: DECK is the name of the data deck you want to get the time steps from, TIME tells the application to return the timing for the run, and "filename" is the name of the file the times are piped to. | D152: “timesteps”
A153: ooow:<A152>+1 -> 151 | B153: --time-step-control-growth-damping-factor | C153: A real positive value that specifies the growth rate of the time step increase when the number of target iterations are undercut. | D153: 3.2
A154: ooow:<A153>+1 -> 152 | B154: --time-step-control-growth-rate | C154: A real positive value that specifies the growth rate of the time step size when the number of target iterations are undercut. | D154: 1.25
A155: ooow:<A154>+1 -> 153 | B155: --time-step-control-target-iterations | C155: A positive integer that defines the number of linear iterations which the time step control scheme should aim for (if applicable). | D155: 30
A156: ooow:<A155>+1 -> 154 | B156: --time-step-control-target-newton-iterations | C156: A positive integer that specifies the number of Newton iterations which the time step control scheme should aim for (if applicable). | D156: 8
A157: ooow:<A156>+1 -> 155 | B157: --time-step-control-tolerance | C157: A real double precision value that sets the tolerance for PID (only used with the pid and pid+ options defined by the --time-step-control option). | D157: 0.1
A158: ooow:<A157>+1 -> 156 | B158: --time-step-verbosity | C158: A positive integer that specifies the "chattiness" during the time integration. | D158: 1
A159: ooow:<A158>+1 -> 157 | B159: --tolerance-cnv | C159: A real positive double precision value that specifies the maximum non-linear tolerance error. This is the local convergence tolerance (maximum of local saturation errors). | D159: 0.01
A160: ooow:<A159>+1 -> 158 | B160: --tolerance-cnv-relaxed | C160: A real positive value that defines the relaxed local convergence tolerance that applies for iterations after the iterations with the strict tolerance. | D160: 1.0
A161: ooow:<A160>+1 -> 159 | B161: --tolerance-mb | C161: A real positive double precision value that sets the maximum mass balance error, that is the tolerated mass balance error relative to total mass present. | D161: 1.0 x 10-6
A162: ooow:<A161>+1 -> 160 | B162: --tolerance-pressure-ms-wells | C162: A real positive double precision value that specifies the tolerance for the pressure equations for multi-segment wells. | D162: 1000
A163: ooow:<A162>+1 -> 161 | B163: --tolerance-well-control | C163: A real positive double precision value that sets the maximum tolerance for the well control equations. | D163: 1.0 x 10-7
A164: ooow:<A163>+1 -> 162 | B164: --tolerance-wells | C164: A real positive double precision value that defines the maximum non-linear error for the well equations. | D164: 1.0 x 10-4
A165: ooow:<A164>+1 -> 163 | B165: -update-equations-scaling | C165: A Boolean value that switches on (true) or off (false) the updating of the scaling factors for mass balance equations during the simulation. | D165: false
A166: ooow:<A165>+1 -> 164 | B166: --use-average-density-ms-wells | C166: A Boolean value that specifies whether to approximate segment densitities by averaging over the segment and its outlet (true) or not (false). | D166: false
A167: ooow:<A166>+1 -> 165 | B167: --use-gmres | C167: A Boolean value that when set to true OPM Flow will use Generalized Minimal Residual (“GMRES”)16 Y. Saad, A flexible inner-outer preconditioned GMRES algorithm, SIAM J. Sci. Statist. Comput.,14, (1993). and 17 Y. Saad and M.H. Schultz, GMRES: A generalized minimum residual algorithm for solving nonsymmetric linear systems, SIAM J. Sci. Statist. Comput., 7 (1986), pp. 856{869.solver instead of Biconjugate Gradient Stabilized (“BiCGSTAB”)18 Van der Vorst, H. A. (1992). "Bi-CGSTAB: A Fast and Smoothly Converging Variant of Bi-CG for the Solution of Nonsymmetric Linear Systems". SIAM J. Sci. Stat. Comput. 13 (2): 631–644. doi:10.1137/0913035. hdl:10338.dmlcz/104566 and 19 Sleijpen, G. L. G.; Fokkema, D. R. (November 1993). "BiCGstab(l) for linear equations involving unsymmetric matrices with complex spectrum" (PDF). Electronic Transactions on Numerical Analysis. Kent, OH: Kent State University. 1: 11–32. ISSN 1068-9613.as the linear solver within the Newton iterations. | D167: false
A168: ooow:<A167>+1 -> 166 | B168: --use-multisegment-well | C168: A Boolean value that when set to true the simulator will use the well model for multi-segment wells instead of the one for single-segment wells. | D168: true
A169: ooow:<A168>+1 -> 167 | B169: --use-update-stabilization | C169: A Boolean value set to true or false that switches on (true) or off (false) the stabilized Newton option, that attempts to detect and correct oscillations or stagnation during the Newton iterations. This option may improve convergence for some cases. | D169: true
A170: ooow:<A169>+1 -> 168 | B170: --water-only-threshold | C170: A real positive value that defines the saturation threshold, for which cells with water saturations above or equal to this threshold are considered one-phase water only. | D170: 1.0
A171: ooow:<A170>+1 -> 169 | B171: --zoltan-imbalance-tol | C171: A real positive value that defines the tolerable imbalance of the load balancing provided by Zoltan package. | D171: 1.1
A172: ooow:<A171>+1 -> 170 | B172: --zoltan-params | C172: A character string that specifies the configuration of the Zoltan partitioner. Valid options are: graph, hypergraph or scotch. Alternatively, you can request a configuration to be read from a JSON file by giving the filename here, ending with '.json.' See https://sandialabs.github.io/Zoltan/ug_html/ug.html for available Zoltan options. | D172: "graph"
A173: Notes: flow --help instead use: flow --help-all to get a list of supported command line Parameters.

Sheet: Table621
A1: OPM Flow 2023-04 Command Line Options
A2: No. | B2: Variable Name | C2: Description | D2: Default
A3: 1 | B3: -h or --help | C3: A character string that causes OPM Flow to print a help message that gives a brief description of the available command line parameters. This now only prints the active user facing command line options. | D3: N/A
A4: ooow:<A3>+1 -> 2 | B4: --help-all | C4: Prints all the command line options included in the release, including obsolete, hidden and deprecated options. | D4: N/A
A5: ooow:<A4>+1 -> 3 | B5: --accelerator-mode | C5: A defined character string that defines the usage of the GPU (cusparseSolver or openclSolver) or FPGA (fpgaSolver) as the linear solver, usage '--accelerator-mode=[none|cusparse|opencl|fpga|amgcl]'. | D5: “none”
A6: ooow:<A5>+1 -> 4 | B6: --allow-distributed-wells | C6: A boolean value set to true of false that allows the perforations of a well to be distributed to interior of multiple processes in a parallel run (true), or not (false). | D6: false
A7: ooow:<A6>+1 -> 5 | B7: --alternative-well-rate-init | C7: A boolean value set to true of false that causes the simulator to use an alternative well rate initialization procedure (true). | D7: true
A8: ooow:<A7>+1 -> 6 | B8: --bda-device-id | C8: Choose device ID for cusparseSolver or openclSolver, use 'nvidia-smi' or 'clinfo' commands to determine valid IDs. | D8: 0
A9: ooow:<A8>+1 -> 7 | B9: --continue-on-convergence-error | C9: A Boolean value set to true or false that that instructs the simulator to continue (true) with a non-converged solution instead of giving up (false) if it encounter a time step size smaller than the minimum time step size. | D9: false
A10: ooow:<A9>+1 -> 8 | B10: --cpr-reuse-interval | C10: A positive integer that sets the reuse preconditioner interval. Used when --cpr-reuse-setup is set to 4, then the preconditioner will be fully recreated instead of reused every N linear solve, where N is this parameter. | D10: 30
A11: ooow:<A10>+1 -> 9 | B11: --cpr-reuse-setup | C11: A positive integer that defines if the CPR solver should re-use the AMG setup. Valid options are: Changed the default value from three to four. | D11: 4
A12: ooow:<A11>+1 -> 10 | B12: --dbph-max-rel | C12: A real positive value that sets maximum relative change of the bottom-hole pressure in a single iteration | D12: 1.0
A13: ooow:<A12>+1 -> 11 | B13: --dp-max-rel | C13: A real positive double precision value that sets the maximum allowed relative change of pressure per iteration. | D13: 0.3
A14: ooow:<A13>+1 -> 12 | B14: --ds-max | C14: A real positive double precision value that sets the maximum allowed change in saturation per iteration. | D14: 0.2
A15: ooow:<A14>+1 -> 13 | B15: --dwell-fraction-max | C15: A real positive value that sets the maximum allowed change in well’s volume fraction per iteration. | D15: 0.2
A16: ooow:<A15>+1 -> 14 | B16: --ecl-deck-file-name | C16: A character string that defines the name of the OPM Flow input file which contains the simulator’s ECLIPSE formatted input deck to be simulated. Note that there must be no spaces in the filename. If there are spaces, which can typically occur on Windows based systems, then the filename should be enclosed in quotes; thus instead of FILE NAME use “FILE NAME”. | D16: “”
A17: ooow:<A16>+1 -> 15 | B17: --ecl-enable-drift-compensation | C17: A Boolean value set to true or false that enables (true) or disables (false) partial compensation of systematic mass losses via the source term of the next time step. | D17: true
A18: ooow:<A17>+1 -> 16 | B18: --ecl-output-double-precision | C18: A Boolean value set to true or false that switches on (true) or off (false) double precision in restart files. Useful for 'perfect' restarts. | D18: false
A19: ooow:<A18>+1 -> 17 | B19: --ecl-output-interval | C19: An integer value defining the number of report steps that ought to be skipped between two writes of restart files results. | D19: -1
A20: ooow:<A19>+1 -> 18 | B20: --edge-weights-method | C20: A defined positive integer value that defines the edge-weighing strategy: | D20: 1
A21: ooow:<A20>+1 -> 19 | B21: --enable-adaptive-time-stepping | C21: A Boolean value set to true or false that turns on (true) or off (false) adaptive time stepping. If set to false the report time steps provided by the input deck are used. | D21: true
A22: ooow:<A21>+1 -> 20 | B22: --enable-async-ecl-output | C22: A Boolean value set to true or false that sets the output mode to be asynchronously (true), letting the simulator continue computing the next time step while writing results to restart and summary files in the commercial simulators format. | D22: true
A23: ooow:<A22>+1 -> 21 | B23: --enable-async-vtk-output | C23: A Boolean value set to true or false that sets the output mode to be asynchronously (true), letting the simulator continue computing the next time step while writing results to the VTK output files. | D23: true
A24: ooow:<A23>+1 -> 22 | B24: --enable-dry-run | C24: A Boolean value set to true or false that specifies if the simulation should actually run, (true) or just check the input deck (false). This option is equivalent to activating the NOSIM keyword in the RUNSPEC section of the input deck (see section Error: Reference source not foundError: Reference source not found). The default value of “auto” will use whatever is stipulated in the input deck via the NOSIM keyword. | D24: “auto”
A25: ooow:<A24>+1 -> 23 | B25: --enable-ecl-output | C25: A Boolean value set to true or false that specifies if the binary output files (restart, summary files, etc.) should be written in the commercial simulator’s format (true), or OPM Flow’s format (false). | D25: true
A26: ooow:<A25>+1 -> 24 | B26: --enable-esmry | C26: A Boolean value that switches on (true) or off (false) the output SUMMARY vectors to the ESMRY file for fast loading of summary data. | D26: false
A27: ooow:<A26>+1 -> 25 | B27: --enable-logging-fallout-warning | C27: A Boolean value set to true or false that sets the developer option to see whether logging was on non-root processors (true). If set to true output will be appended to the *.DBG or *.PRT files. | D27: false
A28: ooow:<A27>+1 -> 26 | B28: --enable-opm-rst-file | C28: A Boolean value set to true or false to write OPM specific data sets to the commercial simulators restart file to enable restart of an OPM Flow runs (true) by OPM Flow, or not to write the data (false). | D28: false
A29: ooow:<A28>+1 -> 27 | B29: --enable-storage-cache | C29: A Boolean value set to true or false that turns on (true) or off (false) storing previous storage terms and avoid re-calculating them. | D29: true
A30: ooow:<A29>+1 -> 28 | B30: --enable-terminal-output | C30: A Boolean value set to true or false that turns on (true) or off (false) high-level information about the simulation's progress to the terminal | D30: true
A31: ooow:<A30>+1 -> 29 | B31: --enable-tuning | C31: A Boolean value set to true or false that instructs OPM Flow to read the time stepping parameters from the Error: Reference source not foundkeyword in the input deck, if set to true. Note that only the first record of the TUNING keyword is processed. | D31: false
A32: ooow:<A31>+1 -> 30 | B32: --enable-vtk-output | C32: A Boolean value set to true or false that turns on (true) or off (false) a global switch for writing VTK files. | D32: false
A33: ooow:<A32>+1 -> 31 | B33: --enable-well-operability-check | C33: A Boolean value set to true or false that enables (true) checking of a well’s operating status, or disables (false) the checking. | D33: true
A34: ooow:<A33>+1 -> 32 | B34: --enable-well-operability-check-iter | C34: A Boolean value set to true or false that enables (true) checking of a well’s operating status during iterations, or disables (false) the checking during iterations. | D34: false
A35: ooow:<A34>+1 -> 33 | B35: --enable-write-all-solutions | C35: A Boolean value set to true or false that turns on (true) or off (false) the writing of all solutions to disk instead of only the ones for the report steps. | D35: false
A36: ooow:<A35>+1 -> 34 | B36: --force-disable-fluid-in-place-output | C36: A Boolean value set to true or false that instructs OPM Flow not to print the Fluid In-Place report after each report time step (true) or not (false). Note this parameter will override the print request in the input deck. | D36: false
A37: ooow:<A36>+1 -> 35 | B37: --force-disable-resv-fluid-in-place-output | C37: A Boolean value set to true or false that instructs OPM Flow to not to print the Reservoir Volume Fluid In-Place report after each report time step (true) or not (false). Note this parameter will override the print request in the input deck. | D37: false
A38: ooow:<A37>+1 -> 36 | B38: --full-time-step-initially | C38: A Boolean value set to true or false that instructs OPM Flow to always attempt to finish a report step using a single time step (true) or not (false). | D38: false
A39: ooow:<A38>+1 -> 37 | B39: --ignore-keywords | C39: A character string that defines a list of keywords which should be ignored by OPM Flow. The keyword string should be enclosed in quotes and each keyword separated by a colon, that is ':' . | D39: “”
B40: ILU Preconditioner Parameters
A41: ooow:<A39>+1 -> 38 | B41: --ilu-fillin-level | C41: A positive integer value that sets the fill in level for the ILU preconditioner. | D41: 0
A42: ooow:<A41>+1 -> 39 | B42: --ilu-redblack | C42: A Boolean value set to true or false that instructs OPM Flow to use red-black partitioning for the ILU preconditioner. (true) or not (false). | D42: false
A43: ooow:<A42>+1 -> 40 | B43: --ilu-relaxation | C43: A real positive double precision value that sets the relaxation factor of the linear solver's ILU preconditioner | D43: 0.9
A44: ooow:<A43>+1 -> 41 | B44: --ilu-reorder-spheres | C44: A Boolean value set to true or false that specifies OPM Flow to reorder the entries of the matrix in the red-black ILU preconditioner in spheres starting at an edge (true) or not (false) If false the original ordering is preserved in each color. Otherwise try to ensure D4 ordering (in a 2D structured grid, the diagonal elements are consecutive). | D44: false
A45: ooow:<A44>+1 -> 42 | B45: --initial-time-step-in-days | C45: A real double precision value that sets the size of initial time step in days. | D45: 1.0
B46: Linear Solver Parameters
A47: ooow:<A45>+1 -> 43 | B47: --linear-solver | C47: A defined quoted character string that sets the configuration of the linear solver, valid values are: Option (5) extends the existing Constrained Pressure Residual (“CPR”) preconditioner to include wells. This option can also be invoked via the CPR keyword in the RUNSPEC section; however, the command line parameter takes precedence. For option (6) one enters a character string enclosed in quotes that defines the filename of a JSON configuration file for the flexible linear solver system. In this case the file extension should be ‘.json’. Note that the *.PRT file contains the “Property tree for the linear solver” listing, which is the JSON specification of the current case, and can be used to configure a user specific linear solver JSON file. The default is "ilu0". The option "cpr" now is an alias for "cprw" instead of "cpr_trueimpes". | D47: “ilu0”
A48: ooow:<A47>+1 -> 44 | B48: --linear-solver-ignore-convergence-failure | C48: A Boolean value set to true or false that if set to true convergences failures in the linear solver are ignored. This option should be used with care, as the results might be unreliable. | D48: false
A49: ooow:<A48>+1 -> 45 | B49: --linear-solver-max-iter | C49: A positive integer value that defines the maximum number of linear iterations. | D49: 200
A50: ooow:<A49>+1 -> 46 | B50: --linear-solver-reduction | C50: A real positive double precision value that sets the minimum reduction of the residual for the linear solver. The linear solver convergences when the residual is reduced sufficiently. The simulator now overrides the default reduction to be 0.005 instead of 0.01, if the linear solver has been set to one of the cpr options, in a similar manner as how the default maximum number of linear iterations for the cpr and cprw options are changed to 20 instead of 100, unless specified by the command line option by the user. | D50: 0.01
A51: ooow:<A50>+1 -> 47 | B51: --linear-solver-restart | C51: A positive integer value that sets the number of iterations after which GMRES is restarted. | D51: 40
A52: ooow:<A51>+1 -> 48 | B52: --linear-solver-verbosity | C52: A positive integer value that defines the output from linear solver: | D52: 0
A53: ooow:<A52>+1 -> 49 | B53: --load-step | C53: An integer value that determines if the simulator should load the serialized state from OPM Flow's version of the restart file. and should be set to either a specific report step, or 0 to load the last stored report step. The default value of -1 does not load the data from the OPM Flow specific restart file. OPM Flow's version of the restart file, is written using the --save-step=N option. | D53: -1
A54: ooow:<A53>+1 -> 50 | B54: --matrix-add-well-contributions | C54: A Boolean value set to true or false that if set to true explicitly specifies the influences of wells between cells in the Jacobian and preconditioner matrices. | D54: false
A55: ooow:<A54>+1 -> 51 | B55: --max-inner-iter-ms-wells | C55: A positive integer value that defines the maximum number of inner iterations for multi-segment wells. | D55: 100
A56: ooow:<A55>+1 -> 52 | B56: --max-inner-iter-wells | C56: A positive integer value that defines the maximum number of inner iterations for standard wells. | D56: 50
A57: ooow:<A56>+1 -> 53 | B57: --max-newton-iterations-with-inner-well-iterations | C57: A positive integer that specifies the maximum newton iterations with inner well iterations. | D57: 8
A58: ooow:<A57>+1 -> 54 | B58: --max-pressure-change-ms-wells | C58: A real positive value that defines the maximum relative pressure change for a single iteration of the multi-segment well model. | D58: 1.0 x 106
A59: ooow:<A58>+1 -> 55 | B59: --max-residual-allowed | C59: A real positive value that sets the absolute maximum tolerance for residuals without cutting the time step size. | D59: 1.0 x 107
A60: ooow:<A59>+1 -> 56 | B60: --max-single-precision-days | C60: A real positive value that sets the maximum time step size where single precision floating point arithmetic can be used for solving the linear systems of equations. | D60: 20.0
A61: ooow:<A60>+1 -> 57 | B61: --max-temperature-change | C61: A real positive value that stipulates the maximum absolute change of temperature in a single iteration. | D61: 5
A62: ooow:<A61>+1 -> 58 | B62: --max-welleq-iter | C62: A positive integer that defines the maximum number of iterations to determine the solution to the well equations. | D62: 30
A63: ooow:<A62>+1 -> 59 | B63: --maximum-number-of-well-switches | C63: A positive integer values that stipulates the maximum number of times a well can switch to the same control. | D63: 3
A64: ooow:<A63>+1 -> 60 | B64: --milu-variant | C64: A defined character string that specifies which variant of the modified ILU preconditioner ought to be used. Possible variants are: The default is “ILU” | D64: “ILU”
A65: ooow:<A64>+1 -> 61 | B65: --min-strict-cnv-ite | C65: A positive integer that sets the minimum number of Newton iterations before relaxed tolerances are used for the CNV convergence criterion. | D65: 0
A66: ooow:<A65>+1 -> 62 | B66: --min-time-step-based-on-newton-iterations | C66: The minimum time step size (in days for field and metric unit and hours for lab unit) can be reduced to based on Newton iteration counts. | D66: 0
A67: ooow:<A66>+1 -> 63 | B67: --min-time-step-before-shutting-problematic-wells-in-days | C67: A real positive value that sets the minimum time step size in days for which problematic wells are not shut. Time steps below this value will result in problematic wells being shut-in by the simulator. | D67: 0.01
B68: Newton Solver Parameters
A69: ooow:<A67>+1 -> 64 | B69: --newton-max-iterations | C69: A positive integer that defines the maximum number of Newton iterations per time step used by the simulator. | D69: 20
A70: ooow:<A69>+1 -> 65 | B70: --newton-max-relax | C70: A real positive value that sets the maximum relaxation factor of a Newton iteration used by the simulator. | D70: 0.5
A71: ooow:<A70>+1 -> 66 | B71: --newton-min-iterations | C71: A real positive integer that sets the minimum number of Newton iterations per time step used by the simulator. The default value of one ensures that at least one Newton iteration is performed after the previous time step. | D71: 1
A72: ooow:<A71>+1 -> 67 | B72: --newton-relaxation-type | C72: A character string that defines the type of relaxation used in Newton’s method, the default is dampen. | D72: “dampen”
A73: ooow:<A72>+1 -> 68 | B73: --opencl-ilu-parallel | C73: A Boolean value set to true or false that if set to true then parallelize the ILU decomposition and application on GPU, or not (false). | D73: WAHR
A74: ooow:<A73>+1 -> 69 | B74: --opencl-platform-id | C74: A positive integer that specifies the platform identification (“ID”) for the openSolver. Use the “clinfo” command to determine valid IDs. | D74: 0
A75: ooow:<A74>+1 -> 70 | B75: --output-dir | C75: A character string that defines the directory to which OPM Flow is to write the commercial simulator compatible output files (restart, summary files etc.). The default value results in the files be written to the same directory as the input file. | D75: “”
A76: ooow:<A75>+1 -> 71 | B76: --output-extra-convergence-info | C76: Provides additional convergence output to separate files for diagnostic purposes. The available options are: Options can be combined with commas, e.g."steps,iterations" for multiple outputs. The default value of "none" prevents the two files from being written out, for better compatibility with the commercial simulator. | D76: none
A77: ooow:<A76>+1 -> 72 | B77: --output-interval | C77: A positive integer that specifies the number of report steps between two consecutive writes of restart data. | D77: 1
A78: ooow:<A77>+1 -> 73 | B78: --output-mode | C78: A defined character string that defines the output to the *.PRT and *.DBG files: For example to just output logging information use: --output-mode=”log” or --output-mode=false | D78: “all”
A79: ooow:<A78>+1 -> 74 | B79: --owner-cells-first | C79: A Boolean value set to true or false that determines if the cells owned by a rank should be ordered before ghost/overlapping the cells (true), or not (false). | D79: true
A80: ooow:<A79>+1 -> 75 | B80: --parameter-file | C80: A character string that defines the name of a parameter file which contains the simulator’s set of run-time parameters, as listed in this table. | D80: “”
A81: ooow:<A80>+1 -> 76 | B81: --parsing-strictness | C81: Set strictness of parsing process. Available options are: Default: "normal" | D81: "normal"
A82: ooow:<A81>+1 -> 77 | B82: --pri-var-oscilation-threshold | C82: A real positive value that defines the threshold value for the primary variable switching conditions after its meaning has switched to hinder oscillations. | D82: 1.0 x 10-5
A83: ooow:<A82>+1 -> 78 | B83: --print-parameters | C83: A positive integer value that request that the run time parameters be printed at the start of the run: | D83: 2
A84: ooow:<A83>+1 -> 79 | B84: --print-properties | C84: A positive integer value that request that the compile time parameters be printed at the start of the run: | D84: 2
A85: ooow:<A84>+1 -> 80 | B85: --project-saturations | C85: A Boolean value set to true or false that determines if all the fluid saturations should be scaled to ensure the values are in the interval (0, 1), including runs that use solvents (true), or not (false). | D85: false
A86: 81 | B86: --regularization-factor-wells | C86: A real positive value that defines the “regularization factor” for wells. | D86: 100
A87: ooow:<A86>+1 -> 82 | B87: --relaxed-linear-solver-reduction | C87: A real positive value that defines the minimum reduction of the residual which the linear solver need to achieve for the solution to be accepted. | D87: 0.01
A88: ooow:<A87>+1 -> 83 | B88: --relaxed-max-pv-fraction | C88: A real positive value that defines The fraction of the pore volume of the reservoir where the volumetric error (CNV) might be violated during strict Newton iterations. | D88: 0.03
A89: ooow:<A88>+1 -> 84 | B89: --relaxed-pressure-tol-msw | C89: A real positive value that sets the relaxation tolerance for the multi-segment well pressure solution in Pascals. | D89: 10000
A90: ooow:<A89>+1 -> 85 | B90: --relaxed-well-flow-tol | C90: A real positive value that sets the relaxation tolerance for the well flow residual in reservoir cubic metres (rm3). | D90: 0.001
A91: ooow:<A90>+1 -> 86 | B91: --save-step | C91: A character string that determines if the simulator should save the serialized state of the OPM Flow simulator at one or more report steps to a special *.OPMRST file. This is in addition to the normal restart files written, and consumes significantly more space than the normal restart files, but restarting OPM Flow from this file using the --load-step option deviates less from the original run, compared to restarting using the normal restart features. The files produced are not compatible with other simulators, and also will not be compatible between different releases of OPM Flow The parameter should be set to one of the following: The default value of "" does not write anything to the OPM Flow specific restart file. | D91: ""
A92: ooow:<A91>+1 -> 87 | B92: --scale-linear-system | C92: A Boolean value set to true or false that switches on (true) or off (false) the scaling of linear system of equations according to the equation scale and primary variable types. | D92: false
A93: ooow:<A92>+1 -> 88 | B93: --sched-restart | C93: A Boolean value that determines for a restart run if the case should initialize wells and groups from the historical SCHEDULE section (true), or from the well and group data on the restart file (false). Note that the commercial simulator always uses data from the restart file (false). | D93: FALSCH
A94: ooow:<A93>+1 -> 89 | B94: --serial-partitioning | C94: A Boolean value that determines if partitioning for parallel runs on a single process (true), or not (false). | D94: false
A95: ooow:<A94>+1 -> 90 | B95: --shut-unsolvable-wells | C95: A Boolean value that determines if the simulator should shut unsolvable wells (true), or not (false). | D95: WAHR
A96: ooow:<A95>+1 -> 91 | B96: --solve-welleq-initially | C96: A Boolean value set to true or false that determines if the simulator should fully solve the well equations before each iteration of the reservoir model (true), or not (false). Note that the well equations are always added to the full system and solved until converged. | D96: true
B97: Solver Parameters
A98: ooow:<A96>+1 -> 92 | B98: --solver-continue-on-convergence-failure | C98: A Boolean value that stipulates if the simulator should continue (true) instead of stopping (false) when the minimum solver time step is reached. | D98: false
A99: ooow:<A98>+1 -> 93 | B99: --solver-growth-factor | C99: A real positive value that specifies the growth factor a time step can be increased by when recovering from one or more time step chops, subject to the maximum allowable time step size set by the --solver-max-time-step-in-days parameter. For example, if the current time step has converged at 5 days after a time step chop, and --solver-growth-factor is set to the default value of 2.0, then the next time step will be 2.0 * 5 days, that is at 10 days. | D99: 2.0
A100: ooow:<A99>+1 -> 94 | B100: --solver-max-growth | C100: A real positive value that specifies the maximum growth factor a time step can be increased by after a report time step. subject to the maximum allowable time step size set by the --solver-max-time-step-in-days parameter. Thus, if the current time step has converged at 5 days after at a report step, and --solver-max-growth is set to the default value of 3.0, then the next time step will be 3.0 * 5 days, that is at 15 days. | D100: 3.0
A101: ooow:<A100>+1 -> 95 | B101: --solver-max-restarts | C101: A positive integer that defines the number of allowed consecutive restarts (or time step chops) before the simulation is terminated. | D101: 10
A102: ooow:<A101>+1 -> 96 | B102: --solver-max-time-step-in-days | C102: A real positive double precision value that specifies the maximum allowed time step size in days. | D102: 365
A103: ooow:<A102>+1 -> 97 | B103: --solver-min-time-step | C103: A real positive double precision value that specifies the minimum size of a time step in days for field and metric units, and hours for laboratory units If a time step cannot converge without getting cut below this time step size the simulator will stop. | D103: 1.0 x 10-12
A104: ooow:<A103>+1 -> 98 | B104: --solver-restart-factor | C104: A real positive double precision value that sets the time step chop factor of the time step after a convergence failure. For example, if the current non-convergent time step is 30 days and --solver-restart-factor is set to the default value, then the time step will be repeated using 0.33 * 30 days as the time step, that is 9.9 days. | D104: 0.33
A105: ooow:<A104>+1 -> 99 | B105: --solver-verbosity | C105: A positive integer that specifies the "chattiness" of the non-linear solver. | D105: 1
A106: ooow:<A105>+1 -> 100 | B106: --strict-inner-iter-wells | C106: A positive integer that specifies the number of inner well iterations with strict tolerance. | D106: 40
A107: ooow:<A106>+1 -> 101 | B107: --strict-outer-iter-wells | C107: A positive integer that specifies the number of newton iterations for which wells are checked with strict tolerance. | D107: 6
A108: ooow:<A107>+1 -> 102 | B108: --temperature-max | C108: A real positive value that sets the maximum absolute temperature. | D108: 1.0 x 109
A109: ooow:<A108>+1 -> 103 | B109: --temperature-min | C109: A real positive value that sets the minimum absolute temperature. | D109: 0
A110: ooow:<A109>+1 -> 104 | B110: --threads-per-process | C110: A positive integer value that stipulates the maximum number of threads to be instantiated per process ('-1' means 'automatic'). | D110: -1
B111: Time Stepping Control Algorithm Parameters
A112: ooow:<A110>+1 -> 105 | B112: --time-step-after-event-in-days | C112: A real double precision value that sets maximum allowed time step after an event; for example, when a well is open or closed etc. The default value of -1 means that events to do effect the time stepping. | D112: -1
A113: ooow:<A112>+1 -> 106 | B113: --time-step-control | C113: A defined character string that defines the time stepping control algorithm and is set to one of the following: | D113: “pid+newtoniteration”
A114: ooow:<A113>+1 -> 107 | B114: --time-step-control-decay-damping-factor | C114: A real positive value that specifies the decay rate a time step can be decreased by after the number target iterations has been exceeded | D114: 1.0
A115: ooow:<A114>+1 -> 108 | B115: --time-step-control-decay-rate | C115: A real positive value that specifies the decay rate a time step size can be decreased by after the number of target iterations has been exceeded | D115: 0.75
A116: ooow:<A115>+1 -> 109 | B116: --time-step-control-file-name | C116: A character string enclosed in quotes that specifies a filename where time steps are specified. The default is the character string timesteps For instance time steps can be generated by the ecl_summary application in libecl as per the following UNIX command line: path_to_libecl_applications/ecl_summary DECK TIME > filename Where: DECK is the name of the data deck you want to get the time steps from, TIME tells the application to return the timing for the run, and "filename" is the name of the file the times are piped to. | D116: “timesteps”
A117: ooow:<A116>+1 -> 110 | B117: --time-step-control-growth-damping-factor | C117: A real positive value that specifies the growth rate of the time step increase when the number of target iterations are undercut. | D117: 3.2
A118: ooow:<A117>+1 -> 111 | B118: --time-step-control-growth-rate | C118: A real positive value that specifies the growth rate of the time step size when the number of target iterations are undercut. | D118: 1.25
A119: ooow:<A118>+1 -> 112 | B119: --time-step-control-target-iterations | C119: A positive integer that defines the number of linear iterations which the time step control scheme should aim for (if applicable). | D119: 30
A120: ooow:<A119>+1 -> 113 | B120: --time-step-control-target-newton-iterations | C120: A positive integer that specifies the number of Newton iterations which the time step control scheme should aim for (if applicable). | D120: 8
A121: ooow:<A120>+1 -> 114 | B121: --time-step-control-tolerance | C121: A real double precision value that sets the tolerance for PID (only used with the pid and pid+ options defined by the --time-step-control option). | D121: 0.1
A122: ooow:<A121>+1 -> 115 | B122: --time-step-verbosity | C122: A positive integer that specifies the "chattiness" during the time integration. | D122: 1
B123: Convergence and Material Balance Tolerance Parameters
A124: ooow:<A122>+1 -> 116 | B124: --tolerance-cnv | C124: A real positive double precision value that specifies the maximum non-linear tolerance error. This is the local convergence tolerance (maximum of local saturation errors). | D124: 0.01
A125: ooow:<A124>+1 -> 117 | B125: --tolerance-cnv-relaxed | C125: A real positive value that defines the relaxed local convergence tolerance that applies for iterations after the iterations with the strict tolerance. | D125: 1.0
A126: ooow:<A125>+1 -> 118 | B126: --tolerance-mb | C126: A real positive double precision value that sets the maximum mass balance error, that is the tolerated mass balance error relative to total mass present. | D126: 1.0 x 10-6
A127: ooow:<A126>+1 -> 119 | B127: --tolerance-pressure-ms-wells | C127: A real positive double precision value that specifies the tolerance for the pressure equations for multi-segment wells. | D127: 1000
A128: ooow:<A127>+1 -> 120 | B128: --tolerance-well-control | C128: A real positive double precision value that sets the maximum tolerance for the well control equations. | D128: 1.0 x 10-7
A129: ooow:<A128>+1 -> 121 | B129: --tolerance-wells | C129: A real positive double precision value that defines the maximum non-linear error for the well equations. | D129: 1.0 x 10-4
A130: ooow:<A129>+1 -> 122 | B130: -update-equations-scaling | C130: A Boolean value that switches on (true) or off (false) the updating of the scaling factors for mass balance equations during the simulation. | D130: false
A131: ooow:<A130>+1 -> 123 | B131: --use-gmres | C131: A Boolean value that when set to true OPM Flow will use Generalized Minimal Residual (“GMRES”)26 Y. Saad, A flexible inner-outer preconditioned GMRES algorithm, SIAM J. Sci. Statist. Comput.,14, (1993). and 27 Y. Saad and M.H. Schultz, GMRES: A generalized minimum residual algorithm for solving nonsymmetric linear systems, SIAM J. Sci. Statist. Comput., 7 (1986), pp. 856{869.solver instead of Biconjugate Gradient Stabilized (“BiCGSTAB”)28 Van der Vorst, H. A. (1992). "Bi-CGSTAB: A Fast and Smoothly Converging Variant of Bi-CG for the Solution of Nonsymmetric Linear Systems". SIAM J. Sci. Stat. Comput. 13 (2): 631–644. doi:10.1137/0913035. hdl:10338.dmlcz/104566 and 29 Sleijpen, G. L. G.; Fokkema, D. R. (November 1993). "BiCGstab(l) for linear equations involving unsymmetric matrices with complex spectrum" (PDF). Electronic Transactions on Numerical Analysis. Kent, OH: Kent State University. 1: 11–32. ISSN 1068-9613.as the linear solver within the Newton iterations. | D131: false
A132: ooow:<A131>+1 -> 124 | B132: --use-multisegment-well | C132: A Boolean value that when set to true the simulator will use the well model for multi-segment wells instead of the one for single-segment wells. | D132: true
A133: ooow:<A132>+1 -> 125 | B133: --use-update-stabilization | C133: A Boolean value set to true or false that switches on (true) or off (false) the stabilized Newton option, that attempts to detect and correct oscillations or stagnation during the Newton iterations. This option may improve convergence for some cases. | D133: true
A134: ooow:<A133>+1 -> 126 | B134: --zoltan-imbalance-tol | C134: A real positive that defines the tolerable imbalance of the load balancing provided by Zoltan package. | D134: 1.1
A135: Notes: flow --help instead use: flow --help-all to get a list of supported command line Parameters.

Sheet: Table2148
A1: OPM Flow 2022-10 Command Line Options
A2: No. | B2: Variable Name | C2: Description | D2: Default
A3: 1 | B3: -h or --help | C3: A character string that causes OPM Flow to print a help message that gives a brief description of the available command line parameters. This now only prints the active user facing command line options. | D3: N/A
A4: ooow:<A3>+1 -> 2 | B4: --help-all | C4: Prints all the command line options included in the release, including obsolete, hidden and deprecated options. | D4: N/A
A5: ooow:<A4>+1 -> 3 | B5: --accelerator-mode | C5: A defined character string that defines the usage of the GPU (cusparseSolver or openclSolver) or FPGA (fpgaSolver) as the linear solver, usage '--accelerator-mode=[none|cusparse|opencl|fpga|amgcl]'. | D5: “none”
A6: ooow:<A5>+1 -> 4 | B6: --allow-distributed-wells | C6: A boolean value set to true of false that allows the perforations of a well to be distributed to interior of multiple processes in a parallel run (true), or not (false). | D6: false
A7: ooow:<A6>+1 -> 5 | B7: --alternative-well-rate-init | C7: A boolean value set to true of false that causes the simulator to use an alternative well rate initialization procedure (true). | D7: true
A8: ooow:<A7>+1 -> 6 | B8: --bda-device-id | C8: Choose device ID for cusparseSolver or openclSolver, use 'nvidia-smi' or 'clinfo' commands to determine valid IDs. | D8: 0
A9: ooow:<A8>+1 -> 7 | B9: --continue-on-convergence-error | C9: A Boolean value set to true or false that that instructs the simulator to continue (true) with a non-converged solution instead of giving up (false) if it encounter a time step size smaller than the minimum time step size. | D9: false
A10: ooow:<A9>+1 -> 8 | B10: --cpr-max-ell-iter | C10: A positive integer that sets the maximum number of Iterations for the elliptic pressure part of the Constrained Pressure Residual (“CPR”) solver. | D10: 20
A11: ooow:<A10>+1 -> 9 | B11: --cpr-reuse-interval | C11: A positive integer that sets the reuse preconditioner interval. Used when --cpr-reuse-setup is set to 4, then the preconditioner will be fully recreated instead of reused every N linear solve, where N is this parameter. | D11: 10
A12: ooow:<A11>+1 -> 10 | B12: --cpr-reuse-setup | C12: A positive integer that defines if the CPR solver should re-use the Amg setup. Valid options are: | D12: 3
A13: ooow:<A12>+1 -> 11 | B13: --dbph-max-rel | C13: A real positive value that sets maximum relative change of the bottom-hole pressure in a single iteration | D13: 1.0
A14: ooow:<A13>+1 -> 12 | B14: --dp-max-rel | C14: A real positive double precision value that sets the maximum allowed relative change of pressure per iteration. | D14: 0.3
A15: ooow:<A14>+1 -> 13 | B15: --ds-max | C15: A real positive double precision value that sets the maximum allowed change in saturation per iteration. | D15: 0.2
A16: ooow:<A15>+1 -> 14 | B16: --dwell-fraction-max | C16: A real positive value that sets the maximum allowed change in well’s volume fraction per iteration. | D16: 0.2
A17: ooow:<A16>+1 -> 15 | B17: --ecl-deck-file-name | C17: A character string that defines the name of the OPM Flow input file which contains the simulator’s ECLIPSE formatted input deck to be simulated. Note that there must be no spaces in the filename. If there are spaces, which can typically occur on Windows based systems, then the filename should be enclosed in quotes; thus instead of FILE NAME use “FILE NAME”. | D17: “”
A18: ooow:<A17>+1 -> 16 | B18: --ecl-enable-drift-compensation | C18: A Boolean value set to true or false that enables (true) or disables (false) partial compensation of systematic mass losses via the source term of the next time step. | D18: true
A19: ooow:<A18>+1 -> 17 | B19: --ecl-output-double-precision | C19: A Boolean value set to true or false that switches on (true) or off (false) double precision in restart files. Useful for 'perfect' restarts. | D19: false
A20: ooow:<A19>+1 -> 18 | B20: --ecl-output-interval | C20: An integer value defining the number of report steps that ought to be skipped between two writes of restart files results. | D20: -1
A21: ooow:<A20>+1 -> 19 | B21: --ecl-strict-parsing | C21: A Boolean value set to true or false that switches on (true) or off (false) strict parsing mode for parsing - all errors are collected before the application exists. Useful for debugging initial runs. | D21: false
A22: ooow:<A21>+1 -> 20 | B22: --edge-weights-method | C22: A defined positive integer value that defines the edge-weighing strategy: | D22: 1
A23: ooow:<A22>+1 -> 21 | B23: --enable-adaptive-time-stepping | C23: A Boolean value set to true or false that turns on (true) or off (false) adaptive time stepping. If set to false the report time steps provided by the input deck are used. | D23: true
A24: ooow:<A23>+1 -> 22 | B24: --enable-async-ecl-output | C24: A Boolean value set to true or false that sets the output mode to be asynchronously (true), letting the simulator continue computing the next time step while writing results to restart and summary files in the commercial simulators format. | D24: true
A25: ooow:<A24>+1 -> 23 | B25: --enable-async-vtk-output | C25: A Boolean value set to true or false that sets the output mode to be asynchronously (true), letting the simulator continue computing the next time step while writing results to the VTK output files. | D25: true
A26: ooow:<A25>+1 -> 24 | B26: --enable-dry-run | C26: A Boolean value set to true or false that specifies if the simulation should actually run, (true) or just check the input deck (false). This option is equivalent to activating the NOSIM keyword in the RUNSPEC section of the input deck (see section Error: Reference source not foundError: Reference source not found). The default value of “auto’ will use whatever is stipulated in the input deck via the NOSIM keyword. | D26: “auto”
A27: ooow:<A26>+1 -> 25 | B27: --enable-ecl-output | C27: A Boolean value set to true or false that specifies if the binary output files (restart, summary files, etc.) should be written in the commercial simulator’s format (true), or OPM Flow’s format (false). | D27: true
A28: ooow:<A27>+1 -> 26 | B28: --enable-esmry | C28: A Boolean value that switches on (true) or off (false) the output SUMMARY vectors to the ESMRY file for fast loading of summary data. | D28: false
A29: ooow:<A28>+1 -> 27 | B29: --enable-logging-fallout-warning | C29: A Boolean value set to true or false that sets the developer option to see whether logging was on non-root processors (true). If set to true output will be appended to the *.DBG or *.PRT files. | D29: false
A30: ooow:<A29>+1 -> 28 | B30: --enable-opm-rst-file | C30: A Boolean value set to true or false to write OPM specific data sets to the commercial simulators restart file to enable restart of an OPM Flow runs (true) by OPM Flow, or not to write the data (false). | D30: false
A31: ooow:<A30>+1 -> 29 | B31: --enable-storage-cache | C31: A Boolean value set to true or false that turns on (true) or off (false) storing previous storage terms and avoid re-calculating them. | D31: true
A32: ooow:<A31>+1 -> 30 | B32: --enable-terminal-output | C32: A Boolean value set to true or false that turns on (true) or off (false) high-level information about the simulation's progress to the terminal | D32: true
A33: ooow:<A32>+1 -> 31 | B33: --enable-tuning | C33: A Boolean value set to true or false that instructs OPM Flow to read the time stepping parameters from the Error: Reference source not foundkeyword in the input deck, if set to true. Note that only the first record of the TUNING keyword is processed. | D33: false
A34: ooow:<A33>+1 -> 32 | B34: --enable-vtk-output | C34: A Boolean value set to true or false that turns on (true) or off (false) a global switch for writing VTK files. | D34: false
A35: ooow:<A34>+1 -> 33 | B35: --enable-well-operability-check | C35: A Boolean value set to true or false that enables (true) checking of a well’s operating status, or disables (false) the checking. | D35: true
A36: ooow:<A35>+1 -> 34 | B36: --enable-well-operability-check-iter | C36: A Boolean value set to true or false that enables (true) checking of a well’s operating status during iterations, or disables (false) the checking during iterations. | D36: false
A37: ooow:<A36>+1 -> 35 | B37: --enable-write-all-solutions | C37: A Boolean value set to true or false that turns on (true) or off (false) the writing of all solutions to disk instead of only the ones for the report steps. | D37: false
A38: ooow:<A37>+1 -> 36 | B38: --force-disable-fluid-in-place-output | C38: A Boolean value set to true or false that instructs OPM Flow not to print the Fluid In-Place report after each report time step (true) or not (false). Note this parameter will override the print request in the input deck. | D38: false
A39: ooow:<A38>+1 -> 37 | B39: --force-disable-resv-fluid-in-place-output | C39: A Boolean value set to true or false that instructs OPM Flow to not to print the Reservoir Volume Fluid In-Place report after each report time step (true) or not (false). Note this parameter will override the print request in the input deck. | D39: false
A40: ooow:<A39>+1 -> 38 | B40: --fpga-bitstream | C40: A character string that specifies the bit stream file for the fpgaSolver (including path), usage: '--fpga-bitstream=<filename>'. | D40: “”
A41: ooow:<A40>+1 -> 39 | B41: --full-time-step-initially | C41: A Boolean value set to true or false that instructs OPM Flow to always attempt to finish a report step using a single time step (true) or not (false). | D41: false
A42: ooow:<A41>+1 -> 40 | B42: --ignore-keywords | C42: A character string that defines a list of keywords which should be ignored by OPM Flow. The keyword string should be enclosed in quotes and each keyword separated by a colon, that is ':' . | D42: “”
B43: ILU Preconditioner Parameters
A44: ooow:<A42>+1 -> 41 | B44: --ilu-fillin-level | C44: A positive integer value that sets the fill in level for the ILU preconditioner. | D44: 0
A45: ooow:<A44>+1 -> 42 | B45: --ilu-redblack | C45: A Boolean value set to true or false that instructs OPM Flow to use red-black partitioning for the ILU preconditioner. (true) or not (false). | D45: false
A46: ooow:<A45>+1 -> 43 | B46: --ilu-relaxation | C46: A real positive double precision value that sets the relaxation factor of the linear solver's ILU preconditioner | D46: 0.9
A47: ooow:<A46>+1 -> 44 | B47: --ilu-reorder-spheres | C47: A Boolean value set to true or false that specifies OPM Flow to reorder the entries of the matrix in the red-black ILU preconditioner in spheres starting at an edge (true) or not (false) If false the original ordering is preserved in each color. Otherwise try to ensure D4 ordering (in a 2D structured grid, the diagonal elements are consecutive). | D47: false
A48: ooow:<A47>+1 -> 45 | B48: --initial-time-step-in-days | C48: A real double precision value that sets the size of initial time step in days. | D48: 1.0
B49: Linear Solver Parameters
A50: ooow:<A48>+1 -> 46 | B50: --linear-solver | C50: “ilu0”A defined quoted character string that sets the configuration of the solver, valid values are: Option (5) extends the existing Constrained Pressure Residual (“CPR”) preconditioner to include wells. For option (6) one enters a character string enclosed in quotes that defines the filename of a JSON configuration file for the flexible linear solver system. In this case the file extension should be ‘.json’. Note that the *.PRT file contains the “Property tree for the linear solver” listing, which is the JSON specification of the current case, and can be used as a guide to configure a user specific linear solver JSON file. The default is "ilu0". | D50: “ilu0”
A51: ooow:<A50>+1 -> 47 | B51: --linear-solver-ignore-convergence-failure | C51: A Boolean value set to true or false that if set to true convergences failures in the linear solver are ignored. This option should be used with care, as the results may be unreliable. | D51: false
A52: ooow:<A51>+1 -> 48 | B52: --linear-solver-max-iter | C52: A positive integer value that defines the maximum number of linear iterations. | D52: 200
A53: ooow:<A52>+1 -> 49 | B53: --linear-solver-reduction | C53: A real positive double precision value that sets the minimum reduction of the residual for the linear solver. The linear solver convergences when the residual is reduced sufficiently. | D53: 0.01
A54: ooow:<A53>+1 -> 50 | B54: --linear-solver-restart | C54: A positive integer value that sets the number of iterations after which GMRES is restarted. | D54: 40
A55: ooow:<A54>+1 -> 51 | B55: --linear-solver-verbosity | C55: A positive integer value that defines the output from linear solver: | D55: 0
A56: ooow:<A55>+1 -> 52 | B56: --matrix-add-well-contributions | C56: A Boolean value set to true or false that if set to true explicitly specifies the influences of wells between cells in the Jacobian and preconditioner matrices. | D56: false
A57: ooow:<A56>+1 -> 53 | B57: --max-inner-iter-ms-wells | C57: A positive integer value that defines the maximum number of inner iterations for multi-segment wells. | D57: 100
A58: ooow:<A57>+1 -> 54 | B58: --max-inner-iter-wells | C58: A positive integer value that defines the maximum number of inner iterations for standard wells. | D58: 50
A59: ooow:<A58>+1 -> 55 | B59: --max-newton-iterations-with-inner-well-iterations | C59: A positive integer that specifies the maximum newton iterations with inner well iterations. | D59: 8
A60: ooow:<A59>+1 -> 56 | B60: --max-pressure-change-ms-wells | C60: A real positive value that defines the maximum relative pressure change for a single iteration of the multi-segment well model. | D60: 1.0 x 106
A61: ooow:<A60>+1 -> 57 | B61: --max-residual-allowed | C61: A real positive value that sets the absolute maximum tolerance for residuals without cutting the time step size. | D61: 1.0 x 107
A62: ooow:<A61>+1 -> 58 | B62: --max-single-precision-days | C62: A real positive value that sets the maximum time step size where single precision floating point arithmetic can be used for solving the linear systems of equations. | D62: 20.0
A63: ooow:<A62>+1 -> 59 | B63: --max-temperature-change | C63: A real positive value that stipulates the maximum absolute change of temperature in a single iteration. | D63: 5
A64: ooow:<A63>+1 -> 60 | B64: --max-welleq-iter | C64: A positive integer that defines the maximum number of iterations to determine the solution to the well equations. | D64: 30
A65: ooow:<A64>+1 -> 61 | B65: --maximum-number-of-well-switches | C65: A positive integer values that stipulates the maximum number of times a well can switch to the same control. | D65: 3
A66: ooow:<A65>+1 -> 62 | B66: --milu-variant | C66: A defined character string that specifies which variant of the modified ILU preconditioner ought to be used. Possible variants are: The default is “ILU” | D66: “ILU”
A67: ooow:<A66>+1 -> 63 | B67: --min-strict-cnv-ite | C67: A positive integer that sets the minimum number of Newton iterations before relaxed tolerances are used for the CNV convergence criterion. | D67: 0
A68: ooow:<A67>+1 -> 64 | B68: --min-time-step-based-on-newton-iterations | C68: The minimum time step size (in days for field and metric unit and hours for lab unit) can be reduced to based on Newton iteration counts. | D68: 0
A69: ooow:<A68>+1 -> 65 | B69: --min-time-step-before-shutting-problematic-wells-in-days | C69: A real positive value that sets the minimum time step size in days for which problematic wells are not shut. Time steps below this value will result in problematic wells being shut-in by the simulator. | D69: 0.01
B70: Newton Solver Parameters
A71: ooow:<A69>+1 -> 66 | B71: --newton-max-iterations | C71: A positive integer that defines the maximum number of Newton iterations per time step used by the simulator. | D71: 20
A72: ooow:<A71>+1 -> 67 | B72: --newton-max-relax | C72: A real positive value that sets the maximum relaxation factor of a Newton iteration used by the simulator. | D72: 0.5
A73: ooow:<A72>+1 -> 68 | B73: --newton-min-iterations | C73: A real positive integer that sets the minimum number of Newton iterations per time step used by the simulator. The default value of one ensures that at least one Newton iteration is performed after the previous time step. | D73: 1
A74: ooow:<A73>+1 -> 69 | B74: --newton-relaxation-type | C74: A character string that defines the type of relaxation used in Newton’s method, the default is dampen. | D74: “dampen”
A75: ooow:<A74>+1 -> 70 | B75: --opencl-ilu-reorder | C75: A defined character string that selects the reordering strategy for ILU for openclSolver and fpgaSolve, and should be set to: Note that “level_scheduling” behaves like Dune and cusparse; whereas, “graph_coloring” is more aggressive and is likely to be faster, but is random-based and generally increases the number of linear solves and linear iterations significantly. | D75: ""
A76: ooow:<A75>+1 -> 71 | B76: --opencl-platform-id | C76: A positive integer that specifies the platform identification (“ID”) for the openSolver. Use the “clinfo” command to determine valid IDs. | D76: 0
A77: ooow:<A76>+1 -> 72 | B77: --output-dir | C77: A character string that defines the directory to which OPM Flow is to write the commercial simulator compatible output files (restart, summary files etc.). The default value results in the files be written to the same directory as the input file. | D77: “”
A78: ooow:<A77>+1 -> 73 | B78: --output-interval | C78: A positive integer that specifies the number of report steps between two consecutive writes of restart data. | D78: 1
A79: ooow:<A78>+1 -> 74 | B79: --output-mode | C79: A defined character string that defines the output to the *.PRT and *.DBG files: For example to just output logging information use: --output-mode=”log” or --output-mode=false | D79: “all”
A80: ooow:<A79>+1 -> 75 | B80: --owner-cells-first | C80: A Boolean value set to true or false that determines if the cells owned by a rank should be ordered before ghost/overlapping the cells (true), or not (false). | D80: true
A81: ooow:<A80>+1 -> 76 | B81: --parameter-file | C81: A character string that defines the name of a parameter file which contains the simulator’s set of run-time parameters, as listed in this table. | D81: “”
A82: ooow:<A81>+1 -> 77 | B82: --pri-var-oscilation-threshold | C82: A real positive value that defines the threshold value for the primary variable switching conditions after its meaning has switched to hinder oscillations. | D82: 1.0 x 10-5
A83: ooow:<A82>+1 -> 78 | B83: --print-parameters | C83: A positive integer value that request that the run time parameters be printed at the start of the run: | D83: 2
A84: ooow:<A83>+1 -> 79 | B84: --print-properties | C84: A positive integer value that request that the compile time parameters be printed at the start of the run: | D84: 2
A85: ooow:<A84>+1 -> 80 | B85: --project-saturations | C85: A Boolean value set to true or false that determines if all the fluid saturations should be scaled to ensure the values are in the interval (0, 1), including runs that use solvents (true), or not (false). | D85: false
A86: ooow:<A85>+1 -> 81 | B86: --regularization-factor | C86: A real positive value that defines the “regularization factor” for wells. | D86: 100
A87: ooow:<A86>+1 -> 82 | B87: --relaxed-max-pv-fraction | C87: A real positive value that defines The fraction of the pore volume of the reservoir where the volumetric error (CNV) may be violated during strict Newton iterations. | D87: 0.03
A88: ooow:<A87>+1 -> 83 | B88: --relaxed-pressure-tol-msw | C88: A real positive value that sets the relaxation tolerance for the multi-segment well pressure solution in Pascals. | D88: 10000
A89: ooow:<A88>+1 -> 84 | B89: --relaxed-well-flow-tol | C89: A real positive value that sets the relaxation tolerance for the well flow residual in reservoir cubic metres (rm3). | D89: 0.001
A90: ooow:<A89>+1 -> 85 | B90: --scale-linear-system | C90: A Boolean value set to true or false that switches on (true) or off (false) the scaling of linear system of equations according to the equation scale and primary variable types. | D90: false
A91: ooow:<A90>+1 -> 86 | B91: --sched-restart | C91: A Boolean value that determines for a restart run if the case should initialize wells and groups from the historical SCHEDULE section (true), or from the well and group data on the restart file (false). Note that the commercial simulator always uses data from the restart file (false). | D91: FALSCH
A92: ooow:<A91>+1 -> 87 | B92: --serial-partitioning | C92: A Boolean value that determines if partitioning for parallel runs on a single process (true), or not (false). | D92: false
A93: ooow:<A92>+1 -> 88 | B93: --shut-unsolvable-wells | C93: A Boolean value that determines if the simulator should shut unsolvable wells (true), or not (false). | D93: WAHR
A94: ooow:<A93>+1 -> 89 | B94: --solve-welleq-initially | C94: A Boolean value set to true or false that determines if the simulator should fully solve the well equations before each iteration of the reservoir model (true), or not (false). Note that the well equations are always added to the full system and solved until converged. | D94: true
B95: Solver Parameters
A96: ooow:<A94>+1 -> 90 | B96: --solver-continue-on-convergence-failure | C96: A Boolean value that stipulates if the simulator should continue (true) instead of stopping (false) when the minimum solver time step is reached. | D96: false
A97: ooow:<A96>+1 -> 91 | B97: --solver-growth-factor | C97: A real positive value that specifies the growth factor a time step can be increased by when recovering from one or more time step chops, subject to the maximum allowable time step size set by the --solver-max-time-step-in-days parameter. For example, if the current time step has converged at 5 days after a time step chop, and --solver-growth-factor is set to the default value of 2.0, then the next time step will be 2.0 * 5 days, that is at 10 days. | D97: 2.0
A98: ooow:<A97>+1 -> 92 | B98: --solver-max-growth | C98: A real positive value that specifies the maximum growth factor a time step can be increased by after a report time step. subject to the maximum allowable time step size set by the --solver-max-time-step-in-days parameter. Thus, if the current time step has converged at 5 days after at a report step, and --solver-max-growth is set to the default value of 3.0, then the next time step will be 3.0 * 5 days, that is at 15 days. | D98: 3.0
A99: ooow:<A98>+1 -> 93 | B99: --solver-max-restarts | C99: A positive integer that defines the number of allowed consecutive restarts (or time step chops) before the simulation is terminated. | D99: 10
A100: ooow:<A99>+1 -> 94 | B100: --solver-max-time-step-in-days | C100: A real positive double precision value that specifies the maximum allowed time step size in days. | D100: 365
A101: ooow:<A100>+1 -> 95 | B101: --solver-min-time-step | C101: A real positive double precision value that specifies the minimum size of a time step in days for field and metric units, and hours for laboratory units If a time step cannot converge without getting cut below this time step size the simulator will stop. | D101: 1.0 x 10-12
A102: ooow:<A101>+1 -> 96 | B102: --solver-restart-factor | C102: A real positive double precision value that sets the time step chop factor of the time step after a convergence failure. For example, if the current non-convergent time step is 30 days and --solver-restart-factor is set to the default value, then the time step will be repeated using 0.33 * 30 days as the time step, that is 9.9 days. | D102: 0.33
A103: ooow:<A102>+1 -> 97 | B103: --solver-verbosity | C103: A positive integer that specifies the "chattiness" of the non-linear solver. | D103: 1
A104: ooow:<A103>+1 -> 98 | B104: --strict-inner-iter-wells | C104: A positive integer that specifies the number of inner well iterations with strict tolerance. | D104: 40
A105: ooow:<A104>+1 -> 99 | B105: --strict-outer-iter-wells | C105: A positive integer that specifies the number of newton iterations for which wells are checked with strict tolerance. | D105: 6
A106: ooow:<A105>+1 -> 100 | B106: --temperature-max | C106: A real positive value that sets the maximum absolute temperature. | D106: 1.0 x 109
A107: ooow:<A106>+1 -> 101 | B107: --temperature-min | C107: A real positive value that sets the minimum absolute temperature. | D107: 0
A108: ooow:<A107>+1 -> 102 | B108: --threads-per-process | C108: A positive integer value that stipulates the maximum number of threads to be instantiated per process ('-1' means 'automatic'). | D108: -1
B109: Time Stepping Control Algorithm Parameters
A110: ooow:<A108>+1 -> 103 | B110: --time-step-after-event-in-days | C110: A real double precision value that sets maximum allowed time step after an event; for example, when a well is open or closed etc. The default value of -1 means that events to do effect the time stepping. | D110: -1
A111: ooow:<A110>+1 -> 104 | B111: --time-step-control | C111: A defined character string that defines the time stepping control algorithm and is set to one of the following: | D111: “pid+newtoniteration”
A112: ooow:<A111>+1 -> 105 | B112: --time-step-control-decay-damping-factor | C112: A real positive value that specifies the decay rate a time step can be decreased by after the number target iterations has been exceeded | D112: 1.0
A113: ooow:<A112>+1 -> 106 | B113: --time-step-control-decay-rate | C113: A real positive value that specifies the decay rate a time step size can be decreased by after the number of target iterations has been exceeded | D113: 0.75
A114: ooow:<A113>+1 -> 107 | B114: --time-step-control-file-name | C114: A character string enclosed in quotes that specifies a filename where time steps are specified. The default is the character string timesteps For instance time steps can be generated by the ecl_summary application in libecl as per the following UNIX command line: path_to_libecl_applications/ecl_summary DECK TIME > filename Where: DECK is the name of the data deck you want to get the time steps from, TIME tells the application to return the timing for the run, and "filename" is the name of the file the times are piped to. | D114: “timesteps”
A115: ooow:<A114>+1 -> 108 | B115: --time-step-control-growth-damping-factor | C115: A real positive value that specifies the growth rate of the time step increase when the number of target iterations are undercut. | D115: 3.2
A116: ooow:<A115>+1 -> 109 | B116: --time-step-control-growth-rate | C116: A real positive value that specifies the growth rate of the time step size when the number of target iterations are undercut. | D116: 1.25
A117: ooow:<A116>+1 -> 110 | B117: --time-step-control-target-iterations | C117: A positive integer that defines the number of linear iterations which the time step control scheme should aim for (if applicable). | D117: 30
A118: ooow:<A117>+1 -> 111 | B118: --time-step-control-target-newton-iterations | C118: A positive integer that specifies the number of Newton iterations which the time step control scheme should aim for (if applicable). | D118: 8
A119: ooow:<A118>+1 -> 112 | B119: --time-step-control-tolerance | C119: A real double precision value that sets the tolerance for PID (only used with the pid and pid+ options defined by the --time-step-control option). | D119: 0.1
A120: ooow:<A119>+1 -> 113 | B120: --time-step-verbosity | C120: A positive integer that specifies the "chattiness" during the time integration. | D120: 1
B121: Convergence and Material Balance Tolerance Parameters
A122: ooow:<A120>+1 -> 114 | B122: --tolerance-cnv | C122: A real positive double precision value that specifies the maximum non-linear tolerance error. This is the local convergence tolerance (maximum of local saturation errors). | D122: 0.01
A123: ooow:<A122>+1 -> 115 | B123: --tolerance-cnv-relaxed | C123: A real positive value that defines the relaxed local convergence tolerance that applies for iterations after the iterations with the strict tolerance. | D123: 1.0
A124: ooow:<A123>+1 -> 116 | B124: --tolerance-mb | C124: A real positive double precision value that sets the maximum mass balance error, that is the tolerated mass balance error relative to total mass present. | D124: 1.0 x 10-6
A125: ooow:<A124>+1 -> 117 | B125: --tolerance-pressure-ms-wells | C125: A real positive double precision value that specifies the tolerance for the pressure equations for multi-segment wells. | D125: 1000
A126: ooow:<A125>+1 -> 118 | B126: --tolerance-well-control | C126: A real positive double precision value that sets the maximum tolerance for the well control equations. | D126: 1.0 x 10-7
A127: ooow:<A126>+1 -> 119 | B127: --tolerance-wells | C127: A real positive double precision value that defines the maximum non-linear error for the well equations. | D127: 1.0 x 10-4
A128: ooow:<A127>+1 -> 120 | B128: -update-equations-scaling | C128: A Boolean value that switches on (true) or off (false) the updating of the scaling factors for mass balance equations during the simulation. | D128: false
A129: ooow:<A128>+1 -> 121 | B129: --use-gmres | C129: A Boolean value that when set to true OPM Flow will use Generalized Minimal Residual (“GMRES”)36 Y. Saad, A flexible inner-outer preconditioned GMRES algorithm, SIAM J. Sci. Statist. Comput.,14, (1993). and 37 Y. Saad and M.H. Schultz, GMRES: A generalized minimum residual algorithm for solving nonsymmetric linear systems, SIAM J. Sci. Statist. Comput., 7 (1986), pp. 856{869.solver instead of Biconjugate Gradient Stabilized (“BiCGSTAB”)38 Van der Vorst, H. A. (1992). "Bi-CGSTAB: A Fast and Smoothly Converging Variant of Bi-CG for the Solution of Nonsymmetric Linear Systems". SIAM J. Sci. Stat. Comput. 13 (2): 631–644. doi:10.1137/0913035. hdl:10338.dmlcz/104566 and 39 Sleijpen, G. L. G.; Fokkema, D. R. (November 1993). "BiCGstab(l) for linear equations involving unsymmetric matrices with complex spectrum" (PDF). Electronic Transactions on Numerical Analysis. Kent, OH: Kent State University. 1: 11–32. ISSN 1068-9613.as the linear solver within the Newton iterations. | D129: false
A130: ooow:<A129>+1 -> 122 | B130: --use-multisegment-well | C130: A Boolean value that when set to true the simulator will use the well model for multi-segment wells instead of the one for single-segment wells. | D130: true
A131: ooow:<A130>+1 -> 123 | B131: --use-update-stabilization | C131: A Boolean value set to true or false that switches on (true) or off (false) the stabilized Newton option, that attempts to detect and correct oscillations or stagnation during the Newton iterations. This option may improve convergence for some cases. | D131: true
A132: ooow:<A131>+1 -> 124 | B132: --zoltan-imbalance-tol | C132: A real positive that defines the tolerable imbalance of the load balancing provided by Zoltan package. | D132: 1.1
A133: Notes: flow --help instead use: flow --help-all to get a list of supported command line Parameters. The –enable-vtk-output option above, if set to “true” will write out the data as stipulated by the compile options. One may need to compile the source code to obtain the desired output.

Sheet: Table2059
A1: OPM Flow 2022-04 Command Line Options
A2: No. | B2: Variable Name | C2: Description | D2: Default
B3: General eWoms/ebos Command Line Parameters
A4: 1 | B4: -h or --help | C4: A character string that causes OPM Flow to print a help message that gives a brief description of the available command line parameters. This now only prints the active user facing command line options. | D4: N/A
A5: ooow:<A4>+1 -> 2 | B5: --help-all | C5: Prints all the command line options included in the release, including obsolete, hidden and deprecated options. | D5: N/A
A6: ooow:<A5>+1 -> 3 | B6: --accelerator-mode | C6: A defined character string that defines the usage of the GPU (cusparseSolver or openclSolver) or FPGA (fpgaSolver) as the linear solver, usage '--accelerator-mode=[none|cusparse|opencl|fpga|amgcl]'. | D6: “none”
A7: ooow:<A6>+1 -> 4 | B7: --allow-distributed-wells | C7: A boolean value set to true of false that allows the perforations of a well to be distributed to interior of multiple processes in a parallel run (true), or not (false). | D7: false
A8: ooow:<A7>+1 -> 5 | B8: --alternative-well-rate-init | C8: A boolean value set to true of false that causes the simulator to use an alternative well rate initialization procedure (true). | D8: true
A9: ooow:<A8>+1 -> 6 | B9: --bda-device-id | C9: Choose device ID for cusparseSolver or openclSolver, use 'nvidia-smi' or 'clinfo' commands to determine valid IDs. | D9: 0
A10: ooow:<A9>+1 -> 7 | B10: --continue-on-convergence-error | C10: A Boolean value set to true or false that that instructs the simulator to continue (true) with a non-converged solution instead of giving up (false) if it encounter a time step size smaller than the minimum time step size. | D10: false
A11: ooow:<A10>+1 -> 8 | B11: --cpr-max-ell-iter | C11: A positive integer that sets the maximum number of Iterations for the elliptic pressure part of the Constrained Pressure Residual (“CPR”) solver. | D11: 20
A12: ooow:<A11>+1 -> 9 | B12: --cpr-reuse-setup | C12: A positive integer that defines if the CPR solver should re-use the Amg setup. Valid options are: | D12: 3
A13: ooow:<A12>+1 -> 10 | B13: --dbph-max-rel | C13: A real positive value that sets maximum relative change of the bottom-hole pressure in a single iteration | D13: 1.0
A14: ooow:<A13>+1 -> 11 | B14: --dp-max-rel | C14: A real positive double precision value that sets the maximum allowed relative change of pressure per iteration. | D14: 0.3
A15: ooow:<A14>+1 -> 12 | B15: --ds-max | C15: A real positive double precision value that sets the maximum allowed change in saturation per iteration. | D15: 0.2
A16: ooow:<A15>+1 -> 13 | B16: --dwell-fraction-max | C16: A real positive value that sets the maximum allowed change in well’s volume fraction per iteration. | D16: 0.2
A17: ooow:<A16>+1 -> 14 | B17: --ecl-deck-file-name | C17: A character string that defines the name of the OPM Flow input file which contains the simulator’s ECLIPSE formatted input deck to be simulated. Note that there must be no spaces in the filename. If there are spaces, which can typically occur on Windows based systems, then the filename should be enclosed in quotes; thus instead of FILE NAME use “FILE NAME”. | D17: “”
A18: ooow:<A17>+1 -> 15 | B18: --ecl-enable-drift-compensation | C18: A Boolean value set to true or false that enables (true) or disables (false) partial compensation of systematic mass losses via the source term of the next time step. | D18: true
A19: ooow:<A18>+1 -> 16 | B19: --ecl-output-double-precision | C19: A Boolean value set to true or false that switches on (true) or off (false) double precision in restart files. Useful for 'perfect' restarts. | D19: false
A20: ooow:<A19>+1 -> 17 | B20: --ecl-output-interval | C20: An integer value defining the number of report steps that ought to be skipped between two writes of restart files results. | D20: -1
A21: ooow:<A20>+1 -> 18 | B21: --ecl-strict-parsing | C21: A Boolean value set to true or false that switches on (true) or off (false) strict parsing mode for parsing - all errors are collected before the application exists. Useful for debugging initial runs. | D21: false
A22: ooow:<A21>+1 -> 19 | B22: --edge-weights-method | C22: A defined positive integer value that defines the edge-weighing strategy: | D22: 1
A23: ooow:<A22>+1 -> 20 | B23: --enable-adaptive-time-stepping | C23: A Boolean value set to true or false that turns on (true) or off (false) adaptive time stepping. If set to false the report time steps provided by the input deck are used. | D23: true
A24: ooow:<A23>+1 -> 21 | B24: --enable-async-ecl-output | C24: A Boolean value set to true or false that sets the output mode to be asynchronously (true), letting the simulator continue computing the next time step while writing results to restart and summary files in the commercial simulators format. | D24: true
A25: ooow:<A24>+1 -> 22 | B25: --enable-async-vtk-output | C25: A Boolean value set to true or false that sets the output mode to be asynchronously (true), letting the simulator continue computing the next time step while writing results to the VTK output files. | D25: true
A26: ooow:<A25>+1 -> 23 | B26: --enable-dry-run | C26: A Boolean value set to true or false that specifies if the simulation should actually run, (true) or just check the input deck (false). This option is equivalent to activating the NOSIM keyword in the RUNSPEC section of the input deck (see section Error: Reference source not foundError: Reference source not found). The default value of “auto’ will use whatever is stipulated in the input deck via the NOSIM keyword. | D26: “auto”
A27: ooow:<A26>+1 -> 24 | B27: --enable-ecl-output | C27: A Boolean value set to true or false that specifies if the binary output files (restart, summary files, etc.) should be written in the commercial simulator’s format (true), or OPM Flow’s format (false). | D27: true
A28: ooow:<A27>+1 -> 25 | B28: --enable-esmry | C28: A Boolean value that switches on (true) or off (false) the output SUMMARY vectors to the ESMRY file for fast loading of summary data. | D28: false
A29: ooow:<A28>+1 -> 26 | B29: --enable-logging-fallout-warning | C29: A Boolean value set to true or false that sets the developer option to see whether logging was on non-root processors (true). If set to true output will be appended to the *.DBG or *.PRT files. | D29: false
A30: ooow:<A29>+1 -> 27 | B30: --enable-opm-rst-file | C30: A Boolean value set to true or false to write OPM specific data sets to the commercial simulators restart file to enable restart of an OPM Flow runs (true) by OPM Flow, or not to write the data (false). | D30: false
A31: ooow:<A30>+1 -> 28 | B31: --enable-storage-cache | C31: A Boolean value set to true or false that turns on (true) or off (false) storing previous storage terms and avoid re-calculating them. | D31: true
A32: ooow:<A31>+1 -> 29 | B32: --enable-terminal-output | C32: A Boolean value set to true or false that turns on (true) or off (false) high-level information about the simulation's progress to the terminal | D32: true
A33: ooow:<A32>+1 -> 30 | B33: --enable-tuning | C33: A Boolean value set to true or false that instructs OPM Flow to read the time stepping parameters from the Error: Reference source not foundkeyword in the input deck, if set to true. Note that only the first record of the TUNING keyword is processed. | D33: false
A34: ooow:<A33>+1 -> 31 | B34: --enable-vtk-output | C34: A Boolean value set to true or false that turns on (true) or off (false) a global switch for writing VTK files. | D34: false
A35: ooow:<A34>+1 -> 32 | B35: --enable-well-operability-check | C35: A Boolean value set to true or false that enables (true) checking of a well’s operating status, or disables (false) the checking. | D35: true
A36: ooow:<A35>+1 -> 33 | B36: --enable-well-operability-check-iter | C36: A Boolean value set to true or false that enables (true) checking of a well’s operating status during iterations, or disables (false) the checking during iterations. | D36: false
A37: ooow:<A36>+1 -> 34 | B37: --enable-write-all-solutions | C37: A Boolean value set to true or false that turns on (true) or off (false) the writing of all solutions to disk instead of only the ones for the report steps. | D37: false
A38: faul | B38: OPM Flow Specific Command Line Parameters
A39: ooow:<A37>+1 -> 35 | B39: --flow-linear-solver-verbosity | C39: A positive integer value that defines the output from linear solver: | D39: 0
A40: ooow:<A39>+1 -> 36 | B40: --flow-newton-max-iterations | C40: A positive integer that defines the maximum number of Newton iterations per time step used by the simulator. | D40: 20
A41: ooow:<A40>+1 -> 37 | B41: --flow-newton-min-iterations | C41: A real positive value that sets the minimum number of Newton iterations per time step used by the simulator. | D41: 1
A42: ooow:<A41>+1 -> 38 | B42: --force-disable-fluid-in-place-output | C42: A Boolean value set to true or false that instructs OPM Flow not to print the Fluid In-Place report after each report time step (true) or not (false). | D42: false
A43: ooow:<A42>+1 -> 39 | B43: --force-disable-resv-fluid-in-place-output | C43: A Boolean value set to true or false that instructs OPM Flow to not to print the Reservoir Volume Fluid In-Place report after each report time step (true) or not (false). | D43: false
B44: General eWoms/ebos Command Line Parameters
A45: ooow:<A43>+1 -> 40 | B45: --fpga-bitstream | C45: A character string that specifies the bit stream file for the fpgaSolver (including path), usage: '--fpga-bitstream=<filename>'. | D45: “”
A46: ooow:<A45>+1 -> 41 | B46: --full-time-step-initially | C46: A Boolean value set to true or false that instructs OPM Flow to always attempt to finish a report step using a single time step (true) or not (false). | D46: false
A47: ooow:<A46>+1 -> 42 | B47: --ignore-keywords | C47: A character string that defines a list of keywords which should be ignored by OPM Flow. The keyword string should be enclosed in quotes and each keyword separated by a colon, that is ':' . | D47: “”
A48: ooow:<A47>+1 -> 43 | B48: --ilu-fillin-level | C48: A positive integer value that sets the fill in level for the ILU preconditioner. | D48: 0
A49: ooow:<A48>+1 -> 44 | B49: --ilu-redblack | C49: A Boolean value set to true or false that instructs OPM Flow to use red-black partitioning for the ILU preconditioner. (true) or not (false). | D49: false
A50: ooow:<A49>+1 -> 45 | B50: --ilu-relaxation | C50: A real positive double precision value that sets the relaxation factor of the linear solver's ILU preconditioner | D50: 0.9
A51: ooow:<A50>+1 -> 46 | B51: --ilu-reorder-spheres | C51: A Boolean value set to true or false that specifies OPM Flow to reorder the entries of the matrix in the red-black ILU preconditioner in spheres starting at an edge (true) or not (false) If false the original ordering is preserved in each color. Otherwise try to ensure D4 ordering (in a 2D structured grid, the diagonal elements are consecutive). | D51: false
A52: ooow:<A51>+1 -> 47 | B52: --initial-time-step-in-days | C52: A real double precision value that sets the size of initial time step in days. | D52: 1.0
A53: ooow:<A52>+1 -> 48 | B53: --linear-solver-ignore-convergence-failure | C53: A Boolean value set to true or false that if set to true convergences failures in the linear solver are ignored. This option should be used with care, as the results may be unreliable. | D53: false
A54: ooow:<A53>+1 -> 49 | B54: --linear-solver-max-iter | C54: A positive integer value that defines the maximum number of linear iterations. | D54: 200
A55: ooow:<A54>+1 -> 50 | B55: --linear-solver-reduction | C55: A real positive double precision value that sets the tolerance for the linear solver. The linear solver convergences when the residual is reduced sufficiently. | D55: 0.01
A56: ooow:<A55>+1 -> 51 | B56: --linear-solver-require-full-sparsity-pattern | C56: A Boolean value set to true or false that if set to true the simulator will produce the full sparsity pattern for the linear solver. | D56: false
A57: ooow:<A56>+1 -> 52 | B57: --linear-solver-restart | C57: A positive integer value that sets the number of iterations after which GMRES is restarted. | D57: 40
A58: ooow:<A57>+1 -> 53 | B58: --linsolver | C58: A defined quoted character string that sets the configuration of the solver, valid values are: The default is "ilu0". Alternatively one can enter a character string enclosed in quotes that defines the filename of a JSON configuration file for the flexible linear solver system. In this case the file extension should be ‘.json’. Command line parameter changed from --linear-solver to --lin-solver | D58: “ilu0”
A59: ooow:<A58>+1 -> 54 | B59: --matrix-add-well-contributions | C59: A Boolean value set to true or false that if set to true explicitly specifies the influences of wells between cells in the Jacobian and preconditioner matrices. | D59: false
A60: ooow:<A59>+1 -> 55 | B60: --max-inner-iter-ms-wells | C60: A positive integer value that defines the maximum number of inner iterations for multi-segment wells. | D60: 100
A61: ooow:<A60>+1 -> 56 | B61: --max-inner-iter-wells | C61: A positive integer value that defines the maximum number of inner iterations for standard wells. | D61: 50
A62: ooow:<A61>+1 -> 57 | B62: --max-newton-iterations-with-inner-well-iterations | C62: A positive integer that specifies the maximum newton iterations with inner well iterations. | D62: 8.0
A63: ooow:<A62>+1 -> 58 | B63: --max-pressure-change-ms-wells | C63: A real positive value that defines the maximum relative pressure change for a single iteration of the multi-segment well model. | D63: 1.0 x 106
A64: ooow:<A63>+1 -> 59 | B64: --max-residual-allowed | C64: A real positive value that sets the absolute maximum tolerance for residuals without cutting the time step size. | D64: 1.0 x 107
A65: ooow:<A64>+1 -> 60 | B65: --max-single-precision-days | C65: A real positive value that sets the maximum time step size where single precision floating point arithmetic can be used for solving the linear systems of equations. | D65: 20.0
A66: ooow:<A65>+1 -> 61 | B66: --max-strict-iter | C66: A positive integer that sets the maximum number of Newton iterations before relaxed tolerances are used for the CNV convergence criterion. | D66: 0
A67: ooow:<A66>+1 -> 62 | B67: --max-temperature-change | C67: A real positive value that stipulates the maximum absolute change of temperature in a single iteration. | D67: 5
A68: ooow:<A67>+1 -> 63 | B68: --max-welleq-iter | C68: A positive integer that defines the maximum number of iterations to determine the solution to the well equations. | D68: 30
A69: ooow:<A68>+1 -> 64 | B69: --maximum-number-of-well-switches | C69: A positive integer values that stipulates the maximum number of times a well can switch to the same control. | D69: 3
A70: ooow:<A69>+1 -> 65 | B70: --milu-variant | C70: A defined character string that specifies which variant of the modified-ILU preconditioner ought to be used. Possible variants are: The default is “ILU” | D70: “ILU”
A71: ooow:<A70>+1 -> 66 | B71: --min-time-step-based-on-newton-iterations | C71: The minimum time step size (in days for field and metric unit and hours for lab unit) can be reduced to based on newton iteration counts. | D71: 0
A72: ooow:<A71>+1 -> 67 | B72: --min-time-step-before-shutting-problematic-wells-in-days | C72: A real positive value that sets the minimum time step size in days for which problematic wells are not shut. Time steps below this value will result in problematic wells being shut-in by the simulator. | D72: 0.01
A73: ooow:<A72>+1 -> 68 | B73: --newton-max-relax | C73: A real positive value that sets the maximum relaxation factor of a Newton iteration used by the simulator. | D73: 0.5
A74: ooow:<A73>+1 -> 69 | B74: --newton-relaxation-type | C74: A character string that defines the type of relaxation used in Newton’s method, default is dampen. | D74: “dampen”
A75: ooow:<A74>+1 -> 70 | B75: --opencl-ilu-reorder | C75: A defined character string that selects the reordering strategy for ILU for openclSolver and fpgaSolve, and should be set to: Note that “level_scheduling” behaves like Dune and cusparse; whereas, “graph_coloring” is more aggressive and is likely to be faster, but is random-based and generally increases the number of linear solves and linear iterations significantly. | D75: ""
A76: ooow:<A75>+1 -> 71 | B76: --opencl-platform-id | C76: A positive integer that specifies the platform identification (“ID”) for the openSolver. Use the “clinfo” command to determine valid IDs. | D76: 0
A77: ooow:<A76>+1 -> 72 | B77: --output-dir | C77: A character string that defines the directory to which OPM Flow is to write the commercial simulator compatible output files (restart, summary files etc.). The default value results in the files be written to the same directory as the input file. | D77: “”
A78: ooow:<A77>+1 -> 73 | B78: --output-interval | C78: A positive integer that specifies the number of report steps between two consecutive writes of restart data. | D78: 1
A79: ooow:<A78>+1 -> 74 | B79: --output-mode | C79: A defined character string that defines the output to the *.PRT and *.DBG files: For example to just output logging information use: --output-mode=”log” or --output-mode=false | D79: “all”
A80: ooow:<A79>+1 -> 75 | B80: --owner-cells-first | C80: A Boolean value set to true or false that determines if the cells owned by a rank should be ordered before ghost/overlapping the cells (true), or not (false). | D80: true
A81: ooow:<A80>+1 -> 76 | B81: --parameter-file | C81: A character string that defines the name of a parameter file which contains the simulator’s set of run-time parameters, as listed in this table. | D81: “”
A82: ooow:<A81>+1 -> 77 | B82: --pri-var-oscilation-threshold | C82: A real positive value that defines the threshold value for the primary variable switching conditions after its meaning has switched to hinder oscillations. | D82: 1.0 x 10-5
A83: ooow:<A82>+1 -> 78 | B83: --print-parameters | C83: A positive integer value that request that the run time parameters be printed at the start of the run: | D83: 2
A84: ooow:<A83>+1 -> 79 | B84: --print-properties | C84: A positive integer value that request that the compile time parameters be printed at the start of the run: | D84: 2
A85: ooow:<A84>+1 -> 80 | B85: --project-saturations | C85: A Boolean value set to true or false that determines if all the fluid saturations should be scaled to ensure the values are in the interval (0, 1), including runs that use solvents (true), or not (false). | D85: false
A86: ooow:<A85>+1 -> 81 | B86: --regularization-factor-msw | C86: A real positive value that defines the “regularization factor” for multi-segment wells. | D86: 1.0
A87: ooow:<A86>+1 -> 82 | B87: --relaxed-max-pv-fraction | C87: A real positive value that defines The fraction of the pore volume of the reservoir where the volumetric error (CNV) may be violated during strict Newton iterations. | D87: 0.03
A88: ooow:<A87>+1 -> 83 | B88: --relaxed-pressure-tol-msw | C88: A real positive value that sets the relaxation tolerance for the multi-segment well pressure solution. | D88: 50000
A89: ooow:<A88>+1 -> 84 | B89: --relaxed-well-flow-tol | C89: A real positive value that sets the relaxation tolerance for the well flow residual. | D89: 1.0
A90: ooow:<A89>+1 -> 85 | B90: --scale-linear-system | C90: A Boolean value set to true or false that switches on (true) or off (false) the scaling of linear system of equations according to the equation scale and primary variable types. | D90: false
A91: ooow:<A90>+1 -> 86 | B91: --sched-restart | C91: A Boolean value that determines for a restart run if the case should initialize wells and groups from the historical SCHEDULE section (true), or from the well and group data on the restart file (false). Note that the commercial simulator always uses data from the restart file (false). | D91: FALSCH
A92: ooow:<A91>+1 -> 87 | B92: --serial-partitioning | C92: A Boolean value that determines if partitioning for parallel runs on a single process (true), or not (false). | D92: false
A93: ooow:<A92>+1 -> 88 | B93: --shut-unsolvable-wells | C93: A Boolean value that determines if the simulator should shut unsolvable wells (true), or not (false). | D93: false
A94: ooow:<A93>+1 -> 89 | B94: --solve-welleq-initially | C94: A Boolean value set to true or false that determines if the simulator should fully solve the well equations before each iteration of the reservoir model (true), or not (false). Note that the well equations are always added to the full system and solved until converged. | D94: true
A95: ooow:<A94>+1 -> 90 | B95: --solver-continue-on-convergence-failure | C95: A Boolean value that stipulates if the simulator should continue (true) instead of stopping (false) when the minimum solver time step is reached. | D95: false
A96: ooow:<A95>+1 -> 91 | B96: --solver-growth-factor | C96: A real positive value that specifies the allowed value a time step can be increased by, subject to the maximum allowable time step size set by the --flow-solver-max-time-step-in-days parameter. For example, if the current time step has converged at 10 days and --flow-solver-growth-factor is set to the default value, then the next time step will be 2.0 * 10 days, that is at 20 days. | D96: 2.0
A97: ooow:<A96>+1 -> 92 | B97: --solver-max-growth | C97: A real positive value that specifies the maximum allowed value a time step can be increased by after a report time step. subject to the maximum allowable time step size set by the --flow-solver-max-time-step-in-days parameter. | D97: 3.0
A98: ooow:<A97>+1 -> 93 | B98: --solver-max-restarts | C98: A positive integer that defines the number of allowed consecutive restarts (or time step chops) before the simulation is terminated. | D98: 10
A99: ooow:<A98>+1 -> 94 | B99: --solver-max-time-step-in-days | C99: A real positive double precision value that specifies the maximum allowed time step size in days. | D99: 365
A100: ooow:<A99>+1 -> 95 | B100: --solver-min-time-step | C100: A real positive double precision value that specifies the minimum size of a time step in seconds. If a step cannot converge without getting cut below this step size the simulator will stop. | D100: 1.0 x 10-12
A101: ooow:<A100>+1 -> 96 | B101: --solver-restart-factor | C101: A real positive double precision value that sets the time step chop factor of the time step after a convergence failure. For example, if the current non-convergent time step is 30 days and --flow-solver-restart-factor is set to the default value, then the time step will be repeated using 0.33 * 30 days as the time step, that is 9.9 days. | D101: 0.33
A102: ooow:<A101>+1 -> 97 | B102: --solver-verbosity | C102: A positive integer that specifies the "chattiness" of the non-linear solver. | D102: 1
A103: ooow:<A102>+1 -> 98 | B103: --strict-inner-iter-wells | C103: A positive integer that specifies the number of inner well iterations with strict tolerance. | D103: 40
A104: ooow:<A103>+1 -> 99 | B104: --strict-outer-iter-wells | C104: A positive integer that specifies the number of newton iterations for which wells are checked with strict tolerance. | D104: 99
A105: ooow:<A104>+1 -> 100 | B105: --temperature-max | C105: A real positive value that sets the maximum absolute temperature. | D105: 400
A106: ooow:<A105>+1 -> 101 | B106: --temperature-min | C106: A real positive value that sets the minimum absolute temperature. | D106: 280
A107: ooow:<A106>+1 -> 102 | B107: --threads-per-process | C107: A positive integer value that stipulates the maximum number of threads to be instantiated per process ('-1' means 'automatic'). | D107: -1
A108: ooow:<A107>+1 -> 103 | B108: --time-step-after-event-in-days | C108: A real double precision value that sets maximum allowed time step after an event; for example, when a well is open or closed etc. The default value of -1 means that events to do effect the time stepping. | D108: -1
A109: ooow:<A108>+1 -> 104 | B109: --time-step-control | C109: A defined character string that defines the time stepping control algorithm and is set to one of the following: | D109: “pid+newtoniteration”
A110: ooow:<A109>+1 -> 105 | B110: --time-step-control-decay-damping-factor | C110: A real positive value that specifies the decay rate a time step can be decreased by after the number target iterations has been exceeded | D110: 1.0
A111: ooow:<A110>+1 -> 106 | B111: --time-step-control-decay-rate | C111: A real positive value that specifies the decay rate a time step size can be decreased by after the number of target iterations has been exceeded | D111: 0.75
A112: ooow:<A111>+1 -> 107 | B112: --time-step-control-file-name | C112: A character string enclosed in quotes that specifies a filename where time steps are specified. The default is the character string timesteps For instance time steps can be generated by the ecl_summary application in libecl as per the following UNIX command line: path_to_libecl_applications/ecl_summary DECK TIME > filename Where: DECK is the name of the data deck you want to get the time steps from, TIME tells the application to return the timing for the run, and "filename" is the name of the file the times are piped to. | D112: “timesteps”
A113: ooow:<A112>+1 -> 108 | B113: --time-step-control-growth-damping-factor | C113: A real positive value that specifies the growth rate of the time step increase when the number of target iterations are undercut. | D113: 3.2
A114: ooow:<A113>+1 -> 109 | B114: --time-step-control-growth-rate | C114: A real positive value that specifies the growth rate of the time step size when the number of target iterations are undercut. | D114: 1.25
A115: ooow:<A114>+1 -> 110 | B115: --time-step-control-target-iterations | C115: A positive integer that defines the number of linear iterations which the time step control scheme should aim for (if applicable). | D115: 30
A116: ooow:<A115>+1 -> 111 | B116: --time-step-control-target-newton-iterations | C116: A positive integer that specifies the number of Newton iterations which the time step control scheme should aim for (if applicable). | D116: 8
A117: ooow:<A116>+1 -> 112 | B117: --time-step-control-tolerance | C117: A real double precision value that sets the tolerance for PID (only used with the pid and pid+ options defined by the --time-step-control option). | D117: 0.1
A118: ooow:<A117>+1 -> 113 | B118: --time-step-verbosity | C118: A positive integer that specifies the "chattiness" during the time integration. | D118: 1
A119: ooow:<A118>+1 -> 114 | B119: --tolerance-cnv | C119: A real positive double precision value that specifies the maximum non-linear tolerance error. This is the local convergence tolerance (maximum of local saturation errors). | D119: 0.01
A120: ooow:<A119>+1 -> 115 | B120: --tolerance-cnv-relaxed | C120: A real positive value that defines the relaxed local convergence tolerance that applies for iterations after the iterations with the strict tolerance. | D120: 1.0
A121: ooow:<A120>+1 -> 116 | B121: --tolerance-mb | C121: A real positive double precision value that sets the maximum mass balance error, that is the tolerated mass balance error relative to total mass present. | D121: 1.0 x 10-6
A122: ooow:<A121>+1 -> 117 | B122: --tolerance-pressure-ms-wells | C122: A real positive double precision value that specifies the tolerance for the pressure equations for multi-segment wells. | D122: 1000
A123: ooow:<A122>+1 -> 118 | B123: --tolerance-well-control | C123: A real positive double precision value that sets the maximum tolerance for the well control equations. | D123: 1.0 x 10-7
A124: ooow:<A123>+1 -> 119 | B124: --tolerance-wells | C124: A real positive double precision value that defines the maximum non-linear error for the well equations. | D124: 1.0 x 10-4
A125: ooow:<A124>+1 -> 120 | B125: -update-equations-scaling | C125: A Boolean value that switches on (true) or off (false) the updating of the scaling factors for mass balance equations during the simulation. | D125: false
A126: ooow:<A125>+1 -> 121 | B126: --use-gmres | C126: A Boolean value that when set to true OPM Flow will use Generalized Minimal Residual (“GMRES”) solver instead of Biconjugate Gradient Stabilized (“BiCGSTAB”) as the linear solver within the Newton iterations. | D126: false
A127: ooow:<A126>+1 -> 122 | B127: --use-multisegment-well | C127: A Boolean value that when set to true the simulator will use the well model for multi-segment wells instead of the one for single-segment wells. | D127: true
A128: ooow:<A127>+1 -> 123 | B128: --use-update-stabilization | C128: A Boolean value set to true or false that switches on (true) or off (false) the stabilized Newton option, that attempts to detect and correct oscillations or stagnation during the Newton iterations. This option may improve convergence for some cases. | D128: true
A129: ooow:<A128>+1 -> 124 | B129: --vtk-write-diffusion-coefficients | C129: A Boolean value that switches on (true) or off (false) the output of the molecular diffusion coefficients to the VTK42 Virtualization ToolKit (“VTK”) files used to visualize the 3D results from the model using ParaView, an open-source, multi-platform general purpose data analysis and visualization application (https://www.paraview.org/overview/). For the commercial simulator’s compatible output files OPM’s ResInsight 3D visualization package can be used instead and is specifically tailored for OPM Flow and the commercial simulator. output files. | D129: false
A130: ooow:<A129>+1 -> 125 | B130: --vtk-write-effective-diffusion-coefficients | C130: A Boolean value that switches on (true) or off (false) the output of the effective molecular diffusion coefficients for the medium to the VTK output files. | D130: false
A131: ooow:<A130>+1 -> 126 | B131: --vtk-write-tortuosities | C131: A Boolean value that switches on (true) or off (false) the output of the tortuosity for each phase to the VTK output files. | D131: false
A132: ooow:<A131>+1 -> 127 | B132: --zoltan-imbalance-tol | C132: A real positive that defines the tolerable imbalance of the load balancing provided by Zoltan package. | D132: 1.1
A133: Notes: flow --help instead use: flow --help-all to get a list of supported command line Parameters. The –enable-vtk-output option above, if set to “true” will write out the data as stipulated by the compile options. One may need to compile the source code to obtain the desired output.

Sheet: Table2009
A1: OPM Flow 2021-10 Command Line Options
A2: No. | B2: Variable Name | C2: Description | D2: Default
B3: General eWoms/ebos Command Line Parameters
A4: 1 | B4: -h or --help | C4: A character string that causes OPM Flow to print a help message that gives a brief description of the available command line parameters. This now only prints the active user facing command line options. | D4: N/A
A5: ooow:<A4>+1 -> 2 | B5: --help-all | C5: Prints all the command line options included in the release, including obsolete, hidden and deprecated options. | D5: N/A
A6: ooow:<A5>+1 -> 3 | B6: --accelerator-mode | C6: A defined character string that defines the usage of the GPU (cusparseSolver or openclSolver) or FPGA (fpgaSolver) as the linear solver, usage '--accelerator-mode=[none|cusparse|opencl|fpga|amgcl]'. | D6: “none”
A7: ooow:<A6>+1 -> 4 | B7: --allow-distributed-wells | C7: A boolean value set to true of false that allows the perforations of a well to be distributed to interior of multiple processes in a parallel run (true), or not (false). | D7: false
A8: ooow:<A7>+1 -> 5 | B8: --alternative-well-rate-init | C8: A boolean value set to true of false that causes the simulator to use an alternative well rate initialization procedure (true). | D8: true
A9: ooow:<A8>+1 -> 6 | B9: --bda-device-id | C9: Choose device ID for cusparseSolver or openclSolver, use 'nvidia-smi' or 'clinfo' commands to determine valid IDs. | D9: 0
A10: ooow:<A9>+1 -> 7 | B10: --continue-on-convergence-error | C10: A Boolean value set to true or false that that instructs the simulator to continue (true) with a non-converged solution instead of giving up (false) if it encounter a time step size smaller than the minimum time step size. | D10: false
A11: ooow:<A10>+1 -> 8 | B11: --cpr-max-ell-iter | C11: A positive integer that sets the maximum number of Iterations for the elliptic pressure part of the Constrained Pressure Residual (“CPR”) solver. | D11: 20
A12: ooow:<A11>+1 -> 9 | B12: --cpr-reuse-setup | C12: A positive integer that defines if the CPR solver should re-use the Amg setup. Valid options are: | D12: 3
A13: ooow:<A12>+1 -> 10 | B13: --dbph-max-rel | C13: A real positive value that sets maximum relative change of the bottom-hole pressure in a single iteration | D13: 1.0
A14: ooow:<A13>+1 -> 11 | B14: --dp-max-rel | C14: A real positive double precision value that sets the maximum allowed relative change of pressure per iteration. | D14: 0.3
A15: ooow:<A14>+1 -> 12 | B15: --ds-max | C15: A real positive double precision value that sets the maximum allowed change in saturation per iteration. | D15: 0.2
A16: ooow:<A15>+1 -> 13 | B16: --dwell-fraction-max | C16: A real positive value that sets the maximum allowed change in well’s volume fraction per iteration. | D16: 0.2
A17: ooow:<A16>+1 -> 14 | B17: --ecl-deck-file-name | C17: A character string that defines the name of the OPM Flow input file which contains the simulator’s ECLIPSE formatted input deck to be simulated. Note that there must be no spaces in the filename. If there are spaces, which can typically occur on Windows based systems, then the filename should be enclosed in quotes; thus instead of FILE NAME use “FILE NAME”. | D17: “”
A18: ooow:<A17>+1 -> 15 | B18: --ecl-enable-drift-compensation | C18: A Boolean value set to true or false that enables (true) or disables (false) partial compensation of systematic mass losses via the source term of the next time step. | D18: true
A19: ooow:<A18>+1 -> 16 | B19: --ecl-output-double-precision | C19: A Boolean value set to true or false that switches on (true) or off (false) double precision in restart files. Useful for 'perfect' restarts. | D19: false
A20: ooow:<A19>+1 -> 17 | B20: --ecl-output-interval | C20: An integer value defining the number of report steps that ought to be skipped between two writes of restart files results. | D20: -1
A21: ooow:<A20>+1 -> 18 | B21: --ecl-strict-parsing | C21: A Boolean value set to true or false that switches on (true) or off (false) strict parsing mode for parsing - all errors are collected before the application exists. Useful for debugging initial runs. | D21: false
A22: ooow:<A21>+1 -> 19 | B22: --edge-weights-method | C22: A defined positive integer value that defines the edge-weighing strategy: | D22: 1
A23: ooow:<A22>+1 -> 20 | B23: --enable-adaptive-time-stepping | C23: A Boolean value set to true or false that turns on (true) or off (false) adaptive time stepping. If set to false the report time steps provided by the input deck are used. | D23: true
A24: ooow:<A23>+1 -> 21 | B24: --enable-async-ecl-output | C24: A Boolean value set to true or false that sets the output mode to be asynchronously (true), letting the simulator continue computing the next time step while writing results to restart and summary files in the commercial simulators format. | D24: true
A25: ooow:<A24>+1 -> 22 | B25: --enable-async-vtk-output | C25: A Boolean value set to true or false that sets the output mode to be asynchronously (true), letting the simulator continue computing the next time step while writing results to the VTK output files. | D25: true
A26: ooow:<A25>+1 -> 23 | B26: --enable-dry-run | C26: A Boolean value set to true or false that specifies if the simulation should actually run, (true) or just check the input deck (false). This option is equivalent to activating the NOSIM keyword in the RUNSPEC section of the input deck (see section Error: Reference source not foundError: Reference source not found). The default value of “auto’ will use whatever is stipulated in the input deck via the NOSIM keyword. | D26: “auto”
A27: ooow:<A26>+1 -> 24 | B27: --enable-ecl-output | C27: A Boolean value set to true or false that specifies if the binary output files (restart, summary files, etc.) should be written in the commercial simulator’s format (true), or OPM Flow’s format (false). | D27: true
A28: ooow:<A27>+1 -> 25 | B28: --enable-esmry | C28: A Boolean value that switches on (true) or off (false) the output SUMMARY vectors to the ESMRY file for fast loading of summary data. | D28: false
A29: ooow:<A28>+1 -> 26 | B29: --enable-logging-fallout-warning | C29: A Boolean value set to true or false that sets the developer option to see whether logging was on non-root processors (true). If set to true output will be appended to the *.DBG or *.PRT files. | D29: false
A30: ooow:<A29>+1 -> 27 | B30: --enable-opm-rst-file | C30: A Boolean value set to true or false to write OPM specific data sets to the commercial simulators restart file to enable restart of an OPM Flow runs (true) by OPM Flow, or not to write the data (false). | D30: false
A31: ooow:<A30>+1 -> 28 | B31: --enable-storage-cache | C31: A Boolean value set to true or false that turns on (true) or off (false) storing previous storage terms and avoid re-calculating them. | D31: true
A32: ooow:<A31>+1 -> 29 | B32: --enable-terminal-output | C32: A Boolean value set to true or false that turns on (true) or off (false) high-level information about the simulation's progress to the terminal | D32: true
A33: ooow:<A32>+1 -> 30 | B33: --enable-tracer-model | C33: A Boolean value set to true or false that turns on (true) or off (false) transport tracer calculations for when tracers have been declared in the input deck. | D33: true
A34: ooow:<A33>+1 -> 31 | B34: --enable-tuning | C34: A Boolean value set to true or false that instructs OPM Flow to read the time stepping parameters from the Error: Reference source not foundkeyword in the input deck, if set to true. Note that only the first record of the TUNING keyword is processed. | D34: false
A35: ooow:<A34>+1 -> 32 | B35: --enable-vtk-output | C35: A Boolean value set to true or false that turns on (true) or off (false) a global switch for writing VTK files. | D35: false
A36: ooow:<A35>+1 -> 33 | B36: --enable-well-operability-check | C36: A Boolean value set to true or false that enables (true) checking of a well’s operating status, or disables (false) the checking. | D36: true
A37: ooow:<A36>+1 -> 34 | B37: --enable-well-operability-check-iter | C37: A Boolean value set to true or false that enables (true) checking of a well’s operating status during iterations, or disables (false) the checking during iterations. | D37: false
A38: ooow:<A37>+1 -> 35 | B38: --enable-write-all-solutions | C38: A Boolean value set to true or false that turns on (true) or off (false) the writing of all solutions to disk instead of only the ones for the report steps. | D38: false
A39: faul | B39: OPM Flow Specific Command Line Parameters
A40: ooow:<A38>+1 -> 36 | B40: --flow-linear-solver-verbosity | C40: A positive integer value that defines the output from linear solver: | D40: 0
A41: ooow:<A40>+1 -> 37 | B41: --flow-newton-max-iterations | C41: A positive integer that defines the maximum number of Newton iterations per time step used by the simulator. | D41: 20
A42: ooow:<A41>+1 -> 38 | B42: --flow-newton-min-iterations | C42: A real positive value that sets the minimum number of Newton iterations per time step used by the simulator. | D42: 1
A43: ooow:<A42>+1 -> 39 | B43: --force-disable-fluid-in-place-output | C43: A Boolean value set to true or false that instructs OPM Flow not to print the Fluid In-Place report after each report time step (true) or not (false). | D43: false
A44: ooow:<A43>+1 -> 40 | B44: --force-disable-resv-fluid-in-place-output | C44: A Boolean value set to true or false that instructs OPM Flow to not to print the Reservoir Volume Fluid In-Place report after each report time step (true) or not (false). | D44: false
B45: General eWoms/ebos Command Line Parameters
A46: ooow:<A44>+1 -> 41 | B46: --fpga-bitstream | C46: A character string that specifies the bit stream file for the fpgaSolver (including path), usage: '--fpga-bitstream=<filename>'. | D46: “”
A47: ooow:<A46>+1 -> 42 | B47: --full-time-step-initially | C47: A Boolean value set to true or false that instructs OPM Flow to always attempt to finish a report step using a single time step (true) or not (false). | D47: false
A48: ooow:<A47>+1 -> 43 | B48: --ignore-keywords | C48: A character string that defines a list of keywords which should be ignored by OPM Flow. The keyword string should be enclosed in quotes and each keyword separated by a colon, that is ':' . | D48: “”
A49: ooow:<A48>+1 -> 44 | B49: --ilu-fillin-level | C49: A positive integer value that sets the fill in level for the ILU preconditioner. | D49: 0
A50: ooow:<A49>+1 -> 45 | B50: --ilu-redblack | C50: A Boolean value set to true or false that instructs OPM Flow to use red-black partitioning for the ILU preconditioner. (true) or not (false). | D50: false
A51: ooow:<A50>+1 -> 46 | B51: --ilu-relaxation | C51: A real positive double precision value that sets the relaxation factor of the linear solver's ILU preconditioner | D51: 0.9
A52: ooow:<A51>+1 -> 47 | B52: --ilu-reorder-spheres | C52: A Boolean value set to true or false that specifies OPM Flow to reorder the entries of the matrix in the red-black ILU preconditioner in spheres starting at an edge (true) or not (false) If false the original ordering is preserved in each color. Otherwise try to ensure D4 ordering (in a 2D structured grid, the diagonal elements are consecutive). | D52: false
A53: ooow:<A52>+1 -> 48 | B53: --initial-time-step-in-days | C53: A real double precision value that sets the size of initial time step in days. | D53: 1.0
A54: ooow:<A53>+1 -> 49 | B54: --linear-solver-ignore-convergence-failure | C54: A Boolean value set to true or false that if set to true convergences failures in the linear solver are ignored. This option should be used with care, as the results may be unreliable. | D54: false
A55: ooow:<A54>+1 -> 50 | B55: --linear-solver-max-iter | C55: A positive integer value that defines the maximum number of linear iterations. | D55: 200
A56: ooow:<A55>+1 -> 51 | B56: --linear-solver-reduction | C56: A real positive double precision value that sets the tolerance for the linear solver. The linear solver convergences when the residual is reduced sufficiently. | D56: 0.01
A57: ooow:<A56>+1 -> 52 | B57: --linear-solver-require-full-sparsity-pattern | C57: A Boolean value set to true or false that if set to true the simulator will produce the full sparsity pattern for the linear solver. | D57: false
A58: ooow:<A57>+1 -> 53 | B58: --linear-solver-restart | C58: A positive integer value that sets the number of iterations after which GMRES is restarted. | D58: 40
A59: ooow:<A58>+1 -> 54 | B59: --linsolver | C59: A defined quoted character string that sets the configuration of the solver, valid values are: The default is "ilu0". Alternatively one can enter a character string enclosed in quotes that defines the filename of a JSON configuration file for the flexible linear solver system. In this case the file extension should be ‘.json’. Command line parameter changed from --linear-solver to --lin-solver | D59: “ilu0”
A60: ooow:<A59>+1 -> 55 | B60: --matrix-add-well-contributions | C60: A Boolean value set to true or false that if set to true explicitly specifies the influences of wells between cells in the Jacobian and preconditioner matrices. | D60: false
A61: ooow:<A60>+1 -> 56 | B61: --max-inner-iter-ms-wells | C61: A positive integer value that defines the maximum number of inner iterations for multi-segment wells. | D61: 100
A62: ooow:<A61>+1 -> 57 | B62: --max-inner-iter-wells | C62: A positive integer value that defines the maximum number of inner iterations for standard wells. | D62: 50
A63: ooow:<A62>+1 -> 58 | B63: --max-newton-iterations-with-inner-well-iterations | C63: A positive integer that specifies the maximum newton iterations with inner well iterations. | D63: 8.0
A64: ooow:<A63>+1 -> 59 | B64: --max-pressure-change-ms-wells | C64: A real positive value that defines the maximum relative pressure change for a single iteration of the multi-segment well model. | D64: 1.0 x 106
A65: ooow:<A64>+1 -> 60 | B65: --max-residual-allowed | C65: A real positive value that sets the absolute maximum tolerance for residuals without cutting the time step size. | D65: 1.0 x 107
A66: ooow:<A65>+1 -> 61 | B66: --max-single-precision-days | C66: A real positive value that set the maximum time step size where single precision floating point arithmetic can be used solving for the linear systems of equations. | D66: 20.0
A67: ooow:<A66>+1 -> 62 | B67: --max-strict-iter | C67: A positive integer that sets the maximum number of Newton iterations before relaxed tolerances are used for the CNV convergence criterion. | D67: 0
A68: ooow:<A67>+1 -> 63 | B68: --max-temperature-change | C68: A real positive value that stipulates the maximum absolute change of temperature in a single iteration. | D68: 5
A69: ooow:<A68>+1 -> 64 | B69: --max-welleq-iter | C69: A positive integer that defines the maximum number of iterations to determine the solution to the well equations. | D69: 30
A70: ooow:<A69>+1 -> 65 | B70: --maximum-number-of-well-switches | C70: A positive integer values that stipulates the maximum number of times a well can switch to the same control. | D70: 3
A71: ooow:<A70>+1 -> 66 | B71: --milu-variant | C71: A defined character string that specifies which variant of the modified-ILU preconditioner ought to be used. Possible variants are: The default is “ILU” | D71: “ILU”
A72: ooow:<A71>+1 -> 67 | B72: --min-time-step-based-on-newton-iterations | C72: The minimum time step size (in days for field and metric unit and hours for lab unit) can be reduced to based on newton iteration counts. | D72: 0
A73: ooow:<A72>+1 -> 68 | B73: --min-time-step-before-shutting-problematic-wells-in-days | C73: A real positive value that sets the minimum time step size in days for which problematic wells are not shut. Time steps below this value will result in problematic wells being shut-in by the simulator. | D73: 0.01
A74: ooow:<A73>+1 -> 69 | B74: --newton-max-relax | C74: A real positive value that sets the maximum relaxation factor of a Newton iteration used by the simulator. | D74: 0.5
A75: ooow:<A74>+1 -> 70 | B75: --newton-relaxation-type | C75: A character string that defines the type of relaxation used in Newton’s method, default is dampen. | D75: “dampen”
A76: ooow:<A75>+1 -> 71 | B76: --opencl-ilu-reorder | C76: A defined character string that selects the reordering strategy for ILU for openclSolver and fpgaSolve, and should be set to: Note that “level_scheduling” behaves like Dune and cusparse; whereas, “graph_coloring” is more aggressive and is likely to be faster, but is random-based and generally increases the number of linear solves and linear iterations significantly. | D76: ""
A77: ooow:<A76>+1 -> 72 | B77: --opencl-platform-id | C77: A positive integer that specifies the platform identification (“ID”) for the openSolver. Use the “clinfo” command to determine valid IDs. | D77: 0
A78: ooow:<A77>+1 -> 73 | B78: --output-dir | C78: A character string that defines the directory to which OPM Flow is to write the commercial simulator compatible output files (restart, summary files etc.). The default value results in the files be written to the same directory as the input file. | D78: “”
A79: ooow:<A78>+1 -> 74 | B79: --output-interval | C79: A positive integer that specifies the number of report steps between two consecutive writes of restart data. | D79: 1
A80: ooow:<A79>+1 -> 75 | B80: --output-mode | C80: A defined character string that defines the output to the *.PRT and *.DBG files: For example to just output logging information use: --output-mode=”log” or --output-mode=false | D80: “all”
A81: ooow:<A80>+1 -> 76 | B81: --owner-cells-first | C81: A Boolean value set to true or false that determines if the cells owned by a rank should be ordered before ghost/overlapping the cells (true), or not (false). | D81: true
A82: ooow:<A81>+1 -> 77 | B82: --parameter-file | C82: A character string that defines the name of a parameter file which contains the simulator’s set of run-time parameters, as listed in this table. | D82: “”
A83: ooow:<A82>+1 -> 78 | B83: --pri-var-oscilation-threshold | C83: A real positive value that defines the threshold value for the primary variable switching conditions after its meaning has switched to hinder oscillations. | D83: 1.0 x 10-5
A84: ooow:<A83>+1 -> 79 | B84: --print-parameters | C84: A positive integer value that request that the run time parameters be printed at the start of the run: | D84: 2
A85: ooow:<A84>+1 -> 80 | B85: --print-properties | C85: A positive integer value that request that the compile time parameters be printed at the start of the run: | D85: 2
A86: ooow:<A85>+1 -> 81 | B86: --project-saturations | C86: A Boolean value set to true or false that determines if all the fluid saturations should be scaled to ensure the values are in the interval (0, 1), including runs that use solvents (true), or not (false). | D86: false
A87: ooow:<A86>+1 -> 82 | B87: --regularization-factor-msw | C87: A real positive value that defines the “regularization factor” for multi-segment wells. | D87: 1.0
A88: ooow:<A87>+1 -> 83 | B88: --relaxed-max-pv-fraction | C88: A real positive value that defines The fraction of the pore volume of the reservoir where the volumetric error (CNV) may be violated during strict Newton iterations. | D88: 0.03
A89: ooow:<A88>+1 -> 84 | B89: --relaxed-pressure-tol-msw | C89: A real positive value that sets the relaxation tolerance for the multi-segment well pressure solution. | D89: 50000
A90: ooow:<A89>+1 -> 85 | B90: --relaxed-well-flow-tol | C90: A real positive value that sets the relaxation tolerance for the well flow residual. | D90: 1.0
A91: ooow:<A90>+1 -> 86 | B91: --scale-linear-system | C91: A Boolean value set to true or false that switches on (true) or off (false) the scaling of linear system of equations according to the equation scale and primary variable types. | D91: false
A92: ooow:<A91>+1 -> 87 | B92: --sched-restart | C92: A Boolean value that determines for a restart run if the case should initialize wells and groups from the historical SCHEDULE section (true), or from the well and group data on the restart file (false). Note that the commercial simulator always uses data from the restart file (false). | D92: true
A93: ooow:<A92>+1 -> 88 | B93: --serial-partitioning | C93: A Boolean value that determines if partitioning for parallel runs on a single process (true), or not (false). | D93: false
A94: ooow:<A93>+1 -> 89 | B94: --shut-unsolvable-wells | C94: A Boolean value that determines if the simulator should shut unsolvable wells (true), or not (false). | D94: false
A95: ooow:<A94>+1 -> 90 | B95: --solve-welleq-initially | C95: A Boolean value set to true or false that determines if the simulator should fully solve the well equations before each iteration of the reservoir model (true), or not (false). Note that the well equations are always added to the full system and solved until converged. | D95: true
A96: ooow:<A95>+1 -> 91 | B96: --solver-continue-on-convergence-failure | C96: A Boolean value that stipulates if the simulator should continue (true) instead of stopping (false) when the minimum solver time step is reached. | D96: false
A97: ooow:<A96>+1 -> 92 | B97: --solver-growth-factor | C97: A real positive value that specifies the allowed value a time step can be increased by, subject to the maximum allowable time step size set by the --flow-solver-max-time-step-in-days parameter. For example, if the current time step has converged at 10 days and --flow-solver-growth-factor is set to the default value, then the next time step will be 2.0 * 10 days, that is at 20 days. | D97: 2.0
A98: ooow:<A97>+1 -> 93 | B98: --solver-max-growth | C98: A real positive value that specifies the maximum allowed value a time step can be increased by after a report time step. subject to the maximum allowable time step size set by the --flow-solver-max-time-step-in-days parameter. | D98: 3.0
A99: ooow:<A98>+1 -> 94 | B99: --solver-max-restarts | C99: A positive integer that defines the number of allowed consecutive restarts (or time step chops) before the simulation is terminated. | D99: 10
A100: ooow:<A99>+1 -> 95 | B100: --solver-max-time-step-in-days | C100: A real positive double precision value that specifies the maximum allowed time step size in days. | D100: 365
A101: ooow:<A100>+1 -> 96 | B101: --solver-min-time-step | C101: A real positive double precision value that specifies the minimum size of a time step in seconds. If a step cannot converge without getting cut below this step size the simulator will stop. | D101: 1.0 x 10-12
A102: ooow:<A101>+1 -> 97 | B102: --solver-restart-factor | C102: A real positive double precision value that sets the time step chop factor of the time step after a convergence failure. For example, if the current non-convergent time step is 30 days and --flow-solver-restart-factor is set to the default value, then the time step will be repeated using 0.33 * 30 days as the time step, that is 9.9 days. | D102: 0.33
A103: ooow:<A102>+1 -> 98 | B103: --solver-verbosity | C103: A positive integer that specifies the "chattiness" of the non-linear solver. | D103: 1
A104: ooow:<A103>+1 -> 99 | B104: --strict-inner-iter-wells | C104: A positive integer that specifies the number of inner well iterations with strict tolerance. | D104: 40
A105: ooow:<A104>+1 -> 100 | B105: --strict-outer-iter-wells | C105: A positive integer that specifies the number of newton iterations for which wells are checked with strict tolerance. | D105: 99
A106: ooow:<A105>+1 -> 101 | B106: --temperature-max | C106: A real positive value that sets the maximum absolute temperature. | D106: 400
A107: ooow:<A106>+1 -> 102 | B107: --temperature-min | C107: A real positive value that sets the minimum absolute temperature. | D107: 280
A108: ooow:<A107>+1 -> 103 | B108: --threads-per-process | C108: A positive integer value that stipulates the maximum number of threads to be instantiated per process ('-1' means 'automatic'). | D108: -1
A109: ooow:<A108>+1 -> 104 | B109: --time-step-after-event-in-days | C109: A real double precision value that sets maximum allowed time step after an event; for example, when a well is open or closed etc. The default value of -1 means that events to do effect the time stepping. | D109: -1
A110: ooow:<A109>+1 -> 105 | B110: --time-step-control | C110: A defined character string that defines the time stepping control algorithm and is set to one of the following: | D110: “pid+newtoniteration”
A111: ooow:<A110>+1 -> 106 | B111: --time-step-control-decay-damping-factor | C111: A real positive value that specifies the decay rate a time step can be decreased by after the number target iterations has been exceeded | D111: 1.0
A112: ooow:<A111>+1 -> 107 | B112: --time-step-control-decay-rate | C112: A real positive value that specifies the decay rate a time step size can be decreased by after the number of target iterations has been exceeded | D112: 0.75
A113: ooow:<A112>+1 -> 108 | B113: --time-step-control-file-name | C113: A character string enclosed in quotes that specifies a filename where time steps are specified. The default is the character string timesteps For instance time steps can be generated by the ecl_summary application in libecl as per the following UNIX command line: path_to_libecl_applications/ecl_summary DECK TIME > filename Where: DECK is the name of the data deck you want to get the time steps from, TIME tells the application to return the timing for the run, and "filename" is the name of the file the times are piped to. | D113: “timesteps”
A114: ooow:<A113>+1 -> 109 | B114: --time-step-control-growth-damping-factor | C114: A real positive value that specifies the growth rate of the time step increase when the number of target iterations are undercut. | D114: 3.2
A115: ooow:<A114>+1 -> 110 | B115: --time-step-control-growth-rate | C115: A real positive value that specifies the growth rate of the time step size when the number of target iterations are undercut. | D115: 1.25
A116: ooow:<A115>+1 -> 111 | B116: --time-step-control-target-iterations | C116: A positive integer that defines the number of linear iterations which the time step control scheme should aim for (if applicable). | D116: 30
A117: ooow:<A116>+1 -> 112 | B117: --time-step-control-target-newton-iterations | C117: A positive integer that specifies the number of Newton iterations which the time step control scheme should aim for (if applicable). | D117: 8
A118: ooow:<A117>+1 -> 113 | B118: --time-step-control-tolerance | C118: A real double precision value that sets the tolerance for PID (only used with the pid and pid+ options defined by the --time-step-control option). | D118: 0.1
A119: ooow:<A118>+1 -> 114 | B119: --time-step-verbosity | C119: A positive integer that specifies the "chattiness" during the time integration. | D119: 1
A120: ooow:<A119>+1 -> 115 | B120: --tolerance-cnv | C120: A real positive double precision value that specifies the maximum non-linear tolerance error. This is the local convergence tolerance (maximum of local saturation errors). | D120: 0.01
A121: ooow:<A120>+1 -> 116 | B121: --tolerance-cnv-relaxed | C121: A real positive value that defines the relaxed local convergence tolerance that applies for iterations after the iterations with the strict tolerance. | D121: 1.0
A122: ooow:<A121>+1 -> 117 | B122: --tolerance-mb | C122: A real positive double precision value that sets the maximum mass balance error, that is the tolerated mass balance error relative to total mass present. | D122: 1.0 x 10-6
A123: ooow:<A122>+1 -> 118 | B123: --tolerance-pressure-ms-wells | C123: A real positive double precision value that specifies the tolerance for the pressure equations for multi-segment wells. | D123: 1000
A124: ooow:<A123>+1 -> 119 | B124: --tolerance-well-control | C124: A real positive double precision value that sets the maximum tolerance for the well control equations. | D124: 1.0 x 10-7
A125: ooow:<A124>+1 -> 120 | B125: --tolerance-wells | C125: A real positive double precision value that defines the maximum non-linear error for the well equations. | D125: 1.0 x 10-4
A126: ooow:<A125>+1 -> 121 | B126: -update-equations-scaling | C126: A Boolean value that switches on (true) or off (false) the updating of the scaling factors for mass balance equations during the simulation. | D126: false
A127: ooow:<A126>+1 -> 122 | B127: --use-gmres | C127: A Boolean value that when set to true OPM Flow will use Generalized Minimal Residual (“GMRES”) solver instead of Biconjugate Gradient Stabilized (“BiCGSTAB”) as the linear solver within the Newton iterations. | D127: false
A128: ooow:<A127>+1 -> 123 | B128: --use-multisegment-well | C128: A Boolean value that when set to true the simulator will use the well model for multi-segment wells instead of the one for single-segment wells. | D128: true
A129: ooow:<A128>+1 -> 124 | B129: --use-update-stabilization | C129: A Boolean value set to true or false that switches on (true) or off (false) the stabilized Newton option, that attempts to detect and correct oscillations or stagnation during the Newton iterations. This option may improve convergence for some cases. | D129: true
A130: ooow:<A129>+1 -> 125 | B130: --vtk-write-diffusion-coefficients | C130: A Boolean value that switches on (true) or off (false) the output of the molecular diffusion coefficients to the VTK45 Virtualization ToolKit (“VTK”) files used to visualize the 3D results from the model using ParaView, an open-source, multi-platform general purpose data analysis and visualization application (https://www.paraview.org/overview/). For the commercial simulator’s compatible output files OPM’s ResInsight 3D visualization package can be used instead and is specifically tailored for OPM Flow and the commercial simulator. output files. | D130: false
A131: ooow:<A130>+1 -> 126 | B131: --vtk-write-effective-diffusion-coefficients | C131: A Boolean value that switches on (true) or off (false) the output of the effective molecular diffusion coefficients for the medium to the VTK output files. | D131: false
A132: ooow:<A131>+1 -> 127 | B132: --vtk-write-tortuosities | C132: A Boolean value that switches on (true) or off (false) the output of the tortuosity for each phase to the VTK output files. | D132: false
A133: ooow:<A132>+1 -> 128 | B133: --zoltan-imbalance-tol | C133: A real positive that defines the tolerable imbalance of the load balancing provided by Zoltan package. | D133: 1.1
A134: Notes: flow --help instead use: flow --help-all to get a list of supported command line Parameters. The –enable-vtk-output option above, if set to “true” will write out the data as stipulated by the compile options. One may need to compile the source code to obtain the desired output.

Sheet: Table2034
A1: OPM Flow 2021-04 Command Line Options
A2: No. | B2: Variable Name | C2: Description | D2: Default
B3: General eWoms/ebos Command Line Parameters
A4: 1 | B4: -h or --help | C4: A character string that causes OPM Flow to print a help message that gives a brief description of the available command line parameters. This now only prints the active user facing command line options. | D4: N/A
A5: ooow:<A4>+1 -> 2 | B5: --help-all | C5: Prints all the command line options included in the release, including obsolete, hidden and deprecated options. | D5: N/A
A6: ooow:<A5>+1 -> 3 | B6: --allow-distributed-wells | C6: A boolean value set to true of false that allows the perforations of a well to be distributed to interior of multiple processes in a parallel run (true), or not (false). | D6: false
A7: ooow:<A6>+1 -> 4 | B7: --alternative-well-rate-init | C7: A boolean value set to true of false that causes the simulator to use an alternative well rate initialization procedure (true). | D7: true
A8: ooow:<A7>+1 -> 5 | B8: --bda-device-id | C8: Choose device ID for cusparseSolver or openclSolver, use 'nvidia-smi' or 'clinfo' commands to determine valid IDs. | D8: 0
A9: ooow:<A8>+1 -> 6 | B9: --continue-on-convergence-error | C9: A Boolean value set to true or false that that instructs the simulator to continue (true) with a non-converged solution instead of giving up (false) if it encounter a time step size smaller than the minimum time step size. | D9: false
A10: ooow:<A9>+1 -> 7 | B10: --cpr-max-ell-iter | C10: A positive integer that sets the maximum number of Iterations for the elliptic pressure part of the Constrained Pressure Residual (“CPR”) solver. | D10: 20
A11: ooow:<A10>+1 -> 8 | B11: --cpr-reuse-setup | C11: A positive integer that defines if the CPR solver should re-use the Amg setup. Valid options are: | D11: 0
A12: ooow:<A11>+1 -> 9 | B12: --dbph-max-rel | C12: A real positive value that sets maximum relative change of the bottom-hole pressure in a single iteration | D12: 1.0
A13: ooow:<A12>+1 -> 10 | B13: --dp-max-rel | C13: A real positive double precision value that sets the maximum allowed relative change of pressure per iteration. | D13: 0.3
A14: ooow:<A13>+1 -> 11 | B14: --ds-max | C14: A real positive double precision value that sets the maximum allowed change in saturation per iteration. | D14: 0.2
A15: ooow:<A14>+1 -> 12 | B15: --dwell-fraction-max | C15: A real positive value that sets the maximum allowed change in well’s volume fraction per iteration. | D15: 0.2
A16: ooow:<A15>+1 -> 13 | B16: --ecl-deck-file-name | C16: A character string that defines the name of the OPM Flow input file which contains the simulator’s ECLIPSE formatted input deck to be simulated. | D16: “”
A17: ooow:<A16>+1 -> 14 | B17: --ecl-enable-drift-compensation | C17: A Boolean value set to true or false that enables (true) or disables (false) partial compensation of systematic mass losses via the source term of the next time step. | D17: true
A18: ooow:<A17>+1 -> 15 | B18: --ecl-output-double-precision | C18: A Boolean value set to true or false that switches on (true) or off (false) double precision in restart files. Useful for 'perfect' restarts. | D18: false
A19: ooow:<A18>+1 -> 16 | B19: --ecl-output-interval | C19: An integer value defining the number of report steps that ought to be skipped between two writes of restart files results. | D19: -1
A20: ooow:<A19>+1 -> 17 | B20: --ecl-strict-parsing | C20: A Boolean value set to true or false that switches on (true) or off (false) strict parsing mode for parsing - all errors are collected before the application exists. Useful for debugging initial runs. | D20: false
A21: ooow:<A20>+1 -> 18 | B21: --edge-weights-method | C21: A defined positive integer value that defines the edge-weighing strategy: | D21: 1
A22: ooow:<A21>+1 -> 19 | B22: --enable-adaptive-time-stepping | C22: A Boolean value set to true or false that turns on (true) or off (false) adaptive time stepping. If set to false the report time steps provided by the input deck are used. | D22: true
A23: ooow:<A22>+1 -> 20 | B23: --enable-async-ecl-output | C23: A Boolean value set to true or false that sets the output mode to be asynchronously (true), letting the simulator continue computing the next time step while writing results to restart and summary files in the commercial simulators format. | D23: true
A24: ooow:<A23>+1 -> 21 | B24: --enable-async-vtk-output | C24: A Boolean value set to true or false that sets the output mode to be asynchronously (true), letting the simulator continue computing the next time step while writing results to the VTK output files. | D24: true
A25: ooow:<A24>+1 -> 22 | B25: --enable-dry-run | C25: A Boolean value set to true or false that specifies if the simulation should actually run, (true) or just check the input deck (false). This option is equivalent to activating the NOSIM keyword in the RUNSPEC section of the input deck (see section Error: Reference source not foundError: Reference source not found). The default value of “auto’ will use whatever is stipulated in the input deck via the NOSIM keyword. | D25: “auto”
A26: ooow:<A25>+1 -> 23 | B26: --enable-ecl-output | C26: A Boolean value set to true or false that specifies if the binary output files (restart, summary files, etc.) should be written in the commercial simulator’s format (true), or OPM Flow’s format (false). | D26: true
A27: ooow:<A26>+1 -> 24 | B27: --enable-logging-fallout-warning | C27: A Boolean value set to true or false that sets the developer option to see whether logging was on non-root processors (true). If set to true output will be appended to the *.DBG or *.PRT files. | D27: false
A28: ooow:<A27>+1 -> 25 | B28: --enable-opm-rst-file | C28: A Boolean value set to true or false to write OPM specific data sets to the commercial simulators restart file to enable restart of an OPM Flow runs (true) by OPM Flow, or not to write the data (false). | D28: false
A29: ooow:<A28>+1 -> 26 | B29: --enable-storage-cache | C29: A Boolean value set to true or false that turns on (true) or off (false) storing previous storage terms and avoid re-calculating them. | D29: true
A30: ooow:<A29>+1 -> 27 | B30: --enable-terminal-output | C30: A Boolean value set to true or false that turns on (true) or off (false) high-level information about the simulation's progress to the terminal | D30: true
A31: ooow:<A30>+1 -> 28 | B31: --enable-tracer-model | C31: A Boolean value set to true or false that turns on (true) or off (false) transport tracer calculations for when tracers have been declared in the input deck. Experimental - use with caution. | D31: false
A32: ooow:<A31>+1 -> 29 | B32: --enable-tuning | C32: A Boolean value set to true or false that instructs OPM Flow to read the time stepping parameters from the Error: Reference source not foundkeyword in the input deck, if set to true. Note that only the first record of the TUNING keyword is processed. | D32: false
A33: ooow:<A32>+1 -> 30 | B33: --enable-vtk-output | C33: A Boolean value set to true or false that turns on (true) or off (false) a global switch for writing VTK files. | D33: false
A34: ooow:<A33>+1 -> 31 | B34: --enable-well-operability-check | C34: A Boolean value set to true or false that enables (true) checking of a well’s operating status, or disables (false) the checking. | D34: true
A35: ooow:<A34>+1 -> 32 | B35: --enable-write-all-solutions | C35: A Boolean value set to true or false that turns on (true) or off (false) the writing of all solutions to disk instead of only the ones for the report steps. | D35: false
A36: faul | B36: OPM Flow Specific Command Line Parameters
A37: ooow:<A35>+1 -> 33 | B37: --flow-linear-solver-verbosity | C37: A positive integer value that defines the output from linear solver: | D37: 0
A38: ooow:<A37>+1 -> 34 | B38: --flow-newton-max-iterations | C38: A positive integer that defines the maximum number of Newton iterations per time step used by the simulator. | D38: 20
A39: ooow:<A38>+1 -> 35 | B39: --flow-newton-min-iterations | C39: A real positive value that sets the minimum number of Newton iterations per time step used by the simulator. | D39: 1
A40: ooow:<A39> -> 35 | B40: General eWoms/ebos Command Line Parameters
A41: ooow:<A40>+1 -> 36 | B41: --force-disable-fluid-in-place-output | C41: A Boolean value set to true or false that instructs OPM Flow to not to print the Fluid In-Place report after each report time step (true) or not (false). | D41: false
A42: ooow:<A41>+1 -> 37 | B42: --full-time-step-initially | C42: A Boolean value set to true or false that instructs OPM Flow to always attempt to finish a report step using a single time step (true) or not (false). | D42: false
A43: ooow:<A42>+1 -> 38 | B43: --gpu-mode | C43: A character string that defines which GPU option to use for the linear solver cusparseSolver or openclSolver. The parameter should be set to: | D43: “none”
A44: ooow:<A43>+1 -> 39 | B44: --ignore-keywords | C44: A character string that defines a list of keywords which should be ignored by OPM Flow. The keyword string should be enclosed in quotes and each keyword separated by a colon, that is ':' . | D44: “”
A45: ooow:<A44>+1 -> 40 | B45: --ilu-fillin-level | C45: A positive integer value that sets the fill in level for the ILU preconditioner. | D45: 0
A46: ooow:<A45>+1 -> 41 | B46: --ilu-redblack | C46: A Boolean value set to true or false that instructs OPM Flow to use red-black partitioning for the ILU preconditioner. (true) or not (false). | D46: false
A47: ooow:<A46>+1 -> 42 | B47: --ilu-relaxation | C47: A real positive double precision value that sets the relaxation factor of the linear solver's ILU preconditioner | D47: 0.9
A48: ooow:<A47>+1 -> 43 | B48: --ilu-reorder-spheres | C48: A Boolean value set to true or false that specifies OPM Flow to reorder the entries of the matrix in the red-black ILU preconditioner in spheres starting at an edge (true) or not (false) If false the original ordering is preserved in each color. Otherwise try to ensure D4 ordering (in a 2D structured grid, the diagonal elements are consecutive). | D48: false
A49: ooow:<A48>+1 -> 44 | B49: --initial-time-step-in-days | C49: A real double precision value that sets the size of initial time step in days. | D49: 1.0
A50: ooow:<A49>+1 -> 45 | B50: --linear-solver-ignore-convergence-failure | C50: A Boolean value set to true or false that if set to true convergences failures in the linear solver are ignored. This option should be used with care, as the results may be unreliable. | D50: false
A51: ooow:<A50>+1 -> 46 | B51: --linear-solver-max-iter | C51: A positive integer value that defines the maximum number of linear iterations. | D51: 200
A52: ooow:<A51>+1 -> 47 | B52: --linear-solver-reduction | C52: A real positive double precision value that sets the tolerance for the linear solver. The linear solver convergences when the residual is reduced sufficiently. | D52: 0.01
A53: ooow:<A52>+1 -> 48 | B53: --linear-solver-require-full-sparsity-pattern | C53: A Boolean value set to true or false that if set to true the simulator will produce the full sparsity pattern for the linear solver. | D53: false
A54: ooow:<A53>+1 -> 49 | B54: --linear-solver-restart | C54: A positive integer value that sets the number of iterations after which GMRES is restarted. | D54: 40
A55: ooow:<A54>+1 -> 50 | B55: --linear-solver | C55: A defined quoted character string that sets the configuration of the solver, valid values are: The default is "ilu0". Alternatively one can enter a character string enclosed in quotes that defines the filename of a JSON configuration file for the flexible linear solver system. In this case the file extension should be ‘.json’. | D55: “ilu0”
A56: ooow:<A55>+1 -> 51 | B56: --matrix-add-well-contributions | C56: A Boolean value set to true or false that if set to true explicitly specifies the influences of wells between cells in the Jacobian and preconditioner matrices. | D56: false
A57: ooow:<A56>+1 -> 52 | B57: --max-inner-iter-ms-wells | C57: A positive integer value that defines the maximum number of inner iterations for multi-segment wells. | D57: 100
A58: ooow:<A57>+1 -> 53 | B58: --max-inner-iter-wells | C58: A positive integer value that defines the maximum number of inner iterations for standard wells. | D58: 50
A59: ooow:<A58>+1 -> 54 | B59: --max-pressure-change-ms-wells | C59: A real positive value that defines the maximum relative pressure change for a single iteration of the multi-segment well model. | D59: 1.0 x 106
A60: ooow:<A59>+1 -> 55 | B60: --max-residual-allowed | C60: A real positive value that sets the absolute maximum tolerance for residuals without cutting the time step size. | D60: 1.0 x 107
A61: ooow:<A60>+1 -> 56 | B61: --max-single-precision-days | C61: A real positive value that set the maximum time step size where single precision floating point arithmetic can be used solving for the linear systems of equations. | D61: 20.0
A62: ooow:<A61>+1 -> 57 | B62: --max-strict-iter | C62: A positive integer that sets the maximum number of Newton iterations before relaxed tolerances are used for the CNV convergence criterion. | D62: 0
A63: ooow:<A62>+1 -> 58 | B63: --max-welleq-iter | C63: A positive integer that defines the maximum number of iterations to determine the solution to the well equations. | D63: 30
A64: ooow:<A63>+1 -> 59 | B64: --milu-variant | C64: A defined character string that specifies which variant of the modified-ILU preconditioner ought to be used. Possible variants are: The default is “ILU” | D64: “ILU”
A65: ooow:<A64>+1 -> 60 | B65: --min-time-step-based-on-newton-iterations | C65: The minimum time step size (in days for field and metric unit and hours for lab unit) can be reduced to based on newton iteration counts. | D65: 0
A66: ooow:<A65>+1 -> 61 | B66: --min-time-step-before-shutting-problematic-wells-in-days | C66: A real positive value that sets the minimum time step size in days for which problematic wells are not shut. Time steps below this value will result in problematic wells being shut-in by the simulator. | D66: 0.01
A67: ooow:<A66>+1 -> 62 | B67: --newton-max-relax | C67: A real positive value that sets the maximum relaxation factor of a Newton iteration used by the simulator. | D67: 0.5
A68: ooow:<A67>+1 -> 63 | B68: --newton-relaxation-type | C68: A character string that defines the type of relaxation used in Newton’s method, default is dampen. | D68: “dampen”
A69: ooow:<A68>+1 -> 64 | B69: --opencl-ilu-reorder | C69: A defined character string that selects the reordering strategy for ILU for openclSolver and should be set to: Note that “level_scheduling” behaves like Dune and cusparse, whereas “graph_coloring” is more aggressive and is likely to be faster, but is random-based and generally increases the number of linear solves and linear iterations significantly. | D69: "graph_coloring"
A70: ooow:<A69>+1 -> 65 | B70: --opencl-platform-id | C70: A positive integer that specifies the platform identification (“ID”) for the openSolver. Use the “clinfo” command to determine valid IDs. | D70: 0
A71: ooow:<A70>+1 -> 66 | B71: --output-dir | C71: A character string that defines the directory to which OPM Flow is to write the commercial simulator compatible output files (restart, summary files etc.). The default value results in the files be written to the same directory as the input file. | D71: “”
A72: ooow:<A71>+1 -> 67 | B72: --output-interval | C72: A positive integer that specifies the number of report steps between two consecutive writes of restart data. | D72: 1
A73: ooow:<A72>+1 -> 68 | B73: --output-mode | C73: A defined character string that defines the output to the *.PRT and *.DBG files: For example to just output logging information use: --output-mode=”log” or --output-mode=false | D73: “all”
A74: ooow:<A73>+1 -> 69 | B74: --owner-cells-first | C74: A Boolean value set to true or false that determines if the cells owned by a rank should be ordered before ghost/overlapping the cells (true), or not (false). | D74: true
A75: ooow:<A74>+1 -> 70 | B75: --parameter-file | C75: A character string that defines the name of a parameter file which contains the simulator’s set of run-time parameters, as listed in this table. | D75: “”
A76: ooow:<A75>+1 -> 71 | B76: --pri-var-oscilation-threshold | C76: A real positive value that defines the threshold value for the primary variable switching conditions after its meaning has switched to hinder oscillations. | D76: 1.0 x 10-5
A77: ooow:<A76>+1 -> 72 | B77: --print-parameters | C77: A positive integer value that request that the run time parameters be printed at the start of the run: | D77: 2
A78: ooow:<A77>+1 -> 73 | B78: --print-properties | C78: A positive integer value that request that the compile time parameters be printed at the start of the run: | D78: 2
A79: ooow:<A78>+1 -> 74 | B79: --project-saturations | C79: A Boolean value set to true or false that determines if all the fluid saturations should be scaled to ensure the values are in the interval (0, 1), including runs that use solvents (true), or not (false). | D79: false
A80: ooow:<A79>+1 -> 75 | B80: --regularization-factor-msw | C80: A real positive value that defines the “regularization factor” for multi-segment wells. | D80: 1.0
A81: ooow:<A80>+1 -> 76 | B81: --relaxed-flow-tol-inner-iter-msw | C81: A real positive value that sets the relaxation tolerance for the inner iteration for the multi-segment well flow solution | D81: 1.0
A82: ooow:<A81>+1 -> 77 | B82: --relaxed-max-pv-fraction | C82: A real positive value that defines The fraction of the pore volume of the reservoir where the volumetric error (CNV) may be violated during strict Newton iterations. | D82: 0.03
A83: ooow:<A82>+1 -> 78 | B83: --relaxed-pressure-tol-inner-iter-msw | C83: A real positive value that sets the relaxation tolerance for the inner iteration for the multi-segment well pressure solution. | D83: 50000
A84: ooow:<A83>+1 -> 79 | B84: --scale-linear-system | C84: A Boolean value set to true or false that switches on (true) or off (false) the scaling of linear system of equations according to the equation scale and primary variable types. | D84: false
A85: ooow:<A84>+1 -> 80 | B85: --sched-restart | C85: A Boolean value that determines for a restart run if the case should initialize wells and groups from the historical SCHEDULE section (true), or from the well and group data on the restart file (false). Note that the commercial simulator always uses data from the restart file (false). | D85: true
A86: ooow:<A85>+1 -> 81 | B86: --serial-partitioning | C86: A Boolean value that determines if partitioning for parallel runs on a single process (true), or not (false). | D86: false
A87: ooow:<A86>+1 -> 82 | B87: --solve-welleq-initially | C87: A Boolean value set to true or false that switches on (true) or off (false) the solving of the well equations as a pre-processing step. Note that the well equations are always added to the full system and solved until converged. | D87: true
A88: ooow:<A87>+1 -> 83 | B88: --solver-growth-factor | C88: A real positive value that specifies the allowed value a time step can be increased by, subject to the maximum allowable time step size set by the --flow-solver-max-time-step-in-days parameter. For example, if the current time step has converged at 10 days and --flow-solver-growth-factor is set to the default value, then the next time step will be 2.0 * 10 days, that is at 20 days. | D88: 2.0
A89: ooow:<A88>+1 -> 84 | B89: --solver-max-growth | C89: A real positive value that specifies the maximum allowed value a time step can be increased by after a report time step. subject to the maximum allowable time step size set by the --flow-solver-max-time-step-in-days parameter. | D89: 3.0
A90: ooow:<A89>+1 -> 85 | B90: --solver-max-restarts | C90: A positive integer that defines the number of allowed consecutive restarts (or time step chops) before the simulation is terminated. | D90: 10
A91: ooow:<A90>+1 -> 86 | B91: --solver-max-time-step-in-days | C91: A real positive double precision value that specifies the maximum allowed time step size in days. | D91: 365
A92: ooow:<A91>+1 -> 87 | B92: --solver-min-time-step | C92: A real positive double precision value that specifies the minimum size of a time step in seconds. If a step cannot converge without getting cut below this step size the simulator will stop. | D92: 1.0 x 10-12
A93: ooow:<A92>+1 -> 88 | B93: --solver-restart-factor | C93: A real positive double precision value that sets the time step chop factor of the time step after a convergence failure. For example, if the current non-convergent time step is 30 days and --flow-solver-restart-factor is set to the default value, then the time step will be repeated using 0.33 * 30 days as the time step, that is 9.9 days. | D93: 0.33
A94: ooow:<A93>+1 -> 89 | B94: --solver-verbosity | C94: A positive integer that specifies the "chattiness" of the non-linear solver. | D94: 1
A95: ooow:<A94>+1 -> 90 | B95: --strict-inner-iter-ms-wells | C95: A positive integer that specifies the number of inner iterations for multi-segment wells with strict tolerance. | D95: 40
A96: ooow:<A95>+1 -> 91 | B96: --threads-per-process | C96: A positive integer value that stipulates the maximum number of threads to be instantiated per process ('-1' means 'automatic'). | D96: -1
A97: ooow:<A96>+1 -> 92 | B97: --time-step-after-event-in-days | C97: A real double precision value that sets maximum allowed time step after an event; for example, when a well is open or closed etc. The default value of -1 means that events to do effect the time stepping. | D97: -1
A98: ooow:<A97>+1 -> 93 | B98: --time-step-control | C98: A defined character string that defines the time stepping control algorithm and is set to one of the following: | D98: “pid+newtoniteration”
A99: ooow:<A98>+1 -> 94 | B99: --time-step-control-decay-damping-factor | C99: A real positive value that specifies the decay rate a time step can be decreased by after the number target iterations has been exceeded | D99: 1.0
A100: ooow:<A99>+1 -> 95 | B100: --time-step-control-decay-rate | C100: A real positive value that specifies the decay rate a time step size can be decreased by after the number of target iterations has been exceeded | D100: 0.75
A101: ooow:<A100>+1 -> 96 | B101: --time-step-control-file-name | C101: A character string enclosed in quotes that specifies a filename where time steps are specified. The default is the character string timesteps For instance time steps can be generated by the ecl_summary application in libecl as per the following UNIX command line: path_to_libecl_applications/ecl_summary DECK TIME > filename Where: DECK is the name of the data deck you want to get the time steps from, TIME tells the application to return the timing for the run, and "filename" is the name of the file the times are piped to. | D101: “timesteps”
A102: ooow:<A101>+1 -> 97 | B102: --time-step-control-growth-damping-factor | C102: A real positive value that specifies the growth rate of the time step increase when the number of target iterations are undercut. | D102: 3.2
A103: ooow:<A102>+1 -> 98 | B103: --time-step-control-growth-rate | C103: A real positive value that specifies the growth rate of the time step size when the number of target iterations are undercut. | D103: 1.25
A104: ooow:<A103>+1 -> 99 | B104: --time-step-control-target-iterations | C104: A positive integer that defines the number of linear iterations which the time step control scheme should aim for (if applicable). | D104: 30
A105: ooow:<A104>+1 -> 100 | B105: --time-step-control-target-newton-iterations | C105: A positive integer that specifies the number of Newton iterations which the time step control scheme should aim for (if applicable). | D105: 8
A106: ooow:<A105>+1 -> 101 | B106: --time-step-control-tolerance | C106: A real double precision value that sets the tolerance for PID (only used with the pid and pid+ options defined by the --time-step-control option). | D106: 0.1
A107: ooow:<A106>+1 -> 102 | B107: --time-step-verbosity | C107: A positive integer that specifies the "chattiness" during the time integration. | D107: 1
A108: ooow:<A107>+1 -> 103 | B108: --tolerance-cnv | C108: A real positive double precision value that specifies the maximum non-linear tolerance error. This is the local convergence tolerance (maximum of local saturation errors). | D108: 0.01
A109: ooow:<A108>+1 -> 104 | B109: --tolerance-cnv-relaxed | C109: A real positive value that defines the relaxed local convergence tolerance that applies for iterations after the iterations with the strict tolerance. | D109: 1.0
A110: ooow:<A109>+1 -> 105 | B110: --tolerance-mb | C110: A real positive double precision value that sets the maximum mass balance error, that is the tolerated mass balance error relative to total mass present. | D110: 1.0 x 10-6
A111: ooow:<A110>+1 -> 106 | B111: --tolerance-pressure-ms-wells | C111: A real positive double precision value that specifies the tolerance for the pressure equations for multi-segment wells. | D111: 1000
A112: ooow:<A111>+1 -> 107 | B112: --tolerance-well-control | C112: A real positive double precision value that sets the maximum tolerance for the well control equations. | D112: 1.0 x 10-7
A113: ooow:<A112>+1 -> 108 | B113: --tolerance-wells | C113: A real positive double precision value that defines the maximum non-linear error for the well equations. | D113: 1.0 x 10-4
A114: ooow:<A113>+1 -> 109 | B114: -update-equations-scaling | C114: A Boolean value that switches on (true) or off (false) the updating of the scaling factors for mass balance equations during the simulation. | D114: false
A115: ooow:<A114>+1 -> 110 | B115: --use-gmres | C115: A Boolean value that when set to true OPM Flow will use Generalized Minimal Residual (“GMRES”) solver instead of Biconjugate Gradient Stabilized (“BiCGSTAB”) as the linear solver within the Newton iterations. | D115: false
A116: ooow:<A115>+1 -> 111 | B116: --use-inner-iterations-ms-wells | C116: A Boolean value that when set to true the simulator will use nested iterations for multi-segment wells. | D116: true
A117: ooow:<A116>+1 -> 112 | B117: --use-inner-iterations-wells | C117: A Boolean value that when set to true the simulator will use nested iterations for standard wells. | D117: false
A118: ooow:<A117>+1 -> 113 | B118: --use-multisegment-well | C118: A Boolean value that when set to true the simulator will use the well model for multi-segment wells instead of the one for single-segment wells. | D118: true
A119: ooow:<A118>+1 -> 114 | B119: --use-update-stabilization | C119: A Boolean value set to true or false that switches on (true) or off (false) the stabilized Newton option. This option may improve convergence for some cases. | D119: true
A120: ooow:<A119>+1 -> 115 | B120: --vtk-write-diffusion-coefficients | C120: A Boolean value that switches on (true) or off (false) the output of the molecular diffusion coefficients to the VTK48 Virtualization ToolKit (“VTK”) files used to visualize the 3D results from the model using ParaView, an open-source, multi-platform general purpose data analysis and visualization application (https://www.paraview.org/overview/). For the commercial simulator’s compatible output files OPM’s ResInsight 3D visualization package can be used instead and is specifically tailored for OPM Flow and the commercial simulator. output files. | D120: false
A121: ooow:<A120>+1 -> 116 | B121: --vtk-write-effective-diffusion-coefficients | C121: A Boolean value that switches on (true) or off (false) the output of the effective molecular diffusion coefficients for the medium to the VTK output files. | D121: false
A122: ooow:<A121>+1 -> 117 | B122: --vtk-write-tortuosities | C122: A Boolean value that switches on (true) or off (false) the output of the tortuosity for each phase to the VTK output files. | D122: false
A123: ooow:<A122>+1 -> 118 | B123: --zoltan-imbalance-tol | C123: A real positive that defines the tolerable imbalance of the load balancing provided by Zoltan package. | D123: 1.1
A124: Notes: flow --help instead use: flow --help-all to get a list of supported command line Parameters. The –enable-vtk-output option above, if set to “true” will write out the data as stipulated by the compile options. One may need to compile the source code to obtain the desired output.

Sheet: Table2035
A1: OPM Flow 2020-10 Command Line Options
A2: No. | B2: Variable Name | C2: Description | D2: Default
B3: General eWoms/ebos Command Line Parameters
A4: 1 | B4: -h or --help | C4: A character string that causes OPM Flow to print a help message that gives a brief description of the available command line parameters. | D4: N/A
A5: ooow:<A4>+1 -> 2 | B5: --bda-device-id | C5: Choose device ID for cusparseSolver or openclSolver, use 'nvidia-smi' or 'clinfo' commands to determine valid IDs. | D5: 0
A6: ooow:<A5> + 1 -> 3 | B6: --continue-on-convergence-error | C6: A Boolean value set to true or false that that instructs the simulator to continue (true) with a non-converged solution instead of giving up (false) if it encounter a time step size smaller than the minimum time step size. | D6: false
A7: ooow:<A6>+1 -> 4 | B7: --cpr-max-ell-iter | C7: A positive integer that sets the maximum number of Iterations for the elliptic pressure part of the Constrained Pressure Residual (“CPR”) solver. | D7: 20
A8: ooow:<A7>+1 -> 5 | B8: --cpr-reuse-setup | C8: A positive integer that defines if the CPR solver should re-use the Amg setup. Valid options are: | D8: 0
A9: ooow:<A8>+1 -> 6 | B9: --dbph-max-rel | C9: A real positive value that sets maximum relative change of the bottom-hole pressure in a single iteration | D9: 1.0
A10: ooow:<A9>+1 -> 7 | B10: --dp-max-rel | C10: A real positive double precision value that sets the maximum allowed relative change of pressure per iteration. | D10: 0.3
A11: ooow:<A10>+1 -> 8 | B11: --ds-max | C11: A real positive double precision value that sets the maximum allowed change in saturation per iteration. | D11: 0.2
A12: ooow:<A11>+1 -> 9 | B12: --dwell-fraction-max | C12: A real positive double precision value that sets the maximum allowed change in well’s volume fraction per iteration. | D12: 0.2
A13: ooow:<A12>+1 -> 10 | B13: --ecl-deck-file-name | C13: A character string that defines the name of the OPM Flow input file which contains the simulator’s ECLIPSE formatted input deck to be simulated. | D13: “”
A14: ooow:<A13>+1 -> 11 | B14: --ecl-enable-drift-compensation | C14: A Boolean value set to true or false that enables (true) or disables (false) partial compensation of systematic mass losses via the source term of the next time step. | D14: false
A15: ooow:<A14>+1 -> 12 | B15: --ecl-output-double-precision | C15: A Boolean value set to true or false that switches on (true) or off (false) double precision in restart files. Useful for 'perfect' restarts. | D15: false
A16: ooow:<A15>+1 -> 13 | B16: --ecl-output-interval | C16: An integer value defining the number of report steps that ought to be skipped between two writes of restart files results. | D16: -1
A17: ooow:<A16>+1 -> 14 | B17: --ecl-strict-parsing | C17: A Boolean value set to true or false that switches on (true) or off (false) strict parsing mode for parsing - all errors are collected before the application exists. Useful for debugging initial runs. | D17: false
A18: ooow:<A17>+1 -> 15 | B18: --edge-weights-method | C18: A defined positive integer value that defines the edge-weighing strategy: | D18: 1
A19: ooow:<A18>+1 -> 16 | B19: --enable-adaptive-time-stepping | C19: A Boolean value set to true or false that turns on (true) or off (false) adaptive time stepping. If set to false the report time steps provided by the input deck are used. | D19: true
A20: ooow:<A19>+1 -> 17 | B20: --enable-async-ecl-output | C20: A Boolean value set to true or false that sets the output mode to be asynchronously (true), letting the simulator continue computing the next time step while writing results to restart and summary files in the commercial simulators format. | D20: true
A21: ooow:<A20>+1 -> 18 | B21: --enable-async-vtk-output | C21: A Boolean value set to true or false that sets the output mode to be asynchronously (true), letting the simulator continue computing the next time step while writing results to the VTK output files. | D21: true
A22: ooow:<A21>+1 -> 19 | B22: --enable-dry-run | C22: A Boolean value set to true or false that specifies if the simulation should actually run, (true) or just check the input deck (false). The option is equivalent to activating the NOSIM keyword in the RUNSPEC section of the input deck (see section Error: Reference source not foundError: Reference source not found). The default value of “auto’ will use whatever is stipulated in the input deck via the NOSIM keyword. | D22: “auto”
A23: ooow:<A22>+1 -> 20 | B23: --enable-ecl-output | C23: A Boolean value set to true or false that specifies if the binary output files (restart, summary files, etc.) should be written in the commercial simulator’s format (true), or OPM Flow’s format (false). | D23: true
A24: ooow:<A23>+1 -> 21 | B24: --enable-logging-fallout-warning | C24: A Boolean value set to true or false that sets the developer option to see whether logging was on non-root processors (true). If set to true output will be appended to the *.DBG or *.PRT files. | D24: false
A25: ooow:<A24>+1 -> 22 | B25: --enable-opm-rst-file | C25: A Boolean value set to true or false to write OPM specific data sets to the commercial simulators restart file to enable restart of an OPM Flow runs (true), or not to write the data (false). | D25: true
A26: ooow:<A25>+1 -> 23 | B26: --enable-storage-cache | C26: A Boolean value set to true or false that turns on (true) or off (false) storing previous storage terms and avoid re-calculating them. | D26: true
A27: ooow:<A26>+1 -> 24 | B27: --enable-terminal-output | C27: A Boolean value set to true or false that turns on (true) or off (false) high-level information about the simulation's progress to the terminal | D27: true
A28: ooow:<A27>+1 -> 25 | B28: --enable-tracer-model | C28: A Boolean value set to true or false that turns on (true) or off (false) transport tracer calculations for when tracers have been declared in the input deck. Experimental - use with caution. | D28: false
A29: ooow:<A28>+1 -> 26 | B29: --enable-tuning | C29: A Boolean value set to true or false that instructs OPM Flow to read the time stepping parameters from the Error: Reference source not foundkeyword in the input deck, if set to true. Note that only the first record of the TUNING keyword is processed. | D29: false
A30: ooow:<A29>+1 -> 27 | B30: --enable-vtk-output | C30: A Boolean value set to true or false that turns on (true) or off (false) a global switch for writing VTK files. | D30: false
A31: ooow:<A30>+1 -> 28 | B31: --enable-well-operability-check | C31: A Boolean value set to true or false that enables (true) checking of a well’s operating status, or disables (false) the checking. | D31: true
A32: ooow:<A31>+1 -> 29 | B32: --enable-write-all-solutions | C32: A Boolean value set to true or false that turns on (true) or off (false) the writing of all solutions to disk instead of only the ones for the report steps. | D32: false
A33: faul | B33: OPM Flow Specific Command Line Parameters
A34: ooow:<A32>+1 -> 30 | B34: --flow-linear-solver-verbosity | C34: A positive integer value that defines the output from linear solver: | D34: 0
A35: ooow:<A34>+1 -> 31 | B35: --flow-newton-max-iterations | C35: A positive integer that defines the maximum number of Newton iterations per time step used by the simulator. | D35: 20
A36: ooow:<A35>+1 -> 32 | B36: --flow-newton-min-iterations | C36: A real positive value that sets the minimum number of Newton iterations per time step used by the simulator. | D36: 1
A37: ooow:<A36> -> 32 | B37: General eWoms/ebos Command Line Parameters
A38: ooow:<A37>+1 -> 33 | B38: --force-disable-fluid-in-place-output | C38: A Boolean value set to true or false that instructs OPM Flow to not to print the Fluid In-Place report after each report time step (true) or not (false). | D38: false
A39: ooow:<A38>+1 -> 34 | B39: --full-time-step-initially | C39: A Boolean value set to true or false that instructs OPM Flow to always attempt to finish a report step using a single time step (true) or not (false). | D39: false
A40: ooow:<A39>+1 -> 35 | B40: --gpu-mode | C40: A character string that defines which GPU option to use for the linear solver cusparseSolver or openclSolver. The parameter should be set to: | D40: “none”
A41: ooow:<A40>+1 -> 36 | B41: --ignore-keywords | C41: A character string that defines a list of keywords which should be ignored by OPM Flow. The keyword string should be enclosed in quotes and each keyword separated by a colon, that is ':' . | D41: “”
A42: ooow:<A41>+1 -> 37 | B42: --ilu-fillin-level | C42: A positive integer value that sets the fill in level for the ILU preconditioner. | D42: 0
A43: ooow:<A42>+1 -> 38 | B43: --ilu-redblack | C43: A Boolean value set to true or false that instructs OPM Flow to use red-black partitioning for the ILU preconditioner. (true) or not (false). | D43: false
A44: ooow:<A43>+1 -> 39 | B44: --ilu-relaxation | C44: A real positive double precision value that sets the relaxation factor of the linear solver's ILU preconditioner | D44: 0.9
A45: ooow:<A44>+1 -> 40 | B45: --ilu-reorder-spheres | C45: A Boolean value set to true or false specifies OPM Flow to reorder the entries of the matrix in the red-black ILU preconditioner in spheres starting at an edge (true) or not (false) If false the original ordering is preserved in each color. Otherwise try to ensure D4 ordering (in a 2D structured grid, the diagonal elements are consecutive). | D45: false
A46: ooow:<A45>+1 -> 41 | B46: --initial-time-step-in-days | C46: A real double precision value that sets the size of initial time step in days. | D46: 1.0
A47: ooow:<A46>+1 -> 42 | B47: --linear-solver-ignore-convergence-failure | C47: A Boolean value set to true or false that if set to true convergences failures in the linear solver are ignored. This option should be used with care, as the results may be unreliable. | D47: false
A48: ooow:<A47>+1 -> 43 | B48: --linear-solver-max-iter | C48: A positive integer value that defines the maximum number of linear iterations. | D48: 200
A49: ooow:<A48>+1 -> 44 | B49: --linear-solver-reduction | C49: A real positive double precision value that sets the tolerance for the linear solver. The linear solver convergences when the residual is reduced sufficiently. | D49: 0.01
A50: ooow:<A49>+1 -> 45 | B50: --linear-solver-require-full-sparsity-pattern | C50: A Boolean value set to true or false that if set to true the simulator will produce the full sparsity pattern for the linear solver. | D50: false
A51: ooow:<A50>+1 -> 46 | B51: --linear-solver-restart | C51: A positive integer value that sets the number of iterations after which GMRES is restarted. | D51: 40
A52: ooow:<A51>+1 -> 47 | B52: --linear-solver | C52: A defined quoted character string that sets the configuration of the solver, valid values are: The default is "ilu0". Alternatively one can enter a character string enclosed in quotes that defines the filename of a JSON configuration file for the flexible linear solver system. In this case the file extension should be ‘.json’. | D52: “ilu0”
A53: ooow:<A52>+1 -> 48 | B53: --matrix-add-well-contributions | C53: A Boolean value set to true or false that if set to true explicitly specifies the influences of wells between cells in the Jacobian and preconditioner matrices. | D53: false
A54: ooow:<A53>+1 -> 49 | B54: --max-inner-iter-ms-wells | C54: A positive integer value that defines the maximum number of inner iterations for multi-segment wells. | D54: 100
A55: ooow:<A54>+1 -> 50 | B55: --max-inner-iter-wells | C55: A positive integer value that defines the maximum number of inner iterations for standard wells. | D55: 50
A56: ooow:<A55>+1 -> 51 | B56: --max-pressure-change-ms-wells | C56: A real positive value that defines the maximum relative pressure change for a single iteration of the multi-segment well model. | D56: 1.0 x 106
A57: ooow:<A56>+1 -> 52 | B57: --max-residual-allowed | C57: A real positive value that sets the absolute maximum tolerance for residuals without cutting the time step size. | D57: 1.0 x 107
A58: ooow:<A57>+1 -> 53 | B58: --max-single-precision-days | C58: A real positive value that set the maximum time step size where single precision floating point arithmetic can be used solving for the linear systems of equations. | D58: 20.0
A59: ooow:<A58>+1 -> 54 | B59: --max-strict-iter | C59: A positive integer that sets the maximum number of Newton iterations before relaxed tolerances are used for the CNV convergence criterion. | D59: 0
A60: ooow:<A59>+1 -> 55 | B60: --max-welleq-iter | C60: A positive integer that defines the maximum number of iterations to determine the solution to the well equations. | D60: 30
A61: ooow:<A60>+1 -> 56 | B61: --milu-variant | C61: A defined character string that specifies which variant of the modified-ILU preconditioner ought to be used. Possible variants are: The default is ILU | D61: “ILU”
A62: ooow:<A61>+1 -> 57 | B62: --min-time-step-before-shutting-problematic-wells-in-days | C62: A real positive value that sets the minimum time step size in days for which problematic wells are not shut. Time steps below this value will result in problematic wells being shut-in by the simulator. | D62: 0.001
A63: ooow:<A62>+1 -> 58 | B63: --newton-max-relax | C63: A real positive value that sets the maximum relaxation factor of a Newton iteration used by the simulator. | D63: 0.5
A64: ooow:<A63>+1 -> 59 | B64: --newton-relaxation-type | C64: A character string that defines the type of relaxation used in Newton’s method, default is dampen. | D64: “dampen”
A65: ooow:<A64>+1 -> 60 | B65: --opencl-platform-id | C65: A positive integer that specifies the platform identification (“ID”) for the openSolver. Use the “clinfo” command to determine valid IDs. | D65: 0
A66: ooow:<A65>+1 -> 61 | B66: --output-dir | C66: A character string that defines the directory to which OPM Flow is to write the commercial simulator compatible output files (restart, summary files etc.). The default value results in the files be written to the same directory as the input file. | D66: “”
A67: ooow:<A66>+1 -> 62 | B67: --output-interval | C67: A positive integer that specifies the number of report steps between two consecutive writes of restart data. | D67: 1
A68: ooow:<A67>+1 -> 63 | B68: --output-mode | C68: A character string that defines the output to the *.PRT and *.DBG files: For example to just output logging information use: --output-mode=log or --output-mode=false | D68: “all”
A69: ooow:<A68>+1 -> 64 | B69: --owner-cells-first | C69: A Boolean value set to true or false that determines if the cells owned by a rank should be ordered before ghost/overlapping the cells (true), or not (false). | D69: true
A70: ooow:<A69>+1 -> 65 | B70: --parameter-file | C70: A character string that defines the name of a parameter file which contains the simulator’s set of run-time parameters, as listed in this table. | D70: “”
A71: ooow:<A70>+1 -> 66 | B71: --pri-var-oscilation-threshold | C71: A real positive value that defines the threshold value for the primary variable switching conditions after its meaning has switched to hinder oscillations. | D71: 1 x 10-5
A72: ooow:<A71>+1 -> 67 | B72: --print-parameters | C72: A positive integer value that request that the run time parameters be printed at the start of the run: | D72: 2
A73: ooow:<A72>+1 -> 68 | B73: --print-properties | C73: A positive integer value that request that the compile time parameters be printed at the start of the run: | D73: 2
A74: ooow:<A73>+1 -> 69 | B74: --project-saturations | C74: A Boolean value set to true or false that determines if all the fluid saturations should be scaled to ensure the values are in the interval (0, 1), including runs that use solvents (true), or not (false). | D74: false
A75: ooow:<A74>+1 -> 70 | B75: --regularization-factor-msw | C75: A real positive value that defines the “regularization factor” for multi-segment wells. | D75: 1.0
A76: ooow:<A75>+1 -> 71 | B76: --relaxed-flow-tol-inner-iter-msw | C76: A real positive value that sets the relaxation tolerance for the inner iteration for the multi-segment well flow solution | D76: 1.0
A77: ooow:<A76>+1 -> 72 | B77: --relaxed-max-pv-fraction | C77: A real positive value that defines The fraction of the pore volume of the reservoir where the volumetric error (CNV) may be violated during strict Newton iterations. | D77: 0.03
A78: ooow:<A77>+1 -> 73 | B78: --relaxed-pressure-tol-inner-iter-msw | C78: A real positive value that sets the relaxation tolerance for the inner iteration for the multi-segment well pressure solution. | D78: 50000
A79: ooow:<A78>+1 -> 74 | B79: --scale-linear-system | C79: A Boolean value set to true or false that switches on (true) or off (false) the scaling of linear system of equations according to the equation scale and primary variable types. | D79: false
A80: ooow:<A79>+1 -> 75 | B80: --sched-restart | C80: A Boolean value that determines for a restart run if the case should initialize wells and groups from the historical SCHEDULE section (true), or from the well and group data on the restart file (false). Note that the commercial simulator always uses data from the restart file (false). | D80: true
A81: ooow:<A80>+1 -> 76 | B81: --serial-partitioning | C81: A Boolean value that determines if partitioning for parallel runs on a single process (true), or not (false). | D81: false
A82: ooow:<A81>+1 -> 77 | B82: --solve-welleq-initially | C82: A Boolean value set to true or false that switches on (true) or off (false) the solving of the well equations as a pre-processing step. Note that the well equations are always added to the full system and solved until converged. | D82: true
A83: ooow:<A82>+1 -> 78 | B83: --solver-growth-factor | C83: A real positive value that specifies the allowed value a time step can be increased by, subject to the maximum allowable time step size set by the --flow-solver-max-time-step-in-days parameter. For example, if the current time step has converged at 10 days and --flow-solver-growth-factor is set to the default value, then the next time step will be 2.0 * 10 days, that is at 20 days. | D83: 2.0
A84: ooow:<A83>+1 -> 79 | B84: --solver-max-growth | C84: A real positive value that specifies the maximum allowed value a time step can be increased by after a report time step. subject to the maximum allowable time step size set by the --flow-solver-max-time-step-in-days parameter. | D84: 3.0
A85: ooow:<A84>+1 -> 80 | B85: --solver-max-restarts | C85: A positive integer that defines the number of allowed consecutive restarts (or time step chops) before the simulation is terminated. | D85: 10
A86: ooow:<A85>+1 -> 81 | B86: --solver-max-time-step-in-days | C86: A real positive double precision value that specifies the maximum allowed time step size in days. | D86: 365
A87: ooow:<A86>+1 -> 82 | B87: --solver-min-time-step | C87: A real positive double precision value that specifies the minimum size of a time step in seconds. If a step cannot converge without getting cut below this step size the simulator will stop. | D87: 0.0
A88: ooow:<A87>+1 -> 83 | B88: --solver-restart-factor | C88: A real positive double precision value that sets the time step chop factor of the time step after a convergence failure. For example, if the current non-convergent time step is 30 days and --flow-solver-restart-factor is set to the default value, then the time step will be repeated using 0.33 * 30 days as the time step, that is 9.9 days. | D88: 0.33
A89: ooow:<A88>+1 -> 84 | B89: --solver-verbosity | C89: A positive integer that specifies the "chattiness" of the non-linear solver. | D89: 1
A90: 85 | B90: --strict-inner-iter-ms-wells | C90: A positive integer that specifies the number of inner iterations for multi-segment wells with strict tolerance. | D90: 40
A91: ooow:<A90>+1 -> 86 | B91: --threads-per-process | C91: A positive integer value that stipulates the maximum number of threads to be instantiated per process ('-1' means 'automatic'). | D91: -1
A92: ooow:<A91>+1 -> 87 | B92: --time-step-after-event-in-days | C92: A real double precision value that sets maximum allowed time step after an event; for example, when a well is open or closed etc. The default value of -1 means that events to do effect the time stepping. | D92: -1
A93: ooow:<A92>+1 -> 88 | B93: --time-step-control | C93: A defined character string that defines the time stepping control algorithm and is set to one of the following: | D93: pid
A94: ooow:<A93>+1 -> 89 | B94: --time-step-control-decay-damping-factor | C94: A real positive value that specifies the decay rate a time step can be decreased by after the number target iterations has been exceeded | D94: 1.0
A95: ooow:<A94>+1 -> 90 | B95: --time-step-control-decay-rate | C95: A real positive value that specifies the decay rate a time step size can be decreased by after the number of target iterations has been exceeded | D95: 0.75
A96: ooow:<A95>+1 -> 91 | B96: --time-step-control-file-name | C96: A character string enclosed in quotes that specifies a filename where time steps are specified. The default is the character string timesteps For instance time steps can be generated by the ecl_summary application in libecl as per the following UNIX command line: path_to_libecl_applications/ecl_summary DECK TIME > filename Where: DECK is the name of the data deck you want to get the time steps from, TIME tells the application to return the timing for the run, and "filename" is the name of the file the times are piped to. | D96: “timesteps”
A97: ooow:<A96>+1 -> 92 | B97: --time-step-control-growth-damping-factor | C97: A real positive value that specifies the growth rate of the time step increase when the number of target iterations are undercut. | D97: 0.833
A98: ooow:<A97>+1 -> 93 | B98: --time-step-control-growth-rate | C98: A real positive value that specifies the growth rate of the time step size when the number of target iterations are undercut. | D98: 1.25
A99: ooow:<A98>+1 -> 94 | B99: --time-step-control-target-iterations | C99: A positive integer that defines the number of linear iterations which the time step control scheme should aim for (if applicable). | D99: 30
A100: ooow:<A99>+1 -> 95 | B100: --time-step-control-target-newton-iterations | C100: A positive integer that specifies the number of Newton iterations which the time step control scheme should aim for (if applicable). | D100: 8
A101: ooow:<A100>+1 -> 96 | B101: --time-step-control-tolerance | C101: A real double precision value that sets the tolerance for PID (only used with the pid and pid+ options defined by the --time-step-control option). | D101: 0.1
A102: ooow:<A101>+1 -> 97 | B102: --time-step-verbosity | C102: A positive integer that specifies the "chattiness" during the time integration. | D102: 1
A103: ooow:<A102>+1 -> 98 | B103: --tolerance-cnv | C103: A real positive double precision value that specifies the maximum non-linear tolerance error. This is the local convergence tolerance (maximum of local saturation errors). | D103: 0.01
A104: ooow:<A103>+1 -> 99 | B104: --tolerance-cnv-relaxed | C104: A real positive value that defines the relaxed local convergence tolerance that applies for iterations after the iterations with the strict tolerance. | D104: 1.0
A105: ooow:<A104>+1 -> 100 | B105: --tolerance-mb | C105: A real positive double precision value that sets the maximum mass balance error, that is the tolerated mass balance error relative to total mass present. | D105: 1.0 x 10-6
A106: ooow:<A105>+1 -> 101 | B106: --tolerance-pressure-ms-wells | C106: A real positive double precision value that specifies the tolerance for the pressure equations for multi-segment wells. | D106: 1000
A107: ooow:<A106>+1 -> 102 | B107: --tolerance-well-control | C107: A real positive double precision value that sets the maximum tolerance for the well control equations. | D107: 1.0 x 10-7
A108: ooow:<A107>+1 -> 103 | B108: --tolerance-wells | C108: A real positive double precision value that defines the maximum non-linear error for the well equations. | D108: 1.0 x 10-4
A109: ooow:<A108>+1 -> 104 | B109: -update-equations-scaling | C109: A Boolean value set to true or false that switches on (true) or off (false) the updating of the scaling factors for mass balance equations during the simulation. | D109: false
A110: ooow:<A109>+1 -> 105 | B110: --use-gmres | C110: A Boolean value set to true or false that when set to true OPM Flow will use Generalized Minimal Residual (“GMRES”) solver instead of Biconjugate Gradient Stabilized (“BiCGSTAB”) as the linear solver within the Newton iterations. | D110: false
A111: ooow:<A110>+1 -> 106 | B111: --use-inner-iterations-ms-wells | C111: A Boolean value set to true or false that when set to true the simulator will use nested iterations for multi-segment wells. | D111: true
A112: ooow:<A111>+1 -> 107 | B112: --use-inner-iterations-wells | C112: A Boolean value set to true or false that when set to true the simulator will use nested iterations for standard wells. | D112: false
A113: 108 | B113: --use-multisegment-well | C113: A Boolean value set to true or false that when set to true the simulator will use the well model for multi-segment wells instead of the one for single-segment wells. | D113: false
A114: ooow:<A113>+1 -> 109 | B114: --use-update-stabilization | C114: A Boolean value set to true or false that switches on (true) or off (false) the stabilized Newton option. This option may improve convergence for some cases. | D114: true
A115: ooow:<A114> -> 109 | B115: VTK Graphics Command Line Parameters51 Virtualization ToolKit (“VTK”) files used to visualize the 3D results from the model using ParaView, an open-source, multi-platform general purpose data analysis and visualization application (https://www.paraview.org/overview/). For the commercial simulator’s compatible output files OPM’s ResInsight 3D visualization package can be used instead and is specifically tailored for OPM Flow and the commercial simulator. This set of commands are no longer supported from the command line interface but can be assessed when compiling OPM Flow from source. The –enable-vtk-output option above, if set to “true” will write out the data as stipulated by the compile options.
A116: Notes:

Sheet: Table2036
A1: OPM Flow 2020-04 Command Line Options
A2: No. | B2: Variable Name | C2: Description | D2: Default
B3: General eWoms/ebos Command Line Parameters
A4: 1 | B4: -h or --help | C4: A character string that causes OPM Flow to print a help message that gives a brief description of the available command line parameters. | D4: N/A
A5: ooow:<A4>+1 -> 2 | B5: --continue-on-convergence-error | C5: A Boolean value set to true or false that that instructs the simulator to continue (true) with a non-converged solution instead of giving up (false) if it encounter a time step size smaller than the minimum time step size. | D5: false
A6: ooow:<A5>+1 -> 3 | B6: --cpr-ell-solvetype | C6: A positive integer that defines the solver type of the elliptic pressure solver: | D6: 0
A7: ooow:<A6>+1 -> 4 | B7: --cpr-max-ell-iter | C7: A positive integer that sets the maximum number of Iterations for the elliptic pressure part of the Constrained Pressure Residual (“CPR”) solver. | D7: 20
A8: ooow:<A7>+1 -> 5 | B8: --cpr-reuse-setup | C8: A positive integer that defines if the CPR solver should re-use the Amg setup. | D8: 0
A9: ooow:<A8>+1 -> 6 | B9: --cpr-solver-verbose | C9: A defined positive integer value that defines the output from CPR solver: | D9: 0
A10: ooow:<A9>+1 -> 7 | B10: --cpr-use-drs | C10: A Boolean value set to true or false that switches on (true) or off (false) the use of dynamic row sum weights in the CPR solver. | D10: false
A11: ooow:<A10>+1 -> 8 | B11: --dbph-max-rel | C11: A real positive value that sets maximum relative change of the bottom-hole pressure in a single iteration | D11: 1.0
A12: ooow:<A11>+1 -> 9 | B12: --dp-max-rel | C12: A real positive double precision value that sets the maximum allowed relative change of pressure per iteration. | D12: 0.3
A13: ooow:<A12>+1 -> 10 | B13: --ds-max | C13: A real positive double precision value that sets the maximum allowed change in saturation per iteration. | D13: 0.2
A14: ooow:<A13>+1 -> 11 | B14: --dwell-fraction-max | C14: A real positive double precision value that sets the maximum allowed change in well’s volume fraction per iteration. | D14: 0.2
A15: ooow:<A14>+1 -> 12 | B15: --ecl-deck-file-name | C15: A character string that defines the name of the OPM Flow input file which contains the simulator’s ECLIPSE formatted input deck to be simulated. | D15: “”
A16: 13 | B16: --ecl-enable-drift-compensation | C16: A Boolean value set to true or false that enables (true) or disables (false) partial compensation of systematic mass losses via the source term of the next time step. | D16: false
A17: ooow:<A16>+1 -> 14 | B17: --ecl-output-double-precision | C17: A Boolean value set to true or false that switches on (true) or off (false) double precision in restart files. Useful for 'perfect' restarts. | D17: false
A18: ooow:<A17>+1 -> 15 | B18: --ecl-output-interval | C18: An integer value defining the number of report steps that ought to be skipped between two writes of restart files results. | D18: -1
A19: ooow:<A18>+1 -> 16 | B19: --ecl-strict-parsing | C19: A Boolean value set to true or false that switches on (true) or off (false) strict parsing mode for parsing - all errors are collected before the application exists. Useful for debugging initial runs. | D19: false
A20: ooow:<A19>+1 -> 17 | B20: --edge-weights-method | C20: A defined positive integer value that defines the edge-weighing strategy: | D20: 1
A21: ooow:<A20>+1 -> 18 | B21: --enable-adaptive-time-stepping | C21: A Boolean value set to true or false that turns on (true) or off (false) adaptive time stepping. If set to false the report time steps provided by the input deck are used. | D21: true
A22: ooow:<A21>+1 -> 19 | B22: --enable-async-ecl-output | C22: A Boolean value set to true or false that sets the output mode to be asynchronously (true), letting the simulator continue computing the next time step while writing results to restart and summary files in the commercial simulators format. | D22: true
A23: ooow:<A22>+1 -> 20 | B23: --enable-async-vtk-output | C23: A Boolean value set to true or false that sets the output mode to be asynchronously (true), letting the simulator continue computing the next time step while writing results to the VTK output files. | D23: true
A24: ooow:<A23>+1 -> 21 | B24: --enable-dry-run | C24: A Boolean value set to true or false that specifies if the simulation should actually run, (true) or just check the input deck (false). This option is equivalent to activating the NOSIM keyword in the RUNSPEC section of the input deck (see section Error: Reference source not foundError: Reference source not found). | D24: true
A25: ooow:<A24>+1 -> 22 | B25: --enable-ecl-output | C25: A Boolean value set to true or false that specifies if the binary output files (restart, summary files, etc.) should be written in the commercial simulator’s format (true), or OPM Flow’s format (false). | D25: true
A26: ooow:<A25>+1 -> 23 | B26: --enable-logging-fallout-warning | C26: A Boolean value set to true or false that sets the developer option to see whether logging was on non-root processors (true). If set to true output will be appended to the *.DBG or *.PRT files. | D26: false
A27: ooow:<A26>+1 -> 24 | B27: --enable-opm-rst-file | C27: A Boolean value set to true or false to write OPM specific data sets to the commercial simulators restart file to enable restart of an OPM Flow runs (true), or not to write the data (false). | D27: true
A28: ooow:<A27>+1 -> 25 | B28: --enable-storage-cache | C28: A Boolean value set to true or false that turns on (true) or off (false) storing previous storage terms and avoid re-calculating them. | D28: true
A29: ooow:<A28>+1 -> 26 | B29: --enable-terminal-output | C29: A Boolean value set to true or false that turns on (true) or off (false) high-level information about the simulation's progress to the terminal | D29: true
A30: ooow:<A29>+1 -> 27 | B30: --enable-tracer-mode | C30: A Boolean value set to true or false that turns on (true) or off (false) transport tracer calculations for when tracers have been declared in the input deck. Experimental - use with caution. | D30: false
A31: ooow:<A30>+1 -> 28 | B31: --enable-tuning | C31: A Boolean value set to true or false that instructs OPM Flow to read the time stepping parameters from the Error: Reference source not foundkeyword in the input deck, if set to true. Note that only the first record of the TUNING keyword is processed. | D31: false
A32: ooow:<A31>+1 -> 29 | B32: --enable-vtk-output | C32: A Boolean value set to true or false that turns on (true) or off (false) a global switch for writing VTK files. | D32: false
A33: ooow:<A32>+1 -> 30 | B33: --enable-well-operability-check | C33: A Boolean value set to true or false that enables (true) checking of a well’s operating status, or disables (false) the checking. | D33: true
A34: ooow:<A33>+1 -> 31 | B34: --enable-write-all-solutions | C34: A Boolean value set to true or false that turns on (true) or off (false) the writing of all solutions to disk instead of only the ones for the report steps. | D34: false
A35: ooow:<A34> -> 31 | B35: OPM Flow Specific Command Line Parameters
A36: ooow:<A35>+1 -> 32 | B36: --flow-linear-solver-verbosity | C36: A positive integer value that defines the output from linear solver: | D36: 0
A37: ooow:<A36>+1 -> 33 | B37: --flow-newton-max-iterations | C37: A positive integer that defines the maximum number of Newton iterations per time step used by the simulator. | D37: 20
A38: ooow:<A37>+1 -> 34 | B38: --flow-newton-min-iterations | C38: A real positive value that sets the minimum number of Newton iterations per time step used by the simulator. | D38: 1
A39: ooow:<A38> -> 34 | B39: General eWoms/ebos Command Line Parameters
A40: ooow:<A39>+1 -> 35 | B40: --force-disable-fluid-in-place-output | C40: A Boolean value set to true or false that instructs OPM Flow to not to print the Fluid In-Place report after each report time step (true) or not (false). | D40: false
A41: ooow:<A40>+1 -> 36 | B41: --full-time-step-initially | C41: A Boolean value set to true or false that instructs OPM Flow to always attempt to finish a report step using a single time step (true) or not (false). | D41: false
A42: ooow:<A41>+1 -> 37 | B42: --ignore-keywords | C42: A character string that defines a list of keywords which should be ignored by OPM Flow. The keyword string should be enclosed in quotes and each keyword separated by a colon, that is ':' . | D42: “”
A43: ooow:<A42>+1 -> 38 | B43: --ilu-fillin-level | C43: A positive integer value that sets the fill in level for the ILU preconditioner. | D43: 0
A44: ooow:<A43>+1 -> 39 | B44: --ilu-redblack | C44: A Boolean value set to true or false that instructs OPM Flow to use red-black partitioning for the ILU preconditioner. (true) or not (false). | D44: false
A45: ooow:<A44>+1 -> 40 | B45: --ilu-relaxation | C45: A real positive double precision value that sets the relaxation factor of the linear solver's ILU preconditioner | D45: 0.9
A46: ooow:<A45>+1 -> 41 | B46: --ilu-reorder-spheres | C46: A Boolean value set to true or false specifies OPM Flow to reorder the entries of the matrix in the red-black ILU preconditioner in spheres starting at an edge (true) or not (false) If false the original ordering is preserved in each color. Otherwise try to ensure D4 ordering (in a 2D structured grid, the diagonal elements are consecutive). | D46: false
A47: ooow:<A46>+1 -> 42 | B47: --initial-time-step-in-days | C47: A real double precision value that sets the size of initial time step in days. | D47: 1.0
A48: ooow:<A47>+1 -> 43 | B48: --linear-solver-configuration | C48: A defined quoted character string that sets the configuration of the solver, valid values are: The default is "ilu0". | D48: ilu0
A49: ooow:<A48>+1 -> 44 | B49: --linear-solver-configuration-json-file | C49: A character string enclosed in quotes that defines the filename of a JSON configuration file for the flexible linear solver system. | D49: none
A50: ooow:<A49>+1 -> 45 | B50: --linear-solver-ignore-convergence-failure | C50: A Boolean value set to true or false that if set to true convergences failures in the linear solver are ignored. This option should be used with care, as the results may be unreliable. | D50: false
A51: ooow:<A50>+1 -> 46 | B51: --linear-solver-max-iter | C51: A positive integer value that defines the maximum number of linear iterations. | D51: 200
A52: ooow:<A51>+1 -> 47 | B52: --linear-solver-reduction | C52: A real positive double precision value that sets the tolerance for the linear solver. The linear solver convergences when the residual is reduced sufficiently. | D52: 0.01
A53: ooow:<A52>+1 -> 48 | B53: --linear-solver-require-full-sparsity-pattern | C53: A Boolean value set to true or false that if set to true the simulator will produce the full sparsity pattern for the linear solver. | D53: false
A54: ooow:<A53>+1 -> 49 | B54: --linear-solver-restart | C54: A positive integer value that sets the number of iterations after which GMRES is restarted. | D54: 40
A55: ooow:<A54>+1 -> 50 | B55: --matrix-add-well-contributions | C55: A Boolean value set to true or false that if set to true explicitly specifies the influences of wells between cells in the Jacobian and preconditioner matrices. | D55: false
A56: ooow:<A55>+1 -> 51 | B56: --max-inner-iter-ms-wells | C56: A positive integer value that defines the maximum number of inner iterations for multi-segment wells. | D56: 100
A57: ooow:<A56>+1 -> 52 | B57: --max-pressure-change-ms-wells | C57: A real positive value that defines the maximum relative pressure change for a single iteration of the multi-segment well model. | D57: 1.0 x 106
A58: ooow:<A57>+1 -> 53 | B58: --max-residual-allowed | C58: A real positive value that sets the absolute maximum tolerance for residuals without cutting the time step size. | D58: 1.0 x 107
A59: ooow:<A58>+1 -> 54 | B59: --max-single-precision-days | C59: A real positive value that set the maximum time step size where single precision floating point arithmetic can be used solving for the linear systems of equations. | D59: 20.0
A60: ooow:<A59>+1 -> 55 | B60: --max-strict-iter | C60: A positive integer that sets the maximum number of Newton iterations before relaxed tolerances are used for the CNV convergence criterion. | D60: 8
A61: ooow:<A60>+1 -> 56 | B61: --max-welleq-iter | C61: A positive integer that defines the maximum number of iterations to determine the solution to the well equations. | D61: 30
A62: ooow:<A61>+1 -> 57 | B62: --milu-variant | C62: A defined character string that specifies which variant of the modified-ILU preconditioner ought to be used. Possible variants are: The default is ILU | D62: ILU
A63: ooow:<A62>+1 -> 58 | B63: --min-time-step-before-shutting-problematic-wells-in-days | C63: A real positive value that sets the minimum time step size in days for which problematic wells are not shut. Time steps below this value will result in problematic wells being shut-in by the simulator. | D63: 0.25
A64: ooow:<A63>+1 -> 59 | B64: --newton-max-relax | C64: A real positive value that sets the maximum relaxation factor of a Newton iteration used by the simulator. | D64: 0.5
A65: ooow:<A64>+1 -> 60 | B65: --newton-relaxation-type | C65: A character string that defines the type of relaxation used in Newton’s method, default is dampen. | D65: dampen
A66: ooow:<A65>+1 -> 61 | B66: --output-dir | C66: A character string that defines the directory to which OPM Flow is to write the commercial simulator compatible output files (restart, summary files etc.). The default value results in the files be written to the same directory as the input file. | D66: “”
A67: ooow:<A66>+1 -> 62 | B67: --output-interval | C67: A positive integer that specifies the number of report steps between two consecutive writes of restart data. | D67: 1
A68: ooow:<A67>+1 -> 63 | B68: --output-mode | C68: A character string that defines the output to the *.PRT and *.DBG files: For example to just output logging information use: --output-mode=log or --output-mode=false | D68: all
A69: ooow:<A68>+1 -> 64 | B69: --owner-cells-first | C69: A Boolean value set to true or false that determines if the cells owned by a rank should be ordered before ghost/overlapping the cells (true), or not (false). | D69: true
A70: ooow:<A69>+1 -> 65 | B70: --parameter-file | C70: A character string that defines the name of a parameter file which contains the simulator’s set of run-time parameters, as listed in this table. | D70: “”
A71: ooow:<A70>+1 -> 66 | B71: --pri-var-oscilation-threshold | C71: A real positive value that defines the threshold value for the primary variable switching conditions after its meaning has switched to hinder oscillations. | D71: 1 x 10-5
A72: ooow:<A71>+1 -> 67 | B72: --print-parameters | C72: A positive integer value that request that the run time parameters be printed at the start of the run: | D72: 2
A73: ooow:<A72>+1 -> 68 | B73: --print-properties | C73: A positive integer value that request that the compile time parameters be printed at the start of the run: | D73: 2
A74: ooow:<A73>+1 -> 69 | B74: --scale-linear-system | C74: A Boolean value set to true or false that switches on (true) or off (false) the scaling of linear system of equations according to the equation scale and primary variable types. | D74: false
A75: ooow:<A74>+1 -> 70 | B75: --sched-restart | C75: A Boolean value that determines for a restart run if the case should initialize wells and groups from the historical SCHEDULE section (true), or from the well and group data on the restart file (false). Note that the commercial simulator always uses data from the restart file (false). | D75: true
A76: ooow:<A75>+1 -> 71 | B76: --solve-welleq-initially | C76: A Boolean value set to true or false that switches on (true) or off (false) the solving of the well equations as a pre-processing step. Note that the well equations are always added to the full system and solved until converged. | D76: true
A77: ooow:<A76>+1 -> 72 | B77: --solver-growth-factor | C77: A real positive value that specifies the allowed value a time step can be increased by, subject to the maximum allowable time step size set by the --flow-solver-max-time-step-in-days parameter. For example, if the current time step has converged at 10 days and --flow-solver-growth-factor is set to the default value, then the next time step will be 2.0 * 10 days, that is at 20 days. | D77: 2.0
A78: ooow:<A77>+1 -> 73 | B78: --solver-max-growth | C78: A real positive value that specifies the maximum allowed value a time step can be increased by after a report time step. subject to the maximum allowable time step size set by the --flow-solver-max-time-step-in-days parameter. | D78: 3.0
A79: ooow:<A78>+1 -> 74 | B79: --solver-max-restarts | C79: A positive integer that defines the number of allowed consecutive restarts (or time step chops) before the simulation is terminated. | D79: 10
A80: ooow:<A79>+1 -> 75 | B80: --solver-max-time-step-in-days | C80: A real positive double precision value that specifies the maximum allowed time step size in days. | D80: 365
A81: ooow:<A80>+1 -> 76 | B81: --solver-min-time-step | C81: A real positive double precision value that specifies the minimum size of a time step in seconds. If a step cannot converge without getting cut below this step size the simulator will stop. | D81: 0.0
A82: ooow:<A81>+1 -> 77 | B82: --solver-restart-factor | C82: A real positive double precision value that sets the time step chop factor of the time step after a convergence failure. For example, if the current non-convergent time step is 30 days and --flow-solver-restart-factor is set to the default value, then the time step will be repeated using 0.33 * 30 days as the time step, that is 9.9 days. | D82: 0.33
A83: ooow:<A82>+1 -> 78 | B83: --solver-verbosity | C83: A positive integer that specifies the "chattiness" of the non-linear solver. | D83: 1
A84: ooow:<A83>+1 -> 79 | B84: --system-strategy | C84: A character string that defines the strategy for reformulating and scaling linear system of equations and is set to one of the following: | D84: none
A85: ooow:<A84>+1 -> 80 | B85: --threads-per-process | C85: A positive integer value that stipulates the maximum number of threads to be instantiated per process ('-1' means 'automatic'). | D85: -1
A86: ooow:<A85>+1 -> 81 | B86: --time-step-after-event-in-days | C86: A real double precision value that sets maximum allowed time step after an event; for example, when a well is open or closed etc. The default value of -1 means that events to do effect the time stepping. | D86: -1
A87: ooow:<A86>+1 -> 82 | B87: --time-step-control | C87: A character string that defines the time stepping control algorithm and is set to one of the following: | D87: pid
A88: ooow:<A87>+1 -> 83 | B88: --time-step-control-decay-rate | C88: A real positive value that specifies the decay rate a time step can be decreased by after the number of target iterations has been exceeded | D88: 0.75
A89: ooow:<A88>+1 -> 84 | B89: --time-step-control-file-name | C89: A character string enclosed in quotes that specifies a filename where time steps are specified. The default is the character string timesteps For instance time steps can be generated by the ecl_summary application in libecl as per the following UNIX command line: path_to_libecl_applications/ecl_summary DECK TIME > filename Where: DECK is the name of the data deck you want to get the time steps from, TIME tells the application to return the timing for the run, and "filename" is the name of the file the times are piped to. | D89: timesteps
A90: ooow:<A89>+1 -> 85 | B90: --time-step-control-growth-rate | C90: A real positive value that specifies the growth rate of the time step size of the number of target iterations is undercut. | D90: 1.25
A91: ooow:<A90>+1 -> 86 | B91: --time-step-control-target-iterations | C91: A positive integer that defines the number of linear iterations which the time step control scheme should aim for (if applicable). | D91: 30
A92: ooow:<A91>+1 -> 87 | B92: --time-step-control-target-newton-iterations | C92: A positive integer that specifies the number of Newton iterations which the time step control scheme should aim for (if applicable). | D92: 8
A93: ooow:<A92>+1 -> 88 | B93: --time-step-control-tolerance | C93: A real double precision value that sets the tolerance for PID (only used with the pid and pid+ options defined by the --time-step-control option). | D93: 0.1
A94: ooow:<A93>+1 -> 89 | B94: --time-step-verbosity | C94: A positive integer that specifies the "chattiness" during the time integration. | D94: 1
A95: ooow:<A94>+1 -> 90 | B95: --tolerance-cnv | C95: A real positive double precision value that specifies the maximum non-linear tolerance error. This is the local convergence tolerance (maximum of local saturation errors). | D95: 0.01
A96: ooow:<A95>+1 -> 91 | B96: --tolerance-cnv-relaxed | C96: A real positive value that defines the relaxed local convergence tolerance that applies for iterations after the iterations with the strict tolerance. | D96: 1.0 x 109
A97: ooow:<A96>+1 -> 92 | B97: --tolerance-mb | C97: A real positive double precision value that sets the maximum mass balance error, that is the tolerated mass balance error relative to total mass present. | D97: 1.0 x 106
A98: ooow:<A97>+1 -> 93 | B98: --tolerance-pressure-ms-wells | C98: A real positive double precision value that specifies the tolerance for the pressure equations for multi-segment wells. | D98: 1000
A99: ooow:<A98>+1 -> 94 | B99: --tolerance-well-control | C99: A real positive double precision value that sets the maximum tolerance for the well control equations. | D99: 1.0 x 10-7
A100: ooow:<A99>+1 -> 95 | B100: --tolerance-wells | C100: A real positive double precision value that defines the maximum non-linear error for the well equations. | D100: 0.0001
A101: ooow:<A100>+1 -> 96 | B101: -update-equations-scaling | C101: A Boolean value set to true or false that switches on (true) or off (false) the updating of the scaling factors for mass balance equations during the simulation. | D101: false
A102: ooow:<A101>+1 -> 97 | B102: --use-amg | C102: A Boolean value set to true or false that if set to true OPM Flow will use AMG as the linear solver's preconditioner | D102: false
A103: ooow:<A102>+1 -> 98 | B103: --use-cpr | C103: A Boolean value set to true or false that when set to true OPM Flow will use CPR as the linear solver's preconditioner | D103: false
A104: ooow:<A103>+1 -> 99 | B104: --use-gmres | C104: A Boolean value set to true or false that when set to true OPM Flow will use Generalized Minimal Residual (“GMRES”) solver instead of Biconjugate Gradient Stabilized (“BiCGSTAB”) as the linear solver within the Newton iterations. | D104: false
A105: ooow:<A104>+1 -> 100 | B105: --use-gpu | C105: A Boolean value that when set to true will result in OPM Flow using the Graphics Processing Unit (“GPU”) cusparseSolver as the linear solver. | D105: false
A106: ooow:<A105>+1 -> 101 | B106: --use-inner-iterations-ms-wells | C106: A Boolean value set to true or false that when set to true the simulator will use nested iterations for multi-segment wells. | D106: true
A107: ooow:<A106>+1 -> 102 | B107: --use-multisegment-well | C107: A Boolean value set to true or false that when set to true the simulator will use the well model for multi-segment wells instead of the one for single-segment wells. | D107: false
A108: ooow:<A107>+1 -> 103 | B108: --use-update-stabilization | C108: A Boolean value set to true or false that switches on (true) or off (false) the stabilized Newton option. This option may improve convergence for some cases. | D108: true
A109: ooow:<A108> -> 103 | B109: VTK Graphics Command Line Parameters53 Virtualization ToolKit (“VTK”) files used to visualize the 3D results from the model using ParaView, an open-source, multi-platform general purpose data analysis and visualization application (https://www.paraview.org/overview/). For the commercial simulator’s compatible output files OPM’s ResInsight 3D visualization package can be used instead and is specifically tailored for OPM Flow and the commercial simulator.
A110: ooow:<A109>+1 -> 104 | B110: --vtk-write-average-molar-masses | C110: A Boolean value set to true or false that turns on (true) or off (false) the output of the average phase mass in the VTK output files. | D110: false
A111: ooow:<A110>+1 -> 105 | B111: --vtk-write-densities | C111: A Boolean value set to true or false that turns on (true) or off (false) the output of the phase densities to the VTK output files | D111: true
A112: ooow:<A111>+1 -> 106 | B112: --vtk-write-dof-index | C112: A Boolean value set to true or false that turns on (true) or off (false) the output of the tracer concentrations to the VTK output files. | D112: false
A113: ooow:<A112>+1 -> 107 | B113: --vtk-write-ecl-tracer-concentration | C113: A Boolean value set to true or false that turns on (true) or off (false) the output of the index of the degrees of freedom to the VTK output files. | D113: false
A114: ooow:<A113>+1 -> 108 | B114: --vtk-write-extrusion-factor | C114: A Boolean value set to true or false that turns on (true) or off (false) the output of the of the extrusion factor of the degrees of freedom to the VTK output files. | D114: false
A115: ooow:<A114>+1 -> 109 | B115: --vtk-write-filter-velocities | C115: A Boolean value set to true or false that turns on (true) or off (false) the output of the filter velocities of the phases in the VTK output files. | D115: false
A116: ooow:<A115>+1 -> 110 | B116: --vtk-write-fugacities | C116: A Boolean value set to true or false that turns on (true) or off (false) the output of the component fugacities to the VTK output files. | D116: false
A117: ooow:<A116>+1 -> 111 | B117: --vtk-write-fugacity-coeffs | C117: A Boolean value set to true or false that turns on (true) or off (false) the output of the component fugacity coefficients to the VTK output files. | D117: false
A118: ooow:<A117>+1 -> 112 | B118: --vtk-write-gas-dissolution-factor | C118: A Boolean value set to true or false that turns on (true) or off (false) the output of the gas dissolution factor (Rs) of the observed oil to the VTK output files. | D118: false
A119: ooow:<A118>+1 -> 113 | B119: --vtk-write-gas-formation-volume-factor | C119: A Boolean value set to true or false that turns on (true) or off (false) the output of the gas formation volume factor (Bg) to the VTK output files. | D119: false
A120: ooow:<A119>+1 -> 114 | B120: --vtk-write-gas-saturation-pressure | C120: A Boolean value set to true or false that turns on (true) or off (false) the output of the saturation pressure of gas (Pg,sat) to the VTK output files’ | D120: false
A121: ooow:<A120>+1 -> 115 | B121: --vtk-write-intrinsic-permeabilities | C121: A Boolean value set to true or false that turns on (true) or off (false) the output of the intrinsic permeability to the VTK output files. | D121: false
A122: ooow:<A121>+1 -> 116 | B122: --vtk-write-mass-fractions | C122: A Boolean value set to true or false that turns on (true) or off (false) the output of the mass fractions to the VTK output files. | D122: false
A123: ooow:<A122>+1 -> 117 | B123: --vtk-write-mobilities | C123: A Boolean value set to true or false that turns on (true) or off (false) the output of the phase mobilities to the VTK output files. | D123: false
A124: ooow:<A123>+1 -> 118 | B124: --vtk-write-molarities | C124: A Boolean value set to true or false that turns on (true) or off (false) the output of the component molarities to the VTK output files. | D124: false
A125: ooow:<A124>+1 -> 119 | B125: --vtk-write-mole-fractions | C125: A Boolean value set to true or false that turns on (true) or off (false) the output of the mole fractions to the VTK output files. | D125: true
A126: ooow:<A125>+1 -> 120 | B126: --vtk-write-oil-formation-volume-factor | C126: A Boolean value set to true or false that turns on (true) or off (false) the output of the oil formation volume factor (Bo) to the VTK output files. | D126: false
A127: ooow:<A126>+1 -> 121 | B127: --vtk-write-oil-saturation-pressure | C127: A Boolean value set to true or false that turns on (true) or off (false) the output of the saturation pressure of oil (Po,sat) to the VTK output files. | D127: false
A128: ooow:<A127>+1 -> 122 | B128: --vtk-write-oil-vaporization-factor | C128: A Boolean value set to true or false that turns on (true) or off (false) the output of the oil vaporization factor (Rv) of the observed gas to the VTK output files. | D128: false
A129: ooow:<A128>+1 -> 123 | B129: --vtk-write-porosity | C129: A Boolean value set to true or false that turns on (true) or off (false) the output of the porosity array to the VTK output files. | D129: true
A130: ooow:<A129>+1 -> 124 | B130: --vtk-write-potential-gradients | C130: A Boolean value set to true or false that turns on (true) or off (false) the output of the phase pressure potential gradients to the VTK output files. | D130: false
A131: ooow:<A130>+1 -> 125 | B131: --vtk-write-pressures | C131: A Boolean value set to true or false that turns on (true) or off (false) the output of the phase pressures to the VTK output files. | D131: true
A132: ooow:<A131>+1 -> 126 | B132: --vtk-write-primary-vars | C132: A Boolean value set to true or false that turns on (true) or off (false) the output of the primary variables to the VTK output files. | D132: false
A133: ooow:<A132>+1 -> 127 | B133: --vtk-write-primary-vars-meaning | C133: A Boolean value set to true or false that turns on (true) or off (false) the output of the how the primary variables should be interpreted to the VTK output files. | D133: false
A134: ooow:<A133>+1 -> 128 | B134: --vtk-write-process-rank | C134: A Boolean value set to true or false that turns on (true) or off (false) the output of the MPI process rank to the VTK output files. | D134: false
A135: ooow:<A134>+1 -> 129 | B135: --vtk-write-relative-permeabilities | C135: A Boolean value set to true or false that turns on (true) or off (false) the output of the phase relative permeabilities to the VTK output files. | D135: true
A136: ooow:<A135>+1 -> 130 | B136: --vtk-write-saturated-gas-oil-vaporization-factor | C136: A Boolean value set to true or false that turns on (true) or off (false) the output of the oil vaporization factor (Rv,sat) of oil saturated gas to the VTK output files. | D136: false
A137: ooow:<A136>+1 -> 131 | B137: --vtk-write-saturated-oil-gas-dissolution-factor | C137: A Boolean value set to true or false that turns on (true) or off (false) the output of the gas dissolution factor (Rs,sat) of gas saturated oil to the VTK output files. | D137: false
A138: ooow:<A137>+1 -> 132 | B138: --vtk-write-saturation-ratios | C138: A Boolean value set to true or false that turns on (true) or off (false) the output of the ratio of the actually and maximum dissolved component of the mixture to the VTK output files | D138: false
A139: ooow:<A138>+1 -> 133 | B139: --vtk-write-saturations | C139: A Boolean value set to true or false that turns on (true) or off (false) the output of the phase saturations to the VTK output files. | D139: true
A140: ooow:<A139>+1 -> 134 | B140: --vtk-write-temperature | C140: A Boolean value set to true or false that turns on (true) or off (false) the output of the temperature array to the VTK output files. | D140: true
A141: ooow:<A140>+1 -> 135 | B141: --vtk-write-total-mass-fractions | C141: A Boolean value set to true or false that turns on (true) or off (false) the output of the total mass fractions to the VTK output files. | D141: false
A142: ooow:<A141>+1 -> 136 | B142: --vtk-write-total-mole-fractions | C142: A Boolean value set to true or false that turns on (true) or off (false) the output of the total mole fractions to the VTK output files. | D142: false
A143: ooow:<A142>+1 -> 137 | B143: --vtk-write-viscosities | C143: A Boolean value set to true or false that turns on (true) or off (false) the output of the component phase viscosities to the VTK output files. | D143: false
A144: ooow:<A143>+1 -> 138 | B144: --vtk-write-water-formation-volume-factor | C144: A Boolean value set to true or false that turns on (true) or off (false) the output of the oil formation volume factor (Bo) to the VTK output files. | D144: false
A145: Notes:

Sheet: Table2037
A1: OPM Flow 2019-10 Command Line Options
A2: No. | B2: Variable Name | C2: Description | D2: Default
B3: General eWoms/ebos Command Line Parameters
A4: 1 | B4: -h or --help | C4: A character string that causes OPM Flow to print a help message that gives a brief description of the available command line parameters. | D4: N/A
A5: ooow:<A4>+1 -> 2 | B5: --continue-on-convergence-error | C5: A Boolean value set to true or false that that instructs the simulator to continue (true) with a non-converged solution instead of giving up (false) if it encounter a time step size smaller than the minimum time step size. | D5: false
A6: ooow:<A5>+1 -> 3 | B6: --cpr-ell-solvetype | C6: A positive integer that defines the solver type of the elliptic pressure solver: | D6: 0
A7: ooow:<A6>+1 -> 4 | B7: --cpr-max-ell-iter | C7: A positive integer that sets the maximum number of Iterations for the elliptic pressure part of the Constrained Pressure Residual (“CPR”) solver. | D7: 20
A8: ooow:<A7>+1 -> 5 | B8: --cpr-reuse-setup | C8: A positive integer that defines if the CPR solver should re-use the Amg setup. | D8: 0
A9: ooow:<A8>+1 -> 6 | B9: --cpr-solver-verbose | C9: A defined positive integer value that defines the output from CPR solver: | D9: 0
A10: ooow:<A9>+1 -> 7 | B10: --cpr-use-drs | C10: A Boolean value set to true or false that switches on (true) or off (false) the use of dynamic row sum weights in the CPR solver. | D10: false
A11: ooow:<A10>+1 -> 8 | B11: --dbph-max-rel | C11: A real positive value that sets maximum relative change of the bottom-hole pressure in a single iteration | D11: 1.0
A12: ooow:<A11>+1 -> 9 | B12: --dp-max-rel | C12: A real positive double precision value that sets the maximum allowed relative change of pressure per iteration. | D12: 0.3
A13: ooow:<A12>+1 -> 10 | B13: --ds-max | C13: A real positive double precision value that sets the maximum allowed change in saturation per iteration. | D13: 0.2
A14: ooow:<A13>+1 -> 11 | B14: --dwell-fraction-max | C14: A real positive double precision value that sets the maximum allowed change in well’s volume fraction per iteration. | D14: 0.2
A15: ooow:<A14>+1 -> 12 | B15: --ecl-deck-file-name | C15: A character string that defines the name of the OPM Flow input file which contains the simulator’s ECLIPSE formatted input deck to be simulated. | D15: “”
A16: 13 | B16: --ecl-enable-drift-compensation | C16: A Boolean value set to true or false that enables (true) or disables (false) partial compensation of systematic mass losses via the source term of the next time step. | D16: false
A17: ooow:<A16>+1 -> 14 | B17: --ecl-output-double-precision | C17: A Boolean value set to true or false that switches on (true) or off (false) double precision in restart files. Useful for 'perfect' restarts. | D17: false
A18: ooow:<A17>+1 -> 15 | B18: --ecl-output-interval | C18: An integer value defining the number of report steps that ought to be skipped between two writes of restart files results. | D18: -1
A19: ooow:<A18>+1 -> 16 | B19: --ecl-strict-parsing | C19: A Boolean value set to true or false that switches on (true) or off (false) strict parsing mode for parsing - all errors are collected before the application exists. Useful for debugging initial runs. | D19: false
A20: ooow:<A19>+1 -> 17 | B20: --edge-weights-method | C20: A defined positive integer value that defines the edge-weighing strategy: | D20: 1
A21: ooow:<A20>+1 -> 18 | B21: --enable-adaptive-time-stepping | C21: A Boolean value set to true or false that turns on (true) or off (false) adaptive time stepping. If set to false the report time steps provided by the input deck are used. | D21: true
A22: ooow:<A21>+1 -> 19 | B22: --enable-async-ecl-output | C22: A Boolean value set to true or false that sets the output mode to be asynchronously (true), letting the simulator continue computing the next time step while writing results to restart and summary files in the commercial simulators format. | D22: true
A23: ooow:<A22>+1 -> 20 | B23: --enable-async-vtk-output | C23: A Boolean value set to true or false that sets the output mode to be asynchronously (true), letting the simulator continue computing the next time step while writing results to the VTK output files. | D23: true
A24: ooow:<A23>+1 -> 21 | B24: --enable-dry-run | C24: A Boolean value set to true or false that specifies if the simulation should actually run, (true) or just check the input deck (false). This option is equivalent to activating the NOSIM keyword in the RUNSPEC section of the input deck (see section Error: Reference source not foundError: Reference source not found). | D24: true
A25: ooow:<A24>+1 -> 22 | B25: --enable-ecl-output | C25: A Boolean value set to true or false that specifies if the binary output files (restart, summary files, etc.) should be written in the commercial simulator’s format (true), or OPM Flow’s format (false). | D25: true
A26: ooow:<A25>+1 -> 23 | B26: --enable-logging-fallout-warning | C26: A Boolean value set to true or false that sets the developer option to see whether logging was on non-root processors (true). If set to true output will be appended to the *.DBG or *.PRT files. | D26: false
A27: ooow:<A26>+1 -> 24 | B27: --enable-opm-rst-file | C27: A Boolean value set to true or false to write OPM specific data sets to the commercial simulators restart file to enable restart of an OPM Flow runs (true), or not to write the data (false). | D27: true
A28: ooow:<A27>+1 -> 25 | B28: --enable-storage-cache | C28: A Boolean value set to true or false that turns on (true) or off (false) storing previous storage terms and avoid re-calculating them. | D28: true
A29: ooow:<A28>+1 -> 26 | B29: --enable-terminal-output | C29: A Boolean value set to true or false that turns on (true) or off (false) high-level information about the simulation's progress to the terminal | D29: true
A30: ooow:<A29>+1 -> 27 | B30: --enable-tracer-mode | C30: A Boolean value set to true or false that turns on (true) or off (false) transport tracer calculations for when tracers have been declared in the input deck. Experimental - use with caution. | D30: false
A31: ooow:<A30>+1 -> 28 | B31: --enable-tuning | C31: A Boolean value set to true or false that instructs OPM Flow to read the time stepping parameters from the Error: Reference source not foundkeyword in the input deck, if set to true. Note that only the first record of the TUNING keyword is processed. | D31: false
A32: ooow:<A31>+1 -> 29 | B32: --enable-vtk-output | C32: A Boolean value set to true or false that turns on (true) or off (false) a global switch for writing VTK files. | D32: false
A33: ooow:<A32>+1 -> 30 | B33: --enable-well-operability-check | C33: A Boolean value set to true or false that enables (true) checking of a well’s operating status, or disables (false) the checking. | D33: true
A34: ooow:<A33>+1 -> 31 | B34: --enable-write-all-solutions | C34: A Boolean value set to true or false that turns on (true) or off (false) the writing of all solutions to disk instead of only the ones for the report steps. | D34: false
A35: ooow:<A34> -> 31 | B35: OPM Flow Specific Command Line Parameters
A36: ooow:<A35>+1 -> 32 | B36: --flow-linear-solver-verbosity | C36: A positive integer value that defines the output from linear solver: | D36: 0
A37: ooow:<A36>+1 -> 33 | B37: --flow-newton-max-iterations | C37: A positive integer that defines the maximum number of Newton iterations per time step used by the simulator. | D37: 20
A38: ooow:<A37>+1 -> 34 | B38: --flow-newton-min-iterations | C38: A real positive value that sets the minimum number of Newton iterations per time step used by the simulator. | D38: 1
A39: ooow:<A38> -> 34 | B39: General eWoms/ebos Command Line Parameters
A40: ooow:<A39>+1 -> 35 | B40: --force-disable-fluid-in-place-output | C40: A Boolean value set to true or false that instructs OPM Flow to not to print the Fluid In-Place report after each report time step (true) or not (false). | D40: false
A41: ooow:<A40>+1 -> 36 | B41: --full-time-step-initially | C41: A Boolean value set to true or false that instructs OPM Flow to always attempt to finish a report step using a single time step (true) or not (false). | D41: false
A42: ooow:<A41>+1 -> 37 | B42: --ignore-keywords | C42: A character string that defines a list of keywords which should be ignored by OPM Flow. The keyword string should be enclosed in quotes and each keyword separated by a colon, that is ':' . | D42: “”
A43: ooow:<A42>+1 -> 38 | B43: --ilu-fillin-level | C43: A positive integer value that sets the fill in level for the ILU preconditioner. | D43: 0
A44: ooow:<A43>+1 -> 39 | B44: --ilu-redblack | C44: A Boolean value set to true or false that instructs OPM Flow to use red-black partitioning for the ILU preconditioner. (true) or not (false). | D44: false
A45: ooow:<A44>+1 -> 40 | B45: --ilu-relaxation | C45: A real positive double precision value that sets the relaxation factor of the linear solver's ILU preconditioner | D45: 0.9
A46: ooow:<A45>+1 -> 41 | B46: --ilu-reorder-spheres | C46: A Boolean value set to true or false specifies OPM Flow to reorder the entries of the matrix in the red-black ILU preconditioner in spheres starting at an edge (true) or not (false) If false the original ordering is preserved in each color. Otherwise try to ensure D4 ordering (in a 2D structured grid, the diagonal elements are consecutive). | D46: false
A47: ooow:<A46>+1 -> 42 | B47: --initial-time-step-in-days | C47: A real double precision value that sets the size of initial time step in days. | D47: 1.0
A48: ooow:<A47>+1 -> 43 | B48: --linear-solver-configuration-json-file | C48: A character string enclosed in quotes that defines the filename of a JSON configuration file for the flexible linear solver system. | D48: none
A49: ooow:<A48>+1 -> 44 | B49: --linear-solver-ignore-convergence-failure | C49: A Boolean value set to true or false that if set to true convergences failures in the linear solver are ignored. This option should be used with care, as the results may be unreliable. | D49: false
A50: ooow:<A49>+1 -> 45 | B50: --linear-solver-max-iter | C50: A positive integer value that defines the maximum number of linear iterations. | D50: 200
A51: ooow:<A50>+1 -> 46 | B51: --linear-solver-reduction | C51: A real positive double precision value that sets the tolerance for the linear solver. The linear solver convergences when the residual is reduced sufficiently. | D51: 0.01
A52: ooow:<A51>+1 -> 47 | B52: --linear-solver-require-full-sparsity-pattern | C52: A Boolean value set to true or false that if set to true the simulator will produce the full sparsity pattern for the linear solver. | D52: false
A53: ooow:<A52>+1 -> 48 | B53: --linear-solver-restart | C53: A positive integer value that sets the number of iterations after which GMRES is restarted. | D53: 40
A54: ooow:<A53>+1 -> 49 | B54: --matrix-add-well-contributions | C54: A Boolean value set to true or false that if set to true explicitly specifies the influences of wells between cells in the Jacobian and preconditioner matrices. | D54: false
A55: ooow:<A54>+1 -> 50 | B55: --max-inner-iter-ms-wells | C55: A positive integer value that defines the maximum number of inner iterations for multi-segment wells. | D55: 100
A56: ooow:<A55>+1 -> 51 | B56: --max-pressure-change-ms-wells | C56: A real positive value that defines the maximum relative pressure change for a single iteration of the multi-segment well model. | D56: 1.0 x 106
A57: ooow:<A56>+1 -> 52 | B57: --max-residual-allowed | C57: A real positive value that sets the absolute maximum tolerance for residuals without cutting the time step size. | D57: 1.0 x 107
A58: ooow:<A57>+1 -> 53 | B58: --max-single-precision-days | C58: A real positive value that set the maximum time step size where single precision floating point arithmetic can be used solving for the linear systems of equations. | D58: 20.0
A59: ooow:<A58>+1 -> 54 | B59: --max-strict-iter | C59: A positive integer that sets the maximum number of Newton iterations before relaxed tolerances are used for the CNV convergence criterion. | D59: 8
A60: ooow:<A59>+1 -> 55 | B60: --max-welleq-iter | C60: A positive integer that defines the maximum number of iterations to determine the solution to the well equations. | D60: 30
A61: ooow:<A60>+1 -> 56 | B61: --milu-variant | C61: A defined character string that specifies which variant of the modified-ILU preconditioner ought to be used. Possible variants are: The default is ILU | D61: ILU
A62: ooow:<A61>+1 -> 57 | B62: --newton-max-relax | C62: A real positive value that sets the maximum relaxation factor of a Newton iteration used by the simulator. | D62: 0.5
A63: ooow:<A62>+1 -> 58 | B63: --newton-relaxation-type | C63: A character string that defines the type of relaxation used in Newton’s method, default is dampen. | D63: dampen
A64: ooow:<A63>+1 -> 59 | B64: --output-dir | C64: A character string that defines the directory to which OPM Flow is to write the commercial simulator compatible output files (restart, summary files etc.). The default value results in the files be written to the same directory as the input file. | D64: “”
A65: ooow:<A64>+1 -> 60 | B65: --output-interval | C65: A positive integer that specifies the number of report steps between two consecutive writes of restart data. | D65: 1
A66: ooow:<A65>+1 -> 61 | B66: --output-mode | C66: A character string that defines the output to the *.PRT and *.DBG files: For example to just output logging information use: --output-mode=log or --output-mode=false | D66: all
A67: ooow:<A66>+1 -> 62 | B67: --parameter-file | C67: A character string that defines the name of a parameter file which contains the simulator’s set of run-time parameters, as listed in this table. | D67: “”
A68: ooow:<A67>+1 -> 63 | B68: --pri-var-oscilation-threshold | C68: A real positive value that defines the threshold value for the primary variable switching conditions after its meaning has switched to hinder oscillations. | D68: 1 x 10-5
A69: ooow:<A68>+1 -> 64 | B69: --print-parameters | C69: A positive integer value that request that the run time parameters be printed at the start of the run: | D69: 2
A70: ooow:<A69>+1 -> 65 | B70: --print-properties | C70: A positive integer value that request that the compile time parameters be printed at the start of the run: | D70: 2
A71: ooow:<A70>+1 -> 66 | B71: --scale-linear-system | C71: A Boolean value set to true or false that switches on (true) or off (false) the scaling of linear system of equations according to the equation scale and primary variable types. | D71: false
A72: ooow:<A71>+1 -> 67 | B72: --solve-welleq-initially | C72: A Boolean value set to true or false that switches on (true) or off (false) the solving of the well equations as a pre-processing step. Note that the well equations are always added to the full system and solved until converged. | D72: true
A73: ooow:<A72>+1 -> 68 | B73: --solver-growth-factor | C73: A real positive value that specifies the allowed value a time step can be increased by, subject to the maximum allowable time step size set by the --flow-solver-max-time-step-in-days parameter. For example, if the current time step has converged at 10 days and --flow-solver-growth-factor is set to the default value, then the next time step will be 2.0 * 10 days, that is at 20 days. | D73: 2.0
A74: ooow:<A73>+1 -> 69 | B74: --solver-max-growth | C74: A real positive value that specifies the maximum allowed value a time step can be increased by after a report time step. subject to the maximum allowable time step size set by the --flow-solver-max-time-step-in-days parameter. | D74: 3.0
A75: ooow:<A74>+1 -> 70 | B75: --solver-max-restarts | C75: A positive integer that defines the number of allowed consecutive restarts (or time step chops) before the simulation is terminated. | D75: 10
A76: ooow:<A75>+1 -> 71 | B76: --solver-max-time-step-in-days | C76: A real positive double precision value that specifies the maximum allowed time step size in days. | D76: 365
A77: ooow:<A76>+1 -> 72 | B77: --solver-restart-factor | C77: A real positive double precision value that sets the time step chop factor of the time step after a convergence failure. For example, if the current non-convergent time step is 30 days and --flow-solver-restart-factor is set to the default value, then the time step will be repeated using 0.33 * 30 days as the time step, that is 9.9 days. | D77: 0.33
A78: ooow:<A77>+1 -> 73 | B78: --solver-verbosity | C78: A positive integer that specifies the "chattiness" of the non-linear solver. | D78: 1
A79: ooow:<A78>+1 -> 74 | B79: --system-strategy | C79: A character string that defines the strategy for reformulating and scaling linear system of equations and is set to one of the following: | D79: none
A80: ooow:<A79>+1 -> 75 | B80: --threads-per-process | C80: A positive integer value that stipulates the maximum number of threads to be instantiated per process ('-1' means 'automatic'). | D80: -1
A81: ooow:<A80>+1 -> 76 | B81: --time-step-after-event-in-days | C81: A real double precision value that sets maximum allowed time step after an event; for example, when a well is open or closed etc. The default value of -1 means that events to do effect the time stepping. | D81: -1
A82: ooow:<A81>+1 -> 77 | B82: --time-step-control | C82: A character string that defines the time stepping control algorithm and is set to one of the following: | D82: pid
A83: ooow:<A82>+1 -> 78 | B83: --time-step-control-decay-rate | C83: A real positive value that specifies the decay rate a time step can be decreased by after the number of target iterations has been exceeded | D83: 0.75
A84: ooow:<A83>+1 -> 79 | B84: --time-step-control-file-name | C84: A character string enclosed in quotes that specifies a filename where time steps are specified. The default is the character string timesteps For instance time steps can be generated by the ecl_summary application in libecl as per the following UNIX command line: path_to_libecl_applications/ecl_summary DECK TIME > filename Where: DECK is the name of the data deck you want to get the time steps from, TIME tells the application to return the timing for the run, and "filename" is the name of the file the times are piped to. | D84: timesteps
A85: ooow:<A84>+1 -> 80 | B85: --time-step-control-growth-rate | C85: A real positive value that specifies the growth rate of the time step size of the number of target iterations is undercut. | D85: 1.25
A86: ooow:<A85>+1 -> 81 | B86: --time-step-control-target-iterations | C86: A positive integer that defines the number of linear iterations which the time step control scheme should aim for (if applicable). | D86: 30
A87: ooow:<A86>+1 -> 82 | B87: --time-step-control-target-newton-iterations | C87: A positive integer that specifies the number of Newton iterations which the time step control scheme should aim for (if applicable). | D87: 8
A88: ooow:<A87>+1 -> 83 | B88: --time-step-control-tolerance | C88: A real double precision value that sets the tolerance for PID (only used with the pid and pid+ options defined by the --time-step-control option). | D88: 0.1
A89: ooow:<A88>+1 -> 84 | B89: --time-step-verbosity | C89: A positive integer that specifies the "chattiness" during the time integration. | D89: 1
A90: ooow:<A89>+1 -> 85 | B90: --tolerance-cnv | C90: A real positive double precision value that specifies the maximum non-linear tolerance error. This is the local convergence tolerance (maximum of local saturation errors). | D90: 0.01
A91: ooow:<A90>+1 -> 86 | B91: --tolerance-cnv-relaxed | C91: A real positive value that defines the relaxed local convergence tolerance that applies for iterations after the iterations with the strict tolerance. | D91: 1.0 x 109
A92: ooow:<A91>+1 -> 87 | B92: --tolerance-mb | C92: A real positive double precision value that sets the maximum mass balance error, that is the tolerated mass balance error relative to total mass present. | D92: 1.0 x 106
A93: ooow:<A92>+1 -> 88 | B93: --tolerance-pressure-ms-wells | C93: A real positive double precision value that specifies the tolerance for the pressure equations for multi-segment wells. | D93: 1000
A94: ooow:<A93>+1 -> 89 | B94: --tolerance-well-control | C94: A real positive double precision value that sets the maximum tolerance for the well control equations. | D94: 1.0 x 10-7
A95: ooow:<A94>+1 -> 90 | B95: --tolerance-wells | C95: A real positive double precision value that defines the maximum non-linear error for the well equations. | D95: 0.0001
A96: ooow:<A95>+1 -> 91 | B96: -update-equations-scaling | C96: A Boolean value set to true or false that switches on (true) or off (false) the updating of the scaling factors for mass balance equations during the simulation. | D96: false
A97: ooow:<A96>+1 -> 92 | B97: --use-amg | C97: A Boolean value set to true or false that if set to true OPM Flow will use AMG as the linear solver's preconditioner | D97: false
A98: ooow:<A97>+1 -> 93 | B98: --use-cpr | C98: A Boolean value set to true or false that when set to true OPM Flow will use CPR as the linear solver's preconditioner | D98: false
A99: ooow:<A98>+1 -> 94 | B99: --use-gmres | C99: A Boolean value set to true or false that when set to true OPM Flow will use Generalized Minimal Residual (“GMRES”) solver instead of Biconjugate Gradient Stabilized (“BiCGSTAB”) as the linear solver within the Newton iterations. | D99: false
A100: ooow:<A99>+1 -> 95 | B100: --use-inner-iterations-ms-wells | C100: A Boolean value set to true or false that when set to true the simulator will use nested iterations for multi-segment wells. | D100: true
A101: ooow:<A100>+1 -> 96 | B101: --use-multisegment-well | C101: A Boolean value set to true or false that when set to true the simulator will use the well model for multi-segment wells instead of the one for single-segment wells. | D101: false
A102: ooow:<A101>+1 -> 97 | B102: --use-update-stabilization | C102: A Boolean value set to true or false that switches on (true) or off (false) the stabilized Newton option. This option may improve convergence for some cases. | D102: true
A103: ooow:<A102> -> 97 | B103: VTK Graphics Command Line Parameters55 Virtualization ToolKit (“VTK”) files used to visualize the 3D results from the model using ParaView, an open-source, multi-platform general purpose data analysis and visualization application (https://www.paraview.org/overview/). For the commercial simulator’s compatible output files OPM’s ResInsight 3D visualization package can be used instead and is specifically tailored for OPM Flow and the commercial simulator.
A104: ooow:<A103>+1 -> 98 | B104: --vtk-write-average-molar-masses | C104: A Boolean value set to true or false that turns on (true) or off (false) the output of the average phase mass in the VTK output files. | D104: false
A105: ooow:<A104>+1 -> 99 | B105: --vtk-write-densities | C105: A Boolean value set to true or false that turns on (true) or off (false) the output of the phase densities to the VTK output files | D105: true
A106: ooow:<A105>+1 -> 100 | B106: --vtk-write-dof-index | C106: A Boolean value set to true or false that turns on (true) or off (false) the output of the tracer concentrations to the VTK output files. | D106: false
A107: ooow:<A106>+1 -> 101 | B107: --vtk-write-ecl-tracer-concentration | C107: A Boolean value set to true or false that turns on (true) or off (false) the output of the index of the degrees of freedom to the VTK output files. | D107: false
A108: ooow:<A107>+1 -> 102 | B108: --vtk-write-extrusion-factor | C108: A Boolean value set to true or false that turns on (true) or off (false) the output of the of the extrusion factor of the degrees of freedom to the VTK output files. | D108: false
A109: ooow:<A108>+1 -> 103 | B109: --vtk-write-filter-velocities | C109: A Boolean value set to true or false that turns on (true) or off (false) the output of the filter velocities of the phases in the VTK output files. | D109: false
A110: ooow:<A109>+1 -> 104 | B110: --vtk-write-fugacities | C110: A Boolean value set to true or false that turns on (true) or off (false) the output of the component fugacities to the VTK output files. | D110: false
A111: ooow:<A110>+1 -> 105 | B111: --vtk-write-fugacity-coeffs | C111: A Boolean value set to true or false that turns on (true) or off (false) the output of the component fugacity coefficients to the VTK output files. | D111: false
A112: ooow:<A111>+1 -> 106 | B112: --vtk-write-gas-dissolution-factor | C112: A Boolean value set to true or false that turns on (true) or off (false) the output of the gas dissolution factor (Rs) of the observed oil to the VTK output files. | D112: false
A113: ooow:<A112>+1 -> 107 | B113: --vtk-write-gas-formation-volume-factor | C113: A Boolean value set to true or false that turns on (true) or off (false) the output of the gas formation volume factor (Bg) to the VTK output files. | D113: false
A114: ooow:<A113>+1 -> 108 | B114: --vtk-write-gas-saturation-pressure | C114: A Boolean value set to true or false that turns on (true) or off (false) the output of the saturation pressure of gas (Pg,sat) to the VTK output files’ | D114: false
A115: ooow:<A114>+1 -> 109 | B115: --vtk-write-intrinsic-permeabilities | C115: A Boolean value set to true or false that turns on (true) or off (false) the output of the intrinsic permeability to the VTK output files. | D115: false
A116: ooow:<A115>+1 -> 110 | B116: --vtk-write-mass-fractions | C116: A Boolean value set to true or false that turns on (true) or off (false) the output of the mass fractions to the VTK output files. | D116: false
A117: ooow:<A116>+1 -> 111 | B117: --vtk-write-mobilities | C117: A Boolean value set to true or false that turns on (true) or off (false) the output of the phase mobilities to the VTK output files. | D117: false
A118: ooow:<A117>+1 -> 112 | B118: --vtk-write-molarities | C118: A Boolean value set to true or false that turns on (true) or off (false) the output of the component molarities to the VTK output files. | D118: false
A119: ooow:<A118>+1 -> 113 | B119: --vtk-write-mole-fractions | C119: A Boolean value set to true or false that turns on (true) or off (false) the output of the mole fractions to the VTK output files. | D119: true
A120: ooow:<A119>+1 -> 114 | B120: --vtk-write-oil-formation-volume-factor | C120: A Boolean value set to true or false that turns on (true) or off (false) the output of the oil formation volume factor (Bo) to the VTK output files. | D120: false
A121: ooow:<A120>+1 -> 115 | B121: --vtk-write-oil-saturation-pressure | C121: A Boolean value set to true or false that turns on (true) or off (false) the output of the saturation pressure of oil (Po,sat) to the VTK output files. | D121: false
A122: ooow:<A121>+1 -> 116 | B122: --vtk-write-oil-vaporization-factor | C122: A Boolean value set to true or false that turns on (true) or off (false) the output of the oil vaporization factor (Rv) of the observed gas to the VTK output files. | D122: false
A123: ooow:<A122>+1 -> 117 | B123: --vtk-write-porosity | C123: A Boolean value set to true or false that turns on (true) or off (false) the output of the porosity array to the VTK output files. | D123: true
A124: ooow:<A123>+1 -> 118 | B124: --vtk-write-potential-gradients | C124: A Boolean value set to true or false that turns on (true) or off (false) the output of the phase pressure potential gradients to the VTK output files. | D124: false
A125: ooow:<A124>+1 -> 119 | B125: --vtk-write-pressures | C125: A Boolean value set to true or false that turns on (true) or off (false) the output of the phase pressures to the VTK output files. | D125: true
A126: ooow:<A125>+1 -> 120 | B126: --vtk-write-primary-vars | C126: A Boolean value set to true or false that turns on (true) or off (false) the output of the primary variables to the VTK output files. | D126: false
A127: ooow:<A126>+1 -> 121 | B127: --vtk-write-primary-vars-meaning | C127: A Boolean value set to true or false that turns on (true) or off (false) the output of the how the primary variables should be interpreted to the VTK output files. | D127: false
A128: ooow:<A127>+1 -> 122 | B128: --vtk-write-process-rank | C128: A Boolean value set to true or false that turns on (true) or off (false) the output of the MPI process rank to the VTK output files. | D128: false
A129: ooow:<A128>+1 -> 123 | B129: --vtk-write-relative-permeabilities | C129: A Boolean value set to true or false that turns on (true) or off (false) the output of the phase relative permeabilities to the VTK output files. | D129: true
A130: ooow:<A129>+1 -> 124 | B130: --vtk-write-saturated-gas-oil-vaporization-factor | C130: A Boolean value set to true or false that turns on (true) or off (false) the output of the oil vaporization factor (Rv,sat) of oil saturated gas to the VTK output files. | D130: false
A131: ooow:<A130>+1 -> 125 | B131: --vtk-write-saturated-oil-gas-dissolution-factor | C131: A Boolean value set to true or false that turns on (true) or off (false) the output of the gas dissolution factor (Rs,sat) of gas saturated oil to the VTK output files. | D131: false
A132: ooow:<A131>+1 -> 126 | B132: --vtk-write-saturation-ratios | C132: A Boolean value set to true or false that turns on (true) or off (false) the output of the ratio of the actually and maximum dissolved component of the mixture to the VTK output files | D132: false
A133: ooow:<A132>+1 -> 127 | B133: --vtk-write-saturations | C133: A Boolean value set to true or false that turns on (true) or off (false) the output of the phase saturations to the VTK output files. | D133: true
A134: ooow:<A133>+1 -> 128 | B134: --vtk-write-temperature | C134: A Boolean value set to true or false that turns on (true) or off (false) the output of the temperature array to the VTK output files. | D134: true
A135: ooow:<A134>+1 -> 129 | B135: --vtk-write-total-mass-fractions | C135: A Boolean value set to true or false that turns on (true) or off (false) the output of the total mass fractions to the VTK output files. | D135: false
A136: ooow:<A135>+1 -> 130 | B136: --vtk-write-total-mole-fractions | C136: A Boolean value set to true or false that turns on (true) or off (false) the output of the total mole fractions to the VTK output files. | D136: false
A137: ooow:<A136>+1 -> 131 | B137: --vtk-write-viscosities | C137: A Boolean value set to true or false that turns on (true) or off (false) the output of the component phase viscosities to the VTK output files. | D137: false
A138: ooow:<A137>+1 -> 132 | B138: --vtk-write-water-formation-volume-factor | C138: A Boolean value set to true or false that turns on (true) or off (false) the output of the oil formation volume factor (Bo) to the VTK output files. | D138: false
A139: Notes:

Sheet: Table2038
A1: OPM Flow 2019-04 Command Line Options
A2: No. | B2: Variable Name | C2: Description | D2: Default
B3: General eWoms/ebos Command Line Parameters
A4: 1 | B4: -h or --help | C4: A character string that causes OPM Flow to print a help message that gives a brief description of the available command line parameters. | D4: N/A
A5: ooow:<A4>+1 -> 2 | B5: --cpr-ell-solvetype | C5: A positive integer that defines the solver type of the elliptic pressure solver: | D5: 0
A6: ooow:<A5>+1 -> 3 | B6: --cpr-max-ell-iter | C6: A positive integer that sets the maximum number of Iterations for the elliptic pressure part of the Constrained Pressure Residual (“CPR”) solver. | D6: 20
A7: ooow:<A6>+1 -> 4 | B7: --cpr-reuse-setup | C7: A positive integer that that defines if the CPR solver should re-use the Amg setup. | D7: 0
A8: ooow:<A7>+1 -> 5 | B8: --cpr-solver-verbose | C8: A positive integer value that defines the output from CPR solver: | D8: 0
A9: ooow:<A8>+1 -> 6 | B9: --cpr-use-drs | C9: A Boolean value set to true or false that switches on (true) or off (false) the use of dynamic row sum weights in the CPR solver. | D9: false
A10: ooow:<A9>+1 -> 7 | B10: --dbph-max-rel | C10: A real positive value that sets maximum relative change of the bottom-hole pressure in a single iteration | D10: 1.0
A11: ooow:<A10>+1 -> 8 | B11: --dp-max-rel | C11: A real positive double precision value that sets the maximum allowed relative change of pressure per iteration. | D11: 0.3
A12: ooow:<A11>+1 -> 9 | B12: --ds-max | C12: A real positive double precision value that sets the maximum allowed change in saturation per iteration. | D12: 0.2
A13: ooow:<A12>+1 -> 10 | B13: --dwell-fraction-max | C13: A real positive double precision value that sets the maximum allowed change in well’s volume fraction per iteration. | D13: 0.2
A14: ooow:<A13>+1 -> 11 | B14: --ecl-deck-file-name | C14: A character string that defines the name of the OPM Flow input file which contains the simulator’s ECLIPSE formatted input deck to be simulated. | D14: “”
A15: ooow:<A14>+1 -> 12 | B15: --ecl-output-double-precision | C15: A Boolean value set to true or false that switches on (true) or off (false) double precision in restart files. Useful for 'perfect' restarts. | D15: false
A16: ooow:<A15>+1 -> 13 | B16: --ecl-output-interval | C16: An integer value defining the number of report steps that ought to be skipped between two writes of restart files results. | D16: -1
A17: ooow:<A16>+1 -> 14 | B17: --ecl-strict-parsing | C17: A Boolean value set to true or false that switches on (true) or off (false) strict parsing mode for parsing - all errors are collected before the application exists. Useful for debugging initial runs. | D17: false
A18: ooow:<A17>+1 -> 15 | B18: --enable-adaptive-time-stepping | C18: A Boolean value set to true or false that that turns on (true) or off (false) adaptive time stepping. If set to false the report time steps provided by the input deck are used. | D18: true
A19: ooow:<A18>+1 -> 16 | B19: --enable-async-ecl-output | C19: A Boolean value set to true or false that sets the output mode to be asynchronously (true), letting the simulator continue computing the next time step while writing results to restart and summary files in the commercial simulators format. | D19: true
A20: ooow:<A19>+1 -> 17 | B20: --enable-async-vtk-output | C20: A Boolean value set to true or false that sets the output mode to be asynchronously (true), letting the simulator continue computing the next time step while writing results to the VTK output files. | D20: true
A21: ooow:<A20>+1 -> 18 | B21: --enable-dry-run | C21: A Boolean value set to true or false that specifies if the simulation should actually run, (true) or just check the input deck (false). This option is equivalent to activating the NOSIM keyword in the RUNSPEC section of the input deck (see section Error: Reference source not foundError: Reference source not found). | D21: true
A22: ooow:<A21>+1 -> 19 | B22: --enable-ecl-output | C22: A Boolean value set to true or false that specifies if the binary output files (restart, summary files, etc.) should be written in the commercial simulator’s format (true), or OPM Flow’s format (false). | D22: true
A23: ooow:<A22>+1 -> 20 | B23: --enable-logging-fallout-warning | C23: A Boolean value set to true or false that sets the developer option to see whether logging was on non-root processors (true). If set to true output will be appended to the *.DBG or *.PRT files. | D23: false
A24: ooow:<A23>+1 -> 21 | B24: --enable-opm-rst-file | C24: A Boolean value set to true or false to write OPM specific data sets to the commercial simulators restart file to enable restart of an OPM Flow runs (true), or not to write the data (false). | D24: true
A25: ooow:<A24>+1 -> 22 | B25: --enable-storage-cache | C25: A Boolean value set to true or false that turns on (true) or off (false) storing previous storage terms and avoid re-calculating them. | D25: true
A26: ooow:<A25>+1 -> 23 | B26: --enable-terminal-output | C26: A Boolean value set to true or false that turns on (true) or off (false) high-level information about the simulation's progress to the terminal | D26: true
A27: ooow:<A26>+1 -> 24 | B27: --enable-tracer-mode | C27: A Boolean value set to true or false that turns on (true) or off (false) transport tracer calculations for when tracers have been declared in the input deck. Experimental - use with caution. | D27: false
A28: ooow:<A27>+1 -> 25 | B28: --enable-tuning | C28: A Boolean value set to true or false that that instructs OPM Flow to read the time stepping parameters from the Error: Reference source not foundkeyword in the input deck, if set to true. Note that only the first record of the TUNING keyword is processed. | D28: false
A29: ooow:<A28>+1 -> 26 | B29: --enable-vtk-output | C29: A Boolean value set to true or false that turns on (true) or off (false) a global switch for writing VTK files. | D29: false
A30: ooow:<A29>+1 -> 27 | B30: --enable-write-all-solutions | C30: A Boolean value set to true or false that turns on (true) or off (false) the writing of all solutions to disk instead of only the ones for the report steps. | D30: false
A31: ooow:<A30> -> 27 | B31: OPM Flow Specific Command Line Parameters
A32: ooow:<A31>+1 -> 28 | B32: --flow-linear-solver-verbosity | C32: A positive integer value that defines the output from linear solver: | D32: 0
A33: ooow:<A32>+1 -> 29 | B33: --flow-newton-max-iterations | C33: A positive integer that defines the maximum number of Newton iterations per time step used by the simulator. | D33: 20
A34: ooow:<A33>+1 -> 30 | B34: --flow-newton-min-iterations | C34: A real positive value that sets the minimum number of Newton iterations per time step used by the simulator. | D34: 1
A35: ooow:<A34> -> 30 | B35: General eWoms/ebos Command Line Parameters
A36: ooow:<A35>+1 -> 31 | B36: --force-disable-fluid-in-place-output | C36: A Boolean value set to true or false that instructs OPM Flow to not to print the Fluid In-Place report after each report time step (true) or not (false). | D36: false
A37: ooow:<A36>+1 -> 32 | B37: --full-time-step-initially | C37: A Boolean value set to true or false that instructs OPM Flow to always attempt to finish a report step using a single time step (true) or not (false). | D37: false
A38: ooow:<A37>+1 -> 33 | B38: --ignore-keywords | C38: A character string that defines a list of keywords which should be ignored by OPM Flow. The keyword string should be enclosed in quotes and each keyword separated by a colon, that is ':' . | D38: “”
A39: ooow:<A38>+1 -> 34 | B39: --ilu-fillin-level | C39: A positive integer value that sets the fill in level for the ILU preconditioner. | D39: 0
A40: ooow:<A39>+1 -> 35 | B40: --ilu-redblack | C40: A Boolean value set to true or false that instructs OPM Flow to use red-black partitioning for the ILU preconditioner. (true) or not (false). | D40: false
A41: ooow:<A40>+1 -> 36 | B41: --ilu-relaxation | C41: A real positive double precision value that sets the relaxation factor of the linear solver's ILU preconditioner | D41: 0.9
A42: ooow:<A41>+1 -> 37 | B42: --ilu-reorder-spheres | C42: A Boolean value set to true or false specifies OPM Flow to reorder the entries of the matrix in the red-black ILU preconditioner in spheres starting at an edge (true) or not (false) If false the original ordering is preserved in each color. Otherwise try to ensure D4 ordering (in a 2D structured grid, the diagonal elements are consecutive). | D42: false
A43: ooow:<A42>+1 -> 38 | B43: --initial-time-step-in-days | C43: A real double precision value that sets the size of initial time step in days. | D43: 1.0
A44: ooow:<A43>+1 -> 39 | B44: --linear-solver-ignore-convergence-failure | C44: A Boolean value set to true or false that if set to true convergences failures in the linear solver are ignored. This option should be used with care, as the results may be unreliable. | D44: false
A45: ooow:<A44>+1 -> 40 | B45: --linear-solver-max-iter | C45: A positive integer value that defines the maximum number of linear iterations. | D45: 200
A46: ooow:<A45>+1 -> 41 | B46: --linear-solver-reduction | C46: A real positive double precision value that sets the tolerance for the linear solver. The linear solver convergences when the residual is reduced sufficiently. | D46: 0.01
A47: ooow:<A46>+1 -> 42 | B47: --linear-solver-require-full-sparsity-pattern | C47: A Boolean value set to true or false that if set to true the simulator will produce the full sparsity pattern for the linear solver. | D47: false
A48: ooow:<A47>+1 -> 43 | B48: --linear-solver-restart | C48: A positive integer value that sets the number of iterations after which GMRES is restarted. | D48: 40
A49: ooow:<A48>+1 -> 44 | B49: --matrix-add-well-contributions | C49: A Boolean value set to true or false that if set to true explicitly specifies the influences of wells between cells in the Jacobian and preconditioner matrices. | D49: false
A50: ooow:<A49>+1 -> 45 | B50: --max-inner-iter-ms-wells | C50: A positive integer value that defines the maximum number of inner iterations for multi-segment wells. | D50: 10
A51: ooow:<A50>+1 -> 46 | B51: --max-pressure-change-ms-wells | C51: A real positive value that defines the maximum relative pressure change for a single iteration of the multi-segment well model. | D51: 200000
A52: ooow:<A51>+1 -> 47 | B52: --max-residual-allowed | C52: A real positive value that sets the absolute maximum tolerance for residuals without cutting the time step size. | D52: 1.0 x 107
A53: ooow:<A52>+1 -> 48 | B53: --max-single-precision-days | C53: A real positive value that set the maximum time step size where single precision floating point arithmetic can be used solving for the linear systems of equations. | D53: 20.0
A54: ooow:<A53>+1 -> 49 | B54: --max-strict-iter | C54: A positive integer that sets the maximum number of Newton iterations before relaxed tolerances are used for the CNV convergence criterion. | D54: 8
A55: ooow:<A54>+1 -> 50 | B55: --max-welleq-iter | C55: A positive integer that defines the maximum number of iterations to determine the solution to the well equations. | D55: 30
A56: ooow:<A55>+1 -> 51 | B56: --milu-variant | C56: A defined character string that specifies which variant of the modified-ILU preconditioner ought to be used. Possible variants are: The default is ILU | D56: ILU
A57: ooow:<A56>+1 -> 52 | B57: --newton-max-relax | C57: A real positive value that sets the maximum relaxation factor of a Newton iteration used by the simulator. | D57: 0.5
A58: ooow:<A57>+1 -> 53 | B58: --newton-relaxation-type | C58: A character string that defines the type of relaxation used in Newton’s method., default is dampen. | D58: dampen
A59: ooow:<A58>+1 -> 54 | B59: --output-dir | C59: A character string that defines the directory to which OPM Flow is to write the commercial simulator compatible output files (restart, summary files etc.). The default value results in the files be written to the same directory as the input file. | D59: “”
A60: ooow:<A59>+1 -> 55 | B60: --output-interval | C60: A positive integer that specifies the number of report steps between two consecutive writes of restart data. | D60: 1
A61: ooow:<A60>+1 -> 56 | B61: --output-mode | C61: A character string that defines the output to *.PRT and *.DBG files: For example to just output logging information use: --output-mode=log or --output-mode=false | D61: all
A62: ooow:<A61>+1 -> 57 | B62: --parameter-file | C62: A character string that defines the name of a parameter file which contains the simulator’s set of run-time parameters, as listed in this table. | D62: “”
A63: ooow:<A62>+1 -> 58 | B63: --preconditioner-add-well-contributions | C63: A Boolean value set to true or false that switches on (true) or off (false) the influences of wells between cells for the preconditioner matrix only. Note this parameter is missing from the help when executing: flow -h | D63: false
A64: ooow:<A63>+1 -> 59 | B64: --pri-var-oscilation-threshold | C64: A real positive value that defines the threshold value for the primary variable switching conditions after its meaning has switched to hinder oscillations. | D64: 1 x 10-5
A65: ooow:<A64>+1 -> 60 | B65: --print-parameters | C65: A positive integer value that request that the run time parameters be printed at the start of the run: | D65: 2
A66: ooow:<A65>+1 -> 61 | B66: --print-properties | C66: A positive integer value that request that the compile time parameters be printed at the start of the run: | D66: 2
A67: ooow:<A66>+1 -> 62 | B67: --scale-linear-system | C67: A Boolean value set to true or false that switches on (true) or off (false) the scaling of linear system of equations according to the equation scale and primary variable types. | D67: false
A68: ooow:<A67>+1 -> 63 | B68: --solve-welleq-initially | C68: A Boolean value set to true or false that switches on (true) or off (false) the solving of the well equations as a pre-processing step. Note that the well equations are always added to the full system and solved until converged. | D68: true
A69: ooow:<A68>+1 -> 64 | B69: --solver-growth-factor | C69: A real positive value that specifies the allowed value a time step can be increased by, subject to the maximum allowable time step size set by the --flow-solver-max-time-step-in-days parameter. For example, if the current time step has converged at 10 days and --flow-solver-growth-factor is set to the default value, then the next time step will be 2.0 * 10 days, that is at 20 days. | D69: 2.0
A70: ooow:<A69>+1 -> 65 | B70: --solver-max-growth | C70: A real positive value that specifies the maximum allowed value a time step can be increased by after a report time step. subject to the maximum allowable time step size set by the --flow-solver-max-time-step-in-days parameter. | D70: 3.0
A71: ooow:<A70>+1 -> 66 | B71: --solver-max-restarts | C71: A positive integer that defines the number of allowed consecutive restarts (or time step chops) before the simulation is terminated. | D71: 10
A72: ooow:<A71>+1 -> 67 | B72: --solver-max-time-step-in-days | C72: A real positive double precision value that specifies the maximum allowed time step size in days. | D72: 365
A73: ooow:<A72>+1 -> 68 | B73: --solver-restart-factor | C73: A real positive double precision value that sets the time step chop factor of the time step after a convergence failure. For example, if the current non-convergent time step is 30 days and --flow-solver-restart-factor is set to the default value, then the time step will be repeated using 0.33 * 30 days as the time step, that is 9.9 days. | D73: 0.33
A74: ooow:<A73>+1 -> 69 | B74: --solver-verbosity | C74: A positive integer that specifies the "chattiness" of the non-linear solver. | D74: 1
A75: ooow:<A74>+1 -> 70 | B75: --system-strategy | C75: A character string that defines the strategy for reformulating and scaling linear system of equations and is set to one of the following: | D75: none
A76: ooow:<A75>+1 -> 71 | B76: --threads-per-process | C76: A positive integer value that stipulates the maximum number of threads to be instantiated per process ('-1' means 'automatic'). | D76: 1
A77: ooow:<A76>+1 -> 72 | B77: --time-step-after-event-in-days | C77: A real double precision value that sets maximum allowed time step after an event; for example, when a well is open or closed etc. The default value of -1 means that events to do effect the time stepping. | D77: -1
A78: ooow:<A77>+1 -> 73 | B78: --time-step-control | C78: A character string that defines the time stepping control algorithm and is set to one of the following: | D78: pid
A79: ooow:<A78>+1 -> 74 | B79: --time-step-control-decay-rate | C79: A real positive value that specifies the decay rate a time step can be decreased by after the number of target iterations has been exceeded | D79: 0.75
A80: ooow:<A79>+1 -> 75 | B80: --time-step-control-file-name | C80: A character string that specifies a filename where time steps are specified. The default is the character string timesteps For instance time steps can be generated by the ecl_summary application in libecl as per the following UNIX command line: path_to_libecl_applications/ecl_summary DECK TIME > filename Where: DECK is the name of the data deck you want to get the time steps from, TIME tells the application to return the timing for the run, and "filename" is the name of the file the times are piped to. | D80: timesteps
A81: ooow:<A80>+1 -> 76 | B81: --time-step-control-growth-rate | C81: A real positive value that specifies the growth rate of the time step size of the number of target iterations is undercut. | D81: 1.25
A82: ooow:<A81>+1 -> 77 | B82: --time-step-control-target-iterations | C82: A positive integer that defines the number of linear iterations which the time step control scheme should aim for (if applicable). | D82: 30
A83: ooow:<A82>+1 -> 78 | B83: --time-step-control-target-newton-iterations | C83: A positive integer that specifies the number of Newton iterations which the time step control scheme should aim for (if applicable). | D83: 8
A84: ooow:<A83>+1 -> 79 | B84: --time-step-control-tolerance | C84: A real double precision value that sets the tolerance for PID (only used with the pid and pid+ options defined by the --time-step-control option). | D84: 0.1
A85: ooow:<A84>+1 -> 80 | B85: --time-step-verbosity | C85: A positive integer that specifies the "chattiness" during the time integration. | D85: 1
A86: ooow:<A85>+1 -> 81 | B86: --tolerance-cnv | C86: A real positive double precision value that specifies the maximum non-linear tolerance error. This is the local convergence tolerance (maximum of local saturation errors). | D86: 0.01
A87: ooow:<A86>+1 -> 82 | B87: --tolerance-cnv-relaxed | C87: A real positive value that defines the relaxed local convergence tolerance that applies for iterations after the iterations with the strict tolerance. | D87: 1.0 x 109
A88: ooow:<A87>+1 -> 83 | B88: --tolerance-mb | C88: A real positive double precision value that sets the maximum mass balance error, that is the tolerated mass balance error relative to total mass present. | D88: 1.0 x 106
A89: ooow:<A88>+1 -> 84 | B89: --tolerance-pressure-ms-wells | C89: A real positive double precision value that specifies the tolerance for the pressure equations for multi-segment wells. | D89: 1000
A90: ooow:<A89>+1 -> 85 | B90: --tolerance-well-control | C90: A real positive double precision value that sets the maximum tolerance for the well control equations. | D90: 1.0 x 10-7
A91: ooow:<A90>+1 -> 86 | B91: --tolerance-wells | C91: A real positive double precision value that defines the maximum non-linear error for the well equations. | D91: 0.0001
A92: ooow:<A91>+1 -> 87 | B92: -update-equations-scaling | C92: A Boolean value set to true or false that switches on (true) or off (false) the updating of the scaling factors for mass balance equations during the simulation. | D92: false
A93: ooow:<A92>+1 -> 88 | B93: --use-amg | C93: A Boolean value set to true or false that if set to true OPM Flow will use AMG as the linear solver's preconditioner | D93: false
A94: ooow:<A93>+1 -> 89 | B94: --use-cpr | C94: A Boolean value set to true or false that when set to true OPM Flow will use CPR as the linear solver's preconditioner | D94: false
A95: ooow:<A94>+1 -> 90 | B95: --use-gmres | C95: A Boolean value set to true or false that when set to true OPM Flow will use Generalized Minimal Residual (“GMRES”) solver instead of Biconjugate Gradient Stabilized (“BiCGSTAB”) as the linear solver within the Newton iterations. | D95: false
A96: ooow:<A95>+1 -> 91 | B96: --use-inner-iterations-ms-wells | C96: A Boolean value set to true or false that when set to true the simulator will use nested iterations for multi-segment wells. | D96: true
A97: ooow:<A96>+1 -> 92 | B97: --use-multisegment-well | C97: A Boolean value set to true or false that when set to true the simulator will use the well model for multi-segment wells instead of the one for single-segment wells. | D97: false
A98: ooow:<A97>+1 -> 93 | B98: --use-update-stabilization | C98: A Boolean value set to true or false that switches on (true) or off (false) the stabilized Newton option. This option may improve convergence for some cases. | D98: true
A99: ooow:<A98> -> 93 | B99: VTK Graphics Command Line Parameters57 Virtualization ToolKit (“VTK”) files used to visualize the 3D results from the model using ParaView, an open-source, multi-platform general purpose data analysis and visualization application (https://www.paraview.org/overview/). For the commercial simulator’s compatible output files OPM’s ResInsight 3D visualization package can be used instead and is specifically tailored for OPM Flow and the commercial simulator.
A100: ooow:<A99>+1 -> 94 | B100: --vtk-write-average-molar-masses | C100: A Boolean value set to true or false that turns on (true) or off (false) the output of the average phase mass in the VTK output files. | D100: false
A101: ooow:<A100>+1 -> 95 | B101: --vtk-write-densities | C101: A Boolean value set to true or false that turns on (true) or off (false) the output of the phase densities to the VTK output files | D101: true
A102: ooow:<A101>+1 -> 96 | B102: --vtk-write-dof-index | C102: A Boolean value set to true or false that turns on (true) or off (false) the output of the tracer concentrations to the VTK output files. | D102: false
A103: ooow:<A102>+1 -> 97 | B103: --vtk-write-ecl-tracer-concentration | C103: A Boolean value set to true or false that turns on (true) or off (false) the output of the index of the degrees of freedom to the VTK output files. | D103: false
A104: ooow:<A103>+1 -> 98 | B104: --vtk-write-extrusion-factor | C104: A Boolean value set to true or false that turns on (true) or off (false) the output of the of the extrusion factor of the degrees of freedom to the VTK output files. | D104: false
A105: ooow:<A104>+1 -> 99 | B105: --vtk-write-filter-velocities | C105: A Boolean value set to true or false that turns on (true) or off (false) the output of the filter velocities of the phases in the VTK output files. | D105: false
A106: ooow:<A105>+1 -> 100 | B106: --vtk-write-fugacities | C106: A Boolean value set to true or false that turns on (true) or off (false) the output of the component fugacities to the VTK output files. | D106: false
A107: ooow:<A106>+1 -> 101 | B107: --vtk-write-fugacity-coeffs | C107: A Boolean value set to true or false that turns on (true) or off (false) the output of the component fugacity coefficients to the VTK output files. | D107: false
A108: ooow:<A107>+1 -> 102 | B108: --vtk-write-gas-dissolution-factor | C108: A Boolean value set to true or false that turns on (true) or off (false) the output of the gas dissolution factor (Rs) of the observed oil to the VTK output files. | D108: false
A109: ooow:<A108>+1 -> 103 | B109: --vtk-write-gas-formation-volume-factor | C109: A Boolean value set to true or false that turns on (true) or off (false) the output of the gas formation volume factor (Bg) to the VTK output files. | D109: false
A110: ooow:<A109>+1 -> 104 | B110: --vtk-write-gas-saturation-pressure | C110: A Boolean value set to true or false that turns on (true) or off (false) the output of the saturation pressure of gas (Pg,sat) to the VTK output files’ | D110: false
A111: ooow:<A110>+1 -> 105 | B111: --vtk-write-intrinsic-permeabilities | C111: A Boolean value set to true or false that turns on (true) or off (false) the output of the intrinsic permeability to the VTK output files. | D111: false
A112: ooow:<A111>+1 -> 106 | B112: --vtk-write-mass-fractions | C112: A Boolean value set to true or false that turns on (true) or off (false) the output of the mass fractions to the VTK output files. | D112: false
A113: ooow:<A112>+1 -> 107 | B113: --vtk-write-mobilities | C113: A Boolean value set to true or false that turns on (true) or off (false) the output of the phase mobilities to the VTK output files. | D113: false
A114: ooow:<A113>+1 -> 108 | B114: --vtk-write-molarities | C114: A Boolean value set to true or false that turns on (true) or off (false) the output of the component molarities to the VTK output files. | D114: false
A115: ooow:<A114>+1 -> 109 | B115: --vtk-write-mole-fractions | C115: A Boolean value set to true or false that turns on (true) or off (false) the output of the mole fractions to the VTK output files. | D115: true
A116: ooow:<A115>+1 -> 110 | B116: --vtk-write-oil-formation-volume-factor | C116: A Boolean value set to true or false that turns on (true) or off (false) the output of the oil formation volume factor (Bo) to the VTK output files. | D116: false
A117: ooow:<A116>+1 -> 111 | B117: --vtk-write-oil-saturation-pressure | C117: A Boolean value set to true or false that turns on (true) or off (false) the output of the saturation pressure of oil (Po,sat) to the VTK output files. | D117: false
A118: ooow:<A117>+1 -> 112 | B118: --vtk-write-oil-vaporization-factor | C118: A Boolean value set to true or false that turns on (true) or off (false) the output of the oil vaporization factor (Rv) of the observed gas to the VTK output files. | D118: false
A119: ooow:<A118>+1 -> 113 | B119: --vtk-write-porosity | C119: A Boolean value set to true or false that turns on (true) or off (false) the output of the porosity array to the VTK output files. | D119: true
A120: ooow:<A119>+1 -> 114 | B120: --vtk-write-potential-gradients | C120: A Boolean value set to true or false that turns on (true) or off (false) the output of the phase pressure potential gradients to the VTK output files. | D120: false
A121: ooow:<A120>+1 -> 115 | B121: --vtk-write-pressures | C121: A Boolean value set to true or false that turns on (true) or off (false) the output of the phase pressures to the VTK output files. | D121: true
A122: ooow:<A121>+1 -> 116 | B122: --vtk-write-primary-vars | C122: A Boolean value set to true or false that turns on (true) or off (false) the output of the primary variables to the VTK output files. | D122: false
A123: ooow:<A122>+1 -> 117 | B123: --vtk-write-primary-vars-meaning | C123: A Boolean value set to true or false that turns on (true) or off (false) the output of the how the primary variables should be interpreted to the VTK output files. | D123: false
A124: ooow:<A123>+1 -> 118 | B124: --vtk-write-process-rank | C124: A Boolean value set to true or false that turns on (true) or off (false) the output of the MPI process rank to the VTK output files. | D124: false
A125: ooow:<A124>+1 -> 119 | B125: --vtk-write-relative-permeabilities | C125: A Boolean value set to true or false that turns on (true) or off (false) the output of the phase relative permeabilities to the VTK output files. | D125: true
A126: ooow:<A125>+1 -> 120 | B126: --vtk-write-saturated-gas-oil-vaporization-factor | C126: A Boolean value set to true or false that turns on (true) or off (false) the output of the oil vaporization factor (Rv,sat) of oil saturated gas to the VTK output files. | D126: false
A127: ooow:<A126>+1 -> 121 | B127: --vtk-write-saturated-oil-gas-dissolution-factor | C127: A Boolean value set to true or false that turns on (true) or off (false) the output of the gas dissolution factor (Rs,sat) of gas saturated oil to the VTK output files. | D127: false
A128: ooow:<A127>+1 -> 122 | B128: --vtk-write-saturation-ratios | C128: A Boolean value set to true or false that turns on (true) or off (false) the output of the ratio of the actually and maximum dissolved component of the mixture to the VTK output files | D128: false
A129: ooow:<A128>+1 -> 123 | B129: --vtk-write-saturations | C129: A Boolean value set to true or false that turns on (true) or off (false) the output of the phase saturations to the VTK output files. | D129: true
A130: ooow:<A129>+1 -> 124 | B130: --vtk-write-temperature | C130: A Boolean value set to true or false that turns on (true) or off (false) the output of the temperature array to the VTK output files. | D130: true
A131: ooow:<A130>+1 -> 125 | B131: --vtk-write-total-mass-fractions | C131: A Boolean value set to true or false that turns on (true) or off (false) the output of the total mass fractions to the VTK output files. | D131: false
A132: ooow:<A131>+1 -> 126 | B132: --vtk-write-total-mole-fractions | C132: A Boolean value set to true or false that turns on (true) or off (false) the output of the total mole fractions to the VTK output files. | D132: false
A133: ooow:<A132>+1 -> 127 | B133: --vtk-write-viscosities | C133: A Boolean value set to true or false that turns on (true) or off (false) the output of the component phase viscosities to the VTK output files. | D133: false
A134: ooow:<A133>+1 -> 128 | B134: --vtk-write-water-formation-volume-factor | C134: A Boolean value set to true or false that turns on (true) or off (false) the output of the oil formation volume factor (Bo) to the VTK output files. | D134: false
A135: Notes:

Sheet: Table2039
A1: OPM Flow 2018-10 Command Line Options
A2: No. | B2: Variable Name | C2: Description | D2: Default
B3: General eWoms/ebos Command Line Parameters
A4: 1 | B4: -h or --help | C4: A character string that causes OPM Flow to print a help message that gives a brief description of the available command line parameters. | D4: N/A
A5: ooow:<A4>+1 -> 2 | B5: --dbph-max-rel | C5: A real positive value that sets maximum relative change of the bottom-hole pressure in a single iteration | D5: 1.0
A6: ooow:<A5>+1 -> 3 | B6: --dp-max-rel | C6: A real positive double precision value that sets the maximum allowed relative change of pressure per iteration. | D6: 0.3
A7: ooow:<A6>+1 -> 4 | B7: --ds-max | C7: A real positive double precision value that sets the maximum allowed change in saturation per iteration. | D7: 0.2
A8: ooow:<A7>+1 -> 5 | B8: --dwell-fraction-max | C8: A real positive double precision value that sets the maximum allowed change in well’s volume fraction per iteration. | D8: 0.2
A9: ooow:<A8>+1 -> 6 | B9: --ecl-deck-file-name | C9: A character string that defines the name of the OPM Flow input file which contains the simulator’s ECLIPSE formatted input deck to be simulated. | D9: N/A
A10: ooow:<A9>+1 -> 7 | B10: --ecl-output-double-precision | C10: A Boolean value set to true or false that switches on (true) or off (false) double precision in restart files. Useful for 'perfect' restarts. | D10: false
A11: ooow:<A10>+1 -> 8 | B11: --ecl-output-interval | C11: An integer value defining the number of report steps that ought to be skipped between two writes of restart files results. | D11: -1
A12: ooow:<A11>+1 -> 9 | B12: --enable-adaptive-time-stepping | C12: A Boolean value set to true or false that that turns on (true) or off (false) adaptive time stepping. If set to false the report time steps provided by the input deck are used. | D12: true
A13: ooow:<A12>+1 -> 10 | B13: --enable-async-ecl-output | C13: A Boolean value set to true or false that sets the output mode to be asynchronously (true), letting the simulator continue computing the next time step while writing results to restart and summary files. | D13: true
A14: ooow:<A13>+1 -> 11 | B14: --enable-async-vtk-output | C14: A Boolean value set to true or false that sets the output mode to be asynchronously (true), letting the simulator continue computing the next time step while writing results to the VTK output files. | D14: true
A15: ooow:<A14>+1 -> 12 | B15: --enable-dry-run | C15: A Boolean value set to true or false that specifies if the simulation should actually run, (true) or just check the input deck (false). This option is equivalent to activating the NOSIM keyword in the RUNSPEC section of the input deck (see section Error: Reference source not foundError: Reference source not found). | D15: true
A16: ooow:<A15>+1 -> 13 | B16: --enable-ecl-output | C16: A Boolean value set to true or false to write the binary output which is compatible with the ECLIPSE commercial simulator (restart and summary files). | D16: true
A17: ooow:<A16>+1 -> 14 | B17: --enable-opm-rst-file | C17: A Boolean value set to true or false to write OPM specific data sets to the commercial simulators restart file to enable restart of an OPM Flow run (true), or not to write the data (false). | D17: true
A18: ooow:<A17>+1 -> 15 | B18: --enable-storage-cache | C18: A Boolean value set to true or false that turns on (true) or off (false) storing previous storage terms and avoid re-calculating them. | D18: true
A19: ooow:<A18>+1 -> 16 | B19: --enable-terminal-output | C19: A Boolean value set to true or false that turns on (true) or off (false) high-level information about the simulation's progress to the terminal | D19: true
A20: ooow:<A19>+1 -> 17 | B20: --enable-tuning | C20: A Boolean value set to true or false that that instructs OPM Flow to read the time stepping parameters from the Error: Reference source not foundkeyword in the input deck, if set to true. Note that only the first record of the TUNING keyword is processed. | D20: false
A21: ooow:<A20>+1 -> 18 | B21: --enable-vtk-output | C21: A Boolean value set to true or false that turns on (true) or off (false) a global switch for writing VTK files. | D21: false
A22: ooow:<A21>+1 -> 19 | B22: --enable-write-all-solutions | C22: A Boolean value set to true or false that turns on (true) or off (false) the writing of all solutions to disk instead of only the ones for the report steps. | D22: false
A23: ooow:<A22> -> 19 | B23: OPM Flow Specific Command Line Parameters
A24: 20 | B24: --flow-linear-solver-verbosity | C24: A positive integer value that defines the output from linear solver: | D24: 0
A25: ooow:<A24>+1 -> 21 | B25: --flow-newton-max-iterations | C25: A positive integer that defines the maximum number of Newton iterations per time step used by the simulator. | D25: 20
A26: 22 | B26: --flow-newton-min-iterations | C26: A real positive value that sets the minimum number of Newton iterations per time step used by the simulator. | D26: 1
A27: ooow:<A26> -> 22 | B27: General eWoms/ebos Command Line Parameters
A28: ooow:<A27>+1 -> 23 | B28: --force-disable-fluid-in-place-output | C28: A Boolean value set to true or false that instructs OPM Flow to not to print the Fluid In-Place report after each report time step (true) or not (false). | D28: false
A29: ooow:<A28>+1 -> 24 | B29: --full-time-step-initially | C29: A Boolean value set to true or false that instructs OPM Flow to always attempt to finish a report step using a single time step (true) or not (false). | D29: false
A30: ooow:<A29>+1 -> 25 | B30: --ilu-fillin-level | C30: A positive integer value that sets the fill in level for the ILU preconditioner. | D30: 0
A31: ooow:<A30>+1 -> 26 | B31: --ilu-redblack | C31: A Boolean value set to true or false that instructs OPM Flow to use red-black partitioning for the ILU preconditioner. (true) or not (false). | D31: false
A32: ooow:<A31>+1 -> 27 | B32: --ilu-relaxation | C32: A real positive double precision value that sets the relaxation factor of the linear solver's ILU preconditioner | D32: 0.9
A33: ooow:<A32>+1 -> 28 | B33: --ilu-reorder-spheres | C33: A Boolean value set to true or false specifies OPM Flow to reorder the entries of the matrix in the red-black ILU preconditioner in spheres starting at an edge (true) or not (false) If false the original ordering is preserved in each color. Otherwise try to ensure D4 ordering (in a 2D structured grid, the diagonal elements are consecutive). | D33: false
A34: ooow:<A33>+1 -> 29 | B34: --initial-time-step-in-days | C34: A real double precision value that sets the size of initial time step in days. | D34: 1.0
A35: ooow:<A34>+1 -> 30 | B35: --linear-solver-ignore-convergence-failure | C35: A Boolean value set to true or false that if set to true convergences failures in the linear solver are ignored. This option should be used with care, as the results may be unreliable. | D35: false
A36: ooow:<A35>+1 -> 31 | B36: --linear-solver-max-iter | C36: A positive integer value that defines the maximum number of linear iterations. | D36: 200
A37: ooow:<A36>+1 -> 32 | B37: --linear-solver-reduction | C37: A real positive double precision value that sets the tolerance for the linear solver. The linear solver convergences when the residual is reduced sufficiently. | D37: 0.01
A38: ooow:<A37>+1 -> 33 | B38: --linear-solver-require-full-sparsity-pattern | C38: A Boolean value set to true or false that if set to true the simulator will produce the full sparsity pattern for the linear solver. | D38: false
A39: ooow:<A38>+1 -> 34 | B39: --linear-solver-restart | C39: A positive integer value that sets the number of iterations after which GMRES is restarted. | D39: 40
A40: ooow:<A39>+1 -> 35 | B40: --matrix-add-well-contributions | C40: A Boolean value set to true or false that if set to true explicitly specifies the influences of wells between cells in the Jacobian and preconditioner matrices. | D40: false
A41: ooow:<A40>+1 -> 36 | B41: --max-inner-iter-ms-wells | C41: A positive integer value that defines the maximum number of inner iterations for multi-segment wells. | D41: 10
A42: ooow:<A41>+1 -> 37 | B42: --max-pressure-change-ms-wells | C42: A real positive value that defines the maximum relative pressure change for a single iteration of the multi-segment well model. | D42: 200000
A43: ooow:<A42>+1 -> 38 | B43: --max-residual-allowed | C43: A real positive value that sets the absolute maximum tolerance for residuals without cutting the time step size. | D43: 1.0 x 107
A44: ooow:<A43>+1 -> 39 | B44: --max-single-precision-days | C44: A real positive value that set the maximum time step size where single precision floating point arithmetic can be used solving for the linear systems of equations. | D44: 20.0
A45: ooow:<A44>+1 -> 40 | B45: --max-strict-iter | C45: A positive integer that sets the maximum number of Newton iterations before relaxed tolerances are used for the CNV convergence criterion. | D45: 8
A46: ooow:<A45>+1 -> 41 | B46: --max-welleq-iter | C46: A positive integer that defines the maximum number of iterations to determine the solution to the well equations. | D46: 15
A47: ooow:<A46>+1 -> 42 | B47: --milu-variant | C47: A defined character string that specifies which variant of the modified-ILU preconditioner ought to be used. Possible variants are: The default is ILU | D47: ILU
A48: ooow:<A47>+1 -> 43 | B48: --newton-max-relax | C48: A real positive value that sets the maximum relaxation factor of a Newton iteration used by the simulator. | D48: 0.5
A49: ooow:<A48>+1 -> 44 | B49: --newton-relaxation-type | C49: A character string that defines the type of relaxation used in Newton’s method., default is dampen. | D49: dampen
A50: ooow:<A49>+1 -> 45 | B50: --output-dir | C50: A character string that defines the directory to which OPM Flow to write the ECLIPSE compatible output files (restart and summary files). | D50: N/A
A51: ooow:<A50>+1 -> 46 | B51: --output-interval | C51: A positive integer that specifies the number of report steps between two consecutive writes of restart data. | D51: 1
A52: ooow:<A51>+1 -> 47 | B52: --output-mode | C52: A character string that defines the output to *.PRT and *.DBG files: For example to just output logging information use: --output-mode=log or --output-mode=false | D52: all
A53: ooow:<A52>+1 -> 48 | B53: --parameter-file | C53: A character string that defines the name of a parameter file which contains the simulator’s set of run-time parameters, as listed in this table. | D53: N/A
A54: ooow:<A53>+1 -> 49 | B54: --preconditioner-add-well-contributions | C54: A Boolean value set to true or false that switches on (true) or off (false) the influences of wells between cells for the preconditioner matrix only. | D54: false
A55: ooow:<A54>+1 -> 50 | B55: --pri-var-oscilation-threshold | C55: A real positive value that defines the threshold value for the primary variable switching conditions after its meaning has switched to hinder oscilations. | D55: 1 x 10-5
A56: ooow:<A55>+1 -> 51 | B56: --print-parameters | C56: A positive integer value that request that the run time parameters be printed at the start of the run: | D56: 2
A57: ooow:<A56>+1 -> 52 | B57: --print-properties | C57: A positive integer value that request that the compile time parameters be printed at the start of the run: | D57: 2
A58: ooow:<A57>+1 -> 53 | B58: --solve-welleq-initially | C58: A Boolean value set to true or false that switches on (true) or off (false) the solving of the well equations as a pre-processing step. Note that the well equations are always added to the full system and solved until converged. | D58: true
A59: ooow:<A58>+1 -> 54 | B59: --solver-growth-factor | C59: A real positive value that specifies the allowed value a time step can be increased by, subject to the maximum allowable time step size set by the --flow-solver-max-time-step-in-days parameter. For example, if the current time step has converged at 10 days and --flow-solver-growth-factor is set to the default value, then the next time step will be 2.0 * 10 days, that is at 20 days. | D59: 2.0
A60: ooow:<A59>+1 -> 55 | B60: --solver-max-growth | C60: A real positive value that specifies the maximum allowed value a time step can be increased by after a report time step. subject to the maximum allowable time step size set by the --flow-solver-max-time-step-in-days parameter. | D60: 3.0
A61: ooow:<A60>+1 -> 56 | B61: --solver-max-restarts | C61: A positive integer that defines the number of allowed consecutive restarts (or time step chops) before the simulation is terminated. | D61: 10
A62: ooow:<A61>+1 -> 57 | B62: --solver-max-time-step-in-days | C62: A real positive double precision value that specifies the maximum allowed time step size in days. | D62: 365
A63: ooow:<A62>+1 -> 58 | B63: --solver-restart-factor | C63: A real positive double precision value that sets the time step chop factor of the time step after a convergence failure. For example, if the current non-convergent time step is 30 days and --flow-solver-restart-factor is set to the default value, then the time step will be repeated using 0.33 * 30 days as the time step, that is 9.9 days. | D63: 0.33
A64: ooow:<A63>+1 -> 59 | B64: --solver-verbosity | C64: A positive integer that specifies the "chattiness" of the non-linear solver. | D64: 1
A65: ooow:<A64>+1 -> 60 | B65: --threads-per-process | C65: A positive integer value that stipulates the maximum number of threads to be instantiated per process ('-1' means 'automatic'). | D65: 1
A66: ooow:<A65>+1 -> 61 | B66: --time-step-after-event-in-days | C66: A real double precision value that sets maximum allowed time step after an event; for example, when a well is open or closed etc. The default value of -1 means that events to do effect the time stepping. | D66: -1
A67: ooow:<A66>+1 -> 62 | B67: --time-step-control | C67: A character string that defines the time stepping control algorithm and is set to one of the following: | D67: pid
A68: ooow:<A67>+1 -> 63 | B68: --time-step-control-decay-rate | C68: A real positive value that specifies the decay rate a time step can be decreased by after the number of target iterations has been exceeded | D68: 0.75
A69: ooow:<A68>+1 -> 64 | B69: --time-step-control-file-name | C69: A character string that specifies a filename where time steps are specified. The default is the character string timesteps For instance generated by the ecl_summary application in libecl as per the following UNIX command line: path_to_libecl_applications/ecl_summary DECK TIME > filename Where: DECK is the name of the data deck you want to get the time steps from, TIME tells the application to return the timing for the run, and "filename" is the name of the file the times are piped to. | D69: timesteps
A70: ooow:<A69>+1 -> 65 | B70: --time-step-control-growth-rate | C70: A real positive value that specifies the growth rate of the time step size of the number of target iterations is undercut. | D70: 1.25
A71: ooow:<A70>+1 -> 66 | B71: --time-step-control-target-iterations | C71: A positive integer that defines the number of linear iterations which the time step control scheme should aim for (if applicable). | D71: 30
A72: ooow:<A71>+1 -> 67 | B72: --time-step-control-target-newton-iterations | C72: A positive integer that specifies the number of Newton iterations which the time step control scheme should aim for (if applicable). | D72: 8
A73: ooow:<A72>+1 -> 68 | B73: --time-step-control-tolerance | C73: A real double precision value that sets the tolerance for PID (only used with the pid and pid+ options defined by the --flow-timestep.control option). | D73: 0.1
A74: ooow:<A73>+1 -> 69 | B74: --time-step-verbosity | C74: A positive integer that specifies the "chattiness" during the time integration. | D74: 1
A75: ooow:<A74>+1 -> 70 | B75: --tolerance-cnv | C75: A real positive double precision value that specifies the maximum non-linear tolerance error. This is the local convergence tolerance (maximum of local saturation errors). | D75: 0.01
A76: ooow:<A75>+1 -> 71 | B76: --tolerance-cnv-relaxed | C76: A real positive value that defines the relaxed local convergence tolerance that applies for iterations after the iterations with the strict tolerance. | D76: 1.0 x 109
A77: ooow:<A76>+1 -> 72 | B77: --tolerance-mb | C77: A real positive double precision value that sets the maximum mass balance error, that is the tolerated mass balance error relative to total mass present. | D77: 1.0 x 105
A78: ooow:<A77>+1 -> 73 | B78: --tolerance-pressure-ms-wells | C78: A real positive double precision value that specifies the tolerance for the pressure equations for multi-segment wells. | D78: 1000
A79: ooow:<A78>+1 -> 74 | B79: --tolerance-well-control | C79: A real positive double precision value that sets the maximum tolerance for the well control equations. | D79: 1.0 x 10-7
A80: ooow:<A79>+1 -> 75 | B80: --tolerance-wells | C80: A real positive double precision value that defines the maximum non-linear error for the well equations. | D80: 0.0001
A81: ooow:<A80>+1 -> 76 | B81: -update-equations-scaling | C81: A Boolean value set to true or false that switches on (true) or off (false) the updating of the scaling factors for mass balance equations during the simulation. | D81: false
A82: ooow:<A81>+1 -> 77 | B82: --use-amg | C82: A Boolean value set to true or false that if set to true OPM Flow will use AMG as the linear solver's preconditioner | D82: false
A83: ooow:<A82>+1 -> 78 | B83: --use-cpr | C83: A Boolean value set to true or false that when set to true OPM Flow will use CPR as the linear solver's preconditioner | D83: false
A84: ooow:<A83>+1 -> 79 | B84: --use-gmres | C84: A Boolean value set to true or false that when set to true OPM Flow will use GMRes instead of BiCGStab as linear solver within the Newton iterations. | D84: false
A85: ooow:<A84>+1 -> 80 | B85: --use-inner-iterations-ms-wells | C85: A Boolean value set to true or false that when set to true the simulator will use nested iterations for multi-segment wells. | D85: true
A86: ooow:<A85>+1 -> 81 | B86: --use-multisegment-well | C86: A Boolean value set to true or false that when set to true the simulator will use the well model for multi-segment wells instead of the one for single-segment wells. | D86: false
A87: ooow:<A86>+1 -> 82 | B87: --use-update-stabilization | C87: A Boolean value set to true or false that switches on (true) or off (false) the stabilized Newton option. This option may improve convergence for some cases. | D87: true
A88: ooow:<A87> -> 82 | B88: VTK Graphics Command Line Parameters60 Virtualization ToolKit (“VTK”) files used to visualize the 3D results from the model using ParaView, an open-source, multi-platform general purpose data analysis and visualization application (https://www.paraview.org/overview/). For ECLIPSE compatible output files OPMS’s ResInsight 3D visualization package can be used which is specifically tailored for OPM Flow and the commercial simulator.
A89: ooow:<A88>+1 -> 83 | B89: --vtk-write-average-molar-masses | C89: A Boolean value set to true or false that turns on (true) or off (false) the output of the average phase mass in the VTK output files. | D89: false
A90: ooow:<A89>+1 -> 84 | B90: --vtk-write-densities | C90: A Boolean value set to true or false that turns on (true) or off (false) the output of the phase densities to the VTK output files | D90: true
A91: ooow:<A90>+1 -> 85 | B91: --vtk-write-dof-index | C91: A Boolean value set to true or false that turns on (true) or off (false) the output of the index of the degrees of freedom to the VTK output files. | D91: false
A92: ooow:<A91>+1 -> 86 | B92: --vtk-write-extrusion-factor | C92: A Boolean value set to true or false that turns on (true) or off (false) the output of the of the extrusion factor of the degrees of freedom to the VTK output files. | D92: false
A93: ooow:<A92>+1 -> 87 | B93: --vtk-write-filter-velocities | C93: A Boolean value set to true or false that turns on (true) or off (false) the output of the filter velocities of the phases in the VTK output files. | D93: false
A94: ooow:<A93>+1 -> 88 | B94: --vtk-write-fugacities | C94: A Boolean value set to true or false that turns on (true) or off (false) the output of the component fugacities to the VTK output files. | D94: false
A95: ooow:<A94>+1 -> 89 | B95: --vtk-write-fugacity-coeffs | C95: A Boolean value set to true or false that turns on (true) or off (false) the output of the component fugacity coefficients to the VTK output files. | D95: false
A96: ooow:<A95>+1 -> 90 | B96: --vtk-write-gas-dissolution-factor | C96: A Boolean value set to true or false that turns on (true) or off (false) the output of the gas dissolution factor (Rs) of the observed oil to the VTK output files. | D96: false
A97: ooow:<A96>+1 -> 91 | B97: --vtk-write-gas-formation-volume-factor | C97: A Boolean value set to true or false that turns on (true) or off (false) the output of the gas formation volume factor (Bg) to the VTK output files. | D97: false
A98: ooow:<A97>+1 -> 92 | B98: --vtk-write-gas-saturation-pressure | C98: A Boolean value set to true or false that turns on (true) or off (false) the output of the saturation pressure of gas (Pg,sat) to the VTK output files’ | D98: false
A99: ooow:<A98>+1 -> 93 | B99: --vtk-write-intrinsic-permeabilities | C99: A Boolean value set to true or false that turns on (true) or off (false) the output of the intrinsic permeability to the VTK output files. | D99: false
A100: ooow:<A99>+1 -> 94 | B100: --vtk-write-mass-fractions | C100: A Boolean value set to true or false that turns on (true) or off (false) the output of the mass fractions to the VTK output files. | D100: false
A101: ooow:<A100>+1 -> 95 | B101: --vtk-write-mobilities | C101: A Boolean value set to true or false that turns on (true) or off (false) the output of the phase mobilities to the VTK output files. | D101: false
A102: ooow:<A101>+1 -> 96 | B102: --vtk-write-molarities | C102: A Boolean value set to true or false that turns on (true) or off (false) the output of the component molarities to the VTK output files. | D102: false
A103: ooow:<A102>+1 -> 97 | B103: --vtk-write-mole-fractions | C103: A Boolean value set to true or false that turns on (true) or off (false) the output of the mole fractions to the VTK output files. | D103: true
A104: ooow:<A103>+1 -> 98 | B104: --vtk-write-oil-formation-volume-factor | C104: A Boolean value set to true or false that turns on (true) or off (false) the output of the oil formation volume factor (Bo) to the VTK output files. | D104: false
A105: ooow:<A104>+1 -> 99 | B105: --vtk-write-oil-saturation-pressure | C105: A Boolean value set to true or false that turns on (true) or off (false) the output of the saturation pressure of oil (Po,sat) to the VTK output files. | D105: false
A106: ooow:<A105>+1 -> 100 | B106: --vtk-write-oil-vaporization-factor | C106: A Boolean value set to true or false that turns on (true) or off (false) the output of the oil vaporization factor (Rv) of the observed gas to the VTK output files. | D106: false
A107: ooow:<A106>+1 -> 101 | B107: --vtk-write-porosity | C107: A Boolean value set to true or false that turns on (true) or off (false) the output of the porosity array to the VTK output files. | D107: true
A108: ooow:<A107>+1 -> 102 | B108: --vtk-write-potential-gradients | C108: A Boolean value set to true or false that turns on (true) or off (false) the output of the phase pressure potential gradients to the VTK output files. | D108: false
A109: ooow:<A108>+1 -> 103 | B109: --vtk-write-pressures | C109: A Boolean value set to true or false that turns on (true) or off (false) the output of the phase pressures to the VTK output files. | D109: true
A110: ooow:<A109>+1 -> 104 | B110: --vtk-write-primary-vars | C110: A Boolean value set to true or false that turns on (true) or off (false) the output of the primary variables to the VTK output files. | D110: false
A111: ooow:<A110>+1 -> 105 | B111: --vtk-write-primary-vars-meaning | C111: A Boolean value set to true or false that turns on (true) or off (false) the output of the how the primary variables should be interpreted to the VTK output files. | D111: false
A112: ooow:<A111>+1 -> 106 | B112: --vtk-write-process-rank | C112: A Boolean value set to true or false that turns on (true) or off (false) the output of the MPI process rank to the VTK output files. | D112: false
A113: ooow:<A112>+1 -> 107 | B113: --vtk-write-relative-permeabilities | C113: A Boolean value set to true or false that turns on (true) or off (false) the output of the phase relative permeabilities to the VTK output files. | D113: true
A114: ooow:<A113>+1 -> 108 | B114: --vtk-write-saturated-gas-oil-vaporization-factor | C114: A Boolean value set to true or false that turns on (true) or off (false) the output of the oil vaporization factor (Rv,sat) of oil saturated gas to the VTK output files. | D114: false
A115: ooow:<A114>+1 -> 109 | B115: --vtk-write-saturated-oil-gas-dissolution-factor | C115: A Boolean value set to true or false that turns on (true) or off (false) the output of the gas dissolution factor (Rs,sat) of gas saturated oil to the VTK output files. | D115: false
A116: ooow:<A115>+1 -> 110 | B116: --vtk-write-saturation-ratios | C116: A Boolean value set to true or false that turns on (true) or off (false) the output of the ratio of the actually and maximum dissolved component of the mixture to the VTK output files | D116: false
A117: ooow:<A116>+1 -> 111 | B117: --vtk-write-saturations | C117: A Boolean value set to true or false that turns on (true) or off (false) the output of the phase saturations to the VTK output files. | D117: true
A118: ooow:<A117>+1 -> 112 | B118: --vtk-write-temperature | C118: A Boolean value set to true or false that turns on (true) or off (false) the output of the temperature array to the VTK output files. | D118: true
A119: ooow:<A118>+1 -> 113 | B119: --vtk-write-total-mass-fractions | C119: A Boolean value set to true or false that turns on (true) or off (false) the output of the total mass fractions to the VTK output files. | D119: false
A120: ooow:<A119>+1 -> 114 | B120: --vtk-write-total-mole-fractions | C120: A Boolean value set to true or false that turns on (true) or off (false) the output of the total mole fractions to the VTK output files. | D120: false
A121: ooow:<A120>+1 -> 115 | B121: --vtk-write-viscosities | C121: A Boolean value set to true or false that turns on (true) or off (false) the output of the component phase viscosities to the VTK output files. | D121: false
A122: ooow:<A121>+1 -> 116 | B122: --vtk-write-water-formation-volume-factor | C122: A Boolean value set to true or false that turns on (true) or off (false) the output of the oil formation volume factor (Bo) to the VTK output files. | D122: false
A123: Notes:

Sheet: Table2040
A1: OPM Flow 2018-04 Command Line Options
A2: No. | B2: Variable Name | C2: Description | D2: Default
A3: 1 | B3: deck_filename | C3: A character string that defines the name of the OPM Flow input file which contains the simulator’s ECLIPSE formatted input deck to be simulated. | D3: N/A
A4: ooow:<A3>+1 -> 2 | B4: output_ecl | C4: A Boolean value set to true or false that turns on (true) or off (false) output to the .*RST and .*SMRY files. | D4: true
A5: ooow:<A4>+1 -> 3 | B5: output | C5: A character string that defines the output to *.PRT and *.DBG files: For example to just output logging information use: output=log or output=false | D5: all
A6: ooow:<A5>+1 -> 4 | B6: output_dir | C6: Set the directory to which output files are written. | D6: deck location
A7: ooow:<A6>+1 -> 5 | B7: restart_double_si | C7: A Boolean value set to true or false that switches on (true) or off (false) double precision in restart files and stores all restart data in SI units rather than using the unit family (METRIC, FIELD etc.) used in the input deck. The option improves the quality of the restart. | D7: false
A8: ooow:<A7>+1 -> 6 | B8: async_output | C8: A Boolean value set to true or false that sets the output mode to be asynchronously (true), letting the simulator continue computing the next time step while writing results to restart and summary files. | D8: true
A9: ooow:<A8>+1 -> 7 | B9: newton_use_gmres | C9: A Boolean value set to true or false that when set to true OPM Flow will use GMRes instead of BiCGStab as linear solver within the Newton iterations. | D9: false
A10: ooow:<A9>+1 -> 8 | B10: linear_solver_reduction | C10: A real positive double precision value that sets the tolerance for the linear solver. The linear solver convergences when the residual is reduced sufficiently. | D10: 0.01
A11: ooow:<A10>+1 -> 9 | B11: linear_solver_maxiter | C11: A positive integer value that defines the maximum number of linear iterations. | D11: 150
A12: ooow:<A11>+1 -> 10 | B12: linear_solver_verbosity | C12: A positive integer value that defines the output from linear solver: | D12: 0
A13: ooow:<A12>+1 -> 11 | B13: linear_solver_ignoreconvergencefailure | C13: A Boolean value set to true or false that if set to true convergences failures in the linear solver are ignored. This option should be used with care, as the results may be unreliable. | D13: false
A14: ooow:<A13>+1 -> 12 | B14: linear_solver_use_amg | C14: A Boolean value set to true or false that if set to true OPM Flow will use amg as the preconditioner instead of ilu. | D14: false
A15: ooow:<A14>+1 -> 13 | B15: ilu_relaxation | C15: A real positive double precision value that sets the relaxation parameter for the ILU preconditioner. | D15: 0.9
A16: ooow:<A15>+1 -> 14 | B16: ilu_fillin_level | C16: A positive integer value that sets the fill in level for the ILU preconditioner. | D16: 0
A17: ooow:<A16>+1 -> 15 | B17: dp_max_rel | C17: A real positive double precision value that sets the maximum allowed relative change of pressure per iteration. | D17: 0.3
A18: ooow:<A17>+1 -> 16 | B18: ds_max | C18: A real positive double precision value that sets the maximum allowed change in saturation per iteration. | D18: 0.2
A19: ooow:<A18>+1 -> 17 | B19: dr_max_rel | C19: A real positive double precision value that sets the maximum allowed relative change in dissolved gas and vaporized oil per iteration | D19: 1e+09
A20: ooow:<A19>+1 -> 18 | B20: dbhp_max_rel | C20: A real positive double precision value that sets the maximum allowed relative change in BHP per iteration. | D20: 1
A21: ooow:<A20>+1 -> 19 | B21: dwell_fraction_max | C21: A real positive double precision value that sets the maximum allowed change in well’s volume per iteration. | D21: 1e+07
A22: ooow:<A21>+1 -> 20 | B22: tolerance_mb | C22: A real positive double precision value that sets the maximum mass balance error. | D22: 1e-05
A23: ooow:<A22>+1 -> 21 | B23: tolerance_cnv | C23: A real positive double precision value that specifies the maximum non-linear tolerance error. | D23: 0.01
A24: ooow:<A23>+1 -> 22 | B24: tolerance_wells | C24: A real positive double precision value that defines the maximum non-linear error for the well equations. | D24: 0.0001
A25: ooow:<A24>+1 -> 23 | B25: max_strict_iter | C25: A positive integer value that sets the maximum number of non-linear iterations. After this maximum value has been exceeded only the mass balance error is checked. | D25: 8
A26: ooow:<A25>+1 -> 24 | B26: solve_welleq_initially | C26: A Boolean value set to true or false that switches on (true) or off (false) the solving of the well equations as a pre-processing step. Note that the well equations are always added to the full system and solved until converged. | D26: true
A27: ooow:<A26>+1 -> 25 | B27: use_update_stabilization | C27: A Boolean value set to true or false that switches on (true) or off (false) the stabilized Newton option. This option may improve convergence for some cases. | D27: true
A28: ooow:<A27>+1 -> 26 | B28: relax_max | C28: A real positive double precision value that is used to tune the stabilized Newton option. | D28: 0.5
A29: ooow:<A28>+1 -> 27 | B29: relax_type | C29: A character string that sets relaxation type of the stabilized Newton option. | D29: dampen
A30: ooow:<A29>+1 -> 28 | B30: max_iter | C30: A positive integer that sets the maximum number of non-linear iterations. | D30: 10
A31: ooow:<A30>+1 -> 29 | B31: min_iter | C31: A positive integer that sets the minimum number of non-linear iterations. | D31: 1
A32: ooow:<A31>+1 -> 30 | B32: output_terminal | C32: A Boolean value set to true or false that turns on (true) or off (false) output to terminal. | D32: true
A33: ooow:<A32>+1 -> 31 | B33: use_TUNING | C33: A Boolean value set to true or false that that instructs OPM Flow to read the time stepping parameters from the Error: Reference source not foundkeyword in the input deck, if set to true. Note that only the first record of the TUNING keyword is processed. | D33: false
A34: ooow:<A33>+1 -> 32 | B34: timestep.adaptive | C34: A Boolean value set to true or false that that turns on (true) or off (false) adaptive time stepping. If set to false the report time steps provided by the input deck are used. | D34: true
A35: ooow:<A34>+1 -> 33 | B35: solver.restartfactor | C35: A real positive double precision value that sets the time step chop factor of the time step after convergence failure. For example, if the current non-convergent time step is 30 days and solver.restartfactor is set to the default value, then the time step will be repeated using 0.33 * 30 days as the time step, that is 9.9 days. | D35: 0.33
A36: ooow:<A35>+1 -> 34 | B36: timestep.control.maxgrowth | C36: A real positive double precision value that sets the maximum allowed value a time step can be increased by, subject to the maximum allowable time step size set by the timestep.max_timestep_in_days parameter. For example, if the current time step has converged at 10 days and solver.restartfactor is set to the default value, then the next time step will be 3.0 * 10 days, that is at 30 days. | D36: 3
A37: ooow:<A36>+1 -> 35 | B37: timestep.max_timestep_in_days | C37: A real positive double precision value that sets the maximum allowed time step size in days. | D37: 365
A38: ooow:<A37>+1 -> 36 | B38: solver.restart | C38: A positive integer that defines the number of allowed consecutive restarts (or time step chops) before the simulation is terminated. | D38: 10
A39: ooow:<A38>+1 -> 37 | B39: solver.verbose | C39: A Boolean value set to true or false that switches on (true) or off (false) solver specific output. | D39: true
A40: ooow:<A39>+1 -> 38 | B40: timestep.verbose | C40: A Boolean value set to true or false that switches on (true) or off (false) time step specific output. | D40: true
A41: ooow:<A40>+1 -> 39 | B41: timestep.initial_timestep_in_days | C41: A real double precision value that sets the size of initial time step in days. The default value of -1 sets the initial time step to be solver.restartfactor * the length of the first report step. | D41: -1
A42: ooow:<A41>+1 -> 40 | B42: full_timestep_initially | C42: Try to use the report steps as time steps. | D42: false
A43: ooow:<A42>+1 -> 41 | B43: timestep.timestep_in_days_after_event | C43: A real double precision value that sets maximum allowed time step after an event; for example, when a well is open or closed etc. The default value of -1 means that events to do effect the time stepping. | D43: -1
A44: ooow:<A43>+1 -> 42 | B44: timestep.control | C44: A character string that defines the time stepping control algorithm and is set to one of the following: | D44: pid
A45: ooow:<A44>+1 -> 43 | B45: timestep.control.tol | C45: A real double precision value that sets the tolerance for PID (only used with the pid and pid+ options defined by the timestep.control option). | D45: 0.1
A46: ooow:<A45>+1 -> 44 | B46: timestep.control.targetiteration | C46: A positive integer that sets the target number of linear / non-linear iterations. This option can only be only used by pid+iterations and pid+newtoniteration defined by the timestep.control option. | D46: 8
A47: ooow:<A46>+1 -> 45 | B47: timestep.control.filename | C47: A character string that specifies a file name where time steps are specified. For instance generated by the ecl_summary application in libecl as per the following UNIX command line: path_to_libecl_applications/ecl_summary DECK TIME > filename Where: DECK is the name of the data deck you want to get the time steps from, TIME tells the application to return the timing for the run, and "filename" is the name of the file the times are piped to.
A48: Notes: