Sheet: Table108
A1: E | B1: I | C1: P | D1: C
A2: Equinor ASA | F2: OPM Flow Reference Manual

Sheet: Table5
A1: O | B1: P | C1: M | D1: OPEN POROUS MEDIA
A2: OPM Flow Reference Manual(2023-04) | E2: Revision: Rev-0

Sheet: Table109
A1: A | B1: B | C1: C | D1: D | E1: E | F1: F | G1: G | H1: H | I1: I | J1: J | K1: E | L1: L | M1: M | N1: N | O1: O | P1: P | Q1: Q | R1: R | S1: S | T1: T | U1: U | V1: V | W1: W | X1: X | Y1: Y | Z1: Z

Sheet: Table1
A1: O | B1: P | C1: M | D1: OPEN POROUS MEDIA
A2: OPM Flow Reference Manual(2023-04) | E2: Revision: Rev-0

Sheet: Table1884
A1: O | B1: P | C1: M | D1: OPEN POROUS MEDIA
A2: OPM Flow Reference Manual(2023-04) | E2: Revision: Rev-0

Sheet: Table1885
A1: O | B1: P | C1: M | D1: OPEN POROUS MEDIA
A2: OPM Flow Reference Manual(2023-04) - | E2: Revision: Rev-0

Sheet: Table1886
A1: O | B1: P | C1: M | D1: OPEN POROUS MEDIA
A2: OPM Flow Reference Manual(2023-04) | E2: Revision: Rev-0

Sheet: Table1786
A1: File Type | B1: Data Type | C1: Description | D1: OPM Flow Status
A2: ESMRY | B2: Dynamic Vector Data | C2: This is an OPM FLOW specific Enhanced SUMMARY (*.ESMRY) output file format that is optimized for fast loading of selected vectors by post-processing applications. The *.ESMRY file is re-written for every time step and does not have a performance impact on the simulation. Load times are in the order of 30 times faster compared with fetching selected vectors using the *.UNSMRY file format in post processing software. The file type is compatible with OPM ResInsight and the option is activated via the enable-esmry=true command line option. Note that the FMTOUT, MULTOUT, and UNIFOUT keywords have no impact on this file type. | D2: OPM Flow Fully Supported.
A3: RSM | B3: Output File | C3: The RSM file contains the variables requested to be written to the SUMMARY file via the keywords described in the 11.2Data Requirements, in a tabulated ASCII output format. The format of the file enables the data to be easily loaded into the LibreOffice Calc program for further processing, as each vector represents one column. The report is written at the end of the simulation run by parsing the SUMMARY Index and SUMMARY Data files. | D3: Fully Supported
A4: SUMMARY Index | B4: Dynamic Vector Index | C4: The SUMMARY index file type specifies and defines the format and data type written to the SUMMARY Data file. | D4: Fully Supported
A5: SUMMARY Data | B5: Dynamic Vector Data | C5: The SUMMARY data file contains the variables requested to be written to the file via the keywords described in the 11.2Data Requirements. The data consists of vectors that are used to generate line graphs of properties such as oil flow rate versus time, grid block pressure versus time, etc. The properties to be stored on the SUMMARY file are written to the summary file at the end of each successful time step. The data can be used to compare actual production data with the simulation derived results in post processing software like OPM ResInsight. | D5: Fully Supported
A6: Notes:

Sheet: Table1787
A1: Process | B1: RUNSPEC Keyword | C1: Description | D1: Files
A2: Input | B2: FMTIN | C2: The keyword defines the input files to be formatted as ASCII i.e. text files, as oppose to binary files. | D2: *.FSMSPEC *.FUNSMRY
B3: MULTIN | C3: The keyword defines the input files to be non-unified multiple files, as opposed to unified files. | D3: *.SMSPEC *.S0001
B4: UNIFIN | C4: UNIFIN defines the input files to be unified files, as opposed to non-unified multiple files. | D4: *.SMSPEC *.UNSMRY
A5: Output | B5: FMTOUT | C5: The keyword sets all output files to be formatted as ASCII i.e. text files, as opposed to binary files. | D5: *.FSMSPEC *.FUNSMRY
B6: MULTOUT | C6: MULTOUT defines the output files to be non-unified multiple files, as opposed to unified files. | D6: *.SMSPEC *.S0001
B7: UNIFOUT | C7: UNIFOUT defines the output files to be unified files, as opposed to non-unified multiple files. | D7: *.SMSPEC *.UNSMRY

Sheet: Table1788
A1: File Type | B1: Unformatted Extension | C1: Description | D1: Formatted Extension
A2: RSM | B2: *.RSM | C2: Output RSM file. | D2: *.RSM
A3: SUMMARY Index | B3: *.SMSPEC | C3: The SUMMARY index file for both unified and non-unified formats. | D3: *.FSMSPEC
A4: SUMMARY Data Non-Unified | B4: *.Snnnn | C4: The SUMMARY data files containing the variables requested to be written to the SUMMARY files. For example, the SUMMARY non-unified binary files would be: CASENAME.S0001 CASENAME.S0002 CASENAME.S0003 etc. CASENAME.SMSPEC | D4: *.Annnn
A5: SUMMARY Data Unified | B5: *.UNSMRY | C5: The SUMMARY data file containing the variables requested to be written to the SUMMARY file. For example, the SUMMARY data unified binary files: CASENAME.UNSMRY CASENAME.SMSPEC | D5: *.FUNSMRY
A6: Notes:

Sheet: Table1790
A1: Summary Variable Mnemonic Syntax
A2: First Character Object | C2: Second Character Object Type | E2: Third Character Flow Type | G2: Four Character Value Type | I2: Fifth Character Special
A3: A | B3: Aquifers | C3: A | D3: Analytical Aquifer | E3: Q | F3: Influx | G3: R
C4: L1 | D4: Analytical Aquifer List | E4: L | F4: Liquid influx | G4: T
C5: N | D5: Numerical Aquifer
A7: B | B7: Block (Grid Cell) | C7: O | D7: Oil | E7: P | F7: Production | G7: R | H7: Rate | I7: L | J7: Liquid
A8: F | B8: Field | C8: W | D8: Water | E8: I | F8: Injection | G8: T | H8: Total (cumulative) | I8: H | J8: History
A9: G | B9: Group | C9: G | D9: Gas | E9: F | F9: Flow | I9: G | J9: Gas
A10: R | B10: Region | C10: V | D10: Volume at reservoir conditions
A11: W | B11: Well | C11: L | D11: Liquid
A12: C | B12: Well Connection | C12: P2 | D12: Pressure
A13: S | B13: Well Segment | C13: T | D13: Tracer
A14: Notes:

Sheet: Table1789
A1: Summary Variable Mnemonics Examples
A2: Name | B2: Description
A3: BOFT | B3: Block Oil Flow Total
A4: COFR | B4: Connection Oil Flow Rate
A5: FOPR | B5: Field Oil Production Rate
A6: GVPR | B6: Group Volume Production Rate
A7: RTIT | B7: Region Tracer Injection Total
A8: WWPT | B8: Well Water Production Total

Sheet: Table1791
A1: Summary Variable Mnemonics Examples Not Following the General
A2: Name | B2: Description
A3: BAPI | B3: Block API
A4: BOSAT | B4: Block Oil Saturation
A5: BPR | B5: Block Pressure
A6: FAQR | B6: Field Aquifer Influx Rate
A7: FPR | B7: Field Average Pressure
A8: FWCT | B8: Field Water Cut
A9: WBHP | B9: Well Bottom-Hole Pressure
A10: WTHP | B10: Well Tubing Head Pressure
A11: WWCT | B11: Well Water Cut

Sheet: Table1793
A1: Summary Variable Format
A2: Summary Object | B2: Format | C2: Example
A3: AQUIFER | B3: Analytical aquifers are identified by the first two characters AA in the variable mnemonic and numerical aquifers are identified by the first two characters of AQ. Aquifer variables for a given aquifer can be followed by a list of aquifer numbers and therefore a terminating “/” is required to end the list of aquifers. A blank list requests output for all the aquifers. | C3: For instance to obtain the aquifer influx rate and cumulative influx for all analytical aquifers in the model, one would use: AAQR / AAQT / or just for numerical aquifers one, two and three: ANQR 1 2 3 / ANQR 1 2 3 /
B4: Analytical aquifers that have been allocated to an analytical aquifer list via the AQUALIST keyword in the SOLUTION section are identified by the first two characters AL in the variable mnemonic. Aquifer variables for a given aquifer list can be followed by a list of aquifer names and therefore a terminating “/” is required to end the list of aquifers. A blank list requests output for all the aquifers. | C4: For instance to obtain the aquifer influx rate and cumulative influx for all two analytical aquifers list, EAST and WEST in the model, one would use: AAQR ‘EAST’ ‘WEST’/ AAQT ‘EAST’ ‘WEST’/ Note OPM Flow does not currently support Analytical Aquifer Lists.
A5: BLOCK (Grid Cells) | B5: Block variables are followed by a list of cell (I, J, K) indices, with each line terminated by a “/”., and the list terminated with another terminating “/”. | C5: To request the oil saturation for a series of grid cells one would use the following: BOSAT 1 1 1 / 10 10 3 / 15 15 10 / /
A6: FIELD | B6: Field variables take no additional parameters and therefore do not require a terminating “/”. | C6: For example: FOPR FOPT FPR Would export the field oil rate and total, plus the field average reservoir pressure to the SUMMARY file.
A7: GROUP | B7: Group variables can be followed by a list of group names enclosed in quotes and therefore a terminating “/” is required to end the list of groups. A blank list requests output for all groups. | C7: As an example to get the oil production rates and totals for two groups representing two platforms one would use GOPR ‘PLAT1’ ‘PLAT2’ / GOPT ‘PLAT1’ ‘PLAT2’ / or GOPR / GOPT / if there are only two groups in the model.
A8: REGION | B8: Region variables for a given region can be followed by a list of region numbers and therefore a terminating “/” is required to end the list of regions. A blank list requests output for all the regions. | C8: For instance to obtain the reservoir pressures and oil totals for all regions: RPR / ROPT / or just for regions one, two and three: RPR 1 2 3 / ROPT 1 2 3 /
B9: Region variables that are based on flows between regions must be followed by a list of region pair numbers, indicating the two regions. Each region pair is terminated by a “/”. In addition the variable mnemonic should also be terminated by a terminating “/”. | C9: To obtain the oil and water flow between regions one and two, and also three and four, one would use: ROFT 1 2 / 3 4 / / RWFT 1 2 / 3 4 / /
A10: WELL | B10: Well variables can be followed by a list of well names enclosed in quotes and therefore a terminating “/” is required to end the list of wells. A blank list requests output for all wells. | C10: As an example to get the oil production rates and totals for all oil wells beginning with the letters OP one would use WOPR ‘OP*’ / WOPT ‘OP*’ / To output the oil production rate for all wells, one may use: WOPR / This would also write out the oil production rate for all well types: producers and injectors, as well as wells declared as gas and water wells.
A11: ‍WELL COMPLETIONS | B11: Well variables for well completion vectors1 The term well connection is used to describe individual connections from the wellbore to the reservoir grid, as opposed to well completions. A well completion is used to describe a set of connections, for example, a well may consist of several completions with each completion consisting of multiple connections. , generally consist of the well mnemonic name suffixed with the letter "L", for example WOPRL, for the completion oil production rate. The completion mnemonic is then followed by a list of well names enclosed in quotes and the completion number, each terminated by a “/”. In addition the list is terminated by a terminating “/”. A blank list for the completions results in all completions for a well being written out. And a blank list for the well will result in all well completions being written to the SUMMARY file. Care should be exercised when defaulting the list of wells and completions as there is the potential to generate large volumes of data. | C11: For example, to get the completion oil production rates for well OP01 completions two, three, and four, and for completion two for OP02 one would use: WOPRL ‘OP01’ 2 / ‘OP01’ 3 / ‘OP01’ 4 / ‘OP02’ 2 / / or to get all the oil production rates for all the completions for well OP01: WORPL ‘OP01’ / /
A12: WELL CONNECTIONS | B12: Connection variables are followed by a list of well names in quotes and completion I, J, K indices, each terminated by a “/”. In addition the list is terminated by a terminating “/”. A blank list for the connections results in all connections for a well being written out. And a blank list for the well will result in all well connections being written to the SUMMARY file. Again, care should be exercised when defaulting the list of wells and connections as there is the potential to generate large volumes of data. | C12: To request the gas-oil ratio and water cut for the OP01 and OP02 wells for several connections, one would use: CGOR OP01 1 1 1 / OP01 1 1 2 / OP02 10 10 1 / / CWCT OP01 1 1 1 / OP01 1 1 2 / OP02 10 10 1 / /
A13: ‍WELL CONNECTIONS (COMPLETIONS) | B13: This type of data is the same as for the Well Completion data, except the Well Connection series of mnemonics are used instead of the well mnemonics. Here the connection vectors consist of the connection mnemonic name suffixed with the letter "L", for example COPRL, for the completion oil production rate. The connection mnemonic is then followed by a list of well names enclosed in quotes and the connection number, each terminated by a “/”. In addition, the list is terminated by a terminating “/”. If any connection has been defined as being within a completion via the COMPLUMP keyword in the SCHEDULE section, then the completion data is written out instead of the connection data. A blank list for the completions results in all completions for a well being written out. However, the well name cannot be defaulted, unlike the other well and connection mnemonics. Care should be exercised when defaulting the list of wells and completions as there is the potential to generate large volumes of data. | C13: To request the gas-oil ratio and water cut for the OP01 and OP02 wells for several connections that have lumped together in a completion, one would use: CGORL OP01 1 1 1 / OP01 1 1 2 / OP02 10 10 1 / / CWCTL OP01 1 1 1 / OP01 1 1 2 / OP02 10 10 1 / /
A14: WELL SEGMENTS | B14: Well variables for multi-segment well segments can be followed by a list of well names enclosed in quotes and the segment number, each terminated by a “/”. In addition, the list is terminated by a terminating “/”. A blank list for the segments results in all segments for a well being written out. And a blank list for the well will result in all well segments being written to the SUMMARY file. Care should be exercised when defaulting the list of wells and segments as there is the potential to generate large volumes of data. | C14: For example, to get the segment oil production rates for well OP01 segments two, three, and four and for segment two for OP02 one would use: SOFR ‘OP01’ 2 / ‘OP01’ 3 / ‘OP01’ 4 / ‘OP02’ 2 / / or to get all the oil production rates for all the segments for well OP01: SOFR ‘OP01’ / /

Sheet: Table1796
A1: Aquifer Summary Variables
A2: Variable | B2: Root | C2: Field | D2: AnalyticalAquifer | E2: AnalyticalAquiferList | F2: NumericalAquifer | G2: Comment
A3: Aquifer Influx Rate (Water Aquifers) | B3: QR | C3: FAQR | D3: AAQR | E3: ALQR | F3: ANQR
A4: Aquifer Influx Total (Water Aquifers) | B4: QT | C4: FAQT | D4: AAQT | E4: ALQT | F4: ANQT
A5: Aquifer Influx Rate (Gas Aquifers) | B5: QRG | C5: FAQRG | D5: AAQRG | E5: ALQRG
A6: Aquifer Influx Total (Gas Aquifers) | B6: QTG | C6: FAQTG | D6: AAQTG | E6: ALQTG
A7: Aquifer Pressure | B7: QP | D7: AAQP | F7: ANQP | G7: Water pore volume weighted average
A8: Aquifer Carter-Tracy Dimensionless Pressure | B8: QTD | D8: AAQTD
A9: Aquifer Carter-Tracy Dimensionless Time | B9: QPD | D9: AAQPD
A10: Notes:

Sheet: Table1792
A1: Field, Group, Well, Well Connection and Completion Summary Variables
A2: Type | B2: Variable | C2: Root | D2: Field | E2: Group | F2: Well | G2: WellConnection | H2: WellCompletion | I2: Comment
A3: Flow | B3: Artificial Lift Quantity | C3: ALQ | F3: WALQ
A4: Flow | B4: Artificial Lift and VFP Table Number | C4: MVFP | F4: WMVFP | I4: Well VFP table number.
A5: Flow | B5: Efficiency Factor | C5: EFF | E5: GEFF | F5: WEFF
A6: Flow | B6: Efficiency Factor Product | C6: EFFG | F6: WEFFG | I6: Efficiency factor of the well times the product of all the groups above the well.
A7: Flow | B7: Energy Production Rate | C7: EPR | D7: FEPR | E7: GEPR | F7: WEPR
A8: Flow | B8: Energy Production Total | C8: EPT | D8: FEPT | E8: GEPT | F8: WEPT
A9: Flow | B9: Gas Consumption Rate | C9: GCR | D9: FGCR | E9: GGCR
A10: Flow | B10: Gas Consumption Total | C10: GCT | D10: FGCT | E10: GGCT
A11: Flow | B11: Gas Flow Rate | C11: GFR | G11: CGFR | H11: CGFRL | I11: Positive for production and negative for injection
A12: Flow | B12: Gas Flow Rate (Free) | C12: GFRF | G12: CGFRF
A13: Flow | B13: Gas Flow Rate (Solution) | C13: GFRS | G13: CGFRS
A14: Flow | B14: Gas Flow Rate (Upstream) | C14: GFRU | G14: CGFRU | I14: Sum of connection Gas flow rates upstream of, and including, this connection
A15: Flow | B15: Gas Import Rate | C15: GIMR | D15: FGIMR | E15: GGIMR
A16: Flow | B16: Gas Import Total | C16: GIMT | D16: FGIMT | E16: GGIMT
A17: Flow | B17: Gas Injection Guide Rate | C17: GIGR | E17: GGIGR | F17: WGIGR
A18: Flow | B18: Gas Injection Rate | C18: GIR | D18: FGIR | E18: GGIR | F18: WGIR | G18: CGIR | H18: CGIRL
A19: Flow | B19: Gas Injection Rate History | C19: GIRH | D19: FGIRH | E19: GGIRH | F19: WGIRH
A20: Flow | B20: Gas Injection Rate Target/Limit | C20: GIRT | D20: FGIRT | E20: GGIRT | F20: WGIRT
A21: Flow | B21: Gas Injection Total | C21: GIT | D21: FGIT | E21: GGIT | F21: WGIT | G21: CGIT | H21: CGITL
A22: Flow | B22: Gas Injection Total History | C22: GITH | D22: FGITH | E22: GGITH | F22: WGITH
A23: Flow | B23: Gas Lift Rate | C23: GLIR | D23: FGLIR | E23: GGLIR | F23: WGLIR | I23: Gas lift gas with group and field total rates based on well efficiency
A24: Flow | B24: Gas Potential Injection Rate | C24: GPI | D24: FGPI | E24: GGPI | F24: WGPI | G24: CGPI | I24: Also WGIP for WGPI
A25: Flow | B25: Gas Potential Injection Rate | C25: GPI2 | D25: FGPI2 | E25: GGPI2 | F25: WGPI2 | I25: Including shut and stopped wells.
A26: Flow | B26: Gas Potential Production Rate | C26: GPP | D26: FGPP | E26: GGPP | F26: WGPP | G26: CGPP
A27: Flow | B27: Gas Potential Production Rate | C27: GPP2 | D27: FGPP2 | E27: GGPP2 | F27: WGPP2 | I27: Including shut and stopped wells.
A28: Flow | B28: Gas Potential Production Rate (Free) | C28: GPPF | D28: FGPPF | E28: GGPPF | F28: WGPPF
A29: Flow | B29: Gas Potential Production Rate (Free) | C29: GPPF2 | D29: FGPPF2 | E29: GGPPF2 | F29: WGPPF2 | I29: Including shut and stopped wells.
A30: Flow | B30: Gas Potential Production Rate (Soln) | C30: GPPS | D30: FGPPS | E30: GGPPS | F30: WGPPS
A31: Flow | B31: Gas Potential Production Rate (Soln) | C31: GPPS2 | D31: FGPPS2 | E31: GGPPS2 | F31: WGPPS2 | I31: Including shut and stopped wells.
A32: Flow | B32: Gas Production Guide Rate | C32: GPGR | E32: GGPGR | F32: WGPGR
A33: Flow | B33: Gas Production Rate | C33: GPR | D33: FGPR | E33: GGPR | F33: WGPR | G33: CGPR | I33: Produced reservoir gas only, gas lift gas excluded
A34: Flow | B34: Gas Production Rate (Free) | C34: GPRF | D34: FGPRF | E34: GGPRF | F34: WGPRF
A35: Flow | B35: Gas Production Rate (Solution) | C35: GPRS | D35: FGPRS | E35: GGPRS | F35: WGPRS
A36: Flow | B36: Gas Production Rate History | C36: GPRH | D36: FGPRH | E36: GGPRH | F36: WGPRH
A37: Flow | B37: Gas Production Rate Target/Limit | C37: GPRT | D37: FGPRT | E37: GGPRT | F37: WGPRT
A38: Flow | B38: Gas Production Total | C38: GPT | D38: FGPT | E38: GGPT | F38: WGPT | G38: CGPT | H38: CGPTL
A39: Flow | B39: Gas Production Total (Free) | C39: GPTF | D39: FGPTF | E39: GGPTF | F39: WGPTF
A40: Flow | B40: Gas Production Total (Solution) | C40: GPTS | D40: FGPTS | E40: GGPTS | F40: WGPTS
A41: Flow | B41: Gas Production Total History | C41: GPTH | D41: FGPTH | E41: GGPTH | F41: WGPTH
A42: Flow | B42: Gas Sales Rate | C42: GSR | D42: FGSR | E42: GGSR
A43: Flow | B43: Gas Sales Total | C43: GST | D43: FGST | E43: GGST
A44: Flow | B44: Gas Voidage Injection Rate | C44: GVIR | F44: WGVIR
A45: Flow | B45: Gas Voidage Production Rate | C45: GVPR | F45: WGVPR
A46: Flow | B46: Liquid Flow Rate | C46: LFR | G46: CLFR | H46: CLFRL | I46: Positive for production and negative for injection
A47: Flow | B47: Liquid Production Rate | C47: LPR | D47: FLPR | E47: GLPR | F47: WLPR | G47: CLPR
A48: Flow | B48: Liquid Production Rate History | C48: LPRH | D48: FLPRH | E48: GLPRH | F48: WLPRH
A49: Flow | B49: Liquid Production Rate Target/Limit | C49: LPRT | D49: FLPRT | E49: GLPRT | F49: WLPRT
A50: Flow | B50: Liquid Production Total | C50: LPT | D50: FLPT | E50: GLPT | F50: WLPT | G50: CLPT | H50: CLPTL
A51: Flow | B51: Liquid Production Total History | C51: LPTH | D51: FLPTH | E51: GLPTH | F51: WLPTH
A52: Flow | B52: Oil Flow Rate | C52: OFR | G52: COFR | H52: COFRL | I52: Positive for production and negative for injection
A53: Flow | B53: Oil Flow Rate (Free) | C53: OFRF | G53: COFRF
A54: Flow | B54: Oil Flow Rate (Solution) | C54: OFRS | G54: COFRS
A55: Flow | B55: Oil Flow Rate (Upstream) | C55: OFRU | G55: COFRU | I55: Sum of connection oil flow rates upstream of, and including, this connection
A56: Flow | B56: Oil Injection Guide Rate | C56: OIGR | E56: GOIGR | F56: WOIGR
A57: Flow | B57: Oil Injection Rate | C57: OIR | D57: FOIR | E57: GOIR | F57: WOIR | G57: COIR | H57: COIRL
A58: Flow | B58: Oil Injection Rate History | C58: OIRH | D58: FOIRH | E58: GOIRH | F58: WOIRH
A59: Flow | B59: Oil Injection Rate Target/Limit | C59: OIRT | D59: FOIRT | E59: GOIRT | F59: WOIRT
A60: Flow | B60: Oil Injection Total | C60: OIT | D60: FOIT | E60: GOIT | F60: WOIT | G60: COIT | H60: COITL
A61: Flow | B61: Oil Injection Total History | C61: OITH | D61: FOITH | E61: GOITH | F61: WOITH
A62: Flow | B62: Oil Potential Injection Rate | C62: OPI | D62: FOPI | E62: GOPI | F62: WOPI
A63: Flow | B63: Oil Potential Injection Rate | C63: OPI2 | D63: FOPI2 | E63: GOPI2 | F63: WOPI2 | I63: Including shut and stopped wells.
A64: Flow | B64: Oil Potential Production Rate | C64: OPP | D64: FOPP | E64: GOPP | F64: WOPP | G64: COPP
A65: Flow | B65: Oil Potential Production Rate | C65: OPP2 | D65: FOPP2 | E65: GOPP2 | F65: WOPP2 | I65: Including shut and stopped wells.
A66: Flow | B66: Oil Production Guide Rate | C66: OPGR | E66: GOPGR | F66: WOPGR
A67: Flow | B67: Oil Production Rate | C67: OPR | D67: FOPR | E67: GOPR | F67: WOPR | G67: COPR
A68: Flow | B68: Oil Production Rate (Free) | C68: OPRF | D68: FOPRF | E68: GOPRF | F68: WOPRF
A69: Flow | B69: Oil Production Rate (Solution) | C69: OPRS | D69: FOPRS | E69: GOPRS | F69: WOPRS
A70: Flow | B70: Oil Production Rate History | C70: OPRH | D70: FOPRH | E70: GOPRH | F70: WOPRH
A71: Flow | B71: Oil Production Rate Target/Limit | C71: OPRT | D71: FOPRT | E71: GOPRT | F71: WOPRT
A72: Flow | B72: Oil Production Total | C72: OPT | D72: FOPT | E72: GOPT | F72: WOPT
A73: Flow | B73: Oil Production Total (Free) | C73: OPTF | D73: FOPTF | E73: GOPTF | F73: WOPTF
A74: Flow | B74: Oil Production Total (Solution) | C74: OPTS | D74: FOPTS | E74: GOPTS | F74: WOPTS
A75: Flow | B75: Oil Production Total History | C75: OPTH | D75: FOPTH | E75: GOPTH | F75: WOPTH
A76: Flow | B76: Res. Vol. Flow Rate | C76: VFR | G76: CVFR | H76: CVFRL | I76: Positive for production and negative for injection
A77: Flow | B77: Res. Vol. Flow Rate (Free) | C77: VFRF | G77: CVFRF
A78: Flow | B78: Res. Vol. Injection Guide Rate | C78: VIGR | E78: GVIGR | F78: WVIGR
A79: Flow | B79: Res. Vol. Injection Rate | C79: VIR | D79: FVIR | E79: GVIR | F79: WVIR | G79: CVIR | H79: CVIRL
A80: Flow | B80: Res. Vol. Injection Rate Target/Limit | C80: VIRT | D80: FVIRT | E80: GVIRT | F80: WVIRT
A81: Flow | B81: Res. Vol. Injection Total | C81: VIT | D81: FVIT | E81: GVIT | F81: WVIT | G81: CVIT | H81: CVITL
A82: Flow | B82: Res. Vol. Potential Injection Rate | C82: VPI | D82: FVPI | E82: GVPI | F82: WVPI
A83: Flow | B83: Res. Vol. Potential Injection Rate | C83: VPI2 | D83: FVPI2 | E83: GVPI2 | F83: WVPI2 | I83: Including shut and stopped wells.
A84: Flow | B84: Res. Vol. Potential Production Rate | C84: VPP | D84: FVPP | E84: GVPP | F84: WVPP | G84: CVPP
A85: Flow | B85: Res. Vol. Potential Production Rate | C85: VPP2 | D85: FVPP2 | E85: GVPP2 | F85: WVPP2 | I85: Including shut and stopped wells.
A86: Flow | B86: Res. Vol. Production Guide Rate | C86: VPGR | E86: GVPGR | F86: WVPGR
A87: Flow | B87: Res. Vol. Production Guide Rate | C87: VPGR | E87: GVPGR | F87: WVPGR
A88: Flow | B88: Res. Vol. Production Rate | C88: VPR | D88: FVPR | E88: GVPR | F88: WVPR | G88: CVPR
A89: Flow | B89: Res. Vol. Production Rate Target/Limit | C89: VPRT | D89: FVPRT | E89: GVPRT | F89: WVPRT
A90: Flow | B90: Res. Vol. Production Total | C90: VPT | D90: FVPT | E90: GVPT | F90: WVPT | G90: CVPT
A91: Flow | B91: Water Flow Rate | C91: WFR | G91: CWFR | H91: CWFRL | I91: Positive for production and negative for injection
A92: Flow | B92: Water Flow Rate (Upstream) | C92: WFRU | G92: CWFRU | I92: Sum of connection water flow rates upstream of, and including, this connection
A93: Flow | B93: Water Injection Guide Rate | C93: WIGR | E93: GWIGR | F93: WWIGR
A94: Flow | B94: Water Injection Rate | C94: WIR | D94: FWIR | E94: GWIR | F94: WWIR | G94: CWIR | H94: CWIRL
A95: Flow | B95: Water Injection Rate History | C95: WIRH | D95: FWIRH | E95: GWIRH | F95: WWIRH
A96: Flow | B96: Water Injection Rate Target/Limit | C96: WIRT | D96: FWIRT | E96: GWIRT | F96: WWIRT
A97: Flow | B97: Water Injection Total | C97: WIT | D97: FWIT | E97: GWIT | F97: WWIT | G97: CWIT | H97: CWITL
A98: Flow | B98: Water Injection Total History | C98: WITH | D98: FWITH | E98: GWITH | F98: WWITH
A99: Flow | B99: Water Potential Injection Rate | C99: WPI | D99: FWPI | E99: GWPI | F99: WWPI | I99: Also WWIP for WWPI
A100: Flow | B100: Water Potential Injection Rate | C100: WPI2 | D100: FWPI2 | E100: GWPI2 | F100: WWPI2 | I100: Including shut and stopped wells.
A101: Flow | B101: Water Potential Production Rate | C101: WPP | D101: FWPP | E101: GWPP | F101: WWPP | G101: CWPP
A102: Flow | B102: Water Potential Production Rate | C102: WPP2 | D102: FWPP2 | E102: GWPP2 | F102: WWPP2 | I102: Including shut and stopped wells.
A103: Flow | B103: Water Produce/Injected Ratio | C103: WPIR | D103: FWPIR | E103: GWPIR | F103: WWPIR | I103: Reported as a percent.
A104: Flow | B104: Water Production Guide Rate | C104: WPGR | E104: GWPGR | F104: WWPGR
A105: Flow | B105: Water Production Rate | C105: WPR | D105: FWPR | E105: GWPR | F105: WWPR | G105: CWPR
A106: Flow | B106: Water Production Rate History | C106: WPRH | D106: FWPRH | E106: GWPRH | F106: WWPRH
A107: Flow | B107: Water Production Rate Target/Limit | C107: WPRT | D107: FWPRT | E107: GWPRT | F107: WWPRT
A108: Flow | B108: Water Production Total | C108: WPT | D108: FWPT | E108: GWPT | F108: WWPT | G108: CWPT | H108: CWPTL
A109: Flow | B109: Water Production Total History | C109: WPTH | D109: FWPTH | E109: GWPTH | F109: WWPTH
A110: Flow | B110: Water Voidage Injection Guide Rate | C110: WVIR | F110: WWVIR
A111: Flow | B111: Water Voidage Injection Guide Total | C111: WVIT | F111: WWVIT
A112: No. Wells | B112: Number of abandoned injection wells | C112: MWIA | D112: FMWIA | E112: GMWIA
A113: No. Wells | B113: Number of abandoned production wells | C113: MWPA | D113: FMWPA | E113: GMWPA
A114: No. Wells | B114: Number of drilling events in total | C114: MWDT | D114: FMWDT | E114: GMWDT
A115: No. Wells | B115: Number of drilling events this timestep | C115: MWDR | D115: FMWDR | E115: GMWDR
A116: No. Wells | B116: Number of injection wells currently flowing | C116: MWIN | D116: FMWIN | E116: GMWIN
A117: No. Wells | B117: Number of injectors on group control | C117: MWIG | D117: FMWIG | E117: GMWIG
A118: No. Wells | B118: Number of injectors on own reservoir volume rate limit control | C118: MWIV | D118: FMWIV | E118: GMWIV
A119: No. Wells | B119: Number of injectors on own surface rate limit control | C119: MWIS | D119: FMWIS | E119: GMWIS
A120: No. Wells | B120: Number of injectors on pressure control | C120: MWIP | D120: FMWIP | E120: GMWIP
A121: No. Wells | B121: Number of producers controlled by own oil rate limit | C121: MWPO | D121: FMWPO | E121: GMWPO
A122: No. Wells | B122: Number of producers on group control | C122: MWPG | D122: FMWPG | E122: GMWPG
A123: No. Wells | B123: Number of producers on own reservoir volume rate limit control | C123: MWPV | D123: FMWPV | E123: GMWPV
A124: No. Wells | B124: Number of producers on own surface rate limit control | C124: MWPS | D124: FMWPS | E124: GMWPS
A125: No. Wells | B125: Number of producers on pressure control | C125: MWPP | D125: FMWPP | E125: GMWPP
A126: No. Wells | B126: Number of producers using artificial lift (with ALQ > 0.0) | C126: MWPL | D126: FMWPL | E126: GMWPL
A127: No. Wells | B127: Number of production wells currently flowing | C127: MWPR | D127: FMWPR | E127: GMWPR
A128: No. Wells | B128: Number of unused injection wells | C128: MWIU | D128: FMWIU | E128: GMWIU
A129: No. Wells | B129: Number of unused production wells | C129: MWPU | D129: FMWPU | E129: GMWPU
A130: No. Wells | B130: Number of workover events in total | C130: MWWT | D130: FMWWT | E130: GMWWT
A131: No. Wells | B131: Number of workover events this time step. | C131: MWWO | D131: FMWWO | E131: GMWWO
A132: No. Wells | B132: The number of connections capable of flowing in the well | C132: MCON | F132: WMCON
A133: No. Wells | B133: Total number of injection wells | C133: MWIT | D133: FMWIT | E133: GMWIT
A134: No. Wells | B134: Total number of production wells | C134: MWPT | D134: FMWPT | E134: GMWPT
A135: Pressure | B135: Blocking Factor (GPP) | C135: CDBF | G135: CCDBF
A136: Pressure | B136: Bottom-Hole Pressure | C136: BHP | F136: WBHP
A137: Pressure | B137: Bottom-Hole Pressure (Five Point | C137: BP5 | F137: WBP5
A138: Pressure | B138: Bottom-Hole Pressure (Four Point) | C138: BP4 | F138: WBP4
A139: Pressure | B139: Bottom-Hole Pressure (Nine Point) | C139: BP9 | F139: WBP9
A140: Pressure | B140: Bottom-Hole Pressure (One Point) | C140: BP | F140: WBP
A141: Pressure | B141: Bottom-Hole Pressure History | C141: BHPH | F141: WBHPH
A142: Pressure | B142: Bottom-Hole Pressure Target/Limit | C142: BHPT | F142: WBHPT
A143: Pressure | B143: Connection Pressure | C143: PR | G143: CPR | H143: CPRL | I143: Completion pressure is an average pressure for the completion
A144: Pressure | B144: Connection Transmissibility Factor | C144: TFAC | G144: CTFAC
A145: Pressure | B145: Productivity (Gas Phase) | C145: PIG | F145: WPIG
A146: Pressure | B146: Productivity (Liquid Phase) | C146: PIL | F146: WPIL
A147: Pressure | B147: Productivity (Oil Phase) | C147: PIO | F147: WPIO
A148: Pressure | B148: Productivity (Preferred Phase – Five Point) | C148: PI5 | F148: WPI5
A149: Pressure | B149: Productivity (Preferred Phase – Four Point) | C149: PI4 | F149: WPI4
A150: Pressure | B150: Productivity (Preferred Phase – Nine Point) | C150: PI9 | F150: WPI9
A151: Pressure | B151: Productivity (Preferred Phase – One Point) | C151: PI1 | F151: WPI1
A152: Pressure | B152: Productivity (Preferred Phase) | C152: PI | F152: WPI | G152: CPI
A153: Pressure | B153: Productivity (Water Phase) | C153: PIW | F153: WPIW
A154: Pressure | B154: Tubing Head Pressure | C154: THP | F154: WTHP
A155: Pressure | B155: Tubing Head Pressure History | C155: THPH | F155: WTHPH
A156: Ratio | B156: Gas-Liquid Ratio | C156: GLR | D156: FGLR | E156: GGLR | F156: WGLR | G156: CGLR | H156: CGLRL
A157: Ratio | B157: Gas-Liquid Ratio (Bottom-Hole) | C157: BGLR | F157: WBGLR
A158: Ratio | B158: Gas-Liquid Ratio History | C158: GLRH | D158: FGLRH | E158: GGLRH | F158: WGLRH
A159: Ratio | B159: Gas-Oil Ratio | C159: GOR | D159: FGOR | E159: GGOR | F159: WGOR | G159: CGOR | H159: CGORL
A160: Ratio | B160: Gas-Oil Ratio History | C160: GORH | D160: FGORH | E160: GGORH | F160: WGORH
A161: Ratio | B161: Oil-Gas Ratio | C161: OGR | D161: FOGR | E161: GOGR | F161: WOGR | G161: COGR | H161: COGRL
A162: Ratio | B162: Oil-Gas Ratio History | C162: OGRH | D162: FOGRH | E162: GOGRH | F162: WOGRH
A163: Ratio | B163: Water -Gas Ratio | C163: WGR | D163: FWGR | E163: GWGR | F163: WWGR | G163: CWGR | H163: CWGRL
A164: Ratio | B164: Water Cut | C164: WCT | D164: FWCT | E164: GWCT | F164: WWCT | G164: CWCT | H164: CWCTL
A165: Ratio | B165: Water Cut History | C165: WCTH | D165: FWCTH | E165: GWCTH | F165: WWCTH
A166: Ratio | B166: Water-Gas Ratio History | C166: WGRH | D166: FWGRH | E166: GWGRH | F166: WWGRH
A167: Notes:

Sheet: Table1794
A1: Field and Group Control Mode Reporting
A2: Object | B2: Field | C2: Group | D2: Field | E2: Group | F2: Field | G2: Group
A3: Mnemonic | B3: FMCTP | C3: GMCTP | D3: FMCTW | E3: GMCTW | F3: FMCTG | G3: GMCTG
A4: Description | B4: Production Group. | D4: Water Injection Group. | F4: Gas Injection Group.
A5: Values | B5: Value | C5: Mnemonic | D5: Value | E5: Mnemonic | F5: Value | G5: Mnemonic
B6: 0.0 | C6: NONE | D6: 0.0 | E6: NONE | F6: 0.0 | G6: NONE
B7: 1.0 | C7: ORAT | D7: 1.0 | E7: RATE | F7: 1.0 | G7: RATE
B8: 2.0 | C8: WRAT | D8: 2.0 | E8: RESV | F8: 2.0 | G8: RESV
B9: 3.0 | C9: GRAT | D9: 3.0 | E9: REIN | F9: 3.0 | G9: REIN
B10: 4.0 | C10: LRAT | D10: 4.0 | E10: VREP | F10: 4.0 | G10: VREP
B11: 5.0 | C11: RESV | D11: 5.0 | F11: 5.0
B12: 6.0 | C12: PRBL | D12: 6.0 | F12: 6.0
B13: 7.0 | C13: ENERGY | D13: 7.0 | F13: 7.0
B14: 8.0 | C14: WGRA | D14: 8.0 | E14: WGRA | F14: 8.0 | G14: WGRA
B15: 9.0 | C15: CRAT | D15: 9.0 | E15: Availability | F15: 9.0 | G15: Availability
B16: 10.0 | C16: PBGS | D16: 10.0 | F16: 10.0
B17: 11.0 | C17: PBWS | D17: 11.0 | F17: 11.0
B18: 12.0 | C18: CRAT | D18: 12.0 | F18: 12.0
A19: Notes:

Sheet: Table1795
A1: Well Control Mode Reporting
A2: Object | B2: Well | E2: Well
A3: Mnemonic | B3: WSTAT | E3: WMCTL
A4: Description | B4: Well Status indicator. | E4: Well Mode of Control indicator.
A5: Values | B5: Value | C5: Mnemonic | D5: Description | E5: Value | F5: Mnemonic | G5: Description
B6: 1 | C6: PROD | D6: Well is a producing well. | E6: -1 | G6: Well is under group control.
B7: ooow:<B6>+1 -> 2 | C7: INJ | D7: Well is an injection well. | E7: 0 | F7: SHUT or STOP | G7: Well is shut-in or stopped.
B8: ooow:<B7>+1 -> 3 | C8: SHUT | D8: Well is shut-in except those under priority control. | E8: 1 | F8: ORAT | G8: Well is on oil rate control.
B9: ooow:<B8>+1 -> 4 | C9: STOP | D9: Well is stopped except those under priority control. | E9: 2 | F9: WRAT | G9: Well is on water rate control.
B10: ooow:<B9>+1 -> 5 | C10: PSHUT | D10: Well is shut-in under priority control. | E10: 3 | F10: GRAT | G10: Well is on gas rate control.
B11: ooow:<B10>+1 -> 6 | C11: PSTOP | D11: Well is stopped under priority control | E11: 4 | F11: LRAT | G11: Well is on liquid rate control.
E12: 5 | F12: RESV | G12: Well is on reservoir voidage rate control.
E13: 6 | F13: THP | G13: Well is on THP control.
E14: 7 | F14: BHP | G14: Well is on BHP control.
E15: 9 | F15: CRAT | G15: Not used
E16: 11 | F16: GOR Penalty
E17: 12 | F17: Drawdown | G17: Well is draw down control
E18: 13 | F18: NGL | G18: Not used
E19: 30 | F19: Availability
E20: 31 | F20: REIN
E21: 32 | F21: TMRA
E22: 33 | F22: WGRA
E23: 34 | F23: CVAL
E24: 41.0 - 51.0
A25: Notes:

Sheet: Table1797
A1: Block, Field and Region Summary Variables
A2: Type | B2: Variable | C2: Root | D2: Field | E2: Region | F2: Block | G2: Comment
A3: Flow | B3: Gas Flow (Inter-Block in I+ Direction) | C3: FLOGI | F3: BFLOGI
A4: Flow | B4: Gas Flow (Inter-Block in J+ Direction) | C4: FLOGJ | F4: BFLOGJ
A5: Flow | B5: Gas Flow (Inter-Block in K+ Direction) | C5: FLOGK | F5: BFLOGK
A6: Flow-Reg | B6: Gas Flow Rate Inter-Region | C6: GFR | E6: RGFR | G6: OPM Flow Implementation
A7: Flow-Reg | B7: Gas Flow Rate Inter-Region (positive contribution) | C7: GFR+ | E7: RGFR+
A8: Flow-Reg | B8: Gas Flow Rate Inter-Region (negative contribution) | C8: GFR- | E8: RGFR-
A9: Flow-Reg | B9: Gas Flow Total Inter-Region (Liquid and Gas Phases) | C9: GFT | E9: RGFT
A10: Flow-Reg | B10: Gas Flow Total Inter-Region (+VE Liquid and Gas Phases) | C10: GFT+ | E10: RGFT+ | G10: OPM Flow Implementation
A11: Flow-Reg | B11: Gas Flow Total Inter-Region (-VE Liquid and Gas Phases) | C11: GFT- | E11: RGFT-
A12: Flow-Reg | B12: Gas Flow Total Inter-Region (Gas Phase) | C12: GFTG | E12: RGFTG
A13: Flow-Reg | B13: Gas Flow Total Inter-Region (Liquid Phase) | C13: GFTL | E13: RGFTL
A14: Flow | B14: Gas Injection Rate | C14: GIR | E14: RGIR
A15: Flow | B15: Gas Injection Total | C15: GIT | E15: RGIT
A16: Flow | B16: Gas Potential | C16: PPG | D16: FPPG | E16: RPPG | F16: BPPG
A17: Flow | B17: Gas Production Rate | C17: GPR | E17: RGPR
A18: Flow | B18: Gas Production Rate (Free) | C18: GPRF | E18: RGPRF
A19: Flow | B19: Gas Production Rate (Solution) | C19: GPRS | E19: RGPRS
A20: Flow | B20: Gas Production Total | C20: GPT | E20: RGPT | G20: Liquid and gas phases
A21: Flow | B21: Gas Production Total (Free) | C21: GPTF | E21: RGPTF
A22: Flow | B22: Gas Production Total (Net From Region) | C22: GP | E22: RGP | G22: Minus injected gas
A23: Flow | B23: Gas Production Total (Solution) | C23: GPTS | E23: RGPTS
A24: Flow | B24: Gas Velocity (Inter-Block in I+ Direction) | C24: VELGI | F24: BVELGI
A25: Flow | B25: Gas Velocity (Inter-Block in J+ Direction) | C25: VELGJ | F25: BVELGJ
A26: Flow | B26: Gas Velocity (Inter-Block in K+ Direction) | C26: VELGK | F26: BVELGK
A27: Flow | B27: Oil Flow (Inter-Block in I+ Direction) | C27: FLOOI | F27: BFLOOI
A28: Flow | B28: Oil Flow (Inter-Block in J+ Direction) | C28: FLOOJ | F28: BFLOOJ
A29: Flow | B29: Oil Flow (Inter-Block in K+ Direction) | C29: FLOOK | F29: BFLOOK
A30: Flow-Reg | B30: Oil Flow Rate Inter-Region | C30: OFR | E30: ROFR | G30: OPM Flow Implementation
A31: Flow-Reg | B31: Oil Flow Rate Inter-Region (positive contribution) | C31: OFR+ | E31: ROFR+
A32: Flow-Reg | B32: Oil Flow Rate Inter-Region (negative contribution) | C32: OFR- | E32: ROFR-
A33: Flow-Reg | B33: Oil Flow Total Inter-Region (Liquid and Gas Phases) | C33: OFT | E33: ROFT
A34: Flow-Reg | B34: Oil Flow Total Inter-Region (+VE Liquid and Gas Phases) | C34: OFT+ | E34: ROFT+ | G34: OPM Flow Implementation
A35: Flow-Reg | B35: Oil Flow Total Inter-Region (-VE Liquid and Gas Phases) | C35: OFT- | E35: ROFT-
A36: Flow-Reg | B36: Oil Flow Total Inter-Region (Gas Phase) | C36: OFTG | E36: ROFTG
A37: Flow-Reg | B37: Oil Flow Total Inter-Region (Liquid Phase) | C37: OFTL | E37: ROFTL
A38: Flow | B38: Oil Injection Rate | C38: OIR | E38: ROIR
A39: Flow | B39: Oil Injection Total | C39: OIT | E39: ROIT
A40: Flow | B40: Oil Potential | C40: PPO | D40: FPPO | E40: RPPO | F40: BPPO
A41: Flow | B41: Oil Production Rate | C41: OPR | E41: ROPR
A42: Flow | B42: Oil Production Total | C42: OPT | E42: ROPT
A43: Flow | B43: Oil Production Total (Net From Region) | C43: OP | E43: ROP
A44: Flow | B44: Oil Velocity (Inter-Block in I+ Direction) | C44: VELOI | F44: BVELOI
A45: Flow | B45: Oil Velocity (Inter-Block in J+ Direction) | C45: VELOJ | F45: BVELOJ
A46: Flow | B46: Oil Velocity (Inter-Block in K+ Direction) | C46: VELOK | F46: BVELOK
A47: Flow | B47: Water Flow (Inter-Block in I+ Direction) | C47: FLOWI | F47: BFLOWI
A48: Flow | B48: Water Flow (Inter-Block in J+ Direction) | C48: FLOWJ | F48: BFLOWJ
A49: Flow | B49: Water Flow (Inter-Block in K+ Direction) | C49: FLOWK | F49: BFLOWK
A50: Flow-Reg | B50: Water Flow Rate Inter-Region | C50: WFR | E50: RWFR | G50: OPM Flow Implementation
A51: Flow-Reg | B51: Water Flow Rate Inter-Region | C51: WFR+ | E51: RWFR+
A52: Flow-Reg | B52: Water Flow Rate Inter-Region | C52: WFR- | E52: RWFR-
A53: Flow-Reg | B53: Water Flow Total Inter-Region | C53: WFT | E53: RWFT
A54: Flow-Reg | B54: Water Flow Total Inter-Region | C54: WFT+ | E54: RWFT+ | G54: OPM Flow Implementation
A55: Flow-Reg | B55: Water Flow Total Inter-Region | C55: WFT- | E55: RWFT-
A56: Flow | B56: Water Injection Rate | C56: WIR | E56: RWIR
A57: Flow | B57: Water Injection Total | C57: WIT | E57: RWIT
A58: Flow | B58: Water Potential | C58: PPW | D58: FPPW | E58: RPPW | F58: BPPW
A59: Flow | B59: Water Production Rate | C59: WPR | E59: RWPR
A60: Flow | B60: Water Production Total | C60: WPT | E60: RWPT
A61: Flow | B61: Water Production Total (Net From Region) | C61: WP | E61: RWP
A62: Flow | B62: Water Velocity (Inter-Block in I+ Direction) | C62: VELWI | F62: BVELWI
A63: Flow | B63: Water Velocity (Inter-Block in J+ Direction) | C63: VELWJ | F63: BVELWJ
A64: Flow | B64: Water Velocity (Inter-Block in K+ Direction) | C64: VELWK | F64: BVELWK
A65: Pressure | B65: Gas Phase Pressure | C65: GPR | F65: BGPR
A66: Pressure | B66: Oil Phase Pressure | C66: PR | D66: FPR | E66: RPR | F66: BPR | G66: Field and Region HCPV weighted
F67: BPRESSUR
A68: Pressure | B68: Oil Phase Pressure | C68: PRH | D68: FPRH | E68: RPRH | G68: Field and Region HCPV weighted
A69: Pressure | B69: Oil Phase Pressure (PV Weighted) | C69: PRP | D69: FPRP | E69: RPRP | G69: Field and Region PV weighted
A70: Pressure | B70: Water Phase Pressure | C70: WPR | F70: BWPR
A71: Property | B71: Block Hydrocarbon Phase State | C71: STATE | F71: BSTATE | G71: Gas (1), Gas & Oil (2), Oil (3)
A72: Property | B72: Bubble Point Pressure | C72: PBUB | F72: BPBUB
A73: Property | B73: Capillary Pressure (Gas-Oil) | C73: GPC | F73: BGPC
A74: Property | B74: Capillary Pressure (Water-Oil) | C74: WPC | F74: BWPC
A75: Property | B75: Dew Point | C75: PDEW | F75: BPDEW
A76: Property | B76: Gas P/Z | C76: PRGZ | D76: FPRGZ | E76: RPRGZ
A77: Property | B77: Gas Reservoir Density | C77: GDEN | D77: FGDEN | E77: RGDEN | F77: BGDEN
A78: Property | B78: Gas Saturation | C78: GSAT | D78: FGSAT | E78: RGSAT | F78: BGSAT BGSAT
A79: Property | B79: Gas Saturation (Drainage to Imbibition) | C79: GSHY | F79: BGSHY | G79: Leaving gas saturation for gas capillary pressure hysteresis
A80: Property | B80: Gas Saturation (Dynamically Trapped) | C80: GTPD | F80: BGTPD | G80: WAG Hysteresis only
A81: Property | B81: Gas Saturation (Trapped Critical) | C81: GSTRP | F81: BGSTRP | G81: For gas capillary pressure hysteresis
A82: Property | B82: Gas Saturation (Trapped) | C82: GTRP | F82: BGTRP | G82: WAG Hysteresis only
A83: Property | B83: Gas Viscosity | C83: GVIS | D83: FGVIS | E83: RGVIS | F83: BGVIS
A84: Property | B84: Gas-Oil Ratio (Saturated) | C84: RSSAT | F84: BRSSAT
A85: Property | B85: Initial Contact Corrected Potential | C85: PPC | D85: FPPC | E85: RPPC | F85: BPPC
A86: Property | B86: Oil Reservoir Density | C86: ODEN | D86: FODEN | E86: RODEN | F86: BODEN
A87: Property | B87: Oil Saturation | C87: OSAT | D87: FOSAT | E87: ROSAT | F87: BOSAT | G87: Also BSOIL
A88: Property | B88: Oil Viscosity | C88: OVIS | D88: FOVIS | E88: ROVIS | F88: BOVIS | G88: Also BVOIL
A89: Property | B89: Oil-Gas Ratio (Saturated) | C89: RVSAT | F89: BRVSAT
A90: Property | B90: Relative Permeability (Gas in the R- Direction) | C90: GKRR- | F90: BGKRR-
A91: Property | B91: Relative Permeability (Gas in the R+ Direction) | C91: GKRR | F91: BGKRR
A92: Property | B92: Relative Permeability (Gas in the Theta- Direction) | C92: GKRT- | F92: BGKRT-
A93: Property | B93: Relative Permeability (Gas in the Theta+ Direction) | C93: GKRT | F93: BGKRT
A94: Property | B94: Relative Permeability (Gas in the X- Direction) | C94: GKRX- | F94: BGKRX- | G94: Also BGKRI-
A95: Property | B95: Relative Permeability (Gas in the X+ Direction) | C95: GKRX | F95: BGKRX | G95: Also BGKRI
A96: Property | B96: Relative Permeability (Gas in the Y- Direction) | C96: GKRY- | F96: BGKRY- | G96: Also BGKRJ-
A97: Property | B97: Relative Permeability (Gas in the Y+ Direction) | C97: GKRY | F97: BGKRY | G97: Also BGKRJ
A98: Property | B98: Relative Permeability (Gas in the Z- Direction) | C98: GKRZ- | F98: BGKRZ- | G98: Also BGKRK-
A99: Property | B99: Relative Permeability (Gas in the Z+ Direction) | C99: GKRZ | F99: BGKRZ | G99: Also BGKRK
A100: Property | B100: Relative Permeability (Gas) | C100: KRG | F100: BKRG | G100: Also BGWR
A101: Property | B101: Relative Permeability (Krw Reduction Factor) | C101: RK | F101: BRK | G101: Due to Polymer
A102: Property | B102: Relative Permeability (Oil Two Phase to Gas) | C102: KROG | F102: BKROG
A103: Property | B103: Relative Permeability (Oil Two Phase to Water) | C103: KROW | F103: BKROW
A104: Property | B104: Relative Permeability (Oil in the R- Direction) | C104: OKRR- | F104: BOKRR-
A105: Property | B105: Relative Permeability (Oil in the R+ Direction) | C105: OKRR | F105: BOKRR
A106: Property | B106: Relative Permeability (Oil in the Theta- Direction) | C106: OKRT- | F106: BOKRT-
A107: Property | B107: Relative Permeability (Oil in the Theta+ Direction) | C107: OKRT | F107: BOKRT
A108: Property | B108: Relative Permeability (Oil in the X- Direction) | C108: OKRX- | F108: BOKRX- | G108: Also BOKRI-
A109: Property | B109: Relative Permeability (Oil in the X+ Direction) | C109: OKRX | F109: BOKRX | G109: Also BOKRI
A110: Property | B110: Relative Permeability (Oil in the Y- Direction) | C110: OKRY- | F110: BOKRY- | G110: Also BOKRJ-
A111: Property | B111: Relative Permeability (Oil in the Y+ Direction) | C111: OKRY | F111: BOKRY | G111: Also BOKRJ
A112: Property | B112: Relative Permeability (Oil in the Z- Direction) | C112: OKRZ- | F112: BOKRZ- | G112: Also BOKRK-
A113: Property | B113: Relative Permeability (Oil in the Z+ Direction) | C113: OKRZ | F113: BOKRZ | G113: Also BOKRK
A114: Property | B114: Relative Permeability (Oil) | C114: KRO | F114: BKRO | G114: Also BOKR
A115: Property | B115: Relative Permeability (Water in the R- Direction) | C115: WKRR- | F115: BWKRR-
A116: Property | B116: Relative Permeability (Water in the R+ Direction) | C116: WKRR | F116: BWKRR
A117: Property | B117: Relative Permeability (Water in the Theta- Direction) | C117: WKRT- | F117: BWKRT-
A118: Property | B118: Relative Permeability (Water in the Theta+ Direction) | C118: WKRT | F118: BWKRT
A119: Property | B119: Relative Permeability (Water in the X- Direction) | C119: WKRX- | F119: BWKRX- | G119: Also BWKRI-
A120: Property | B120: Relative Permeability (Water in the X+ Direction) | C120: WKRX | F120: BWKRX | G120: Also BWKRI
A121: Property | B121: Relative Permeability (Water in the Y- Direction) | C121: WKRY- | F121: BWKRY- | G121: Also BWKRJ-
A122: Property | B122: Relative Permeability (Water in the Y+ Direction) | C122: WKRY | F122: BWKRY | G122: Also BWKRJ
A123: Property | B123: Relative Permeability (Water in the Z- Direction) | C123: WKRZ- | F123: BWKRZ- | G123: Also BWKRK-
A124: Property | B124: Relative Permeability (Water in the Z+ Direction) | C124: WKRZ | F124: BWKRZ | G124: Also BWKRK
A125: Property | B125: Relative Permeability (Water) | C125: KRW | F125: BKRW | G125: Also BWKR
A126: Property | B126: Water Reservoir Density | C126: WDEN | D126: FWDEN | E126: RWDEN | F126: BWDEN
A127: Property | B127: Water Saturation | C127: WSAT | D127: FWSAT | E127: RWSAT | F127: BWSAT | G127: Also BSWAT
A128: Property | B128: Water Saturation (Drainage to Imbibition) | C128: WSHY | F128: BWSHY | G128: Leaving water saturation for gas capillary pressure hysteresis
A129: Property | B129: Water Saturation (Maximum Wetting) | C129: WSMA | F129: BWSMA | G129: Capillary pressure hysteresis maximum water saturation
A130: Property | B130: Water Viscosity | C130: WVIS | D130: FWVIS | E130: RWVIS | F130: BWVIS
A131: Ratio | B131: Gas-Oil Ratio | C131: RS | D131: FRS | E131: RRS | F131: BRS
A132: Ratio | B132: Oil-Gas Ratio | C132: RV | D132: FRV | E132: RRV | F132: BRV
A133: Volumes | B133: Gas In-Place | C133: GIP | D133: FGIP | E133: RGIP | F133: BGIP | G133: Liquid and gas phases
A134: Volumes | B134: Gas In-Place (Gas Phase) | C134: GIPG | D134: FGIPG | E134: RGIPG | F134: BGIPG
A135: Volumes | B135: Gas In-Place (Liquid Phase) | C135: GIPL | D135: FGIPL | E135: RGIPL | F135: BGIPL | G135: Only for cases that have dissolved gas in the water phase
A136: Volumes | B136: Gas In-Place (Reservoir Conditions) | C136: GIPR | D136: FGIPR | G136: Compositional vector implemented in OPM Flow.
A137: Volumes | B137: Oil In-Place | C137: OIP | D137: FOIP | E137: ROIP | F137: BOIP | G137: Liquid and gas phases
A138: Volumes | B138: Oil In-Place (Gas Phase) | C138: OIPG | D138: FOIPG | E138: ROIPG | F138: BOIPG
A139: Volumes | B139: Oil In-Place (Liquid Phase) | C139: OIPL | D139: FOIPL | E139: ROIPL | F139: BOIPL
A140: Volumes | B140: Oil In-Place (Reservoir Conditions) | C140: OIPR | D140: FOIPR | G140: Compositional vector implemented in OPM Flow.
A141: Volumes | B141: Pore Volume (Gas) | C141: GPV | D141: FGPV | E141: RGPV | F141: BGPV
A142: Volumes | B142: Pore Volume (HCPV) | C142: HPV | D142: FHPV | E142: RHPV | F142: BHPV | G142: Also BHPV
A143: Volumes | B143: Pore Volume (Oil) | C143: OPV | D143: FOPV | E143: ROPV | F143: BOPV
A144: Volumes | B144: Pore Volume (Reservoir Conditions) | C144: RPV | D144: FRPV | F144: BRPV
A145: Volumes | B145: Pore Volume (Water) | C145: WPV | D145: FWPV | E145: RWPV | F145: BWPV
A146: Volumes | B146: Rock Compaction (Trans. Multiplier X Direction) | C146: PERMMDX | F146: BPERMMDX | G146: Also BPERMOD
A147: Volumes | B147: Rock Compaction (Trans. Multiplier Y Direction) | C147: PERMMDY | F147: BPERMMDY
A148: Volumes | B148: Rock Compaction (Trans. Multiplier Z Direction) | C148: PERMMDZ | F148: BPERMMDZ
A149: Volumes | B149: Rock Compaction (Trans. Multiplier) | C149: RTM | D149: FRTM | E149: RRTM | F149: BRTM
A150: Volumes | B150: Rock Compaction (Dual Porosity SIGMA Multiplier) | C150: SIGMMOD | F150: BSIGMMOD
A151: Volumes | B151: Rock Compaction (PV Multiplier) | C151: PORVMOD | F151: BPORVMOD
A152: Volumes | B152: Water In-Place | C152: WIP | D152: FWIP | E152: RWIP | F152: BWIP
A153: Volumes | B153: Water In-Place (Reservoir Conditions) | C153: WIPR | D153: FWIPR | G153: Compositional vector implemented in OPM Flow.
A154: Notes:

Sheet: Table1798
A1: Field and Region Summary Recovery Variables
A2: Type | B2: Variable | C2: Root | D2: Field | E2: Region | F2: Comment
A3: Recovery | B3: Oil Recovery Efficiency (STOIIP) | C3: OE | D3: FOE | E3: ROE | F3: Based on STOIIP
A4: Recovery | B4: Oil Recovery Efficiency (Wells) | C4: OEW | D4: FOEW | E4: ROEW | F4: Based on well production and STOIIP
A5: Recovery | B5: Oil Recovery Efficiency (STOIIP Mobile with respect to Water) | C5: OEIW | D5: FOEIW | E5: ROEIW | F5: Based on STOIIP and initial mobile oil saturate with respect to water
A6: Recovery | B6: Oil Recovery Efficiency Wells Mobile with respect to Water) | C6: OEWW | D6: FOEWW | E6: ROEWW | F6: Based on well production and initial mobile oil saturate with respect to water
A7: Recovery | B7: Oil Recovery Efficiency (STOIIP Mobile with respect to Gas) | C7: OEIG | D7: FOEIG | E7: ROEIG | F7: Based on STOIIP and initial mobile oil saturate with respect to gas.
A8: Recovery | B8: Oil Recovery Efficiency (Wells Mobile with respect to Gas) | C8: OEWG | D8: FOEWG | E8: ROEWG | F8: Based on well production and initial mobile oil saturate with respect to gas.
A9: Recovery | B9: Oil Production Total (Free Gas Gas) | C9: OTMF | D9: FOTMF | E9: ROTMF | F9: Volumes reported at stock tank conditions
A10: Recovery | B10: Oil Production Total (Gas Influx) | C10: ORMG | D10: FORMG | E10: RORMG
A11: Recovery | B11: Oil Production Total (Oil Expansion) | C11: ORME | D11: FORME | E11: RORME
A12: Recovery | B12: Oil Production Total (Rock Compaction) | C12: ORMR | D12: FORMR | E12: RORMR
A13: Recovery | B13: Oil Production Total (Solution Gas) | C13: ORMS | D13: FORMS | E13: RORMS
A14: Recovery | B14: Oil Production Total (Water Influx) | C14: ORMW | D14: FORMW | E14: RORMW
A15: Notes:

Sheet: Table1799
A1: OE = ( STOIIP t = 0 − STOIIP t = i ) STOIIP t = 0 "OE" = left (STOIIP sub{t=0}`` - ``STOIIP sub{t=i} Right) over {STOIIP sub{t=0}} VkNMTVRGAQAxAAAAAAAAAAEAGwAAAAAAAAAAAAAAAAABAAAAAQAAAAEAAAABAAAAAbkUAACf BAAAiAAAAJYAAQACAAAACQCLAAEAAgAAAP//gQABABAAAAAAAAAAAAAAALgUAACeBAAAlQAB AAQAAAAAAAAAlgABAAIAAAAJAIsAAQACAAAAHwCKAAEASAAAAAUAQgAAABAATGliZXJhdGlv biBTZXJpZgAAAAAAAKcBAAAAAAAAAAAFAAAAAAAAAP8DAAAAAAAAAAEA/wMAAAAAAAAAAAAA AIgAAQACAAAAAQCHAAEABQAAAP////8AhgABAAQAAAAAAAAAcgACABoAAAAAAAAA5QIAAAIA T0U0AgAAAAACAAIATwBFAIwAAQAAAAAAiwABAAIAAAAfAIoAAQBCAAAABQA8AAAACgBPcGVu U3ltYm9sAAAAAAAApwEAAP//AAAAAAUAAAAAAAAA/wMAAAAAAAAAAQD/AwAAAAAAAAAAAAAA iAABAAIAAAABAIcAAQAFAAAA/////wCGAAEABAAAAAAAAAByAAIAGgAAADwCAADlAgAAAQAA AD0AUAEAAAAAAQABAD0AjAABAAAAAACLAAEAAgAAAB8AigABAEIAAAAFADwAAAAKAE9wZW5T eW1ib2wAAO0AAADwAQAA//8AAAAABQAAAAAAAAD/AwAAAAAAAAABAP8DAAAAAABPAQAAAACI AAEAAgAAAAEAhwABAAUAAAD/////AIYAAQAEAAAAAAAAAHIAAgAaAAAAuQMAAL0BAAABAAAA KAByAAAAAAABAAEAKACMAAEAAAAAAIsAAQACAAAAHwCKAAEASAAAAAUAQgAAABAATGliZXJh dGlvbiBTZXJpZgAAAAAAAKcBAAAAAAAAAAAFAAAAAAACAP8DAAAAAAAAAAEA/wMAAAAAAAAA AAAAAIgAAQACAAAAAQCHAAEABQAAAP////8AhgABAAQAAAAAAAAAcgACACYAAABNBAAAkgEA AAYAU1RPSUlQBQUAAAAABgAGAFMAVABPAEkASQBQAIwAAQAAAAAAiwABAAIAAAAfAIoAAQBI AAAABQBCAAAAEABMaWJlcmF0aW9uIFNlcmlmAAAAAAAA/QAAAAAAAAAAAAUAAAAAAAIA/wMA AAAAAAAAAQD/AwAAAAAAAAAAAAAAiAABAAIAAAABAIcAAQAFAAAA/////wCGAAEABAAAAAAA AAByAAIAFwAAAG0JAAD8AQAAAQB0RgAAAAAAAQABAHQAjAABAAAAAACLAAEAAgAAAB8AigAB AEIAAAAFADwAAAAKAE9wZW5TeW1ib2wAAAAAAAD9AAAA//8AAAAABQAAAAAAAAD/AwAAAAAA AAABAP8DAAAAAAAAAAAAAACIAAEAAgAAAAEAhwABAAUAAAD/////AIYAAQAEAAAAAAAAAHIA AgAaAAAAwgkAAPwBAAABAAAAPQDJAAAAAAABAAEAPQCMAAEAAAAAAIsAAQACAAAAHwCKAAEA SAAAAAUAQgAAABAATGliZXJhdGlvbiBTZXJpZgAAAAAAAP0AAAAAAAAAAAAFAAAAAAAAAP8D AAAAAAAAAAEA/wMAAAAAAAAAAAAAAIgAAQACAAAAAQCHAAEABQAAAP////8AhgABAAQAAAAA AAAAcgACABcAAACVCgAA/AEAAAEAMH8AAAAAAAEAAQAwAIwAAQAAAAAAiwABAAIAAAAfAIoA AQBCAAAABQA8AAAACgBPcGVuU3ltYm9sAAAAAAAApwEAAP//AAAAAAUAAAAAAAAA/wMAAAAA AAAAAQD/AwAAAAAAAAAAAAAAiAABAAIAAAABAIcAAQAFAAAA/////wCGAAEABAAAAAAAAABy AAIAGgAAAJMLAACSAQAAAQAAABIiUAEAAAAAAQABABIijAABAAAAAACLAAEAAgAAAB8AigAB AEgAAAAFAEIAAAAQAExpYmVyYXRpb24gU2VyaWYAAAAAAACnAQAAAAAAAAAABQAAAAAAAgD/ AwAAAAAAAAABAP8DAAAAAAAAAAAAAACIAAEAAgAAAAEAhwABAAUAAAD/////AIYAAQAEAAAA AAAAAHIAAgAmAAAAeg0AAJIBAAAGAFNUT0lJUAUFAAAAAAYABgBTAFQATwBJAEkAUACMAAEA AAAAAIsAAQACAAAAHwCKAAEASAAAAAUAQgAAABAATGliZXJhdGlvbiBTZXJpZgAAAAAAAP0A AAAAAAAAAAAFAAAAAAACAP8DAAAAAAAAAAEA/wMAAAAAAAAAAAAAAIgAAQACAAAAAQCHAAEA BQAAAP////8AhgABAAQAAAAAAAAAcgACABcAAACbEgAA/AEAAAEAdEYAAAAAAAEAAQB0AIwA AQAAAAAAiwABAAIAAAAfAIoAAQBCAAAABQA8AAAACgBPcGVuU3ltYm9sAAAAAAAA/QAAAP// AAAAAAUAAAAAAAAA/wMAAAAAAAAAAQD/AwAAAAAAAAAAAAAAiAABAAIAAAABAIcAAQAFAAAA /////wCGAAEABAAAAAAAAAByAAIAGgAAAO8SAAD8AQAAAQAAAD0AyQAAAAAAAQABAD0AjAAB AAAAAACLAAEAAgAAAB8AigABAEgAAAAFAEIAAAAQAExpYmVyYXRpb24gU2VyaWYAAAAAAAD9 AAAAAAAAAAAABQAAAAAAAgD/AwAAAAAAAAABAP8DAAAAAAAAAAAAAACIAAEAAgAAAAEAhwAB AAUAAAD/////AIYAAQAEAAAAAAAAAHIAAgAXAAAAwxMAAPwBAAABAGlGAAAAAAABAAEAaQCM AAEAAAAAAIsAAQACAAAAHwCKAAEAQgAAAAUAPAAAAAoAT3BlblN5bWJvbAAA7QAAAPABAAD/ /wAAAAAFAAAAAAAAAP8DAAAAAAAAAAEA/wMAAAAAAE8BAAAAAIgAAQACAAAAAQCHAAEABQAA AP////8AhgABAAQAAAAAAAAAcgACABoAAAAtFAAAvQEAAAEAAAApAHIAAAAAAAEAAQApAIwA AQAAAAAAiwABAAIAAAAfAIUAAQAFAAAAAAAAAAGEAAEABQAAAAAAAAAAigABAEIAAAAFADwA AAAKAE9wZW5TeW1ib2wAAAAAAACnAQAA//8AAAAABQAAAAAAAAD/AwAAAAAAAAABAP8DAAAA AAAAAAAAAACIAAEAAgAAAAEAhwABAAUAAAD/////AIYAAQAEAAAAAAAAAGcAAQAQAAAAuQMA AGYCAACtFAAAegIAAIwAAQAAAAAAiwABAAIAAAAfAIoAAQBIAAAABQBCAAAAEABMaWJlcmF0 aW9uIFNlcmlmAAAAAAAApwEAAAAAAAAAAAUAAAAAAAIA/wMAAAAAAAAAAQD/AwAAAAAAAAAA AAAAiAABAAIAAAABAIcAAQAFAAAA/////wCGAAEABAAAAAAAAAByAAIAJgAAANkIAAANBAAA BgBTVE9JSVAFBQAAAAAGAAYAUwBUAE8ASQBJAFAAjAABAAAAAACLAAEAAgAAAB8AigABAEgA AAAFAEIAAAAQAExpYmVyYXRpb24gU2VyaWYAAAAAAAD9AAAAAAAAAAAABQAAAAAAAgD/AwAA AAAAAAABAP8DAAAAAAAAAAAAAACIAAEAAgAAAAEAhwABAAUAAAD/////AIYAAQAEAAAAAAAA AHIAAgAXAAAA5A0AAGIEAAABAHRGAAAAAAABAAEAdACMAAEAAAAAAIsAAQACAAAAHwCKAAEA QgAAAAUAPAAAAAoAT3BlblN5bWJvbAAAAAAAAP0AAAD//wAAAAAFAAAAAAAAAP8DAAAAAAAA AAEA/wMAAAAAAAAAAAAAAIgAAQACAAAAAQCHAAEABQAAAP////8AhgABAAQAAAAAAAAAcgAC ABoAAAA5DgAAYgQAAAEAAAA9AMkAAAAAAAEAAQA9AIwAAQAAAAAAiwABAAIAAAAfAIoAAQBI AAAABQBCAAAAEABMaWJlcmF0aW9uIFNlcmlmAAAAAAAA/QAAAAAAAAAAAAUAAAAAAAAA/wMA AAAAAAAAAQD/AwAAAAAAAAAAAAAAiAABAAIAAAABAIcAAQAFAAAA/////wCGAAEABAAAAAAA AAByAAIAFwAAAAwPAABiBAAAAQAwfwAAAAAAAQABADAAjAABAAAAAACVAAEABAAAAAAAAACW AAEAAgAAAAkAjAABAAAAAAA= formula | B1: (11.1)

Sheet: Table1800
A1: OEW = ( Well Oil Production t = i ) STOIIP t = 0 "OEW" = left ("Well Oil Production" sub {t=i}Right) over {STOIIP sub{t=0} } VkNMTVRGAQAxAAAAAAAAAAEAGwAAAAAAAAAAAAAAAAABAAAAAQAAAAEAAAABAAAAAXkVAACf BAAAZQAAAJYAAQACAAAACQCLAAEAAgAAAP//gQABABAAAAAAAAAAAAAAAHgVAACeBAAAlQAB AAQAAAAAAAAAlgABAAIAAAAJAIsAAQACAAAAHwCKAAEASAAAAAUAQgAAABAATGliZXJhdGlv biBTZXJpZgAAAAAAAKcBAAAAAAAAAAAFAAAAAAAAAP8DAAAAAAAAAAEA/wMAAAAAAAAAAAAA AIgAAQACAAAAAQCHAAEABQAAAP////8AhgABAAQAAAAAAAAAcgACAB0AAAAAAAAA5QIAAAMA T0VXwwMAAAAAAwADAE8ARQBXAIwAAQAAAAAAiwABAAIAAAAfAIoAAQBCAAAABQA8AAAACgBP cGVuU3ltYm9sAAAAAAAApwEAAP//AAAAAAUAAAAAAAAA/wMAAAAAAAAAAQD/AwAAAAAAAAAA AAAAiAABAAIAAAABAIcAAQAFAAAA/////wCGAAEABAAAAAAAAAByAAIAGgAAAOMDAADlAgAA AQAAAD0AUAEAAAAAAQABAD0AjAABAAAAAACLAAEAAgAAAB8AigABAEIAAAAFADwAAAAKAE9w ZW5TeW1ib2wAAO0AAADwAQAA//8AAAAABQAAAAAAAAD/AwAAAAAAAAABAP8DAAAAAABPAQAA AACIAAEAAgAAAAEAhwABAAUAAAD/////AIYAAQAEAAAAAAAAAHIAAgAaAAAAYAUAAL0BAAAB AAAAKAByAAAAAAABAAEAKACMAAEAAAAAAIsAAQACAAAAHwCKAAEASAAAAAUAQgAAABAATGli ZXJhdGlvbiBTZXJpZgAAAAAAAKcBAAAAAAAAAAAFAAAAAAAAAP8DAAAAAAAAAAEA/wMAAAAA AAAAAAAAAIgAAQACAAAAAQCHAAEABQAAAP////8AhgABAAQAAAAAAAAAcgACAE0AAAD0BQAA kgEAABMAV2VsbCBPaWwgUHJvZHVjdGlvbkYNAAAAABMAEwBXAGUAbABsACAATwBpAGwAIABQ AHIAbwBkAHUAYwB0AGkAbwBuAIwAAQAAAAAAiwABAAIAAAAfAIoAAQBIAAAABQBCAAAAEABM aWJlcmF0aW9uIFNlcmlmAAAAAAAA/QAAAAAAAAAAAAUAAAAAAAIA/wMAAAAAAAAAAQD/AwAA AAAAAAAAAAAAiAABAAIAAAABAIcAAQAFAAAA/////wCGAAEABAAAAAAAAAByAAIAFwAAAFkT AAD8AQAAAQB0RgAAAAAAAQABAHQAjAABAAAAAACLAAEAAgAAAB8AigABAEIAAAAFADwAAAAK AE9wZW5TeW1ib2wAAAAAAAD9AAAA//8AAAAABQAAAAAAAAD/AwAAAAAAAAABAP8DAAAAAAAA AAAAAACIAAEAAgAAAAEAhwABAAUAAAD/////AIYAAQAEAAAAAAAAAHIAAgAaAAAArhMAAPwB AAABAAAAPQDJAAAAAAABAAEAPQCMAAEAAAAAAIsAAQACAAAAHwCKAAEASAAAAAUAQgAAABAA TGliZXJhdGlvbiBTZXJpZgAAAAAAAP0AAAAAAAAAAAAFAAAAAAACAP8DAAAAAAAAAAEA/wMA AAAAAAAAAAAAAIgAAQACAAAAAQCHAAEABQAAAP////8AhgABAAQAAAAAAAAAcgACABcAAACB FAAA/AEAAAEAaUYAAAAAAAEAAQBpAIwAAQAAAAAAiwABAAIAAAAfAIoAAQBCAAAABQA8AAAA CgBPcGVuU3ltYm9sAADtAAAA8AEAAP//AAAAAAUAAAAAAAAA/wMAAAAAAAAAAQD/AwAAAAAA TwEAAAAAiAABAAIAAAABAIcAAQAFAAAA/////wCGAAEABAAAAAAAAAByAAIAGgAAAOsUAAC9 AQAAAQAAACkAcgAAAAAAAQABACkAjAABAAAAAACLAAEAAgAAAB8AhQABAAUAAAAAAAAAAYQA AQAFAAAAAAAAAACKAAEAQgAAAAUAPAAAAAoAT3BlblN5bWJvbAAAAAAAAKcBAAD//wAAAAAF AAAAAAAAAP8DAAAAAAAAAAEA/wMAAAAAAAAAAAAAAIgAAQACAAAAAQCHAAEABQAAAP////8A hgABAAQAAAAAAAAAZwABABAAAABLBQAAZgIAAFwVAAB6AgAAjAABAAAAAACLAAEAAgAAAB8A igABAEgAAAAFAEIAAAAQAExpYmVyYXRpb24gU2VyaWYAAAAAAACnAQAAAAAAAAAABQAAAAAA AgD/AwAAAAAAAAABAP8DAAAAAAAAAAAAAACIAAEAAgAAAAEAhwABAAUAAAD/////AIYAAQAE AAAAAAAAAHIAAgAmAAAAAQoAAA0EAAAGAFNUT0lJUAUFAAAAAAYABgBTAFQATwBJAEkAUACM AAEAAAAAAIsAAQACAAAAHwCKAAEASAAAAAUAQgAAABAATGliZXJhdGlvbiBTZXJpZgAAAAAA AP0AAAAAAAAAAAAFAAAAAAACAP8DAAAAAAAAAAEA/wMAAAAAAAAAAAAAAIgAAQACAAAAAQCH AAEABQAAAP////8AhgABAAQAAAAAAAAAcgACABcAAAAMDwAAYgQAAAEAdEYAAAAAAAEAAQB0 AIwAAQAAAAAAiwABAAIAAAAfAIoAAQBCAAAABQA8AAAACgBPcGVuU3ltYm9sAAAAAAAA/QAA AP//AAAAAAUAAAAAAAAA/wMAAAAAAAAAAQD/AwAAAAAAAAAAAAAAiAABAAIAAAABAIcAAQAF AAAA/////wCGAAEABAAAAAAAAAByAAIAGgAAAHYPAABiBAAAAQAAAD0AyQAAAAAAAQABAD0A jAABAAAAAACLAAEAAgAAAB8AigABAEgAAAAFAEIAAAAQAExpYmVyYXRpb24gU2VyaWYAAAAA AAD9AAAAAAAAAAAABQAAAAAAAAD/AwAAAAAAAAABAP8DAAAAAAAAAAAAAACIAAEAAgAAAAEA hwABAAUAAAD/////AIYAAQAEAAAAAAAAAHIAAgAXAAAAShAAAGIEAAABADB/AAAAAAABAAEA MACMAAEAAAAAAJUAAQAEAAAAAAAAAJYAAQACAAAACQCMAAEAAAAAAA== formula | B1: (11.2)

Sheet: Table1801
A1: OEIW = ( STOIIP t = 0 − STOIIP t = i ) ( Initial Mobile Oil Saturation with respect to Water t = 0 ) "OEIW" = left (STOIIP sub{t=0}`` - ``STOIIP sub{t=i} Right) over {left ("Initial Mobile Oil Saturation with respect to Water" sub{t=0} right) } VkNMTVRGAQAxAAAAAAAAAAEAGwAAAAAAAAAAAAAAAAABAAAAAQAAAAEAAAABAAAAATkqAADY BAAAlgAAAJYAAQACAAAACQCLAAEAAgAAAP//gQABABAAAAAAAAAAAAAAADgqAADXBAAAlQAB AAQAAAAAAAAAlgABAAIAAAAJAIsAAQACAAAAHwCKAAEASAAAAAUAQgAAABAATGliZXJhdGlv biBTZXJpZgAAAAAAAKcBAAAAAAAAAAAFAAAAAAAAAP8DAAAAAAAAAAEA/wMAAAAAAAAAAAAA AIgAAQACAAAAAQCHAAEABQAAAP////8AhgABAAQAAAAAAAAAcgACACAAAAAAAAAA5QIAAAQA T0VJV1AEAAAAAAQABABPAEUASQBXAIwAAQAAAAAAiwABAAIAAAAfAIoAAQBCAAAABQA8AAAA CgBPcGVuU3ltYm9sAAAAAAAApwEAAP//AAAAAAUAAAAAAAAA/wMAAAAAAAAAAQD/AwAAAAAA AAAAAAAAiAABAAIAAAABAIcAAQAFAAAA/////wCGAAEABAAAAAAAAAByAAIAGgAAAHcEAADl AgAAAQAAAD0AUAEAAAAAAQABAD0AjAABAAAAAACLAAEAAgAAAB8AigABAEIAAAAFADwAAAAK AE9wZW5TeW1ib2wAAO0AAADwAQAA//8AAAAABQAAAAAAAAD/AwAAAAAAAAABAP8DAAAAAABP AQAAAACIAAEAAgAAAAEAhwABAAUAAAD/////AIYAAQAEAAAAAAAAAHIAAgAaAAAAiw8AAL0B AAABAAAAKAByAAAAAAABAAEAKACMAAEAAAAAAIsAAQACAAAAHwCKAAEASAAAAAUAQgAAABAA TGliZXJhdGlvbiBTZXJpZgAAAAAAAKcBAAAAAAAAAAAFAAAAAAACAP8DAAAAAAAAAAEA/wMA AAAAAAAAAAAAAIgAAQACAAAAAQCHAAEABQAAAP////8AhgABAAQAAAAAAAAAcgACACYAAAA1 EAAAkgEAAAYAU1RPSUlQBQUAAAAABgAGAFMAVABPAEkASQBQAIwAAQAAAAAAiwABAAIAAAAf AIoAAQBIAAAABQBCAAAAEABMaWJlcmF0aW9uIFNlcmlmAAAAAAAA/QAAAAAAAAAAAAUAAAAA AAIA/wMAAAAAAAAAAQD/AwAAAAAAAAAAAAAAiAABAAIAAAABAIcAAQAFAAAA/////wCGAAEA BAAAAAAAAAByAAIAFwAAAEAVAAD8AQAAAQB0RgAAAAAAAQABAHQAjAABAAAAAACLAAEAAgAA AB8AigABAEIAAAAFADwAAAAKAE9wZW5TeW1ib2wAAAAAAAD9AAAA//8AAAAABQAAAAAAAAD/ AwAAAAAAAAABAP8DAAAAAAAAAAAAAACIAAEAAgAAAAEAhwABAAUAAAD/////AIYAAQAEAAAA AAAAAHIAAgAaAAAAlRUAAPwBAAABAAAAPQDJAAAAAAABAAEAPQCMAAEAAAAAAIsAAQACAAAA HwCKAAEASAAAAAUAQgAAABAATGliZXJhdGlvbiBTZXJpZgAAAAAAAP0AAAAAAAAAAAAFAAAA AAAAAP8DAAAAAAAAAAEA/wMAAAAAAAAAAAAAAIgAAQACAAAAAQCHAAEABQAAAP////8AhgAB AAQAAAAAAAAAcgACABcAAABoFgAA/AEAAAEAMH8AAAAAAAEAAQAwAIwAAQAAAAAAiwABAAIA AAAfAIoAAQBCAAAABQA8AAAACgBPcGVuU3ltYm9sAAAAAAAApwEAAP//AAAAAAUAAAAAAAAA /wMAAAAAAAAAAQD/AwAAAAAAAAAAAAAAiAABAAIAAAABAIcAAQAFAAAA/////wCGAAEABAAA AAAAAAByAAIAGgAAAHsXAACSAQAAAQAAABIiUAEAAAAAAQABABIijAABAAAAAACLAAEAAgAA AB8AigABAEgAAAAFAEIAAAAQAExpYmVyYXRpb24gU2VyaWYAAAAAAACnAQAAAAAAAAAABQAA AAAAAgD/AwAAAAAAAAABAP8DAAAAAAAAAAAAAACIAAEAAgAAAAEAhwABAAUAAAD/////AIYA AQAEAAAAAAAAAHIAAgAmAAAAYhkAAJIBAAAGAFNUT0lJUAUFAAAAAAYABgBTAFQATwBJAEkA UACMAAEAAAAAAIsAAQACAAAAHwCKAAEASAAAAAUAQgAAABAATGliZXJhdGlvbiBTZXJpZgAA AAAAAP0AAAAAAAAAAAAFAAAAAAACAP8DAAAAAAAAAAEA/wMAAAAAAAAAAAAAAIgAAQACAAAA AQCHAAEABQAAAP////8AhgABAAQAAAAAAAAAcgACABcAAABtHgAA/AEAAAEAdEYAAAAAAAEA AQB0AIwAAQAAAAAAiwABAAIAAAAfAIoAAQBCAAAABQA8AAAACgBPcGVuU3ltYm9sAAAAAAAA /QAAAP//AAAAAAUAAAAAAAAA/wMAAAAAAAAAAQD/AwAAAAAAAAAAAAAAiAABAAIAAAABAIcA AQAFAAAA/////wCGAAEABAAAAAAAAAByAAIAGgAAAMIeAAD8AQAAAQAAAD0AyQAAAAAAAQAB AD0AjAABAAAAAACLAAEAAgAAAB8AigABAEgAAAAFAEIAAAAQAExpYmVyYXRpb24gU2VyaWYA AAAAAAD9AAAAAAAAAAAABQAAAAAAAgD/AwAAAAAAAAABAP8DAAAAAAAAAAAAAACIAAEAAgAA AAEAhwABAAUAAAD/////AIYAAQAEAAAAAAAAAHIAAgAXAAAAlh8AAPwBAAABAGlGAAAAAAAB AAEAaQCMAAEAAAAAAIsAAQACAAAAHwCKAAEAQgAAAAUAPAAAAAoAT3BlblN5bWJvbAAA7QAA APABAAD//wAAAAAFAAAAAAAAAP8DAAAAAAAAAAEA/wMAAAAAAE8BAAAAAIgAAQACAAAAAQCH AAEABQAAAP////8AhgABAAQAAAAAAAAAcgACABoAAAAAIAAAvQEAAAEAAAApAHIAAAAAAAEA AQApAIwAAQAAAAAAiwABAAIAAAAfAIUAAQAFAAAAAAAAAAGEAAEABQAAAAAAAAAAigABAEIA AAAFADwAAAAKAE9wZW5TeW1ib2wAAAAAAACnAQAA//8AAAAABQAAAAAAAAD/AwAAAAAAAAAB AP8DAAAAAAAAAAAAAACIAAEAAgAAAAEAhwABAAUAAAD/////AIYAAQAEAAAAAAAAAGcAAQAQ AAAA3wUAAGYCAAAjKgAAegIAAIwAAQAAAAAAiwABAAIAAAAfAIoAAQBCAAAABQA8AAAACgBP cGVuU3ltYm9sAADtAAAA8AEAAP//AAAAAAUAAAAAAAAA/wMAAAAAAAAAAQD/AwAAAAAATwEA AAAAiAABAAIAAAABAIcAAQAFAAAA/////wCGAAEABAAAAAAAAAByAAIAGgAAAPQFAABNBAAA AQAAACgAcgAAAAAAAQABACgAjAABAAAAAACLAAEAAgAAAB8AigABAEgAAAAFAEIAAAAQAExp YmVyYXRpb24gU2VyaWYAAAAAAACnAQAAAAAAAAAABQAAAAAAAAD/AwAAAAAAAAABAP8DAAAA AAAAAAAAAACIAAEAAgAAAAEAhwABAAUAAAD/////AIYAAQAEAAAAAAAAAHIAAgCtAAAAcwYA ACIEAAAzAEluaXRpYWwgTW9iaWxlIE9pbCBTYXR1cmF0aW9uIHdpdGggcmVzcGVjdCB0byBX YXRlck4hAAAAADMAMwBJAG4AaQB0AGkAYQBsACAATQBvAGIAaQBsAGUAIABPAGkAbAAgAFMA YQB0AHUAcgBhAHQAaQBvAG4AIAB3AGkAdABoACAAcgBlAHMAcABlAGMAdAAgAHQAbwAgAFcA YQB0AGUAcgCMAAEAAAAAAIsAAQACAAAAHwCKAAEASAAAAAUAQgAAABAATGliZXJhdGlvbiBT ZXJpZgAAAAAAAP0AAAAAAAAAAAAFAAAAAAACAP8DAAAAAAAAAAEA/wMAAAAAAAAAAAAAAIgA AQACAAAAAQCHAAEABQAAAP////8AhgABAAQAAAAAAAAAcgACABcAAADaJwAAjAQAAAEAdEYA AAAAAAEAAQB0AIwAAQAAAAAAiwABAAIAAAAfAIoAAQBCAAAABQA8AAAACgBPcGVuU3ltYm9s AAAAAAAA/QAAAP//AAAAAAUAAAAAAAAA/wMAAAAAAAAAAQD/AwAAAAAAAAAAAAAAiAABAAIA AAABAIcAAQAFAAAA/////wCGAAEABAAAAAAAAAByAAIAGgAAAEQoAACMBAAAAQAAAD0AyQAA AAAAAQABAD0AjAABAAAAAACLAAEAAgAAAB8AigABAEgAAAAFAEIAAAAQAExpYmVyYXRpb24g U2VyaWYAAAAAAAD9AAAAAAAAAAAABQAAAAAAAAD/AwAAAAAAAAABAP8DAAAAAAAAAAAAAACI AAEAAgAAAAEAhwABAAUAAAD/////AIYAAQAEAAAAAAAAAHIAAgAXAAAAAykAAIwEAAABADB/ AAAAAAABAAEAMACMAAEAAAAAAIsAAQACAAAAHwCKAAEAQgAAAAUAPAAAAAoAT3BlblN5bWJv bAAA7QAAAPABAAD//wAAAAAFAAAAAAAAAP8DAAAAAAAAAAEA/wMAAAAAAE8BAAAAAIgAAQAC AAAAAQCHAAEABQAAAP////8AhgABAAQAAAAAAAAAcgACABoAAACsKQAATQQAAAEAAAApAHIA AAAAAAEAAQApAIwAAQAAAAAAlQABAAQAAAAAAAAAlgABAAIAAAAJAIwAAQAAAAAA formula | B1: (11.3)

Sheet: Table1802
A1: OEWW = ( Well Oil Production t = i ) ( Initial Mobile Oil Saturation with respect to Water t = 0 ) "OEWW" = left ("Well Oil Production" sub {t=i}Right) over {left ("Initial Mobile Oil Saturation with respect to Water" sub{t=0} right) } VkNMTVRGAQAxAAAAAAAAAAEAGwAAAAAAAAAAAAAAAAABAAAAAQAAAAEAAAABAAAAATsrAADY BAAAcwAAAJYAAQACAAAACQCLAAEAAgAAAP//gQABABAAAAAAAAAAAAAAADorAADXBAAAlQAB AAQAAAAAAAAAlgABAAIAAAAJAIsAAQACAAAAHwCKAAEASAAAAAUAQgAAABAATGliZXJhdGlv biBTZXJpZgAAAAAAAKcBAAAAAAAAAAAFAAAAAAAAAP8DAAAAAAAAAAEA/wMAAAAAAAAAAAAA AIgAAQACAAAAAQCHAAEABQAAAP////8AhgABAAQAAAAAAAAAcgACACAAAAAAAAAA5QIAAAQA T0VXV1IFAAAAAAQABABPAEUAVwBXAIwAAQAAAAAAiwABAAIAAAAfAIoAAQBCAAAABQA8AAAA CgBPcGVuU3ltYm9sAAAAAAAApwEAAP//AAAAAAUAAAAAAAAA/wMAAAAAAAAAAQD/AwAAAAAA AAAAAAAAiAABAAIAAAABAIcAAQAFAAAA/////wCGAAEABAAAAAAAAAByAAIAGgAAAHUFAADl AgAAAQAAAD0AUAEAAAAAAQABAD0AjAABAAAAAACLAAEAAgAAAB8AigABAEIAAAAFADwAAAAK AE9wZW5TeW1ib2wAAO0AAADwAQAA//8AAAAABQAAAAAAAAD/AwAAAAAAAAABAP8DAAAAAABP AQAAAACIAAEAAgAAAAEAhwABAAUAAAD/////AIYAAQAEAAAAAAAAAHIAAgAaAAAACBEAAL0B AAABAAAAKAByAAAAAAABAAEAKACMAAEAAAAAAIsAAQACAAAAHwCKAAEASAAAAAUAQgAAABAA TGliZXJhdGlvbiBTZXJpZgAAAAAAAKcBAAAAAAAAAAAFAAAAAAAAAP8DAAAAAAAAAAEA/wMA AAAAAAAAAAAAAIgAAQACAAAAAQCHAAEABQAAAP////8AhgABAAQAAAAAAAAAcgACAE0AAACd EQAAkgEAABMAV2VsbCBPaWwgUHJvZHVjdGlvbkYNAAAAABMAEwBXAGUAbABsACAATwBpAGwA IABQAHIAbwBkAHUAYwB0AGkAbwBuAIwAAQAAAAAAiwABAAIAAAAfAIoAAQBIAAAABQBCAAAA EABMaWJlcmF0aW9uIFNlcmlmAAAAAAAA/QAAAAAAAAAAAAUAAAAAAAIA/wMAAAAAAAAAAQD/ AwAAAAAAAAAAAAAAiAABAAIAAAABAIcAAQAFAAAA/////wCGAAEABAAAAAAAAAByAAIAFwAA AAIfAAD8AQAAAQB0RgAAAAAAAQABAHQAjAABAAAAAACLAAEAAgAAAB8AigABAEIAAAAFADwA AAAKAE9wZW5TeW1ib2wAAAAAAAD9AAAA//8AAAAABQAAAAAAAAD/AwAAAAAAAAABAP8DAAAA AAAAAAAAAACIAAEAAgAAAAEAhwABAAUAAAD/////AIYAAQAEAAAAAAAAAHIAAgAaAAAAVh8A APwBAAABAAAAPQDJAAAAAAABAAEAPQCMAAEAAAAAAIsAAQACAAAAHwCKAAEASAAAAAUAQgAA ABAATGliZXJhdGlvbiBTZXJpZgAAAAAAAP0AAAAAAAAAAAAFAAAAAAACAP8DAAAAAAAAAAEA /wMAAAAAAAAAAAAAAIgAAQACAAAAAQCHAAEABQAAAP////8AhgABAAQAAAAAAAAAcgACABcA AAAqIAAA/AEAAAEAaUYAAAAAAAEAAQBpAIwAAQAAAAAAiwABAAIAAAAfAIoAAQBCAAAABQA8 AAAACgBPcGVuU3ltYm9sAADtAAAA8AEAAP//AAAAAAUAAAAAAAAA/wMAAAAAAAAAAQD/AwAA AAAATwEAAAAAiAABAAIAAAABAIcAAQAFAAAA/////wCGAAEABAAAAAAAAAByAAIAGgAAAJQg AAC9AQAAAQAAACkAcgAAAAAAAQABACkAjAABAAAAAACLAAEAAgAAAB8AhQABAAUAAAAAAAAA AYQAAQAFAAAAAAAAAACKAAEAQgAAAAUAPAAAAAoAT3BlblN5bWJvbAAAAAAAAKcBAAD//wAA AAAFAAAAAAAAAP8DAAAAAAAAAAEA/wMAAAAAAAAAAAAAAIgAAQACAAAAAQCHAAEABQAAAP// //8AhgABAAQAAAAAAAAAZwABABAAAADdBgAAZgIAACErAAB6AgAAjAABAAAAAACLAAEAAgAA AB8AigABAEIAAAAFADwAAAAKAE9wZW5TeW1ib2wAAO0AAADwAQAA//8AAAAABQAAAAAAAAD/ AwAAAAAAAAABAP8DAAAAAABPAQAAAACIAAEAAgAAAAEAhwABAAUAAAD/////AIYAAQAEAAAA AAAAAHIAAgAaAAAA8gYAAE0EAAABAAAAKAByAAAAAAABAAEAKACMAAEAAAAAAIsAAQACAAAA HwCKAAEASAAAAAUAQgAAABAATGliZXJhdGlvbiBTZXJpZgAAAAAAAKcBAAAAAAAAAAAFAAAA AAAAAP8DAAAAAAAAAAEA/wMAAAAAAAAAAAAAAIgAAQACAAAAAQCHAAEABQAAAP////8AhgAB AAQAAAAAAAAAcgACAK0AAACGBwAAIgQAADMASW5pdGlhbCBNb2JpbGUgT2lsIFNhdHVyYXRp b24gd2l0aCByZXNwZWN0IHRvIFdhdGVyTiEAAAAAMwAzAEkAbgBpAHQAaQBhAGwAIABNAG8A YgBpAGwAZQAgAE8AaQBsACAAUwBhAHQAdQByAGEAdABpAG8AbgAgAHcAaQB0AGgAIAByAGUA cwBwAGUAYwB0ACAAdABvACAAVwBhAHQAZQByAIwAAQAAAAAAiwABAAIAAAAfAIoAAQBIAAAA BQBCAAAAEABMaWJlcmF0aW9uIFNlcmlmAAAAAAAA/QAAAAAAAAAAAAUAAAAAAAIA/wMAAAAA AAAAAQD/AwAAAAAAAAAAAAAAiAABAAIAAAABAIcAAQAFAAAA/////wCGAAEABAAAAAAAAABy AAIAFwAAANgoAACMBAAAAQB0RgAAAAAAAQABAHQAjAABAAAAAACLAAEAAgAAAB8AigABAEIA AAAFADwAAAAKAE9wZW5TeW1ib2wAAAAAAAD9AAAA//8AAAAABQAAAAAAAAD/AwAAAAAAAAAB AP8DAAAAAAAAAAAAAACIAAEAAgAAAAEAhwABAAUAAAD/////AIYAAQAEAAAAAAAAAHIAAgAa AAAAQikAAIwEAAABAAAAPQDJAAAAAAABAAEAPQCMAAEAAAAAAIsAAQACAAAAHwCKAAEASAAA AAUAQgAAABAATGliZXJhdGlvbiBTZXJpZgAAAAAAAP0AAAAAAAAAAAAFAAAAAAAAAP8DAAAA AAAAAAEA/wMAAAAAAAAAAAAAAIgAAQACAAAAAQCHAAEABQAAAP////8AhgABAAQAAAAAAAAA cgACABcAAAAWKgAAjAQAAAEAMH8AAAAAAAEAAQAwAIwAAQAAAAAAiwABAAIAAAAfAIoAAQBC AAAABQA8AAAACgBPcGVuU3ltYm9sAADtAAAA8AEAAP//AAAAAAUAAAAAAAAA/wMAAAAAAAAA AQD/AwAAAAAATwEAAAAAiAABAAIAAAABAIcAAQAFAAAA/////wCGAAEABAAAAAAAAAByAAIA GgAAAKoqAABNBAAAAQAAACkAcgAAAAAAAQABACkAjAABAAAAAACVAAEABAAAAAAAAACWAAEA AgAAAAkAjAABAAAAAAA= formula | B1: (11.4)

Sheet: Table1803
A1: OEIG = ( STOIIP t = 0 − STOIIP t = i ) ( Initial Mobile Oil Saturation with respect to Gas t = 0 ) "OEIG" = left (STOIIP sub{t=0}`` - ``STOIIP sub{t=i} Right) over {left ("Initial Mobile Oil Saturation with respect to Gas" sub{t=0} right) } VkNMTVRGAQAxAAAAAAAAAAEAGwAAAAAAAAAAAAAAAAABAAAAAQAAAAEAAAABAAAAAXYoAADY BAAAlgAAAJYAAQACAAAACQCLAAEAAgAAAP//gQABABAAAAAAAAAAAAAAAHUoAADXBAAAlQAB AAQAAAAAAAAAlgABAAIAAAAJAIsAAQACAAAAHwCKAAEASAAAAAUAQgAAABAATGliZXJhdGlv biBTZXJpZgAAAAAAAKcBAAAAAAAAAAAFAAAAAAAAAP8DAAAAAAAAAAEA/wMAAAAAAAAAAAAA AIgAAQACAAAAAQCHAAEABQAAAP////8AhgABAAQAAAAAAAAAcgACACAAAAAAAAAA5QIAAAQA T0VJR/IDAAAAAAQABABPAEUASQBHAIwAAQAAAAAAiwABAAIAAAAfAIoAAQBCAAAABQA8AAAA CgBPcGVuU3ltYm9sAAAAAAAApwEAAP//AAAAAAUAAAAAAAAA/wMAAAAAAAAAAQD/AwAAAAAA AAAAAAAAiAABAAIAAAABAIcAAQAFAAAA/////wCGAAEABAAAAAAAAAByAAIAGgAAAA0EAADl AgAAAQAAAD0AUAEAAAAAAQABAD0AjAABAAAAAACLAAEAAgAAAB8AigABAEIAAAAFADwAAAAK AE9wZW5TeW1ib2wAAO0AAADwAQAA//8AAAAABQAAAAAAAAD/AwAAAAAAAAABAP8DAAAAAABP AQAAAACIAAEAAgAAAAEAhwABAAUAAAD/////AIYAAQAEAAAAAAAAAHIAAgAaAAAAeA4AAL0B AAABAAAAKAByAAAAAAABAAEAKACMAAEAAAAAAIsAAQACAAAAHwCKAAEASAAAAAUAQgAAABAA TGliZXJhdGlvbiBTZXJpZgAAAAAAAKcBAAAAAAAAAAAFAAAAAAACAP8DAAAAAAAAAAEA/wMA AAAAAAAAAAAAAIgAAQACAAAAAQCHAAEABQAAAP////8AhgABAAQAAAAAAAAAcgACACYAAAAi DwAAkgEAAAYAU1RPSUlQBQUAAAAABgAGAFMAVABPAEkASQBQAIwAAQAAAAAAiwABAAIAAAAf AIoAAQBIAAAABQBCAAAAEABMaWJlcmF0aW9uIFNlcmlmAAAAAAAA/QAAAAAAAAAAAAUAAAAA AAIA/wMAAAAAAAAAAQD/AwAAAAAAAAAAAAAAiAABAAIAAAABAIcAAQAFAAAA/////wCGAAEA BAAAAAAAAAByAAIAFwAAAC0UAAD8AQAAAQB0RgAAAAAAAQABAHQAjAABAAAAAACLAAEAAgAA AB8AigABAEIAAAAFADwAAAAKAE9wZW5TeW1ib2wAAAAAAAD9AAAA//8AAAAABQAAAAAAAAD/ AwAAAAAAAAABAP8DAAAAAAAAAAAAAACIAAEAAgAAAAEAhwABAAUAAAD/////AIYAAQAEAAAA AAAAAHIAAgAaAAAAgRQAAPwBAAABAAAAPQDJAAAAAAABAAEAPQCMAAEAAAAAAIsAAQACAAAA HwCKAAEASAAAAAUAQgAAABAATGliZXJhdGlvbiBTZXJpZgAAAAAAAP0AAAAAAAAAAAAFAAAA AAAAAP8DAAAAAAAAAAEA/wMAAAAAAAAAAAAAAIgAAQACAAAAAQCHAAEABQAAAP////8AhgAB AAQAAAAAAAAAcgACABcAAABVFQAA/AEAAAEAMH8AAAAAAAEAAQAwAIwAAQAAAAAAiwABAAIA AAAfAIoAAQBCAAAABQA8AAAACgBPcGVuU3ltYm9sAAAAAAAApwEAAP//AAAAAAUAAAAAAAAA /wMAAAAAAAAAAQD/AwAAAAAAAAAAAAAAiAABAAIAAAABAIcAAQAFAAAA/////wCGAAEABAAA AAAAAAByAAIAGgAAAGgWAACSAQAAAQAAABIiUAEAAAAAAQABABIijAABAAAAAACLAAEAAgAA AB8AigABAEgAAAAFAEIAAAAQAExpYmVyYXRpb24gU2VyaWYAAAAAAACnAQAAAAAAAAAABQAA AAAAAgD/AwAAAAAAAAABAP8DAAAAAAAAAAAAAACIAAEAAgAAAAEAhwABAAUAAAD/////AIYA AQAEAAAAAAAAAHIAAgAmAAAATxgAAJIBAAAGAFNUT0lJUAUFAAAAAAYABgBTAFQATwBJAEkA UACMAAEAAAAAAIsAAQACAAAAHwCKAAEASAAAAAUAQgAAABAATGliZXJhdGlvbiBTZXJpZgAA AAAAAP0AAAAAAAAAAAAFAAAAAAACAP8DAAAAAAAAAAEA/wMAAAAAAAAAAAAAAIgAAQACAAAA AQCHAAEABQAAAP////8AhgABAAQAAAAAAAAAcgACABcAAABaHQAA/AEAAAEAdEYAAAAAAAEA AQB0AIwAAQAAAAAAiwABAAIAAAAfAIoAAQBCAAAABQA8AAAACgBPcGVuU3ltYm9sAAAAAAAA /QAAAP//AAAAAAUAAAAAAAAA/wMAAAAAAAAAAQD/AwAAAAAAAAAAAAAAiAABAAIAAAABAIcA AQAFAAAA/////wCGAAEABAAAAAAAAAByAAIAGgAAAK8dAAD8AQAAAQAAAD0AyQAAAAAAAQAB AD0AjAABAAAAAACLAAEAAgAAAB8AigABAEgAAAAFAEIAAAAQAExpYmVyYXRpb24gU2VyaWYA AAAAAAD9AAAAAAAAAAAABQAAAAAAAgD/AwAAAAAAAAABAP8DAAAAAAAAAAAAAACIAAEAAgAA AAEAhwABAAUAAAD/////AIYAAQAEAAAAAAAAAHIAAgAXAAAAgx4AAPwBAAABAGlGAAAAAAAB AAEAaQCMAAEAAAAAAIsAAQACAAAAHwCKAAEAQgAAAAUAPAAAAAoAT3BlblN5bWJvbAAA7QAA APABAAD//wAAAAAFAAAAAAAAAP8DAAAAAAAAAAEA/wMAAAAAAE8BAAAAAIgAAQACAAAAAQCH AAEABQAAAP////8AhgABAAQAAAAAAAAAcgACABoAAADsHgAAvQEAAAEAAAApAHIAAAAAAAEA AQApAIwAAQAAAAAAiwABAAIAAAAfAIUAAQAFAAAAAAAAAAGEAAEABQAAAAAAAAAAigABAEIA AAAFADwAAAAKAE9wZW5TeW1ib2wAAAAAAACnAQAA//8AAAAABQAAAAAAAAD/AwAAAAAAAAAB AP8DAAAAAAAAAAAAAACIAAEAAgAAAAEAhwABAAUAAAD/////AIYAAQAEAAAAAAAAAGcAAQAQ AAAAdQUAAGYCAABgKAAAegIAAIwAAQAAAAAAiwABAAIAAAAfAIoAAQBCAAAABQA8AAAACgBP cGVuU3ltYm9sAADtAAAA8AEAAP//AAAAAAUAAAAAAAAA/wMAAAAAAAAAAQD/AwAAAAAATwEA AAAAiAABAAIAAAABAIcAAQAFAAAA/////wCGAAEABAAAAAAAAAByAAIAGgAAAIoFAABNBAAA AQAAACgAcgAAAAAAAQABACgAjAABAAAAAACLAAEAAgAAAB8AigABAEgAAAAFAEIAAAAQAExp YmVyYXRpb24gU2VyaWYAAAAAAACnAQAAAAAAAAAABQAAAAAAAAD/AwAAAAAAAAABAP8DAAAA AAAAAAAAAACIAAEAAgAAAAEAhwABAAUAAAD/////AIYAAQAEAAAAAAAAAHIAAgCnAAAACQYA ACIEAAAxAEluaXRpYWwgTW9iaWxlIE9pbCBTYXR1cmF0aW9uIHdpdGggcmVzcGVjdCB0byBH YXMAIAAAAAAxADEASQBuAGkAdABpAGEAbAAgAE0AbwBiAGkAbABlACAATwBpAGwAIABTAGEA dAB1AHIAYQB0AGkAbwBuACAAdwBpAHQAaAAgAHIAZQBzAHAAZQBjAHQAIAB0AG8AIABHAGEA cwCMAAEAAAAAAIsAAQACAAAAHwCKAAEASAAAAAUAQgAAABAATGliZXJhdGlvbiBTZXJpZgAA AAAAAP0AAAAAAAAAAAAFAAAAAAACAP8DAAAAAAAAAAEA/wMAAAAAAAAAAAAAAIgAAQACAAAA AQCHAAEABQAAAP////8AhgABAAQAAAAAAAAAcgACABcAAAAeJgAAjAQAAAEAdEYAAAAAAAEA AQB0AIwAAQAAAAAAiwABAAIAAAAfAIoAAQBCAAAABQA8AAAACgBPcGVuU3ltYm9sAAAAAAAA /QAAAP//AAAAAAUAAAAAAAAA/wMAAAAAAAAAAQD/AwAAAAAAAAAAAAAAiAABAAIAAAABAIcA AQAFAAAA/////wCGAAEABAAAAAAAAAByAAIAGgAAAHMmAACMBAAAAQAAAD0AyQAAAAAAAQAB AD0AjAABAAAAAACLAAEAAgAAAB8AigABAEgAAAAFAEIAAAAQAExpYmVyYXRpb24gU2VyaWYA AAAAAAD9AAAAAAAAAAAABQAAAAAAAAD/AwAAAAAAAAABAP8DAAAAAAAAAAAAAACIAAEAAgAA AAEAhwABAAUAAAD/////AIYAAQAEAAAAAAAAAHIAAgAXAAAARicAAIwEAAABADB/AAAAAAAB AAEAMACMAAEAAAAAAIsAAQACAAAAHwCKAAEAQgAAAAUAPAAAAAoAT3BlblN5bWJvbAAA7QAA APABAAD//wAAAAAFAAAAAAAAAP8DAAAAAAAAAAEA/wMAAAAAAE8BAAAAAIgAAQACAAAAAQCH AAEABQAAAP////8AhgABAAQAAAAAAAAAcgACABoAAADaJwAATQQAAAEAAAApAHIAAAAAAAEA AQApAIwAAQAAAAAAlQABAAQAAAAAAAAAlgABAAIAAAAJAIwAAQAAAAAA formula | B1: (11.5)

Sheet: Table1804
A1: OEWG = ( Well Oil Production t = i ) ( Initial Mobile Oil Saturation with respect to Gas t = 0 ) "OEWG" = left ("Well Oil Production"sub{t=i} Right) over {left ("Initial Mobile Oil Saturation with respect to Gas" sub{t=0} right) } VkNMTVRGAQAxAAAAAAAAAAEAGwAAAAAAAAAAAAAAAAABAAAAAQAAAAEAAAABAAAAAXgpAADY BAAAcwAAAJYAAQACAAAACQCLAAEAAgAAAP//gQABABAAAAAAAAAAAAAAAHcpAADXBAAAlQAB AAQAAAAAAAAAlgABAAIAAAAJAIsAAQACAAAAHwCKAAEASAAAAAUAQgAAABAATGliZXJhdGlv biBTZXJpZgAAAAAAAKcBAAAAAAAAAAAFAAAAAAAAAP8DAAAAAAAAAAEA/wMAAAAAAAAAAAAA AIgAAQACAAAAAQCHAAEABQAAAP////8AhgABAAQAAAAAAAAAcgACACAAAAAAAAAA5QIAAAQA T0VXR/UEAAAAAAQABABPAEUAVwBHAIwAAQAAAAAAiwABAAIAAAAfAIoAAQBCAAAABQA8AAAA CgBPcGVuU3ltYm9sAAAAAAAApwEAAP//AAAAAAUAAAAAAAAA/wMAAAAAAAAAAQD/AwAAAAAA AAAAAAAAiAABAAIAAAABAIcAAQAFAAAA/////wCGAAEABAAAAAAAAAByAAIAGgAAAAsFAADl AgAAAQAAAD0AUAEAAAAAAQABAD0AjAABAAAAAACLAAEAAgAAAB8AigABAEIAAAAFADwAAAAK AE9wZW5TeW1ib2wAAO0AAADwAQAA//8AAAAABQAAAAAAAAD/AwAAAAAAAAABAP8DAAAAAABP AQAAAACIAAEAAgAAAAEAhwABAAUAAAD/////AIYAAQAEAAAAAAAAAHIAAgAaAAAA9Q8AAL0B AAABAAAAKAByAAAAAAABAAEAKACMAAEAAAAAAIsAAQACAAAAHwCKAAEASAAAAAUAQgAAABAA TGliZXJhdGlvbiBTZXJpZgAAAAAAAKcBAAAAAAAAAAAFAAAAAAAAAP8DAAAAAAAAAAEA/wMA AAAAAAAAAAAAAIgAAQACAAAAAQCHAAEABQAAAP////8AhgABAAQAAAAAAAAAcgACAE0AAACJ EAAAkgEAABMAV2VsbCBPaWwgUHJvZHVjdGlvbkYNAAAAABMAEwBXAGUAbABsACAATwBpAGwA IABQAHIAbwBkAHUAYwB0AGkAbwBuAIwAAQAAAAAAiwABAAIAAAAfAIoAAQBIAAAABQBCAAAA EABMaWJlcmF0aW9uIFNlcmlmAAAAAAAA/QAAAAAAAAAAAAUAAAAAAAIA/wMAAAAAAAAAAQD/ AwAAAAAAAAAAAAAAiAABAAIAAAABAIcAAQAFAAAA/////wCGAAEABAAAAAAAAAByAAIAFwAA AO4dAAD8AQAAAQB0RgAAAAAAAQABAHQAjAABAAAAAACLAAEAAgAAAB8AigABAEIAAAAFADwA AAAKAE9wZW5TeW1ib2wAAAAAAAD9AAAA//8AAAAABQAAAAAAAAD/AwAAAAAAAAABAP8DAAAA AAAAAAAAAACIAAEAAgAAAAEAhwABAAUAAAD/////AIYAAQAEAAAAAAAAAHIAAgAaAAAAQx4A APwBAAABAAAAPQDJAAAAAAABAAEAPQCMAAEAAAAAAIsAAQACAAAAHwCKAAEASAAAAAUAQgAA ABAATGliZXJhdGlvbiBTZXJpZgAAAAAAAP0AAAAAAAAAAAAFAAAAAAACAP8DAAAAAAAAAAEA /wMAAAAAAAAAAAAAAIgAAQACAAAAAQCHAAEABQAAAP////8AhgABAAQAAAAAAAAAcgACABcA AAAXHwAA/AEAAAEAaUYAAAAAAAEAAQBpAIwAAQAAAAAAiwABAAIAAAAfAIoAAQBCAAAABQA8 AAAACgBPcGVuU3ltYm9sAADtAAAA8AEAAP//AAAAAAUAAAAAAAAA/wMAAAAAAAAAAQD/AwAA AAAATwEAAAAAiAABAAIAAAABAIcAAQAFAAAA/////wCGAAEABAAAAAAAAAByAAIAGgAAAGsf AAC9AQAAAQAAACkAcgAAAAAAAQABACkAjAABAAAAAACLAAEAAgAAAB8AhQABAAUAAAAAAAAA AYQAAQAFAAAAAAAAAACKAAEAQgAAAAUAPAAAAAoAT3BlblN5bWJvbAAAAAAAAKcBAAD//wAA AAAFAAAAAAAAAP8DAAAAAAAAAAEA/wMAAAAAAAAAAAAAAIgAAQACAAAAAQCHAAEABQAAAP// //8AhgABAAQAAAAAAAAAZwABABAAAABzBgAAZgIAAF4pAAB6AgAAjAABAAAAAACLAAEAAgAA AB8AigABAEIAAAAFADwAAAAKAE9wZW5TeW1ib2wAAO0AAADwAQAA//8AAAAABQAAAAAAAAD/ AwAAAAAAAAABAP8DAAAAAABPAQAAAACIAAEAAgAAAAEAhwABAAUAAAD/////AIYAAQAEAAAA AAAAAHIAAgAaAAAAiAYAAE0EAAABAAAAKAByAAAAAAABAAEAKACMAAEAAAAAAIsAAQACAAAA HwCKAAEASAAAAAUAQgAAABAATGliZXJhdGlvbiBTZXJpZgAAAAAAAKcBAAAAAAAAAAAFAAAA AAAAAP8DAAAAAAAAAAEA/wMAAAAAAAAAAAAAAIgAAQACAAAAAQCHAAEABQAAAP////8AhgAB AAQAAAAAAAAAcgACAKcAAAAcBwAAIgQAADEASW5pdGlhbCBNb2JpbGUgT2lsIFNhdHVyYXRp b24gd2l0aCByZXNwZWN0IHRvIEdhcwAgAAAAADEAMQBJAG4AaQB0AGkAYQBsACAATQBvAGIA aQBsAGUAIABPAGkAbAAgAFMAYQB0AHUAcgBhAHQAaQBvAG4AIAB3AGkAdABoACAAcgBlAHMA cABlAGMAdAAgAHQAbwAgAEcAYQBzAIwAAQAAAAAAiwABAAIAAAAfAIoAAQBIAAAABQBCAAAA EABMaWJlcmF0aW9uIFNlcmlmAAAAAAAA/QAAAAAAAAAAAAUAAAAAAAIA/wMAAAAAAAAAAQD/ AwAAAAAAAAAAAAAAiAABAAIAAAABAIcAAQAFAAAA/////wCGAAEABAAAAAAAAAByAAIAFwAA ABwnAACMBAAAAQB0RgAAAAAAAQABAHQAjAABAAAAAACLAAEAAgAAAB8AigABAEIAAAAFADwA AAAKAE9wZW5TeW1ib2wAAAAAAAD9AAAA//8AAAAABQAAAAAAAAD/AwAAAAAAAAABAP8DAAAA AAAAAAAAAACIAAEAAgAAAAEAhwABAAUAAAD/////AIYAAQAEAAAAAAAAAHIAAgAaAAAAcScA AIwEAAABAAAAPQDJAAAAAAABAAEAPQCMAAEAAAAAAIsAAQACAAAAHwCKAAEASAAAAAUAQgAA ABAATGliZXJhdGlvbiBTZXJpZgAAAAAAAP0AAAAAAAAAAAAFAAAAAAAAAP8DAAAAAAAAAAEA /wMAAAAAAAAAAAAAAIgAAQACAAAAAQCHAAEABQAAAP////8AhgABAAQAAAAAAAAAcgACABcA AABEKAAAjAQAAAEAMH8AAAAAAAEAAQAwAIwAAQAAAAAAiwABAAIAAAAfAIoAAQBCAAAABQA8 AAAACgBPcGVuU3ltYm9sAADtAAAA8AEAAP//AAAAAAUAAAAAAAAA/wMAAAAAAAAAAQD/AwAA AAAATwEAAAAAiAABAAIAAAABAIcAAQAFAAAA/////wCGAAEABAAAAAAAAAByAAIAGgAAANgo AABNBAAAAQAAACkAcgAAAAAAAQABACkAjAABAAAAAACVAAEABAAAAAAAAACWAAEAAgAAAAkA jAABAAAAAAA= formula | B1: (11.6)

Sheet: Table1805
A1: API and Tracer Tracking Summary Variables
A2: Type | B2: Variable | C2: Root | D2: Field | E2: Group | F2: Well | G2: WellConnection | H2: Region | I2: Block
A3: Flow | B3: Oil API | C3: API | D3: FAPI | E3: GAPI | F3: WAPI | G3: CAPI | H3: RAPI | I3: BAPI
A4: Flow | B4: Tracer Flow Rate | C4: TFR | G4: CTFR
A5: Flow | B5: Tracer Flow Total (Free Inter Region) | C5: TFTF | H5: RTFTF
A6: Flow | B6: Tracer Flow Total (Free Inter Region) | C6: TFTT | H6: RTFTT
A7: Flow | B7: Tracer Flow Total (Solution Inter Region) | C7: TFTS | H7: RTFTS
A8: Flow | B8: Tracer Injection Concentration | C8: TIC | D8: FTIC | E8: GTIC | F8: WTIC | G8: CTIC
A9: Flow | B9: Tracer Injection Rate | C9: TIR | D9: FTIR | E9: GTIR | F9: WTIR | G9: CTIR
A10: Flow | B10: Tracer Injection Total | C10: TIT | D10: FTIT | E10: GTIT | F10: WTIT | G10: CTIT
A11: Flow | B11: Tracer Production Concentration | C11: TPC | D11: FTPC | E11: GTPC | F11: WTPC | G11: CTPC
A12: Flow | B12: Tracer Production Rate | C12: TPR | D12: FTPR | E12: GTPR | F12: WTPR | G12: CTPR
A13: Flow | B13: Tracer Production Total | C13: TPT | D13: FTPT | E13: GTPT | F13: WTPT | G13: CTPT
A14: Volume | B14: Tracer Concentration | C14: TCN | I14: BTCN
A15: Volume | B15: Tracer Concentration (Free) | C15: TCNF | I15: BTCNF
A16: Volume | B16: Tracer Concentration (Solution) | C16: TCNS | I16: BTCNS
A17: Volume | B17: Tracer In-Place | C17: TIPT | D17: FTIPT | H17: RTIPT | I17: BTIPT
A18: Volume | B18: Tracer In-Place (Free) | C18: TIPF | D18: FTIPF | H18: RTIPF | I18: BTIPF
A19: Volume | B19: Tracer In-Place (Solution) | C19: TIPS | D19: FTIPS | H19: RTIPS | I19: BTIPS
A20: Notes:

Sheet: Table1806
A1: Brine and Multi-Component Brine Model Summary Variables
A2: Type | B2: Variable | C2: Root | D2: Field | E2: Group | F2: Well | G2: WellConnection | H2: Region | I2: Block | J2: Comment
A3: Flow | B3: Salt Flow Rate | C3: SFR | G3: CSFR | J3: Brine and Salt Precipitation Models
A4: Flow | B4: Salt Injection Rate | C4: SIR | D4: FSIR | E4: GSIR | F4: WSIR | G4: CSIR
A5: Flow | B5: Salt Injection Total | C5: SIT | D5: FSIT | E5: GSIT | F5: WSIT | G5: CSIT
A6: Flow | B6: Salt Production Rate | C6: SPR | D6: FSPR | E6: GSPR | F6: WSPR | G6: CSPR
A7: Flow | B7: Salt Production Total | C7: SPT | D7: FSPT | E7: GSPT | F7: WSPT | G7: CSPT
A8: Property | B8: Salt Corrected Water Viscosity | C8: EMV_SAL | I8: BEMV_SAL
A9: Volume | B9: Salt Concentration (Block) | C9: SCN | I9: BSCN
A10: Volume | B10: Salt Concentration (Injection) | C10: SIC | D10: FSIC | E10: GSIC | F10: WSIC | G10: CSIC
A11: Volume | B11: Salt Concentration (Production) | C11: SPC | D11: FSPC | E11: GSPC | F11: WSPC | G11: CSPC
A12: Volume | B12: Salt In-Place | C12: SIP | D12: FSIP | H12: RSIP | I12: BSIP
A13: Flow | B13: Anion Concentration (Block) | C13: TCNFANI | I13: BTCNFANI | J13: Multi-Component Brine Model
A14: Flow | B14: Anion Flow Rate | C14: TFRANI | G14: CTFRANI
A15: Flow | B15: Anion Injection Rate | C15: TIRANI | D15: FTIRANI | E15: GTIRANI | F15: WTIRANI
A16: Flow | B16: Anion Injection Total | C16: TITANI | D16: FTITANI | E16: GTITANI | F16: WTITANI | G16: CTITANI
A17: Flow | B17: Anion Production Rate | C17: TPRANI | D17: FTPRANI | E17: GTPRANI | F17: WTPRANI
A18: Flow | B18: Anion Production Total | C18: TPTANI | D18: FTPTANI | E18: GTPTANI | F18: WTPTANI | G18: CTPTANI
A19: Flow | B19: Cation Flow Rate | C19: TFRCAT | G19: CTFRCAT
A20: Flow | B20: Cation Injection Rate | C20: TIRCAT | D20: FTIRCAT | E20: GTIRCAT | F20: WTIRCAT
A21: Flow | B21: Cation Injection Total | C21: TITCAT | D21: FTITCAT | E21: GTITCAT | F21: WTITCAT | G21: CTITCAT
A22: Flow | B22: Cation Production Rate | C22: TPRCAT | D22: FTPRCAT | E22: GTPRCAT | F22: WTPRCAT
A23: Flow | B23: Cation Production Total | C23: TPTCAT | D23: FTPTCAT | E23: GTPTCAT | F23: WTPTCAT | G23: CTPTCAT
A24: Property | B24: Effective Salinity (Polymer) | C24: ESALPLY | I24: BESALPLY
A25: Property | B25: Effective Salinity (Surfactant) | C25: ESALSUR | I25: BESALSUR
A26: Volume | B26: Cation Concentration (Block) | C26: TCNFCAT | I26: BTCNFCAT
A27: Volume | B27: Cation Concentration (Rock Associated) | C27: TRADCAT | I27: BTRADCAT
A28: Volume | B28: Cation Concentration (Surfactant Associated) | C28: TSADCAT | I28: BTSADCAT
A29: Notes:

Sheet: Table12
A1: CO2STORE Summary Variables
A2: Type | B2: Variable | C2: Root | D2: Field | E2: Group | F2: Well | G2: WellConnection | H2: Region | I2: Block
A3: Volume | B3: CO2 Dissolved and immobile in the gas phase | C3: GCDI | D3: FGCDI | H3: RGCDI
A4: Volume | B4: CO2 Dissolved and mobile in the gas phase | C4: GCDM | D4: FGCDM | H4: RGCDM
A5: Volume | B5: CO2 Dissolved in the water phase | C5: WCD | D5: FWCD | H5: RWCD
A6: Volume | B6: Water in the gas phase | C6: WIPG | D6: FWIPG | H6: RWIPG
A7: Volume | B7: Water in the water phase | C7: WIPL | D7: FWIPL | H7: RWIPL
A8: Notes:

Sheet: Table2
A1: Formation Damage Model Summary Variables
A2: Type | B2: Variable | C2: Root | D2: Field | E2: Group | F2: Well | G2: WellConnection | H2: Region | I2: Block
A3: Flow | B3: Filtrate Injection Concentration | C3: INJFC | F3: WINFC
A4: Flow | B4: Filtrate Volume Injection Rate | C4: INJFVR | F4: WINJFVR | G4: CINJFVR
A5: Flow | B5: Filtrate Volume Injection Total | C5: INJFVT | F5: WINJFVT | G5: CINJFVT
A6: Property | B6: Filter Cake Area Of Flow | C6: FCAOF | G6: CFCAOF
A7: Property | B7: Filter Cake Permeability | C7: FCPERM | G7: CFCPERM
A8: Property | B8: Filter Cake Porosity | C8: FCPORO | G8: CFCPORO
A9: Property | B9: Filter Cake Radius | C9: FCRAD | G9: CFCRAD
A10: Property | B10: Filter Cake Skin | C10: FCSKIN | G10: CFCSKIN
A11: Property | B11: Filter Cake Width | C11: FCWIDTH | G11: CFCWIDTH
A12: Notes:

Sheet: Table1807
A1: Foam Model Tracers Summary Variables
A2: Type | B2: Variable | C2: Root | D2: Field | E2: Group | F2: Well | G2: WellConnection | H2: Region | I2: Block | J2: Comment
A3: Flow | B3: Foam Flow Rate | C3: TFRFOA | G3: CTFRFOA
A4: Flow | B4: Foam Injection Rate | C4: TIRFOA | D4: FTIRFOA | E4: GTIRFOA | F4: WTIRFOA
A5: Flow | B5: Foam Injection Total | C5: TITFOA | D5: FTITFOA | E5: GTITFOA | F5: WTITFOA | G5: CTITFOA
A6: Flow | B6: Foam Production Rate | C6: TPRFOA | D6: FTPRFOA | E6: GTPRFOA | F6: WTPRFOA
A7: Flow | B7: Foam Production Total | C7: TPTFOA | D7: FTPTFOA | E7: GTPTFOA | F7: WTPTFOA | G7: CTPTFOA
A8: Property | B8: Foam Adsorption Total | C8: TADSFOA | D8: FTADSFOA | G8: CTADSFOA | H8: RTADSFOA | I8: BTADSFOA | J8: Block is current value
A9: Property | B9: Foam Capillary Number | C9: TCNMFOA | I9: BTCNMFOA
A10: Property | B10: Foam Decayed Half Life | C10: THLFFOA | I10: BTHLFFOA
A11: Property | B11: Foam Decayed Tracer | C11: TDCYFOA | D11: FTDCYFOA | H11: RTDCYFOA | I11: BTDCYFOA
A12: Property | B12: Foam Gas Mobility Factor | C12: TMOBFOA | D12: FTMOBFOA | J12: Excluding shear
A13: Property | B13: Foam in Solution | C13: TIPTFOA | D13: FTIPTFOA | G13: CTIPTFOA | H13: RTIPTFOA | I13: BTIPTFOA
A14: Volume | B14: Foam Concentration | C14: TCNFFOA | I14: BTCNFFOA
A15: Notes:

Sheet: Table1910
A1: Gas Lift Optimization Model Summary Variables
A2: Type | B2: Variable | C2: Root | D2: Field | E2: Group | F2: Well | G2: WellConnection | H2: Region | I2: Block
A3: Flow | B3: Gas lift gas rate, based on ALQ. | C3: GLIR | D3: FGLIR | E3: GGLIR | F3: WGLIR
A4: Flow | B4: Incremental oil rate per unit incremental gas lift gas quantity, that is the well’s GRADIENT as defined by equation (11.7)below. | C4: OGLR | F4: WOGLR
A5: Notes:

Sheet: Table1912
A1: Gradient = ( ( β w × Δ Q Oil ) ( Δ Q GasLift + β g × Δ Q Gas ) ) Gradient`=` left ( left ( %beta _w times %DELTA Q_Oil right ) over left (%DELTA Q_GasLift``+`` %beta_g times %DELTA Q_Gas right) right) VkNMTVRGAQAxAAAAAAAAAAEAGwAAAAAAAAAAAAAAAAABAAAAAQAAAAEAAAABAAAAAQUaAABW BQAAuQAAAJYAAQACAAAACQCLAAEAAgAAAP//gQABABAAAAAAAAAAAAAAAAQaAABVBQAAlQAB AAQAAAAAAAAAlgABAAIAAAAJAIsAAQACAAAAHwCKAAEASAAAAAUAQgAAABAATGliZXJhdGlv biBTZXJpZgAAAAAAAKcBAAAAAAAAAAAFAAAAAAACAP8DAAAAAAAAAAEA/wMAAAAAAAAAAAAA AIgAAQACAAAAAQCHAAEABQAAAP////8AhgABAAQAAAAAAAAAcgACACwAAAAAAAAAJAMAAAgA R3JhZGllbnT4BQAAAAAIAAgARwByAGEAZABpAGUAbgB0AIwAAQAAAAAAiwABAAIAAAAfAIoA AQBCAAAABQA8AAAACgBPcGVuU3ltYm9sAAAAAAAApwEAAP//AAAAAAUAAAAAAAAA/wMAAAAA AAAAAQD/AwAAAAAAAAAAAAAAiAABAAIAAAABAIcAAQAFAAAA/////wCGAAEABAAAAAAAAABy AAIAGgAAAHMGAAAkAwAAAQAAAD0AUAEAAAAAAQABAD0AjAABAAAAAACLAAEAAgAAAB8AigAB AEIAAAAFADwAAAAKAE9wZW5TeW1ib2wAALABAACzBAAA//8AAAAABQAAAAAAAAD/AwAAAAAA AAABAP8DAAAAAABkAgAAAACIAAEAAgAAAAEAhwABAAUAAAD/////AIYAAQAEAAAAAAAAAHIA AgAaAAAABQgAACIEAAABAAAAKADQAAAAAAABAAEAKACMAAEAAAAAAIsAAQACAAAAHwCKAAEA QgAAAAUAPAAAAAoAT3BlblN5bWJvbAAA7QAAAPABAAD//wAAAAAFAAAAAAAAAP8DAAAAAAAA AAEA/wMAAAAAAE8BAAAAAIgAAQACAAAAAQCHAAEABQAAAP////8AhgABAAQAAAAAAAAAcgAC ABoAAADmDAAA/AEAAAEAAAAoAHIAAAAAAAEAAQAoAIwAAQAAAAAAiwABAAIAAAAfAIoAAQBC AAAABQA8AAAACgBPcGVuU3ltYm9sAAAAAAAApwEAAP//AAAAAAUAAAAAAAIA/wMAAAAAAAAA AQD/AwAAAAAAAAAAAAAAiAABAAIAAAABAIcAAQAFAAAA/////wCGAAEABAAAAAAAAAByAAIA GgAAAHoNAADSAQAAAQAAALID6AAAAAAAAQABALIDjAABAAAAAACLAAEAAgAAAB8AigABAEgA AAAFAEIAAAAQAExpYmVyYXRpb24gU2VyaWYAAAAAAAD9AAAAAAAAAAAABQAAAAAAAgD/AwAA AAAAAAABAP8DAAAAAAAAAAAAAACIAAEAAgAAAAEAhwABAAUAAAD/////AIYAAQAEAAAAAAAA AHIAAgAXAAAAuA4AADwCAAABAHepAAAAAAABAAEAdwCMAAEAAAAAAIsAAQACAAAAHwCKAAEA QgAAAAUAPAAAAAoAT3BlblN5bWJvbAAAAAAAAKcBAAD//wAAAAAFAAAAAAAAAP8DAAAAAAAA AAEA/wMAAAAAAAAAAAAAAIgAAQACAAAAAQCHAAEABQAAAP////8AhgABAAQAAAAAAAAAcgAC ABoAAAB2DwAA0gEAAAEAAADXAFABAAAAAAEAAQDXAIwAAQAAAAAAiwABAAIAAAAfAIoAAQBC AAAABQA8AAAACgBPcGVuU3ltYm9sAAAAAAAApwEAAP//AAAAAAUAAAAAAAAA/wMAAAAAAAAA AQD/AwAAAAAAAAAAAAAAiAABAAIAAAABAIcAAQAFAAAA/////wCGAAEABAAAAAAAAAByAAIA GgAAAN4QAADSAQAAAQAAAJQDAwEAAAAAAQABAJQDjAABAAAAAACLAAEAAgAAAB8AigABAEgA AAAFAEIAAAAQAExpYmVyYXRpb24gU2VyaWYAAAAAAACnAQAAAAAAAAAABQAAAAAAAgD/AwAA AAAAAAABAP8DAAAAAAAAAAAAAACIAAEAAgAAAAEAhwABAAUAAAD/////AIYAAQAEAAAAAAAA AHIAAgAXAAAABhIAANIBAAABAFExAQAAAAABAAEAUQCMAAEAAAAAAIsAAQACAAAAHwCKAAEA SAAAAAUAQgAAABAATGliZXJhdGlvbiBTZXJpZgAAAAAAAP0AAAAAAAAAAAAFAAAAAAACAP8D AAAAAAAAAAEA/wMAAAAAAAAAAAAAAIgAAQACAAAAAQCHAAEABQAAAP////8AhgABAAQAAAAA AAAAcgACAB0AAABEEwAAPAIAAAMAT2lsQwEAAAAAAwADAE8AaQBsAIwAAQAAAAAAiwABAAIA AAAfAIoAAQBCAAAABQA8AAAACgBPcGVuU3ltYm9sAADtAAAA8AEAAP//AAAAAAUAAAAAAAAA /wMAAAAAAAAAAQD/AwAAAAAATwEAAAAAiAABAAIAAAABAIcAAQAFAAAA/////wCGAAEABAAA AAAAAAByAAIAGgAAAKwUAAD8AQAAAQAAACkAcgAAAAAAAQABACkAjAABAAAAAACLAAEAAgAA AB8AhQABAAUAAAAAAAAAAYQAAQAFAAAAAAAAAACKAAEAQgAAAAUAPAAAAAoAT3BlblN5bWJv bAAAAAAAAKcBAAD//wAAAAAFAAAAAAAAAP8DAAAAAAAAAAEA/wMAAAAAAAAAAAAAAIgAAQAC AAAAAQCHAAEABQAAAP////8AhgABAAQAAAAAAAAAZwABABAAAADuCAAApQIAABsZAAC5AgAA jAABAAAAAACLAAEAAgAAAB8AigABAEIAAAAFADwAAAAKAE9wZW5TeW1ib2wAAO0AAADwAQAA //8AAAAABQAAAAAAAAD/AwAAAAAAAAABAP8DAAAAAABPAQAAAACIAAEAAgAAAAEAhwABAAUA AAD/////AIYAAQAEAAAAAAAAAHIAAgAaAAAAAwkAAIwEAAABAAAAKAByAAAAAAABAAEAKACM AAEAAAAAAIsAAQACAAAAHwCKAAEAQgAAAAUAPAAAAAoAT3BlblN5bWJvbAAAAAAAAKcBAAD/ /wAAAAAFAAAAAAAAAP8DAAAAAAAAAAEA/wMAAAAAAAAAAAAAAIgAAQACAAAAAQCHAAEABQAA AP////8AhgABAAQAAAAAAAAAcgACABoAAACXCQAAYgQAAAEAAACUAwMBAAAAAAEAAQCUA4wA AQAAAAAAiwABAAIAAAAfAIoAAQBIAAAABQBCAAAAEABMaWJlcmF0aW9uIFNlcmlmAAAAAAAA pwEAAAAAAAAAAAUAAAAAAAIA/wMAAAAAAAAAAQD/AwAAAAAAAAAAAAAAiAABAAIAAAABAIcA AQAFAAAA/////wCGAAEABAAAAAAAAAByAAIAFwAAAMAKAABiBAAAAQBRMQEAAAAAAQABAFEA jAABAAAAAACLAAEAAgAAAB8AigABAEgAAAAFAEIAAAAQAExpYmVyYXRpb24gU2VyaWYAAAAA AAD9AAAAAAAAAAAABQAAAAAAAgD/AwAAAAAAAAABAP8DAAAAAAAAAAAAAACIAAEAAgAAAAEA hwABAAUAAAD/////AIYAAQAEAAAAAAAAAHIAAgApAAAAEgwAAMwEAAAHAEdhc0xpZnT4AgAA AAAHAAcARwBhAHMATABpAGYAdACMAAEAAAAAAIsAAQACAAAAHwCKAAEAQgAAAAUAPAAAAAoA T3BlblN5bWJvbAAAAAAAAKcBAAD//wAAAAAFAAAAAAAAAP8DAAAAAAAAAAEA/wMAAAAAAAAA AAAAAIgAAQACAAAAAQCHAAEABQAAAP////8AhgABAAQAAAAAAAAAcgACABoAAAChDwAAYgQA AAEAAAArAPcAAAAAAAEAAQArAIwAAQAAAAAAiwABAAIAAAAfAIoAAQBCAAAABQA8AAAACgBP cGVuU3ltYm9sAAAAAAAApwEAAP//AAAAAAUAAAAAAAIA/wMAAAAAAAAAAQD/AwAAAAAAAAAA AAAAiAABAAIAAAABAIcAAQAFAAAA/////wCGAAEABAAAAAAAAAByAAIAGgAAAEgRAABiBAAA AQAAALID6AAAAAAAAQABALIDjAABAAAAAACLAAEAAgAAAB8AigABAEgAAAAFAEIAAAAQAExp YmVyYXRpb24gU2VyaWYAAAAAAAD9AAAAAAAAAAAABQAAAAAAAgD/AwAAAAAAAAABAP8DAAAA AAAAAAAAAACIAAEAAgAAAAEAhwABAAUAAAD/////AIYAAQAEAAAAAAAAAHIAAgAXAAAAhRIA AMwEAAABAGd/AAAAAAABAAEAZwCMAAEAAAAAAIsAAQACAAAAHwCKAAEAQgAAAAUAPAAAAAoA T3BlblN5bWJvbAAAAAAAAKcBAAD//wAAAAAFAAAAAAAAAP8DAAAAAAAAAAEA/wMAAAAAAAAA AAAAAIgAAQACAAAAAQCHAAEABQAAAP////8AhgABAAQAAAAAAAAAcgACABoAAAAEEwAAYgQA AAEAAADXAFABAAAAAAEAAQDXAIwAAQAAAAAAiwABAAIAAAAfAIoAAQBCAAAABQA8AAAACgBP cGVuU3ltYm9sAAAAAAAApwEAAP//AAAAAAUAAAAAAAAA/wMAAAAAAAAAAQD/AwAAAAAAAAAA AAAAiAABAAIAAAABAIcAAQAFAAAA/////wCGAAEABAAAAAAAAAByAAIAGgAAAGwUAABiBAAA AQAAAJQDAwEAAAAAAQABAJQDjAABAAAAAACLAAEAAgAAAB8AigABAEgAAAAFAEIAAAAQAExp YmVyYXRpb24gU2VyaWYAAAAAAACnAQAAAAAAAAAABQAAAAAAAgD/AwAAAAAAAAABAP8DAAAA AAAAAAAAAACIAAEAAgAAAAEAhwABAAUAAAD/////AIYAAQAEAAAAAAAAAHIAAgAXAAAAqhUA AGIEAAABAFExAQAAAAABAAEAUQCMAAEAAAAAAIsAAQACAAAAHwCKAAEASAAAAAUAQgAAABAA TGliZXJhdGlvbiBTZXJpZgAAAAAAAP0AAAAAAAAAAAAFAAAAAAACAP8DAAAAAAAAAAEA/wMA AAAAAAAAAAAAAIgAAQACAAAAAQCHAAEABQAAAP////8AhgABAAQAAAAAAAAAcgACAB0AAADn FgAAzAQAAAMAR2FzmAEAAAAAAwADAEcAYQBzAIwAAQAAAAAAiwABAAIAAAAfAIoAAQBCAAAA BQA8AAAACgBPcGVuU3ltYm9sAADtAAAA8AEAAP//AAAAAAUAAAAAAAAA/wMAAAAAAAAAAQD/ AwAAAAAATwEAAAAAiAABAAIAAAABAIcAAQAFAAAA/////wCGAAEABAAAAAAAAAByAAIAGgAA AKQYAACMBAAAAQAAACkAcgAAAAAAAQABACkAjAABAAAAAACLAAEAAgAAAB8AigABAEIAAAAF ADwAAAAKAE9wZW5TeW1ib2wAALABAACzBAAA//8AAAAABQAAAAAAAAD/AwAAAAAAAAABAP8D AAAAAABkAgAAAACIAAEAAgAAAAEAhwABAAUAAAD/////AIYAAQAEAAAAAAAAAHIAAgAaAAAA OBkAACIEAAABAAAAKQDQAAAAAAABAAEAKQCMAAEAAAAAAJUAAQAEAAAAAAAAAJYAAQACAAAA CQCMAAEAAAAAAA== formula | B1: (11.7)

Sheet: Table1913
A1: Gradient = ( ( β w × Δ Q Oil ) Δ Q GasLift ) Gradient`=` left ( left ( %beta _w times %DELTA Q_Oil right ) over {%DELTA Q_GasLift} right) VkNMTVRGAQAxAAAAAAAAAAEAGwAAAAAAAAAAAAAAAAABAAAAAQAAAAEAAAABAAAAATASAAAZ BQAAegAAAJYAAQACAAAACQCLAAEAAgAAAP//gQABABAAAAAAAAAAAAAAAC8SAAAYBQAAlQAB AAQAAAAAAAAAlgABAAIAAAAJAIsAAQACAAAAHwCKAAEASAAAAAUAQgAAABAATGliZXJhdGlv biBTZXJpZgAAAAAAAKcBAAAAAAAAAAAFAAAAAAACAP8DAAAAAAAAAAEA/wMAAAAAAAAAAAAA AIgAAQACAAAAAQCHAAEABQAAAP////8AhgABAAQAAAAAAAAAcgACACwAAAAAAAAAJAMAAAgA R3JhZGllbnT4BQAAAAAIAAgARwByAGEAZABpAGUAbgB0AIwAAQAAAAAAiwABAAIAAAAfAIoA AQBCAAAABQA8AAAACgBPcGVuU3ltYm9sAAAAAAAApwEAAP//AAAAAAUAAAAAAAAA/wMAAAAA AAAAAQD/AwAAAAAAAAAAAAAAiAABAAIAAAABAIcAAQAFAAAA/////wCGAAEABAAAAAAAAABy AAIAGgAAAHMGAAAkAwAAAQAAAD0AUAEAAAAAAQABAD0AjAABAAAAAACLAAEAAgAAAB8AigAB AEIAAAAFADwAAAAKAE9wZW5TeW1ib2wAALABAAB8BAAA//8AAAAABQAAAAAAAAD/AwAAAAAA AAABAP8DAAAAAABlAgAAAACIAAEAAgAAAAEAhwABAAUAAAD/////AIYAAQAEAAAAAAAAAHIA AgAaAAAABQgAAPgDAAABAAAAKADQAAAAAAABAAEAKACMAAEAAAAAAIsAAQACAAAAHwCKAAEA QgAAAAUAPAAAAAoAT3BlblN5bWJvbAAA7QAAAPABAAD//wAAAAAFAAAAAAAAAP8DAAAAAAAA AAEA/wMAAAAAAE8BAAAAAIgAAQACAAAAAQCHAAEABQAAAP////8AhgABAAQAAAAAAAAAcgAC ABoAAAADCQAA/AEAAAEAAAAoAHIAAAAAAAEAAQAoAIwAAQAAAAAAiwABAAIAAAAfAIoAAQBC AAAABQA8AAAACgBPcGVuU3ltYm9sAAAAAAAApwEAAP//AAAAAAUAAAAAAAIA/wMAAAAAAAAA AQD/AwAAAAAAAAAAAAAAiAABAAIAAAABAIcAAQAFAAAA/////wCGAAEABAAAAAAAAAByAAIA GgAAAJcJAADSAQAAAQAAALID6AAAAAAAAQABALIDjAABAAAAAACLAAEAAgAAAB8AigABAEgA AAAFAEIAAAAQAExpYmVyYXRpb24gU2VyaWYAAAAAAAD9AAAAAAAAAAAABQAAAAAAAgD/AwAA AAAAAAABAP8DAAAAAAAAAAAAAACIAAEAAgAAAAEAhwABAAUAAAD/////AIYAAQAEAAAAAAAA AHIAAgAXAAAAwAoAADwCAAABAHepAAAAAAABAAEAdwCMAAEAAAAAAIsAAQACAAAAHwCKAAEA QgAAAAUAPAAAAAoAT3BlblN5bWJvbAAAAAAAAKcBAAD//wAAAAAFAAAAAAAAAP8DAAAAAAAA AAEA/wMAAAAAAAAAAAAAAIgAAQACAAAAAQCHAAEABQAAAP////8AhgABAAQAAAAAAAAAcgAC ABoAAAB+CwAA0gEAAAEAAADXAFABAAAAAAEAAQDXAIwAAQAAAAAAiwABAAIAAAAfAIoAAQBC AAAABQA8AAAACgBPcGVuU3ltYm9sAAAAAAAApwEAAP//AAAAAAUAAAAAAAAA/wMAAAAAAAAA AQD/AwAAAAAAAAAAAAAAiAABAAIAAAABAIcAAQAFAAAA/////wCGAAEABAAAAAAAAAByAAIA GgAAAOYMAADSAQAAAQAAAJQDAwEAAAAAAQABAJQDjAABAAAAAACLAAEAAgAAAB8AigABAEgA AAAFAEIAAAAQAExpYmVyYXRpb24gU2VyaWYAAAAAAACnAQAAAAAAAAAABQAAAAAAAgD/AwAA AAAAAAABAP8DAAAAAAAAAAAAAACIAAEAAgAAAAEAhwABAAUAAAD/////AIYAAQAEAAAAAAAA AHIAAgAXAAAAJA4AANIBAAABAFExAQAAAAABAAEAUQCMAAEAAAAAAIsAAQACAAAAHwCKAAEA SAAAAAUAQgAAABAATGliZXJhdGlvbiBTZXJpZgAAAAAAAP0AAAAAAAAAAAAFAAAAAAACAP8D AAAAAAAAAAEA/wMAAAAAAAAAAAAAAIgAAQACAAAAAQCHAAEABQAAAP////8AhgABAAQAAAAA AAAAcgACAB0AAABhDwAAPAIAAAMAT2lsQwEAAAAAAwADAE8AaQBsAIwAAQAAAAAAiwABAAIA AAAfAIoAAQBCAAAABQA8AAAACgBPcGVuU3ltYm9sAADtAAAA8AEAAP//AAAAAAUAAAAAAAAA /wMAAAAAAAAAAQD/AwAAAAAATwEAAAAAiAABAAIAAAABAIcAAQAFAAAA/////wCGAAEABAAA AAAAAAByAAIAGgAAAMkQAAD8AQAAAQAAACkAcgAAAAAAAQABACkAjAABAAAAAACLAAEAAgAA AB8AhQABAAUAAAAAAAAAAYQAAQAFAAAAAAAAAACKAAEAQgAAAAUAPAAAAAoAT3BlblN5bWJv bAAAAAAAAKcBAAD//wAAAAAFAAAAAAAAAP8DAAAAAAAAAAEA/wMAAAAAAAAAAAAAAIgAAQAC AAAAAQCHAAEABQAAAP////8AhgABAAQAAAAAAAAAZwABABAAAADuCAAApQIAAEYRAAC5AgAA jAABAAAAAACLAAEAAgAAAB8AigABAEIAAAAFADwAAAAKAE9wZW5TeW1ib2wAAAAAAACnAQAA //8AAAAABQAAAAAAAAD/AwAAAAAAAAABAP8DAAAAAAAAAAAAAACIAAEAAgAAAAEAhwABAAUA AAD/////AIYAAQAEAAAAAAAAAHIAAgAaAAAAVgoAADgEAAABAAAAlAMDAQAAAAABAAEAlAOM AAEAAAAAAIsAAQACAAAAHwCKAAEASAAAAAUAQgAAABAATGliZXJhdGlvbiBTZXJpZgAAAAAA AKcBAAAAAAAAAAAFAAAAAAACAP8DAAAAAAAAAAEA/wMAAAAAAAAAAAAAAIgAAQACAAAAAQCH AAEABQAAAP////8AhgABAAQAAAAAAAAAcgACABcAAACTCwAAOAQAAAEAUTEBAAAAAAEAAQBR AIwAAQAAAAAAiwABAAIAAAAfAIoAAQBIAAAABQBCAAAAEABMaWJlcmF0aW9uIFNlcmlmAAAA AAAA/QAAAAAAAAAAAAUAAAAAAAIA/wMAAAAAAAAAAQD/AwAAAAAAAAAAAAAAiAABAAIAAAAB AIcAAQAFAAAA/////wCGAAEABAAAAAAAAAByAAIAKQAAANEMAAChBAAABwBHYXNMaWZ0+AIA AAAABwAHAEcAYQBzAEwAaQBmAHQAjAABAAAAAACLAAEAAgAAAB8AigABAEIAAAAFADwAAAAK AE9wZW5TeW1ib2wAALABAAB8BAAA//8AAAAABQAAAAAAAAD/AwAAAAAAAAABAP8DAAAAAABl AgAAAACIAAEAAgAAAAEAhwABAAUAAAD/////AIYAAQAEAAAAAAAAAHIAAgAaAAAAXREAAPgD AAABAAAAKQDQAAAAAAABAAEAKQCMAAEAAAAAAJUAAQAEAAAAAAAAAJYAAQACAAAACQCMAAEA AAAAAA== formula | B1: (11.8)

Sheet: Table1808
A1: Multi-Segment Wells Summary Variables
A2: Type | B2: Variable | C2: Root | D2: WellSegment | E2: Comment
A3: Flow | B3: Artificial Lift Quantity | C3: ALQ | D3: SALQ | E3: See keyword WSEGTABL
A4: Flow | B4: Brine Flow Rate | C4: FR | D4: SFR | E4: Surfactant and Polymer model
A5: Flow | B5: Gas Flow Rate | C5: GFR | D5: SGFR
A6: Flow | B6: Gas Flow Rate (Free) | C6: GFRF | D6: SGFRF
A7: Flow | B7: Gas Flow Rate (Solution) | C7: GFRS | D7: SGFRS
A8: Flow | B8: Gas Flow Total (Absolute) | C8: GFTA | D8: SGFTA
A9: Flow | B9: Gas Flow Total | C9: GFT | D9: SGFT
A10: Flow | B10: Gas Flow Velocity | C10: GFV | D10: SGFV
A11: Flow | B11: Gas Holdup Fraction | C11: GHF | D11: SGHF
A12: Flow | B12: Gas Import Rate | C12: GIMR | D12: SGIMR | E12: See keyword WSEGEXSS
A13: Flow | B13: Gas Import Total | C13: GIMT | D13: SGIMT | E13: See keyword WSEGEXSS
A14: Flow | B14: Oil Absolute Flow Total | C14: OFTA | D14: SOFTA
A15: Flow | B15: Oil Flow Rate | C15: OFR | D15: SOFR
A16: Flow | B16: Oil Flow Rate (Free) | C16: OFRF | D16: SOFRF
A17: Flow | B17: Oil Flow Rate (Solution) | C17: OFRS | D17: SOFRS
A18: Flow | B18: Oil Flow Total | C18: OFT | D18: SOFT
A19: Flow | B19: Oil Flow Velocity | C19: OFV | D19: SOFV
A20: Flow | B20: Oil Holdup Fraction | C20: OHF | D20: SOHF
A21: Flow | B21: Polymer Flow Rate | C21: CFR | D21: SCFR | E21: Polymer model
A22: Flow | B22: Tracer Flow Rate | C22: TFR | D22: STFR | E22: Tracer model
A23: Flow | B23: Water Flow Rate | C23: WFR | D23: SWFR
A24: Flow | B24: Water Flow Total | C24: WFT | D24: SWFT
A25: Flow | B25: Water Flow Total (Absolute) | C25: WFTA | D25: SWFTA
A26: Flow | B26: Water Flow Velocity | C26: WFV | D26: SWFV
A27: Flow | B27: Water Holdup Fraction | C27: WHF | D27: SWHF
A28: Flow | B28: Water Import Rate | C28: WIMR | D28: SWIMR | E28: See keyword WSEGEXSS
A29: Flow | B29: Water Import Total | C29: WIMT | D29: SWIMT | E29: See keyword WSEGEXSS
A30: Pressure | B30: Pressure | C30: PR | D30: SPR
A31: Pressure | B31: Pressure Drop | C31: PRD | D31: SPRD
A32: Pressure | B32: Pressure Drop component due to Friction | C32: PRDF | D32: SPRDF
A33: Pressure | B33: Pressure Drop component due to Hydrostatic head | C33: PRDH | D33: SPRDH
A34: Pressure | B34: Pressure drop due to Acceleration head | C34: PRDA | D34: SPRDA
A35: Pressure | B35: Pressure Drop Frictional Multiplier | C35: PRDM | D35: SPRDM | E35: See keyword WSEGMULT
A36: Property | B36: API | C36: API | D36: SAPI | E36: API model
A37: Property | B37: Fluid Mixture Density (Excludes Exponents) | C37: DENM | D37: SDENM | E37: Excludes exponents of flowing fractions
A38: Property | B38: Fluid Mixture Density (Includes Exponents) | C38: MDEN | D38: SMDEN | E38: Includes exponents of flowing fractions
A39: Property | B39: Fluid Mixture Viscosity (Includes Exponents) | C39: MVIS | D39: SMVIS | E39: Includes exponents of flowing fractions
A40: Property | B40: Fluid Viscosity (Effective Mixture) | C40: EMVIS | D40: SEMVIS | E40: Water/polymer fluid
A41: Property | B41: Gas Density | C41: GDEN | D41: SGDEN
A42: Property | B42: Gas Viscosity | C42: GVIS | D42: SGVIS
A43: Property | B43: Gas-Liquid Drift Velocity (Vd) | C43: GLVD | D43: SGLVD | E43: Drift flux slip model
A44: Property | B44: Gas-Liquid Profile Parameter (C0) | C44: GLPP | D44: SGLPP | E44: Drift flux slip model
A45: Property | B45: Oil Density | C45: ODEN | D45: SODEN
A46: Property | B46: Oil Viscosity | C46: OVI | D46: SOVI
A47: Property | B47: Oil-Water Drift Velocity (Vd) | C47: OWVD | D47: SOWVD | E47: Drift flux slip model
A48: Property | B48: Oil-Water Profile Parameter (C0) | C48: OWPP | D48: SOWPP | E48: Drift flux slip model
A49: Property | B49: Pump Working Power | C49: PPOW | D49: SPPOW | E49: See keyword WSEGPULL
A50: Property | B50: Scale Deposition Diameter (Karst Conduit Calcite Dissolution) | C50: FD | D50: SFD | E50: Scale Deposition model
A51: Property | B51: Setting of segment | C51: FOPN | D51: SFOPN | E51: See keywords WSEGVALV, WSEGAICD, WSEGSICD, WSEGTABL, WSEGLABY and WSEGFLIM)
A52: Property | B52: Strength of ICD on segment | C52: STR | D52: SSTR | E52: See keywords WSEGVALV, WSEGAICD and WSEGSICD)
A53: Property | B53: Water Density (Pure Water) | C53: WDEN | D53: SWDEN
A54: Property | B54: Water Viscosity (Pure Water) | C54: WVIS | D54: SWVIS
A55: Ratio | B55: Gas-Oil Ratio | C55: GOR | D55: SGOR
A56: Ratio | B56: Oil-Gas Ratio | C56: OGR | D56: SOGR
A57: Ratio | B57: Water Cut | C57: WCT | D57: SWCT
A58: Ratio | B58: Water Gas Ratio | C58: WGR | D58: SWGR
A59: Volume | B59: Brine Concentration | C59: SCN | D59: SSCN | E59: Surfactant and Polymer model
A60: Volume | B60: Polymer Concentration | C60: CCN | D60: SCCN | E60: Polymer model
A61: Volume | B61: Tracer Concentration | C61: TFC | D61: STFC | E61: Tracer model
A62: Notes:

Sheet: Table1918
A1: Network Model Summary Variables
A2: Type | B2: Variable | C2: Root | D2: Field | E2: Group | F2: Well | G2: WellConnection | H2: Region | I2: Block
A3: Pressure | B3: Group/Node pressure in a production network. | E3: GPR
A4: Pressure | B4: Group /Node pressure in a gas injection network. | E4: GPRG
A5: Pressure | B5: Group/Node pressure in a water injection network. | E5: GPRW
A6: Pressure | B6: Pressure drop along the group’s or node’s outlet branch in a production network. | E6: GPRB
A7: Pressure | B7: Pressure drop along the group’s or node’s inlet branch in a gas injection network. | E7: GPRBG
A8: Pressure | B8: Pressure drop along the group’s or node’s inlet branch in a water injection network. | E8: GPRBW
A9: Flow | B9: Artificial Lift Quantity (“ALQ”) in the group’s or node’s outlet branch in a production network. Note no units are stated as ALQ units are variable, for example Hz for ESP or rate for gas lift gas. | E9: GALQ
A10: Flow | B10: Oil flow rate along the group’s or node’s outlet branch in a production network. | E10: GOPRNB
A11: Flow | B11: Water flow rate along the group’s or node’s outlet branch in a production network. | E11: GWPRNB
A12: Flow | B12: Gas flow rate along the group’s or node’s outlet branch in a production network. | E12: GGPRNB
A13: Flow | B13: Liquid flow rate along the group’s or node’s outlet branch in a production network. | E13: GLPRNB
A14: Flow | B14: Water flow rate along the group’s or node’s inlet branch in water injection network. | E14: GWIRNB
A15: Flow | B15: Gas flow rate along the group’s or node’s inlet branch in gas injection network. | E15: GGIRNB
A16: Notes:

Sheet: Table1868
A1: OPM Flow Simulation Performance
A2: Variable Description | D2: Variable | E2: Comment
A3: Elapsed - Cumulative waiting time per process in seconds. | D3: DTMWAIT | E3: Unsupported
A4: Elapsed - Elapsed time in seconds. | D4: ELAPSED | E4: No data written to file.
A5: Iterations - Number of linear iterations for each gradient calculation (Gradient Option). | D5: HLINEARS | E5: OPM Flow currently has not implemented the Gradient option.
A6: Iterations - Total number of linear iterations for each gradient pressure (Gradient Option). | D6: HSUMLINS | E6: OPM Flow currently has not implemented the Gradient option.
A7: Maximum Courant-Friedrichs-Lewy value for each time step. | D7: MAXCFL | E7: Compositional keyword
A8: Maximum variation in energy for each time step. | D8: MAXDE | E8: Compositional keyword
A9: Maximum variation in pressure for each time step. | D9: MAXDPR | E9: Unsupported
A10: Maximum variation in gas saturation for each time step. | D10: MAXDSG | E10: Unsupported
A11: Maximum variation in oil saturation for each time step. | D11: MAXDSO | E11: Unsupported
A12: Maximum variation in water saturation for each time step. | D12: MAXDSW | E12: Unsupported
A13: Maximum variation in temperature for each time step. | D13: MAXDT | E13: Compositional keyword
A14: Memory - Operating system reported maximum current memory usage across all processors. | D14: MEMORYTS | E14: Unsupported
A15: CPR Solver - Number of pressure iterations for each time step. | D15: MLINEARP | E15: Unsupported
A16: Iterations - Number linear iterations for each time step. | D16: MLINEARS
A17: Messages - Cumulative number of BUG messages. | D17: MSUMBUG | E17: Unsupported
A18: Messages - Cumulative number of COMMENT messages. | D18: MSUMCOMM | E18: Unsupported
A19: Messages - Cumulative number of ERROR messages. | D19: MSUMERR | E19: Unsupported
A20: CPR Solver - Cumulative number of pressure iterations. | D20: MSUMLINP | E20: Unsupported
A21: Iterations - Cumulative number of linear iterations. | D21: MSUMLINS
A22: Messages - Cumulative number of MESSAGES messages. | D22: MSUMMESS | E22: Unsupported
A23: Iterations - Cumulative number of Newton iterations. | D23: MSUMNEWT
A24: Messages - Cumulative number of PROBLEM messages. | D24: MSUMPROB | E24: Unsupported
A25: Messages - Cumulative number of WARNING messages. | D25: MSUMWARN | E25: Unsupported
A26: Number of flash calculations for each time step | D26: NBAKFL | E26: Compositional keyword
A27: Memory - Peak usage of dynamically allocated memory reported by OPM Flow. For parallel cases this is the maximum across all processors. | D27: NBYTOT | E27: Unsupported
A28: CPR Solver - Average number of pressure iterations per linear iteration for each time step. | D28: NCPRLINS | E28: Unsupported
A29: Iterations – Cumulative average number of Newton iterations per cell in flash calculations.. | D29: NEWTFL | E29: Compositional keyword
A30: Iterations - Number of Newton iterations used for each time step. | D30: NEWTON
A31: CPR Solver - Average number of pressure iterations per Newton iteration per time step. | D31: NLINEARP | E31: Unsupported
A32: Iterations - Average number of linear iterations per Newton iteration for each time step. | D32: NLINEARS | E32: For runs with LGRs, LLINEARS will automatically be exported for each LGR.
A33: Iterations - Maximum number of linear iterations in the Newton iterations per time step. | D33: NLINSMAX
A34: Iterations - Minimum number of linear iterations in the Newton iterations per time step. | D34: NLINSMIN
A35: Cumulative number of flash calculations. | D35: NNUMFL | E35: Compositional keyword
A36: Cumulative number of stability tests. | D36: NNUMST | E36: Compositional keyword
A37: Non-linear residual total. | D37: NLRESSUM | E37: Compositional keyword
A38: Non-linear residual maximum value. | D38: NLRESMAX | E38: Compositional keyword
A39: Number of time steps – taken. | D39: NTS | E39: Compositional keyword
A40: Number of time steps – pressure converged. | D40: NTSPCL | E40: Compositional keyword
A41: Number of time steps – molar density converged. | D41: NTSMCL | E41: Compositional keyword
A42: Number of time steps – energy density converged. | D42: NTSECL | E42: Compositional keyword
A43: Time Step – Criteria used to select the length of the time step, set to one of the following: | D43: STEPTYPE | E43: No data written to file. Note if the RUNSUM keyword has been activated in the SUMMARY section, then the mnemonics are written to the RSM file instead of integer values.
A44: Value | B44: Criteria | C44: Definition
A45: 1 | B45: INIT | C45: Initial time step.
A46: ooow:<A45>+1 -> 2 | B46: TRNC | C46: Controlled via time truncation error.
A47: ooow:<A46>+1 -> 3 | B47: MINF | C47: Minimum ratio between one time step and the next.
A48: ooow:<A47>+1 -> 4 | B48: MAXF | C48: Maximum ratio between one time step and the next.
A49: ooow:<A48>+1 -> 5 | B49: MINS | C49: Minimum permitted time step.
A50: ooow:<A49>+1 -> 6 | B50: MAXS | C50: Maximum permitted time step.
A51: ooow:<A50>+1 -> 7 | B51: REPT | C51: Report time step
A52: ooow:<A51>+1 -> 8 | B52: HALF | C52: Half of the time set to reach the next report time step.
A53: ooow:<A52>+1 -> 9 | B53: CHOP | C53: Time step chopped due non-convergence of non-linear equations.
A54: ooow:<A53>+1 -> 10 | B54: SATM | C54: Maximum saturation change.
A55: ooow:<A54>+1 -> 11 | B55: PCHP | C55: Time step chopped due to maximum pressure change in IMPES formulation.
A56: ooow:<A55>+1 -> 12 | B56: DIFF | C56: Difficult time step after a time step CHOP.
A57: ooow:<A56>+1 -> 13 | B57: LGRC | C57: Determined by LGR fluid in-place error targets.
A58: ooow:<A57>+1 -> 14 | B58: SURF | C58: Set by maximum expected grid block surfactant concentration change.
A59: ooow:<A58>+1 -> 15 | B59: NETW | C59: Time step determined by network balancing controls.
A60: ooow:<A59>+1 -> 16 | B60: THRP | C60: Time step controlled by maximum through put ratio.
A61: ooow:<A60>+1 -> 17 | B61: EMTH | C61: Time step selected to match the end of a month.
A62: ooow:<A61>+1 -> 18 | B62: MAXP | C62: Set by maximum expected grid block pressure change.
A63: ooow:<A62>+1 -> 19 | B63: WCYC | C63: Determined by well cycling on/off time.
A64: ooow:<A63>+1 -> 20 | B64: MAST | C64: Chosen by the master simulation in a reservoir coupling run.
A65: ooow:<A64>+1 -> 21 | B65: SLVR | C65: Selected by a slave simulation to match a slave reporting time step, in a reservoir coupling run.
A66: ooow:<A65>+1 -> 22 | B66: SLVC | C66: Time step selected by a slave simulation due to a slave’s expected flow rate change in a reservoir coupling run.
A67: ooow:<A66>+1 -> 23 | B67: MAXW | C67: Maximum time step size after a well control event.
A68: ooow:<A67>+1 -> 24 | B68: EFF+ | C68: Selected by ZIPPY optimum time selection algorithm.
A69: ooow:<A68>+1 -> 25 | B69: EFF-
A70: ooow:<A69>+1 -> 26 | B70: NLTR
A71: ooow:<A70>+1 -> 27 | B71: EFFT
A72: ooow:<A71>+1 -> 28 | B72: DLYA
A73: ooow:<A72>+1 -> 29 | B73: ACTN
A74: ooow:<A73>+1 -> 30 | B74: RAIN
A75: CPU - Current CPU usage in seconds. | D75: TCPU | E75: Does not consider the time taken by inter-process communications in parallel runs, whereas ELAPSED does. Thus, for parallel jobs, ELAPSED is the most relevant time measurement.
A76: CPU - CPU time per day (or hour in lab units depending on run units system). | D76: TCPUDAY
A77: CPU – Cumulative CPU time for each gradient calculation (Gradient Option). | D77: TCPUH | E77: OPM Flow currently has not implemented the Gradient option.
A78: CPU - Cumulative CPU time for all gradient calculations (Gradient Option). | D78: TCPUHT | E78: OPM Flow currently has not implemented the Gradient option.
A79: CPU - Cumulative CPU time used in SCHEDULE section. | D79: TCPUSCH | E79: Unsupported
A80: CPU - CPU time per time step in seconds. | D80: TCPUTS
A81: CPU - CPU time per time step for each gradient calculation (Gradient Option). | D81: TCPUTSH | E81: OPM Flow currently has not implemented the Gradient option.
A82: CPU - CPU time per time step for all gradient calculations (Gradient Option). | D82: TCPUTSHT | E82: OPM Flow currently has not implemented the Gradient option.
A83: CPU – Cumulative Tracer CPU time. | D83: TCPUTR | E83: Compositional keyword
A84: CPU – Cumulative Tracer implicit CPU time. | D84: TCPUTRSV | E84: Compositional keyword
A85: CPU – Cumulative Tracer Lagrangian tracer stramline CPU time. | D85: TCPULGTR | E85: Compositional keyword
A86: CPU – Cumulative Tracer Lagrangian tracer solver CPU time. | D86: TCPULGSV | E86: Compositional keyword
A87: Elapsed - Elapsed time per day (or hour in lab units). | D87: TELAPDAY | E87: Unsupported
A88: Elapsed - Elapsed time per linear iteration in seconds. | D88: TELAPLIN | E88: No data written to file.
A89: Elapsed - Elapsed time per time step in seconds. | D89: TELAPTS | E89: Unsupported
A90: Time Step - Length of time step. | D90: TIMESTEP
A91: Iterations - Number of well Newton iterations taken in the last global Newton iteration. A negative value indicates that the well failed to converge. | D91: WNEWTON | E91: Unsupported
A92: Time Step - Predicted efficiency of the time step (developer use). | D92: ZIPEFF | E92: Unsupported
A93: Time Step - Predicted efficiency of the time step divided by the actual efficiency (developer use). | D93: ZIPEFFC | E93: Unsupported
A94: Notes:

Sheet: Table1809
A1: Polymer Model Summary Variables
A2: Type | B2: Variable | C2: Root | D2: Field | E2: Group | F2: Well | G2: WellConnection | H2: Region | I2: Block | J2: Comment
A3: Flow | B3: Polymer Flow Rate | C3: CFR | G3: CCFR
A4: Flow | B4: Polymer Flow Total (Inter-Region) | C4: CFT | H4: RCFT
A5: Flow | B5: Polymer Injection Rate | C5: CIR | D5: FCIR | E5: GCIR | F5: WCIR | G5: CCIR
A6: Flow | B6: Polymer Injection Total | C6: CIT | D6: FCIT | E6: GCIT | F6: WCIT | G6: CCIT
A7: Flow | B7: Polymer Production Rate | C7: CPR | D7: FCPR | E7: GCPR | F7: WCPR | G7: CCPR
A8: Flow | B8: Polymer Production Total | C8: CPT | D8: FCPT | E8: GCPT | F8: WCPT | G8: CCPT
A9: Flow | B9: Salt Flow Rate | C9: SFR | G9: CSPR
A10: Flow | B10: Salt Injection Rate | C10: SIR | D10: FSIR | E10: GSIR | F10: WSIR | G10: CSIR
A11: Flow | B11: Salt Injection Total | C11: SIT | D11: FSIT | E11: GSIT | F11: WSIT | G11: CSIT
A12: Flow | B12: Salt Production Rate | C12: SPR | D12: FSPR | E12: GSPR | F12: WSPR | G12: CSPR
A13: Flow | B13: Salt Production Total | C13: SPT | D13: FSPT | E13: GSPT | F13: WSPT | G13: CSPT
A14: Property | B14: Polymer Adsorbed (PLYTRRFA) | C14: CABnnn | I14: BCABnnn | J14: By highest temperature band at which residual resistance factor was calculated, see keyword PLYTRRFA. The band number nnn can range from 001 to 999, but must be less than or equal to the argument on the PLYTRRFA keyword.
A15: Property | B15: Polymer Adsorption Total | C15: CAD | D15: FCAD | H15: RCAD | I15: BCAD | J15: Block is concentration
A16: Property | B16: Polymer Solution (Effective Viscosity) | C16: EPVIS | I16: BEPVIS | J16: Also BVPOLY
A17: Property | B17: Polymer Solution Shear Viscosity (Inter-Block I+ Direction) | C17: SHWVISI | I17: BSHWVISI
A18: Property | B18: Polymer Solution Shear Viscosity (Inter-Block J+ Direction) | C18: SHWVISJ | I18: BSHWVISJ
A19: Property | B19: Polymer Solution Shear Viscosity (Inter-Block K+ Direction) | C19: SHWVISK | I19: BSHWVISK
A20: Property | B20: Polymer Thermal Degradation | C20: CDCS | I20: BCDCS | J20: Total mass degraded in previous time step
A21: Property | B21: Polymer Thermal Degradation Rate | C21: CDCR | I21: BCDCR | J21: Total mass degraded in previous time step
A22: Property | B22: Polymer Thermal Degradation Rate (Adsorbed) | C22: CDCA | I22: BCDCA
A23: Property | B23: Polymer Thermal Degradation Rate (Solution) | C23: CDCP | I23: BCDCP
A24: Property | B24: Polymer Water (Effective Viscosity) | C24: EMVIS | I24: BEMVIS | J24: Based on block center properties.
A25: Property | B25: Water Flow Rate Times Shear Multiplier (Inter-Block I+ Direction) | C25: FLOW0I | I25: BFLOW0I | J25: Multiplied by the corresponding shear multiplier (PLYSHLOG and PLYSHEAR options only)
A26: Property | B26: Water Flow Rate Times Shear Multiplier (Inter-Block J+ Direction) | C26: FLOW0J | I26: BFLOW0J
A27: Property | B27: Water Flow Rate Times Shear Multiplier (Inter-Block K+ Direction) | C27: FLOW0K | I27: BFLOW0K
A28: Property | B28: Water Shear Rate After Shear Effects (Inter-Block I+ Direction) | C28: SRTWI | I28: BSRTWI
A29: Property | B29: Water Shear Rate After Shear Effects (Inter-Block J+ Direction) | C29: SRTWJ | I29: BSRTWJ
A30: Property | B30: Water Shear Rate After Shear Effects (Inter-Block K+ Direction) | C30: SRTWK | I30: BSRTWK
A31: Property | B31: Water Shear Rate Prior to Shear Effects (Inter-Block I+ Direction) | C31: SRTW0I | I31: BSRTW0I
A32: Property | B32: Water Shear Rate Prior to Shear Effects (Inter-Block J+ Direction) | C32: SRTW0J | I32: BSRTW0J
A33: Property | B33: Water Shear Rate Prior to Shear Effects (Inter-Block K+ Direction) | C33: SRTW0K | I33: BSRTW0K
A34: Property | B34: Water Velocity (Inter-Block I+ Direction) | C34: VELW0I | I34: BVELW0I
A35: Property | B35: Water Velocity (Inter-Block J+ Direction) | C35: VELW0J | I35: BVELW0J
A36: Property | B36: Water Velocity (Inter-Block K+ Direction) | C36: VELW0K | I36: BVELW0K
A37: Property | B37: Water Viscosity (Effective) | C37: EWV_POL | I37: BEWV_POL
A38: Property | B38: Water Viscosity Sheared Factor (Inter-Block I+ Direction) | C38: PSHLZI | I38: BPSHLZI
A39: Property | B39: Water Viscosity Sheared Factor (Inter-Block J+ Direction) | C39: PSHLZJ | I39: BPSHLZJ
A40: Property | B40: Water Viscosity Sheared Factor (Inter-Block K+ Direction) | C40: PSHLZK | I40: BPSHLZK
A41: Volume | B41: Polymer Concentration (Block) | C41: CCN | I41: BCCN
A42: Volume | B42: Polymer Concentration (Injection) | C42: CIC | D42: FCIC | E42: GCIC | F42: WCIC | G42: CCIC
A43: Volume | B43: Polymer Concentration (Production) | C43: CPC | D43: FCPC | E43: GCPC | F43: WCPC | G43: CCPC
A44: Volume | B44: Polymer Solution (In Solution) | C44: CIP | D44: FCIP | H44: RCIP | I44: BCIP
A45: Volume | B45: Salt Cell Concentration | C45: SCN | I45: BSCN
A46: Volume | B46: Salt In Place | C46: SIP | D46: FSIP | H46: RSIP | I46: BSIP
A47: Volume | B47: Salt inter-region Flow Total | C47: SFT | H47: RSFT
A48: Notes:

Sheet: Table1810
A1: Solvent Model Summary Variables
A2: Type | B2: Variable | C2: Root | D2: Field | E2: Group | F2: Well | G2: WellConnection | H2: Region | I2: Block | J2: Comment
A3: Flow | B3: Solvent Flow Rate | C3: NFR | G3: CNFR | J3: Field, group and wells gas rates and cumulative volumes include the solvent gas.
A4: Flow | B4: Solvent Flow Total (Inter-Region) | C4: NFT | H4: RNFT
A5: Flow | B5: Solvent Injection Rate | C5: NIR | D5: FNIR | E5: GNIR | F5: WNIR
A6: Flow | B6: Solvent Injection Total | C6: NIT | D6: FNIT | E6: GNIT | F6: WNIT | G6: CNIT
A7: Flow | B7: Solvent Production Rate | C7: NPR | D7: FNPR | E7: GNPR | F7: WNPR
A8: Flow | B8: Solvent Production Total | C8: NPT | D8: FNPT | E8: GNPT | F8: WNPT | G8: CNPT
A9: Property | B9: Solvent Relative Permeability | C9: NKR | I9: BNKR
A10: Volume | B10: Solvent In-Place | C10: NIP | D10: FNIP | H10: RNIP | I10: BNIP
A11: Volume | B11: Solvent Saturation | C11: NSAT | I11: BNSAT
A12: Notes:

Sheet: Table1812
A1: Thermal Model Summary Variables
A2: Type | B2: Variable | C2: Root | D2: Field | E2: Group | F2: Well | G2: WellConnection | H2: Region | I2: Block | J2: Comment
A3: Flow | B3: Energy Injection Rate | C3: TIRHEA | D3: FTIRHEA | E3: GTIRHEA | F3: WTIRHEA
A4: Flow | B4: Energy Injection Total | C4: TITHEA | D4: FTITHEA | E4: GTITHEA | F4: WTITHEA
A5: Flow | B5: Energy Production Rate | C5: TPRHEA | D5: FTPRHEA | E5: GTPRHEA | F5: WTPRHEA
A6: Flow | B6: Energy Production Total | C6: TPTHEA | D6: FTPTHEA | E6: GTPTHEA | F6: WTPTHEA
A7: Property | B7: Temperature (Block) | C7: TCNFHEA | I7: BTCNFHEA
A8: Property | B8: Temperature (Injection) | C8: TICHEA | D8: FTICHEA | E8: GTICHEA | F8: WTICHEA
A9: Property | B9: Temperature (Production) | C9: TPCHEA | D9: FTPCHEA | E9: GTPCHEA | F9: WTPCHEA | I9: BTPCHEA
A10: Volume | B10: Energy In-Place Difference | C10: TIPTHEA | D10: FTIPTHEA | H10: RTIPTHEA4 | I10: BTIPTHEA | J10: Difference in energy in- place from start of run to current time.
A11: Notes:

Sheet: Table1811
A1: User Define Quantities Summary Variables
A2: Variable | B2: Root | C2: Field | D2: Group | E2: Well | F2: WellConnection | G2: Region | H2: WellSegment
A3: UDQ Variable | B3: XXXXXX | C3: FUXXXXXX | D3: GUXXXXXX | E3: WUXXXXXX | F3: CUXXXXXX | G3: RUXXXXXX | H3: SUXXXXXX
A4: Notes:

Sheet: Table711
A1: RUNSPEC | B1: GRID | C1: EDIT | D1: PROPS | E1: REGIONS | F1: SOLUTION | G1: SUMMARY | H1: SCHEDULE

Sheet: Table1813
A1: Standard Production, Injection, and Pressures Summary Variables
A2: Variable | B2: Root | C2: Field | D2: Group | E2: Well | F2: Comment
A3: Gas Injection Rate | B3: GIR | C3: FGIR | D3: GGIR | E3: WGIR
A4: Gas Injection Total | B4: GIT | C4: FGIT | D4: GGIT | E4: WGIT
A5: Gas Production Rate | B5: GPR | C5: FGPR | D5: GGPR | E5: WGPR | F5: Produced reservoir gas only, gas lift gas is excluded.
A6: Gas Production Total | B6: GPT | C6: FGPT | D6: GGPT | E6: WGPT
A7: Oil Injection Rate | B7: OIR | C7: FOIR | D7: GOIR | E7: WOIR
A8: Oil Injection Total | B8: OIT | C8: FOIT | D8: GOIT | E8: WOIT
A9: Oil Production Rate | B9: OPR | C9: FOPR | D9: GOPR | E9: WOPR
A10: Oil Production Total | B10: OPT | C10: FOPT | D10: GOPT | E10: WOPT
A11: Res. Vol. Injection Rate | B11: VIR | C11: FVIR | D11: GVIR | E11: WVIR
A12: Res. Vol. Injection Total | B12: VIT | C12: FVIT | D12: GVIT | E12: WVIT
A13: Res. Vol. Production Rate | B13: VPR | C13: FVPR | D13: GVPR | E13: WVPR
A14: Res. Vol. Production Total | B14: VPT | C14: FVPT | D14: GVPT | E14: WVPT
A15: Water Injection Rate | B15: WIR | C15: FWIR | D15: GWIR | E15: WWIR
A16: Water Injection Total | B16: WIT | C16: FWIT | D16: GWIT | E16: WWIT
A17: Water Production Rate | B17: WPR | C17: FWPR | D17: GWPR | E17: WWPR
A18: Water Production Total | B18: WPT | C18: FWPT | D18: GWPT | E18: WWPT
A19: Bottom-Hole Pressure | B19: BHP | E19: WBHP
A20: Productivity | B20: PI | E20: WPI | F20: Preferred Phase
A21: Tubing Head Pressure | B21: THP | E21: WTHP
A22: Gas-Oil Ratio | B22: GOR | C22: FGOR | D22: GGOR | E22: WGOR
A23: Water -Gas Ratio | B23: WGR | C23: FWGR | D23: GWGR | E23: WWGR
A24: Water Cut | B24: WCT | C24: FWCT | D24: GWCT | E24: WWCT
A25: Pressures and Volumes
A26: Variable | B26: Root | C26: Field | D26: Group | E26: Well | F26: Comment
A27: Oil Phase Pressure | B27: PR | C27: FPR | F27: Field and Region HCPV weighted
A28: Gas In-Place | B28: GIP | C28: FGIP | F28: Liquid and gas phases
A29: Gas In-Place (Gas Phase) | B29: GIPG | C29: FGIPG
A30: Gas In-Place (Liquid Phase) | B30: GIPL | C30: FGIPL | F30: Only for cases that have dissolved gas in the water phase
A31: Oil In-Place | B31: OIP | C31: FOIP | F31: Liquid and gas phases
A32: Oil In-Place (Gas Phase) | B32: OIPG | C32: FOIPG
A33: Oil In-Place (Liquid Phase) | B33: OIPL | C33: FOIPL
A34: Water In-Place | B34: WIP | C34: FWIP
A35: Notes:

Sheet: Table1814
A1: Standard Aquifer Summary Variables
A2: Variable | B2: Root | C2: Field | D2: AnalyticalAquifer | E2: AnalyticalAquiferList | F2: NumericalAquifer | G2: Comment
A3: Aquifer Influx Rate (Water Aquifers) | B3: QR | C3: FAQR | D3: AAQR
A4: Aquifer Influx Total (Water Aquifers) | B4: QT | C4: FAQT | D4: AAQT
A5: Aquifer Influx Rate (Gas Aquifers) | B5: QRG | C5: FAQRG | D5: AAQRG
A6: Aquifer Influx Total (Gas Aquifers) | B6: QTG | C6: FAQTG | D6: AAQTG
A7: Notes:

Sheet: Table633
A1: RUNSPEC | B1: GRID | C1: EDIT | D1: PROPS | E1: REGIONS | F1: SOLUTION | G1: SUMMARY | H1: SCHEDULE

Sheet: Table634
A1: RUNSPEC | B1: GRID | C1: EDIT | D1: PROPS | E1: REGIONS | F1: SOLUTION | G1: SUMMARY | H1: SCHEDULE

Sheet: Table712
A1: RUNSPEC | B1: GRID | C1: EDIT | D1: PROPS | E1: REGIONS | F1: SOLUTION | G1: SUMMARY | H1: SCHEDULE

Sheet: Table1850
A1: Field and Group Well Status Summary Variables
A2: Variable | B2: Root | C2: Field | D2: Group | E2: Comment
A3: Number of abandoned injection wells | B3: MWIA | C3: FMWIA | D3: GMWIA
A4: Number of abandoned production wells | B4: MWPA | C4: FMWPA | D4: GMWPA
A5: Number of drilling events in total | B5: MWDT | C5: FMWDT | D5: GMWDT
A6: Number of drilling events this time step | B6: MWDR | C6: FMWDR | D6: GMWDR
A7: Number of injection wells currently flowing | B7: MWIN | C7: FMWIN | D7: GMWIN
A8: Number of injectors on group control | B8: MWIG | C8: FMWIG | D8: GMWIG
A9: Number of injectors on own reservoir volume rate limit control | B9: MWIV | C9: FMWIV | D9: GMWIV
A10: Number of injectors on own surface rate limit control | B10: MWIS | C10: FMWIS | D10: GMWIS
A11: Number of injectors on pressure control | B11: MWIP | C11: FMWIP | D11: GMWIP
A12: Number of producers controlled by own oil rate limit | B12: MWPO | C12: FMWPO | D12: GMWPO
A13: Number of producers on group control | B13: MWPG | C13: FMWPG | D13: GMWPG
A14: Number of producers on own reservoir volume rate limit control | B14: MWPV | C14: FMWPV | D14: GMWPV
A15: Number of producers on own surface rate limit control | B15: MWPS | C15: FMWPS | D15: GMWPS
A16: Number of producers on pressure control | B16: MWPP | C16: FMWPP | D16: GMWPP
A17: Number of producers using artificial lift (with ALQ > 0.0) | B17: MWPL | C17: FMWPL | D17: GMWPL
A18: Number of production wells currently flowing | B18: MWPR | C18: FMWPR | D18: GMWPR
A19: Number of unused injection wells | B19: MWIU | C19: FMWIU | D19: GMWIU
A20: Number of unused production wells | B20: MWPU | C20: FMWPU | D20: GMWPU
A21: Number of workover events in total | B21: MWWT | C21: FMWWT | D21: GMWWT
A22: Number of workover events this time step. | B22: MWWO | C22: FMWWO | D22: GMWWO
A23: Total number of injection wells | B23: MWIT | C23: FMWIT | D23: GMWIT
A24: Total number of production wells | B24: MWPT | C24: FMWPT | D24: GMWPT
A25: Notes:

Sheet: Table713
A1: RUNSPEC | B1: GRID | C1: EDIT | D1: PROPS | E1: REGIONS | F1: SOLUTION | G1: SUMMARY | H1: SCHEDULE

Sheet: Table1848
A1: Field and Group Well Status Summary Variables
A2: Variable | B2: Root | C2: Field | D2: Group | E2: Comment
A3: Number of abandoned injection wells | B3: MWIA | C3: FMWIA | D3: GMWIA
A4: Number of abandoned production wells | B4: MWPA | C4: FMWPA | D4: GMWPA
A5: Number of drilling events in total | B5: MWDT | C5: FMWDT | D5: GMWDT
A6: Number of drilling events this timestep | B6: MWDR | C6: FMWDR | D6: GMWDR
A7: Number of injection wells currently flowing | B7: MWIN | C7: FMWIN | D7: GMWIN
A8: Number of injectors on group control | B8: MWIG | C8: FMWIG | D8: GMWIG
A9: Number of injectors on own reservoir volume rate limit control | B9: MWIV | C9: FMWIV | D9: GMWIV
A10: Number of injectors on own surface rate limit control | B10: MWIS | C10: FMWIS | D10: GMWIS
A11: Number of injectors on pressure control | B11: MWIP | C11: FMWIP | D11: GMWIP
A12: Number of producers controlled by own oil rate limit | B12: MWPO | C12: FMWPO | D12: GMWPO
A13: Number of producers on group control | B13: MWPG | C13: FMWPG | D13: GMWPG
A14: Number of producers on own reservoir volume rate limit control | B14: MWPV | C14: FMWPV | D14: GMWPV
A15: Number of producers on own surface rate limit control | B15: MWPS | C15: FMWPS | D15: GMWPS
A16: Number of producers on pressure control | B16: MWPP | C16: FMWPP | D16: GMWPP
A17: Number of producers using artificial lift (with ALQ > 0.0) | B17: MWPL | C17: FMWPL | D17: GMWPL
A18: Number of production wells currently flowing | B18: MWPR | C18: FMWPR | D18: GMWPR
A19: Number of unused injection wells | B19: MWIU | C19: FMWIU | D19: GMWIU
A20: Number of unused production wells | B20: MWPU | C20: FMWPU | D20: GMWPU
A21: Number of workover events in total | B21: MWWT | C21: FMWWT | D21: GMWWT
A22: Number of workover events this time step. | B22: MWWO | C22: FMWWO | D22: GMWWO
A23: Total number of injection wells | B23: MWIT | C23: FMWIT | D23: GMWIT
A24: Total number of production wells | B24: MWPT | C24: FMWPT | D24: GMWPT
A25: Notes:

Sheet: Table1404
A1: RUNSPEC | B1: GRID | C1: EDIT | D1: PROPS | E1: REGIONS | F1: SOLUTION | G1: SUMMARY | H1: SCHEDULE

Sheet: Table1410
A1: RUNSPEC | B1: GRID | C1: EDIT | D1: PROPS | E1: REGIONS | F1: SOLUTION | G1: SUMMARY | H1: SCHEDULE

Sheet: Table862
A1: RUNSPEC | B1: GRID | C1: EDIT | D1: PROPS | E1: REGIONS | F1: SOLUTION | G1: SUMMARY | H1: SCHEDULE

Sheet: Table1840
A1: OPM Flow Simulator Performance Summary Variables Cumulative Message Variables
A2: Variable Description | B2: Variable | C2: Comment
A3: Messages - Cumulative number of BUG messages. | B3: MSUMBUG | C3: Unsupported.
A4: Messages - Cumulative number of COMMENT messages. | B4: MSUMCOMM | C4: Unsupported.
A5: Messages - Cumulative number of ERROR messages. | B5: MSUMERR | C5: Unsupported.
A6: Messages - Cumulative number of MESSAGES messages. | B6: MSUMMESS | C6: Unsupported.
A7: Messages - Cumulative number of PROBLEM messages. | B7: MSUMPROB | C7: Unsupported.
A8: Messages - Cumulative number of WARNING messages. | B8: MSUMWARN | C8: Unsupported.
A9: Notes:

Sheet: Table1435
A1: RUNSPEC | B1: GRID | C1: EDIT | D1: PROPS | E1: REGIONS | F1: SOLUTION | G1: SUMMARY | H1: SCHEDULE

Sheet: Table1867
A1: RUNSPEC | B1: GRID | C1: EDIT | D1: PROPS | E1: REGIONS | F1: SOLUTION | G1: SUMMARY | H1: SCHEDULE

Sheet: Table1870
A1: OPM Flow Simulator Performance Summary Variables Numerical Performance Variables
A2: Variable Description | B2: Variable | C2: Comment
A3: Elapsed - Elapsed time in seconds. | B3: ELAPSED | C3: No data written to file.
A4: Iterations - Number linear iterations for each time step. | B4: MLINEARS
A5: Iterations - Cumulative number of linear iterations. | B5: MSUMLINS
A6: Iterations - Cumulative number of Newton iterations. | B6: MSUMNEWT
A7: Iterations - Number of Newton iterations used for each time step. | B7: NEWTON
A8: Iterations - Average number of linear iterations per Newton iteration for each time step. | B8: NLINEARS | C8: For runs with LGRs, LLINEARS will automatically be exported for each LGR.
A9: Iterations - Maximum number of linear iterations in the Newton iterations per time step. | B9: NLINSMAX
A10: Iterations - Minimum number of linear iterations in the Newton iterations per time step. | B10: NLINSMIN
A11: Time Step – Criteria used to select the length of the time step. See section 11.2.25Option Specific Variables – OPM Flow Simulation Performancefor the definition of of the STEPTYPE mnemonics. | B11: STEPTYPE | C11: No data written to file.
A12: CPU - Current CPU usage in seconds. | B12: TCPU | C12: Does not consider the time taken by inter-process communications in parallel runs, whereas ELAPSED does. Thus, for parallel jobs, ELAPSED is the most relevant time measurement.
A13: CPU - CPU time per day (or hour in lab units depending on run units system). | B13: TCPUDAY | C13: No data written to file.
A14: CPU - CPU time per time step in seconds. | B14: TCPUTS | C14: No data written to file.
A15: Elapsed - Elapsed time per linear iteration in seconds. | B15: TELAPLIN | C15: No data written to file.
A16: Time Step - Length of time step. | B16: TIMESTEP
A17: Notes:

Sheet: Table1981
A1: Note If the summary vector data is unavailable then zeros are written at each time step to the SUMMARY and RSM file.

Sheet: Table635
A1: RUNSPEC | B1: GRID | C1: EDIT | D1: PROPS | E1: REGIONS | F1: SOLUTION | G1: SUMMARY | H1: SCHEDULE

Sheet: Table636
A1: RUNSPEC | B1: GRID | C1: EDIT | D1: PROPS | E1: REGIONS | F1: SOLUTION | G1: SUMMARY | H1: SCHEDULE

Sheet: Table788
A1: RUNSPEC | B1: GRID | C1: EDIT | D1: PROPS | E1: REGIONS | F1: SOLUTION | G1: SUMMARY | H1: SCHEDULE

Sheet: Table789
A1: No. | B1: Name | C1: Description | D1: Default
A2: 1 | B2: RPTSMRY | C2: An integer value set to zero for no report, or one to produce the report. | D2: 0
A3: Notes:

Sheet: Table637
A1: RUNSPEC | B1: GRID | C1: EDIT | D1: PROPS | E1: REGIONS | F1: SOLUTION | G1: SUMMARY | H1: SCHEDULE

Sheet: Table638
A1: RUNSPEC | B1: GRID | C1: EDIT | D1: PROPS | E1: REGIONS | F1: SOLUTION | G1: SUMMARY | H1: SCHEDULE

Sheet: Table197
A1: RUNSPEC | B1: GRID | C1: EDIT | D1: PROPS | E1: REGIONS | F1: SOLUTION | G1: SUMMARY | H1: SCHEDULE

Sheet: Table639
A1: RUNSPEC | B1: GRID | C1: EDIT | D1: PROPS | E1: REGIONS | F1: SOLUTION | G1: SUMMARY | H1: SCHEDULE

Sheet: Table640
A1: No. | B1: Name | C1: Description | F1: Default
C2: Field | D2: Metric | E2: Laboratory
A3: 1 | B3: SUMSTEP | C3: SUMSTEP is a real positive number that defines the time interval for which the first time step of data will be written to the SUMMARY file (and the RSM file if RSM output has been activated). For example, if SUMSTEP is set to 30 days, and if the simulator takes time steps of 0, 5, 10, 16, 24, 30, 40, 45, 60, 90 days. Then the SUMMARY data will be written out at time steps 0, 30, 40 and 60 days. | F3: None
C4: days | D4: days | E4: hours
A5: Notes: